listing_id,id,date,reviewer_id,reviewer_name,comments
7003848,38559208,2015-07-16,38040660,Kazumasa,Had great stay in The place. Very quiet neighborhood. View and atmosphere are just great.  
7003848,38969713,2015-07-19,8522925,Kathie-Duyen,Gabe was great and was able to accomodate us with such short notice. The place was warm and welcoming and he even had welcome beverages for us. You definitely feel like you are on vacation at this home. The backyard with the bay view is just spectacular. 
7003848,39831055,2015-07-26,38094779,Gail,Gabe was excellent to deal with. Extremely helpful and quick to answer any questions we had. The place is great and the view is beautiful. Would definitely stay here again. 
7003848,40652790,2015-08-01,3479894,Eva,Gave is an amazing host!  Beautiful property in a lovely neighborhood!  Convenient to everything and highly recommend staying here!
7003848,41994714,2015-08-10,30966208,Yue Ming,"Me and a few friend stumbled upon Gabe's place while looking for a place to Seattle. We stayed there for about 10 (website hidden) very happy to have rented the place. The place was clean and looked fairly new. It was as described in the pictures.

Gabe himself was an excellent host. We ran into some issues with our mail while staying with him and Gabe went out of his way to help us!
He provided ample information about Seattle and helped us to find several things such as where to eat/ buy mobile phone plans and even helped my friend out by buying an empty box to help with his packing.

Overall I feel that both the place and the host are 10/10 and would recommend  anyone to book his place !"
7003848,42947257,2015-08-16,22428225,宋,"Gabe is warm heart man and very kind to instruct me how to make a comfort stay. I had to say this is the best place i have ever stayed. That this house owns great view directly towards river and the environment is very very very quiet. I hope that I could bring my family here again in future!

And we enjoyed tea and coffee prepare by host. There are even frozen glass for beer!"
7003848,44247021,2015-08-24,29378152,Abe,The host was excellent and the property was brilliant - excellent amenities and terrific location and view
7003848,44398664,2015-08-25,29378152,Abe,"The place was exactly as described and the process to book it and deal with the landlord was very effective -- all the interactions were professional and pleasant and the place was an EXCELLENT property.  We had the place for a week and really enjoyed the LOCATION, the Landlord and the amenities -- Rate it a 5 out of 5!"
7003848,48647656,2015-09-27,2970772,Rj,Gavin was a great host and the process was incredibly smooth. The apartment was brand new and well renovated in a wonderful neighborhood. We would definitely recommend anyone to stay here who is visiting the Seattle area.
7003848,55143610,2015-11-28,29627978,Ari,"This is a wonderful rental in a very charming part of town with absolutely tremendous views of the University district. Walking distance to several places (markets, restaurants, stores) and a short drive from downtown. 
It's very nicely renovated with modern and clean decor and furnishings. A very nice kitchen. One of the bathrooms has one of the nicest showers we've ever used, with five separate heads. My wife and I stayed there with my parents, and it was very comfortable for two couples to enjoy.
Gabe was a very pleasant and accommodating host who wants his guests to feel comfortable and enjoy their time. "
8306581,53263042,2015-11-07,17842409,Elizabeth,"This is a terrific apartment in one of Seattle's iconic neighborhoods with restaurants and shops in abundance nearby.   The apartment is lovely and well appointed.  Rob and Ann were especially kind to leave an abundance of supplies for the use of their guests - even a few items in the fridge.   

There were five of us staying - 3 humans and 2 dogs and it was perfect as it was very easy to get in and out of the apartment to walk the dogs.   The apartment is quiet and the gated parking area is a huge plus.  

There were just a few minor issues that needed some attention (internet access problems_ but the organization (Pillow) that Rob and Ann use to help with these things has a 24-hour phone line and could solve them quickly and easily.   

All told, I would highly recommend this location to anyone visiting Seattle who wants to get away from downtown but still wants access to everything Seattle has to offer."
3468261,16220216,2014-07-23,17558099,Brian,"This was my first airbnb experience and it went perfectly.  Michael welcomed me, gave me a quick tour, and then left me with a 6-pack of beer to enjoy.  

Nice 1 bedroom apartment and a great location walking distance to the space needle or a longer walk to downtown Seattle.  

Can't wait to visit Seattle again and use airbnb again!"
3468261,17418864,2014-08-11,14984232,Kristin,"What a great apartment! Awesome location: super safe and centrally located. 

Michael's apartment was clean and cozy. We had everything we needed, from travel size shampoos to info about a good deli across the street.

Additionally, Michael was very accommodating of our need for a late key pick up. He is a flexible and gracious host- we'd definitely stay here again! "
3468261,18810267,2014-09-01,18663451,Will,"Michael and Britta were absolutely fantastic. Their apartment was extremely clean and in a great location. Michael and Britta were extremely welcoming and left a bottle of wine for us as well as recommendations on local places to try. They made the overall experience extremely easy and enjoyable and communicated very clearly how to pick up the keys and access the apartment. Would stay with them again in a heartbeat. Thanks for a lovely weekend in Seattle!

-Will and Laura "
3468261,35848097,2015-06-22,10552442,Josh,"I would highly recommend Michael's apartment to anyone looking to visit Seattle.  It's an amazing location just outside of downtown with an  incredible panoramic view of the city from the rooftop area.

The apartment is lived in, but very clean, and the bed was quite comfortable.

Michael was very prompt in responding to any question that I had, and I had no problem getting around Seattle via mass transit for Uber/Lyft from his place.

I definitely would stay at Michael's again the next time I visit Seattle!"
3468261,39110545,2015-07-20,20938076,Tricia,This was a great place to stay in Seattle.  There was a great coffee shop across the street and we were able to walk a lot of places.  We enjoyed the balcony on the courtyard as well as the rooftop patio.  We'll look to stay here again next time we're in town :-)
3468261,41960712,2015-08-10,35868239,Mumu,"The apartment was lovely, clean, and absolutely charming. Michael and Britta were responsive in coordinating check-in/out. The location is convenient (right across the street from a cafe and coffee shop). I felt right at home, and my stay in Seattle was made ten times better because of this place. Would absolutely recommend! "
3468261,48838607,2015-09-28,6495984,Tuyen,"Great stay in Seattle! Michael was attentive and quick to respond to our reservation request. He kept in touch with how to get to his place from the airport. Check in was easy, we picked up keys early but check in is 11am. The neighborhood is very nice, in south lake Union a half hour walk to Pike Place and all the action, and a quick car ride to other neighborhoods like Capitol Hill. The apartment building is secure and clean. The unit itself was also very clean and nicely decorated. It's a lived in apartment but still felt welcoming, comfy bed and clean bathroom. The rooftop view was gorgeous.

All in all a great private apartment and good neighborhood, just not super central. Would recommend it to folks looking for some luxury and privacy."
5825701,30465257,2015-04-22,28135813,Ann,"Joe made us feel very welcome and at home at his house.  Given that my family and I were his very first airbnb guests, he checked in with us and made sure we were comfortable and had everything we needed. The location can't be beat, it's a friendly neighborhood, great highway access, and very walkable to a big park, great cafe, some restaurants and shops. The house has plenty of room for a large family or group with lots of common space plus an awesome deck, back yard and hot tub. At the time of the booking, the house was true the listing description, but the listing didn't clarify that two of the bedrooms are below grade (but with large windows) and two of the bedrooms are upstairs from the ground floor.  (Although Joe and I communicated about this later.) It ended up working out fine for us because the separation helped with noise and gave everyone some more personal space. The house was not the most kid-friendly with a fair amount of fragile decor, (although a lot of it was pictured in the listing), so that made the experience less than ideal for us, but overall we had a very comfortable stay and would recommend this house to others. "
5825701,31831496,2015-05-10,31983043,Nancy,"Six adults (3 couples) used the home.  It functioned very well for our group with enough bedrooms and multiple areas to either spend time together or to retreat to.  Although on different levels (there are 8 stair steps between each level), our group found them ok to walk between (we aged from 65-90).  The kitchen is well laid out for those who cook, with enough tableware and utensils to accommodate us. The home is in a nice, walkable, quiet, and friendly neighborhood.  A small commercial area is nearby offering good coffee with breakfast and lunch offerings.  A major mall is 1 mile away as is a grocery store and other shopping opportunities.  The backyard and decks were good areas to unwind and relax.  The online photos accurately portray the house.  Our host met us on arrival to show us around and wanted to make sure our stay was a good one.  We were comfortable and pleased we chose this home for our getaway."
5825701,32570010,2015-05-19,31028714,Jim,"Joe, or as my wife calls him ""American Richard Branson"", met us at the door of his home and showed us everything we needed to know about his place.  The neighborhood was very family friendly with people walking their dogs and some taking their newborns on walks in strollers.  It felt very safe and the listing was accurate.  The one aspect of the listing that is difficult to describe is how much you would enjoy staying in this home if you appreciate the craftsmanship of very well kept older home.  The windows were all updated to double pane, the appliances in the kitchen were top notch, the wood floors (warning they did creak so light sleepers should take the upstairs bedrooms) were in great condition, and the downstairs shower even had THREE shower heads!  Though we didn't spend time in the yard, it is very well kept with a grill and Jacuzzi and I can see it being used on a nice summer day.  The only downside to the home are the stairs, or I should say the abundance of them.  The home is really a double split level home with four floors and three sets of 1/2 flights of stairs and it's really a nice layout.  However, if you have a young mobile child (ours were fortunately barely old enough to know falling down the stairs would hurt a lot) you may want to consider another property.  Also, to leave on a positive note, the area has a surprisingly large number of highly ranked restaurants within a mile or two of the property."
5825701,32926004,2015-05-23,33056694,Charles,"Staying in Joe's home was a wonderful experience and deceivingly spacious! He was immediately welcoming, attentive, and accommodating. This home is perfectly situated (a fast few blocks from I-5) for travelers who want to visit any part of the Seattle metro area to include downtown (Space Needle and Pier) or Bellevue, or venture northward for a whale watching tour!  This home was clean, comfortable, spacious, fully appointed, and the deck area was a delightfully private retreat with hummingbirds whirring around. The residence is in a very quiet neighborhood with great nearby accommodations like Blue Saucer, which has the best coffee ever! Shopping, restaurants and drinking establishments are just a few blocks away! And Univ of Washington is only 15 minutes drive!  We would stay here again anytime!"
5825701,34645187,2015-06-10,30321495,Pantipa,"We loved this place. The house was cozy like our own home. The host supplied everything e.g. towels, amenities, kitchen/toilet paper, dryer, vacuum cleaner etc. 

The house looks small from outside but inside was much more bigger. We loved making BBQ at the back porch.

The 4 bedrooms fits 7 of us for 8 days perfectly!

We really loved the kitchen!, hugh refrigerator and all of what we wanted were there!

If we had a chance to visit Seattle again, we would definitely stay here again."
5825701,35083628,2015-06-15,20862093,Robin,"Joe and Alicia were awesome.We stayed almost a week for my daughter's graduation. The weekend was great and so was the house.  Besides the house being gorgeous with a beautiful kitchen and other rooms, it was clean and very well supplied with linens, dishes, etc. 
I would stay there again when visiting Seattle.
Thank you Alicia and Joe.
"
5825701,35922004,2015-06-23,31430319,Matilde,"Fuimos a Seattle para la graduación de nuestra hija, y tanto la ciudad como la estancia en la casa de Joe y Alicia, fueron super  gratificantes.
La casa es muy amplia, y acogedora, esta muy bien equipada con todo lo necesario, como secadora de pelo y plancha para la ropa.
Todo estaba limpio y ordenado, utilizamos dos veces el asador en la terraza. Muchas gracias por sus atenciones. "
5825701,36527611,2015-06-29,2619800,Diane,"My group loved staying at Joe's house! It was beautifully appointed, cozy, and the deck was amazing, peaceful, and had a great view. The place looked even better in person than in the pictures. We had no complaints whatsoever. Thanks Joe for sharing your house with us!"
5825701,37306663,2015-07-06,2713132,Erica,"The house was cute and in a great location, with lots of nice spaces to hang out. The kitchen was nice, the backyard and hot tub were great, and Joe was a responsive host. I would definitely stay here again.

"
5825701,37684351,2015-07-09,6658891,Nate,"A beautiful, comfortable home in a great neighborhood - this was a seamless and pleasant stay. Joe was communicative but stayed out of our way, and the house was well-stocked and comfortable even in a Seattle heat wave. "
5825701,38120990,2015-07-13,1703366,Krishna,Joe was a great host. The house was perfect and accommodated my parents and in-laws beautifully. We love Seattle and will be back!
5825701,38998258,2015-07-20,12179920,Jeffrey B.,"Joe's house is indeed everything the name boasts, and more! We had a wonderful stay during out time there. The backyard is beautiful and very cozy. The house is in great condition and in a great neighborhood - we had a blast going down to the lake everyday.

I would highly recommend staying at Joe's place! He's a wonderful host, was available to us if we needed anything and he was very flexible.

Thanks again Joe for a great stay!! :)"
5825701,40242582,2015-07-29,26230371,John,"We absolutely loved our stay in this home! We couldn't have picked a more perfect place for our stay with our family. It is a very quiet neighborhood which was perfect for us. It was very spacious and very accommodating. It was also only 10 to 15 minutes from the places we visited like the Woodlands Zoo, Pike Market, the Pacific science center, the Space Needle, beaches and more. Alicia was great, she met us at the house to show us how everything worked and was super helpful. Joe and Alicia also had brochures and info for things to do in the area. We loved it!"
5825701,40900544,2015-08-03,1381688,Amy,"Joe and Alicia's house was a perfect venue for our group of four women. There are two seating areas, a well-equipped kitchen and a bar fridge in the lower-level area. We used the back deck and grill, too. The two shared baths work well for the space and the house is much larger than you think from the street. Joe and Alicia were responsive and attentive. If you are coming from the Midwest or East Coast, please keep in mind that few homes have A/C. Even though the days were unseasonably warm, it cooled off at night and was quite comfy for sleeping. "
5825701,41347008,2015-08-07,20413455,Ana,We loved the charming house in this quiet and safe neighborhood.  The place was tastefully remodeled and it was very well equipped with all the essentials.  The backyard provided an amazing view of the sunset.  I strongly recommend this listing and would not hesitate to book again if my travels take me back to Seattle.  
5825701,41932317,2015-08-10,6947272,Jordan,"A beautiful and a comfortable house! It was perfect for our wedding party to stay at, ample of room for 8 people and a decent location to go out and explore the city! "
5825701,44282339,2015-08-25,12585136,Denise,"We had been in close communication with Joe, because there had been a last-minute rental the night before our arrival. Joe called us just as we were pulling into the driveway to let us know that he had completed his cleanup following the departure of the previous stay and to reassure us that the house was ready for our arrival, and that my elderly mother would be able to rest before we headed off to begin the wedding festivities.
Sure enough, the house was sparkling clean, homey and welcoming for weary travellers."
5825701,45066252,2015-08-31,33077147,Bradley,Joe was an attentive and welcoming host. We loved the backyard with the barbecue and hot tub. 
5825701,45928398,2015-09-07,32370090,Nick,"The description was accurateJoe was wonderful to work with.  He met with my parents and sister promptly as they checked in and went over the features of the house and neighborhood.  The location was perfect for activities near the University of Washington and Downtown Seattle.  The house was clean and the backyard was very nice.  Kitchen was great, well stocked.  
We would definitely ask to reserve this home again.  "
5825701,46615478,2015-09-12,40239931,Milaina,Joe was very accommodating.  The house is clean and nicely furnished and close to public transportation for easy access to downtown Seattle.  There are menu's and good recommendation for places to eat which we appreciated.  I love staying there and would do it again. 
5825701,47717859,2015-09-21,41272351,Catherine,"It was a pleasure working with Joe! He bent over backwards to make sure we were accommodated in every way! The home was beyond our expectations! Cozy, impeccably clean and stocked with everything we needed. I would definitely rent here again. Thank you Joe for a fabulous first time Airbnb experience ! You Rock! "
5825701,48696142,2015-09-28,15684025,Casey,"Great host and house.  Close to everything, very comfortable, and just as described.  Great outdoor deck and proximity to cafe/restaurants."
5825701,49960563,2015-10-07,30390790,Jason,"We are a traveling band that does workshops with youth and community...and also performances throughout the U.S. Alicia and Joe were great hosts and the space was unique and beautiful. They responded very quickly! The jacuzzi was an added bonus! We stayed for 3 days and enjoyed the comforts and serenity of this home. Recommend this space if you want a tranquil, spacious and beautiful time! Will definitely be back. Thanks Alicia!"
5825701,50333776,2015-10-11,44374695,Ariel,"We loved staying at the house! Everything was clean, house was very cute and plenty of space for everyone. Check in/out was super easy and it was great to have a place to park our cars. Joe was quick with his responses to all our questions"
5825701,51111591,2015-10-18,35970803,Christine,"We accessed the house with no problem, left for home the same way.  It's a very nice home, and the hot tub was a nice way to end the days. The washer and dryer were great, as that allowed us to pack light.  We did have a problem with the internet, but I didn't think to call Joe about it, so, my own fault!  The dishes and pots/pans were adequate for basic cooking.  Beds were comfy, and there was plenty of space for my friends and I to gather and catch up.  The view from the back deck is spectacular.  This is definitely a ""home away from home"", and I will be back if I venture out to Seattle again!  "
5825701,51811880,2015-10-24,45668427,Joe,We really enjoyed our stay here. The maple leaf neighbourhood and perfect for our young family - the local park was fun. The house was perfectly as described and served us very well. Thank you 
5825701,54116803,2015-11-16,39248856,Manny,"Joe was very accommodating. This house was very nice and cozy and in a great location. Joe let us check in early and let us stay a little later after check out which helped us out a lot. Joe was also very easy to get a hold of and offered help of it was needed. Overall, it was a great stay and a nice house. "
5825701,55352989,2015-12-01,2893840,Will,"We had a great stay at Joe's house, it's very nicely equipped, in a great neighborhood, comfortable and quiet. Many thanks!"
5825701,56982620,2015-12-20,35710957,迪,"It was a huge bless that we finally reserved this time-honored house with limited time. We were so amazed at the house for its tidiness, cleaness, artistic style and even every single detail the moment we gently pushed the door open.During the days in Seattle, we just loved roaming around the alleys surrounding the house. we really did.  For us，everyday was perfect！"
5825701,58196700,2016-01-01,1530844,Kevin,Just a perfect and wonderful experience. My whole family flew into Seattle to celebrate the new year. Bus to downtown was simple and easy. The hot tub was great and the kitchen allowed us to make a wonderful dinner. Our only regret is that we didn't have time to stay longer!
639130,40090287,2015-07-28,32689573,Kristen,This was our first time using airbnb.  The house was the perfect size for our group.  Close to all downtown has to offer.  The owners do have 2 cats that need to be fed twice a day.  Taz and Reece.  Taz is a bit hyper and I would worry if there were small children staying.  He was laying on me and when I slowly went to move him off he bit my cheek.  Just left a red mark but could have been worse.    There were no blinds/shades in the hall bathroom.  We could see people in a house when we were in the bathroom.  If you can see them odds are they can see you in the bathroom.   We got to the house later than we originally had planned.  I felt like they pretty much handed the the keys over and were out the door.  I would have liked a little more info on the house and the cats.  Like I said this was our first time renting so maybe this is all normal. 
639130,45919783,2015-09-07,8618678,Robert,"In Seattle we found a delightful host, home and neighborhood.
Ann was prompt to reply to emails and personable upon arrival. She helped welcome us and got us oriented to both home and neighborhood.
The 4-bedroom home is spacious, well lighted and featuring comfortable beds. It isn’t a full-time rental. It’s Ann’s home, but she arranged things so that we could stay there very nicely for four nights. She even found a place for her two cats to stay since some in our party don’t do particularly well with pets. That was much appreciated.
The established Madrona neighborhood is a great one to explore. We took sets of public stairs down past hillside homes and streets until we entered a short trail that led to the shores of expansive Lake Washington. We ate breakfast, along with many locals, at the yummy Hi Spot Café, an easy walk from the house. And we enjoyed being about 15 minutes away from Pike Place Market and Seattle Center.
I highly recommend this home.
"
458183,3672546,2013-03-02,2633212,Jonah,"Comfortable place to stay right around the corner from a great Seattle neighborhood. Nicely renovated, amazing kitchen that you could do some serious cooking in. Parking can be tight, but the area is so walkable it's not a big concern. I would stay here again."
458183,4411354,2013-05-03,6108492,Logan,"Chris was incredibly hospitable, and responded to all my questions about what to do in the area, and how to get the most out of my experience in Seattle. My lodgings were great as well. I was totally comfortable, and felt right at home: I wanted for nothing in my time at Pure Space. Stay here!!!"
458183,6166507,2013-08-01,7097154,Peter,"Really cool place as advertized.  Fun neighborhood, you can walk to just about anything."
458183,6311048,2013-08-07,7304417,Sarah,"Great spot and great host!  Wish we had more time...
We will definitely try and make it back!"
458183,7572836,2013-09-24,1770872,Karine,"Nice place. Good location. Between a BB and a hostel, the Pure Space is a great option to feel at home in Seattle."
458183,19248362,2014-09-08,20897160,Christi,"The host was quick to respond to questions, very welcoming. The room was clean and the neighborhood was quiet and super close to lots of great shops/cafes. Didn't have trouble with parking (though it was also a weekend which makes it easier). Only complaint is we couldn't figure out how to use the door. There was a trick to it, though if another guest hadn't helped us, I am sure Chris would have responded quickly enough to help us out. Since this was the only ""issue"", it's safe to say that it was a successful airbnb stay. :)"
