listing_id,id,date,reviewer_id,reviewer_name,comments
3123041,25232816,2015-01-10,23423181,Cathy,"After a long day of walking, we looked forward to coming ""home."" Studio was clean, comfortable, and well-designed. It was close to the 33 bus stop, which we used everyday. Though we didn't meet, Diane was amazing. She had a folder of information that truly helped out tourists like us. She had a personalized message on the chalkboard. Ever since we were approved for the studio, she has been consistent and helpful with communication. We're going to miss this place."
3123041,25495326,2015-01-18,20409876,Cassie,"Diane's Little Urban Studio is the most incredible place to stay in Seattle. To be honest, I was  a first time AirBNB User and heading into my trip I was apprehensive about the way everything worked. Not to worry, Diane made our visit to Seattle the most welcoming, comfortable, home-y experience I've ever had.

The studio is located in a charming neighborhood slightly north of Downtown. If you are using public transportation, the bus to and from downtown is located one house down from Diane's (that being said, if you are a light sleeper, the bus might wake you. It was never a problem for me). It is the easiest, most pleasant commute and our experience with public transportation was amazing. The neighborhood is safe, charming, and such a wonderful place to be.

My friend and I were using the Little Urban Studio mostly as a place to rest our heads as we spent all seven days of our trip out and about around downtown Seattle and the neighboring areas. It is a cozy space, it's always warm (but there is a space heater so you can control the temperature), and the details are so thought-out from Diane providing bus maps to chocolate to a variety of teas, coffees, and hot chocolates. It truly is like a home away from home.

Next time I am in Seattle, I would only choose to stay in Diane's Little Urban Studio. It is in a charming area, a safe neighborhood, it's easily accessible through public transportation, and Diane is a sweet, flexible host who went above and beyond to accommodate my friend and I. I would recommend this to anyone staying in Seattle because my experience here was beyond incredible."
3123041,26551342,2015-02-15,26934261,Darcie Lynn,"Stop searching because you just found the most incredible place to stay in Seattle. Diane is the sweetest host and left is a little treat for Valentine's Day. This suite is amazing, so cozy and well decorated. We chose it because of the private access, our own bathroom and parking availability. We were able to park a large truck nearby and didn't need to pay for parking or worry about a thing. Extremely accessible by public transport. With just a bit of walking we were able to see all parts of the city with a little help from Google maps and didn't have to get a taxi or use the truck once! Also, Diane has graciously stocked the suite with a Kurieg machine and a mini fridge. We were so spoiled."
3123041,26939188,2015-02-22,27135445,Ruben,Great place.  Always answered any questions I had and then some. Tans for everything!
3123041,28325924,2015-03-22,28180522,Anita,"My first time AirBnB experience was great with Diane as my hostess. I came in late (after 9:30PM) and Diane was very gracious and welcoming. Stella was delightful. 

Diane showed me the studio and explained where everything was and some quirky little items. This is a very private unit, and very quiet. I had to move the ticking alarm clock into the bathroom because it was too loud! 

This was the perfect place to come back to after spending the day exploring Seattle. Diane very thoughtfully turned on the space heater and the heated mattress pad my first night as I got back after dinner rather late - that was a wonderful, thoughtful touch. The other nights when I came in even later, I was not worried that I would disturb anyone since this studio is separate from the house.

I did not use the coffee maker, but it was a nice touch to have this available. There is WiFi but no TV or radio - that makes it very restful. The artistic touches make the studio very personable.

Thank you, Diane!
"
3123041,28582789,2015-03-26,29482283,Craig,"Diane and Stella  were perfect hosts.  She messaged me on the day of my arrival wishing me safe travels since I was driving up from California to Seattle in one trip.  She gave me perfect instructions on her place and was greeted with a greeting on the chalkboard as I walked in which was a nice touch.  Diane's ""little urban studio"" was clean and tidy.  Since this was my first time in Seattle her place is only about 10 minutes from downtown yet seems much further away for a restful nights sleep in a quaint neighborhood.   I wanted to explore her neighborhood but fell short on time.  So much nicer than a hotel room but with more amenities.  Washer/dryer and keurig to name a few.  Only thing missing was a tv but I didn't even miss it.   If you have a laptop or tablet, she has wifi and you can just stream a show or tv.   Before I checked out, I got a text from Diane asking if I was still around so we can meet.  She came by and we got a chance to meet in person and chat for a bit.  Diane gave some things to do next time I visit.    Definitely will be back and hopefully stay here again =)"
3123041,29074561,2015-04-03,6827147,Julia,"An amazing place to stay! Private, clean, cosy and so cleverly set up and styled! Diane is a traveller so she really does know what you need! We were lucky enough to meet her and Stella! Thanks again Diane"
3123041,29772475,2015-04-12,1997066,Eric,"My girlfriend and I had a wonderful stay at Diane's thoughtful little studio.  

This was my first experience booking an Airbnb myself so I wanted to find an experienced host.  Diane was awesome.  

The Little Urban Studio is clean, warm (the space heater and electric blanket were great), fun (loved the pictures and decor), and convenient (right by the freeway).  It had everything we could need.  We were delighted by all the thought and care Diane put into designing this place.  

It's exactly as described--a small but cozy place to come back to at the end of a day out.  Even if you need to stay indoors for a while, the bed and desk are fine enough for lounging/reading/working. 

Since it's a separate unit we could come and go as we pleased, which was perfect for us.  However, we did get to meet Diane and Stella when we first arrived, which is great because they are both so friendly.

All this, and much cheaper than a hotel with all its cookie-cutter designs and expensive room services we won't use (website hidden);dr--just what we wanted.  Would definitely stay again.

"
3123041,30124617,2015-04-18,12923793,Don,Great experience. Easy communication and check in process. Nice off street parking right by the space. Wonderful private restroom and the room was very comfortable! Highly recommend this host. 
3123041,32649920,2015-05-19,922290,Christopher,"Diane is charming and thoughtful. The studio apartment has every little thing a traveller could need, such as extra toiletries. Having access to a washer and dryer is a really nice perk as well. I highly recommend her place. "
3123041,32872263,2015-05-22,2744354,Boris,"Diane was an amazing host. Her place was super cute, had everything I needed: comfy bed, full bathroom, writing desk, even a small fridge. She was very accommodating too, responding to my request on the same day, and letting me arrive past 1am (flight was delayed). She invited me into her home and we had a great chat about Seattle and life in general. She was very kind, positive and energetic, and told me tons about what it's like to live in Seattle. Would definitely stay again when I'm up to visit. Thank you so much Diane!!!"
3123041,33148601,2015-05-25,5696146,Olivia,"The Little Urban Studio is as pictured: cute, small, a bit quirky, and private. My boyfriend and I stayed 3 nights over Memorial Day weekend, and loved the privacy and ""separate"" feeling of the place, as opposed to other AirBnBs we've had that were rooms inside someone's home. We truly could come and go as we liked! Using public transit was also easy and convenient, with several options close by. Bed was comfy, sheets were crisp, towels were plentiful and fluffy. Our hostess and her pup were both very warm and helpful, we felt completely at ease there. thanks to Diane and Stella for a lovely stay!"
3123041,33545801,2015-05-29,32779300,Ryan,"Diane provided a quiet and private, yet vibrantly decorated room with private bathroom, mini fridge, and washer/dryer. I had an excellent experience and would highly recommend the Little Urban Studio."
3123041,34863065,2015-06-13,28333362,Anja Fredborg,"We stayed with Diane and Stella for a couple of nights and we had a great time. Diane is very helpful and the little urban studio is very cosy. Stella is very friendly and cute :) 
If we ever go to Seattle again we hope that Diane and Stella is still in business :) "
3123041,35216008,2015-06-16,31617249,Clare,"I was very happy staying in Disney Little Urban Studio. The Space is beautiful, with a comfortable bed and a very nice bathroom. I especially liked the availability of laundry since Seattle was the second stop on my trip. I highly recommend Diane's studio. "
3123041,36046077,2015-06-24,32352138,Will,"We loved our stay at Diane's Little Urban Studio! The check-in process was simple & convenient as we didn't know exactly when we would arrive and we easily found parking right outside. 

The space itself was perfect for our stay with more amenities than we could have thought of-especially the washer/dryer and mini fridge. Even though we were there during a heatwave, the fans kept us cool at night and we never had a problem. The thoughtful extras like bottled water, full stationery set, local suggestions, coffee maker and chocolate were lovely. 

Staying in this neighbourhood gave us a more local experience and with a bus stop right down the street, grabbing the bus downtown was easy.

Diane was easily reachable, offered us great breakfast suggestions when we asked, and made an effort to stop by and meet us with adorable Stella before we left. We wish we could have stayed longer, and if we're ever back in Seattle we will definitely want to stay here again!"
3123041,36247039,2015-06-26,36488445,Lucas,"Diane's place was exceptional.  As soon as we walked in, we were impressed by the level of thought that she had put into this place.  She had everything from a Keurig to a full laundry to a binder with all of her recommendations of things to do around Seattle.  The place was perfectly clean, well-decorated, and in a great location to explore Seattle (just a ten minute drive from Pike's Place and five minutes from all that Ballard has to offer).  We have no complaints, and thank Diane for her hospitality and for a wonderful place to stay."
3123041,36379668,2015-06-28,15544151,Angie,"Diane is such a great host! We felt so welcome and had the opportunity to hang out with her and Stella and get to know each other better. The studio is comfortable and stylish. Even with the Seattle summer heat, the ceiling fan and side windows gave us a nice breeze throughout the night. We had everything we needed including a coffee maker and mini fridge. The bathroom has lots of extras just in case you forget something. Absolutely love it here. We'll definitely try and stay here everytime we visit. Thank you!"
3123041,36668745,2015-06-30,1917204,Camille,"Nice, clean accommodations in a pleasant neighborhood, convenient to bus lines, Starbucks, a few neighborhood restaurants, and a supermarket.  Diane provided lots of information about Seattle, bus schedules, ferry schedules.  And water.  And chocolate.  And a washer and dryer.  She was easy to reach via text and thus was always available in case a need arose.  We would definitely stay here again.  "
3123041,36985274,2015-07-03,2478272,Alejandra,"Wonderful little studio with everything you could possibly need. Plenty of room for two people. I didn't have the pleasure to meet Diane, but communication was easy and prompt. I highly recommend staying here!"
3123041,37464150,2015-07-07,29313092,Claudia,"Bien! Le studio est situé dans un charmant quartier, à proximité des arrêts autobus. Cela prend moins de 10 min pour se rendre au centre-ville. L'endroit est propre et vous avez votre intimité grâce à l'entrée indépendante."
3123041,37769540,2015-07-10,35575318,Oscar,"Diane was very nice and friendly. The check-in process was easy and she greeted us upon arrival. We enjoyed having a separate entrance and our own private space. The location was only a few minutes away from Pike Market, Space Needle, and major highways. Diane was kind enough to provide us with maps and brochures on nearby eateries, museums, and pubs. She had great insight and feedback on places to visit and explore while traveling through Seattle. We look forward to future stays with Diane. "
3123041,38726527,2015-07-18,17814449,Brett,"The Little Urban Studio was perfect for the two of us. From the Welcome message on the chalkboard, to the water,  the list of places to visit, and the maps, Diane did an awesome job making us feel welcome!  My fiancé was super happy that Diane provided a hair dryer and ear plugs.

The Studio itself was clean, private, quite, close to everything, and fit our needs perfectly. 

Diane was super responsive to our questions, and the check in process was super easy.

"
3123041,39101499,2015-07-20,8766201,Alisa,"The little urban studio was the best! We enjoyed the neighborhood which was really relaxed. The studio was not only pretty, it was a cosy, super quiet place and we instantly felt at home and slept very well.  Diane was a great host and it was easy to communicate with her. In her studio Diane has provided her guests with everything one could possibly need and even more. We were so happy to have picked her for our stay."
3123041,39395513,2015-07-23,15421355,Paul,"Diane was very accommodating and friendly. The ""Little Urban Studio"" was as advertised and very comfortable. Easy access and private. On street parking can be finicky, but that's Seattle. We were there to visit with my son and daughter-in-law and new grandson, and realized they live in the same neighborhood."
3123041,39759018,2015-07-26,13408917,Andrew,Perfect little place to lay your head for a weekend in seattle. Close to transit easy access and complete privacy. Diane was very helpful with any questions we had and was accommodating as much as possible! Very happy with the place.  
3123041,41730367,2015-08-09,28571861,Austin,"The ""Little Urban Studio"" looked great on the site, but it was better than we imagined! Everything was clean and simple! Diane also had loads of little and big things to make our stay comfortable. She was always available for questions and to help make our stay comfortable and awesome!"
3123041,42403596,2015-08-13,36161833,Robert,"Diane is a terrific host. She made us feel comfortable and welcome to her lovely studio apartment. It's a fantastic bargain with bus service available for a short ride to downtown Seattle and all the major attractions. We would highly recommend staying in Diane's ""Little Urban Studio"". Bob & Susan Wassaic
NY.
"
3123041,43200209,2015-08-17,40334257,Chuck,"What a sweet spot just a stone's throw outside of the busy Seattle downtown core!  The space is a detached garage that has been finished/converted into a one bedroom studio detached from the home.  The entire property is incredibly cute and incredibly convenient.  Diane was a fantastic host and made us feel VERY welcome.  We had access to her washer & dryer, which we took advantage of (was nice to return home without hours worth of laundry to get caught up on).  The space doesn't have air conditioning, but with the windows open--the draft keeps the space most comfortable.  Diane has a binder in the room full of her own personal recommendations:  breakfast joints, dinner, coffee shops, hiking, shopping, parks, neighborhoods, misc. sites, etc.  We were never disappointed when going on her recommends--win after win!  My only regret was that we never got to see her doggie Stella :-)"
3123041,44312651,2015-08-25,38100292,Robert,"space was beautiful and comfortable, as pictured. Diane also left a welcome book with awesome local insight and tips. neighborhood is residential but a short bus ride or uber trip to plenty of bars, restaurants and the city center. should I ind myself back in Seattle, would not hesitate to stay here again. "
3123041,45074316,2015-08-31,34885914,Sean,This was my first experience with Air BnB and I could not have been more pleased.  Diane is a stellar host who has thought of every little thing that a traveler could possible want or need.  I loved the private entry studio and privacy while being able to enjoy all the wonderful aspects of the Magnolia neighborhood.  I would definitely return in future.   
3123041,45533951,2015-09-03,22362620,Diana,We stayed 3 days at Diane's Urban Studio which is a small but quiet and comfortable place to stay in Seattle - exactly as described. Diane made us feel very welcome. We found Diane's dinner recommendations very helpful and have had a wonderful time. Thank you!
3123041,46383660,2015-09-10,25317029,Kent And Mary,Diane was incredibly easy to work with.  She was very accomodating about making sure we could access the studio.  The studio is a perfect place to stay and explore the city!  My girlfriend and I really enjoyed our stay in this quiet neighborhood.  
3123041,46812511,2015-09-13,14128061,Mazi,Diane made us feel so welcomed when we arrived. She greeted us with Stella (her beautiful dog) and made sure we had everything we needed. The studio is very clean and comfortable! It is exactly like the description. Diane is truly a super host because she pays so much attention to detail. I will most definitely stay at the Little Urban Studio again when I return to Seattle! 
3123041,47160629,2015-09-16,39185757,Dawn,"The studio was charming and cozy! It met our needs perfectly, and is also conveniently located to a bus line that goes straight to downtown Seattle. Diane was welcoming and worked to make sure the studio was comfortable, clean, and ready for us. Great experience overall!"
3123041,48877486,2015-09-29,38792100,Jing,Amazing experience! Diane prepared almost everything you may need from cleansing oil to detailed tips. We couldn't have such perfect tour without Diane's tips.
3123041,49882157,2015-10-07,33809678,Danilo,Very warm welcome! The studio was comfortable with everything you need. Diane and her dog are very nice.
3123041,50881106,2015-10-15,45563433,Melanie,"The Little Urban Studio was my first AirBnB experience. The place is cute and since I had a car, it was easy to get everywhere. I especially appreciated the comfy bed and pillows, the space heater, the hangers and hooks for my clothes, the tea pot, 2 bottles of water, the fridge, a roomy bathroom counter and the privacy. The trucks rumbling by in the mornings would wake me up. I actually FELT them go by but that rarely happened at night. It's a quiet residential street. I was a little worried about the noise of the home being built 2 doors down but it wasn't an issue. I didn't use the washer and dryer but that is a great perk! I never actually met Diane or Stella since I was gone most of the time but I'm sure they are lovely. I definitely had a good experience!"
3123041,53014001,2015-11-03,14996484,Kaneika,This was my first Airbnb experience and my Boyfriend and I loved everything about this place. The studio was perfect it had all the little amenities of home. It was so warm and cozy and the location in the city was great. It was hear everything that we wanted to get  to. Everyone knows Seattle can be a bit chilly so they had robes and slippers waiting on us and the electric blanket warned right up on cold nights. I would love to stay here again on future trips to Seattle. The location of the studio next to house made it feel extremely private and secluded which was exactly what we were looking for. 5 Stars!!! Thanks Diane & Stella
3123041,54350220,2015-11-18,45996033,Elle,"Seattle was amazing. I was visiting to see a school and I left with a love for the city. The neighborhood where Diane lives is right in the middle of everything, if you have a car. "
3123041,55786591,2015-12-06,15544151,Angie,We love staying at Diane's Little Urban Studio. This is our third stay and have become very comfortable with the studio and the neighborhood. It's a short drive to downtown with the ease of being in a quiet and cute part of the city. Always a pleasure! 
3123041,56375866,2015-12-13,35430528,Rachel,"My husband and I had a great experience staying in Diane's Little Urban Studio! It really does have everything you need: the bed is cozy and warm (with an awesome electric mattress pad); the bathroom os with equipped towels and toiletries; washer and dryer and mini fridge with utensils and tupperware are available; and what's more, there are lots of little extra touches, like a coffee-maker, bus route lists, pamphlets about the city, slippers to wear in the studio, and of course, the binder full of info and recommendations.

The location is great - there is a direct bus into downtown that only takes 20-30 minutes and Ballard is just 15 minutes to the north. We used Car-to-Go and Uber a lot as well and nothing was very expensive.
Finding the place and getting the keys was super easy.

We came just after there were a bunch of flooding alerts in the area and there had been a lot of rain. This was probably the reason that the studio's sump pump gave us some trouble. We had to stop using the plumbing in the apartment, but we told Diane about it right away and she invited us to use her bathroom in the morning and then was able to get the sump pump fixed the next day! In the end, we were actually happy that the turn of events allowed us to get to know Diane and her dog, Stella, a bit better!

I whole-heatedly recommend Diane and her Little Urban Studio!"
7988337,45754641,2015-09-05,43191694,Rudy,"Tiffany was very hospitable on our stay. The place, although not that well furnished, was very cozy and close enough to get back and forth to everything we had planned while visiting seattle. The U-district had a lot of shops and places to get food that were fun to check out in the area very near to the apartment. "
7988337,45903746,2015-09-06,42844948,Laura,"This place has some potential.  It's just not quite there yet.  It's pretty bare-bones with a twin bed, sleeper couch, armchair, and coffee table.  I feel the nightly rate for this place is too expensive for what it is.  The host, Tiffany, was very helpful."
7988337,46672432,2015-09-12,42508649,Lars,"We had a great 4 nights stay in this unit. Tiffany and David made us feel very welcome and made sure we had everything we needed. The only thing we were kinda missing is a table with some chairs. But there is room for more furniture, so i'm confident they will put something in it soon. Thank you tiffany and david!"
7988337,46828220,2015-09-13,43656713,Mariah,"Tiffany made us feel very welcome! She was willing to let 4 of us stay in this unit instead of the listed 3. We were expecting just a sleeping bag on the floor for our 4th, but she went above and beyond and got an inflatable mattress for us. The couch turned into a very large, comfy bed. She also gave us an Uber discount card to help us get around! Dishware was provided and she stocked the fridge with some snacks for us as well. It was very easy to get a hold of her and she was quick to answer any questions we had. Overall, a wonderful host!

Parking is easier on the weekend, since parking is free after 8pm on Saturdays and all day Sunday. We found parking just a block away.

It gets a little hot in the unit since there is no AC, but there are windows to open to help circulate air. Everything was clean and in working condition. There was some noise from outside during the night, but that was to be expected from Udistrict and didn't bother us.

We strongly encourage everyone to stay at her place!"
7988337,47793912,2015-09-21,42904343,Yuhao,"Everything is great. They provided everything you need. If you have any questions or need, you can ask them. "
7988337,49145481,2015-10-01,18912472,Andres,"Great experience.
Tiffany was very helpful and a great host.
The apartment was as expected, would recommend it to anyone."
7988337,49477734,2015-10-04,42996634,Paul,"Great neighborhood, not far from downtown. Clean apartment, would definitely stay here again. Easy check-in/out"
7988337,49738442,2015-10-05,3599181,Richard,Clean and neat apartment.   The host setup both beds for us before we even got there anticipating that we needed both beds.  We also had to arrive late and was very accommodating. 
7988337,49921840,2015-10-07,2447882,Anthony,"This was exactly what I was looking for.  A nice, clean apartment in a nice area. Thank you David and Tiffany for making me feel so welcome. I would definitely stay there again."
7988337,50257725,2015-10-10,13642336,Nikki,"I was the chaperone for two UW prospective students (my daughter and her friend) and this apartment could not have been better located for our needs.  The building, and the apartment, were vintage and darling and my girls were all but ready to move in! The mattress and the couch were very comfortable, everything was clean and tidy. Tiffany and her partner David were very helpful and made us feel right at home. I was concerned about the parking, but there was a lot right across the street, and plenty of easy street parking right on the block. "
