listing_id,id,date,reviewer_id,reviewer_name,comments
265901,1471890,2012-06-12,2279395,Kathy,The reservation was canceled 16 days before arrival. This is an automated posting.
265901,1694412,2012-07-12,2884274,Joelle,"Keith (we never met Cherie) was a wonderful host. He made us feel very welcome and was flexible with our schedule. He was also helpful with giving us information about store and transit locations and recommendations. 

The space was very generous, clean and had everything you would need. There was a nice kitchen with a good variety of kitchen implements for making your own food. (The smoke alarm went off as they usually do when cooking but Keith was great about that too!) We wanted for nothing.

The location was great, just a few blocks from transit to go into downtown. It was also easy to get to.

"
265901,1906653,2012-08-06,3022050,Sophie,"Our stay with Keith and Cherie this past weekend was the epitome of hospitality! Keith checked in every so often to make sure we were safe and enjoying our stay. We hung out with his family 'til 3-4am on Saturday. Keith even gave us a last-minute ride to the airport, and with it, a super quick tour of the city and Lake Washington. Staying here was a huge part of our positive Seattle experience. "
265901,5407161,2013-06-28,3929845,Carol,"My husband and I were in Seattle attending a two day seminar downtown and stayed with Prez and Cherie. We booked their ground floor unit for its accessibility, and it worked great for us. We took advantage of their transportation business for pick-up and delivery to our destination for a reasonable fee. Their home was clean and accessible and our hosts were friendly and also easily accessible by text messages.We would stay with them again and recommend their home to others. For Seattle tourists, this would be a great base, close to light rail, near downtown, the space needle and other points of interest.  "
265901,5684476,2013-07-11,1813237,Wan Fadhilah,"Prez was a great host! he took us around the city on the first night to a beautiful viewpoint and showed us the Grey's Anatomy hospital! He got us into great clubs that night and we got to ride on his party bus on the way back! It was a great way to start our trip :) Great location, located in a safe neighborhood (we came home pretty late a few times) and the house is close to 2 light rail stations and buses and the light rail gets you to the airport or downtown which is definitely convenient! The kitchen is well stocked and we had everything we needed for the stay :) I would definitely recommend this place and it was great to meet you guys!"
265901,9210103,2013-12-13,7458530,George,"Very pleasant experience... and our hosts were great!  
It is  well located for our early morning (email hidden) Hospital.  We would stay here again when we come to Seattle. "
265901,10440200,2014-02-18,9730844,Alicia,"Seattle was the best getaway from LA!! We will be back as soon as we can and we absolutely can't thank Prez for the hospitality enough! The room we stayed in was clean, warm and comfortable. The bathroom was clean, open and there was plenty of hot water. The living room and the kitchen are sized perfectly for 4 people. They also have interesting books on the shelves. Prez gave us a key to the bedroom so we felt very trusting leaving our valuables behind. The walk to the station is about 1/2 a mile. It's a nice walk too, the houses around the block are all so nice to admire. The latest we got in from the train was 10pm, we felt safe walking back to the house. The rest of our nights we called UBER, which is super cheap and convenient. We only really used the space to sleep, shower and change clothing, we really explored the city and drove out to Vancouver. Prez was a great host and we loved our entire experience there! Thank YOU Prez and also to your father who picked us up from the station in a PARTY BUS... strip pole included!! and for driving us to the airport at 6am. Woop Woop! Next round of tequila shots on us. "
265901,10647985,2014-03-01,12372676,Lulu,"It was very nice and clean room. Location Is very  close to downtown and buses running late. Prez was very helpful, and even gave me a ride to the train station on the day I was living, so it was very nice of him. If I go back to Seattle I will definitely stay there again. "
265901,10734206,2014-03-04,3877770,Blaine,"What a perfect place!  The accessibility by car to/from downtown, Mercer Island, Capitol Hill, I-5 & I-90 was very convenient as I needed to make a bunch of visits.  The space is very spacious and complete with way more amenities than I expected.  I happened to be solo on this trip, but I could easily see using this space when I visit with my family and our kids.  This downstairs unit has two rooms, laundry, kitchen, tv, etc.  Thanks a bunch!"
265901,11717762,2014-04-13,13136412,Andrea,"I stayed with Prez and Cherie while on a short trip to Seattle, and have never experienced hospitality like this before!  Right off the bat, Prez picked me up from the airport and, it being my first time in Seattle, gave me a tour of the city before heading to the house.  The house was perfect!  Everything was super clean and I felt very safe.  It was also very quiet at night, which is definitely a HUGE plus when looking for a place to stay.  Prez continued to check in on me throughout the entire stay, which made me feel very welcomed and which I was very appreciative of, since I was a young female in Seattle by myself.  I would definitely, DEFINITELY recommend staying here.  The accommodations are very clean, and Prez went out of his way to make sure that I was doing okay throughout the trip.  5 stars!!"
265901,14449540,2014-06-19,10066190,Kara,We stayed three nights at Prez and Cherie's. The location was great and accommodation was clean and comfortable. Would definitely recommend this if you are looking to stay in Seattle!
1429904,6973691,2013-09-01,729527,Sivan,"Cecilia was great, very helpful, quick to respond and a wonderful host. Her property is spotless, comfortable, cozy, well located And highly recommended - thank you!"
1429904,7002492,2013-09-02,8290402,David,Cecilia was very easy to communicate with but gave us our space in the back stand alone cottage which is what we wanted.  
1429904,7050105,2013-09-04,5226390,Catarina,"We enjoyed our stay very much, the place was very much like what she described. Very quiet and very private. Cecilia provided everything we need in the house, we enjoyed the organic tea  and coffee.... Very nice.

It s a part of Seattle that we never been before, so it' s a great chance to explore the other side of Seattle. Walking distance to bus stops to the U District and downtown. We spent an evening just exploring the area and ended up in fremont, another nice area.

Cecilia was very friendly and very helpful with directions and ideas. We would definitely love to go back!"
1429904,7266080,2013-09-13,5208871,Sharrol,"My husband and I recently stayed at Cecelia's One Room Cottage and we found it welcoming and clean.  I appreciated the board games that were available, the futon was surprisingly comfortable, and the backyard were the cottage is located had a secluded  and private feel due to strategic plantings of bamboo and other flora.  The location was perfect for us and is not far from the university district.   Cecelia graciously went out of her way to accommodate a change in our schedule and was very helpful despite a busy schedule of her own at the time of our visit.  We will definitely book with Cecelia again and recommend  her cottage to others looking for a quiet, clean, and charming place to rest after a day in the city."
1429904,7590133,2013-09-25,410598,Natasha,"Very quiet, clean and private cottage in a nice neighborhood close to UW. Great for a couple. Cecilia's check-in instructions were very easy, and she gave a great recommendation for a local coffee spot."
1429904,7903923,2013-10-07,2321039,Crystal Lynn,"The unit sits in a precious tiny garden in a lovely residential neighborhood.  The futon was really comfortable and the heat worked like a champ, so it was nice and warm in the unit.   Cecilia, whom I didn't get to meet in person but spoke to on the phone, seems nice. I really appreciate her accommodating me (and my cat) with only three days notice. 

There were a few issues with getting clear instructions on many things so I ended up locking myself out of the unit.  There was no key because I was expected to leave my luggage in the unit unsecured.  But then I got a key which was nice, but still a little unnerving that I was expected to leave things unsecured.  It's a nice neighborhood so maybe that's why!   

Unfortunately, there's not a lot of attention to detail in the place.  It's really just a big room with a bathroom.  And you have to be okay washing any dishes in the bathroom sink.  It wasn't exceptionally clean-- it was alright, but  the toilet needed a proper cleaning as did the sink and shower.  It was probably clean enough for the standards of another, but I wouldn't invite someone into my place like that.  I feel like a place should be made pristine for guests.  

And actually, the communication was really poor all along, so we couldn't find linens and my friend ended up sleeping under a throw with a towel.  Also, I couldn't figure out how to get into the place upon arriving and I had to bring in my stuff past a loudly barking dog.  He was in the house behind the glass doors, but seriously, it's not a friendly way to be greeted.  He was so agitated by my presence that I felt bad for him. 
"
1429904,8238783,2013-10-21,2270486,David,"We had a great time in Seattle. Cecilia's cottage was cozy and perfect for us (a couple). Good location, clean, surrounded by green. I'd definitively stay there again.  "
1429904,8668250,2013-11-11,1801085,Ardell,"We enjoyed our stay in Cecilia's cottage.  It was clean, comfortable and located in a nice neighborhood."
1429904,9008339,2013-12-01,178199,Paul,Cecilia was super nice and the place was definitely as-described. Great experience.
1429904,9144809,2013-12-09,283497,Jaered,"Cottage was nice and clean, quiet, and street parking was easy. Cecelia was helpful and friendly, making sure we had everything we needed while still giving us privacy. The best part, I think, is the heated floors. We needed them for all the 20 degree weather we were having!"
1429904,9402272,2013-12-27,3158288,Lawrence,"Cecilia's cottage is delightful and warm!  For us, it was ideally located and easily accessible. We'll not hesitate to stay here again in the future."
1429904,9529223,2014-01-01,10680660,Nathan,"This one room cottage is truly a gem. We had such a great experience staying here, and we can easily say that it exceeded our expectations. The place was very comfortable, clean, and well cared for. We found so many nice things that really made a difference - the comfortable mattress, tea maker, fridge, microwave, utensils, tv and dvd collection, couch, privacy, the list goes on and on. We would definitely stay here again!"
1429904,10394866,2014-02-17,11017539,Dessa,"Great place! Cecilia left us the Sunday paper, oatmeal & cream. She was very accommodating. I would definitely stay there again."
1429904,11312250,2014-03-29,9898232,Kari,"I loved staying at the cottage - it was cozy & quiet, perfect for a little retreat while visiting the city for a 2-day meeting. The cottage is surrounded by lovely spring flowers and blossoming trees and Cecilia was wonderfully welcoming - the cottage will be on my list of favorite places to stay in Seattle! "
1429904,11521531,2014-04-06,5590506,Erika,"My stay in Cecilia's cottage was perfect.  I was in town to visit UW, and Cecilia let me borrow a bike to get around.  The cottage is located very close to the Burke-Gilman trail, and I was able to ride to UW, Gas Works Park and Magnuson Park.  The cottage itself is very nice, and looks exactly like the pictures.  It was clean and comfortable.  While I did have a little trouble with the wifi, Cecilia did everything she could to fix it immediately.  Cecilia was very friendly and helpful with suggestions for me, since it was my first time in Seattle.  Overall, a great place!"
1429904,11966045,2014-04-20,13585897,Ken,"First off, the cottage is wonderfully furnished and has everything a traveler could ask for. Second off, Cecilia was an amazing host, and was wonderfully kind to my girlfriend and me the whole trip through. I was out and about, so I didn't get a chance to meet her, but she was great. 
The cottage is in a beautiful part of town and it wasn't that hard to get to using a bus. If you're in town, it's definitely worth a stay!"
1429904,12311105,2014-04-28,5843985,Annalisa,"Great little nook! It's a wonderful spot with a beautiful backyard, and Cecelia was beyond accommodating, I definitely recommend this place!"
1429904,12572167,2014-05-05,11030949,Bob,"Nice space in a garden. Clean and comfortable.  Might be an issue for people with pet allergies, my wife was congested and itchy as soon as we came in but she is super sensitive to pets and this is clearly a pet friendly place.  Me, I like pets and the cool dog artwork. Everything is nice, just be aware of the possible pet allergies. "
1429904,12850534,2014-05-12,11017539,Dessa,This was my second time staying at the cottage and once again it was lovely.
1429904,13152527,2014-05-20,8821470,David,"I stayed here for three nights with my wife. We wanted to stay somewhere close to downtown but not far, somewhere accessible to mass transit, and a place that had privacy. Cecilia's cottage met all of our needs. I met her on the first day and that was the only time we saw each other. Although I would have enjoyed more time picking her brain about Seattle our paths just did not cross again. Her place was clean and Cecilia made it feel like our own! She even let us use two of her bikes for free! Calculate your savings of not having to rent bikes when considering your stay here. Internet connection had some bumps in the road but it wasn't anything that Cecilia wasn't able to fix with a quick text message. We took advantage if the teas she had available. P.S. There is body wash in the shower so you don't have to pack soap. "
1429904,13415974,2014-05-27,8083385,Daniel,"Cecilia's cottage was perfect for our short stay in Seattle. Only a short drive from all the downtown attractions and located in a quiet neighborhood, it is a great place to relax with a bottle of wine after a long day of sightseeing. She was friendly and helpful, the perfect host."
1429904,14191454,2014-06-14,3924822,Roger,"This is a beautiful, quiet location.  The host was most gracious.  Excellent accommodations."
1429904,14275224,2014-06-16,8385619,Stephanie,"Cecilia's cottage is an incredibly homey and welcoming setting. We really enjoyed the delicious teas and amazing lighting. The neighborhood is quaint and near UW. The bed was very comfortable and left no chance of being sleepless in Seattle.

Overall, fantastic host and lovely stay at Cecilia's one room cottage."
1429904,14415535,2014-06-18,16175651,Cara,"We had an amazing time! The cottage is gorgeous, and Cecilia was super flexible, friendly and gracious. If I'm ever back in Seattle, I would LOVE to stay here again. "
1429904,14572522,2014-06-22,15973478,Patricia,"The cottage was a great quiet, comfortable  space with comfortable bed and beautiful garden.  I used the bikes to cycle on the burke gilman trail.
It had easy street parking and easy access to bus lines.
gracious and helpful host
We really enjoyed our stay and would stay here again."
1429904,15314084,2014-07-07,14736658,Lesley,"Thanks Cecilia for hosting us! Everything was exactly as expected. It really made our weekend trip a lot easier. Staying so close to UW saved us lots of time. Unfortunately we did not have enough time to enjoy the back yard or the rest of the neighborhood, but everything looked great. There was clearly a little construction and improvements going on, but nothing to interfere with our stay."
1429904,16060535,2014-07-21,14296066,Ayesha,"My friend and I were visiting Seattle to attend a workshop at the university of Washington. We loved staying at Cecilia's place. She was an incredible host, and let us use her bikes! She was extremely helpful and we were both very happy staying in Cecilia's cottage. Would highly recommend it!"
1429904,16620096,2014-07-30,1782738,Marilyn,"It was so fun to stay at Cecilia's cottage in the University District of Seattle! Located on a quiet, tree-lined neighborhood street, the cottage safely tucked away in a secret garden behind the house- a truly enchanting atmosphere! The space was cute, colorful, clean, and cozy. Check in and check out process was very easy given Cecilia's responsiveness. She even left fresh berries in the refrigerator for us and offered to lend bikes to us! There are lots of board games, books, and movies in the room as well. The cottage was a comfortable place to return to after busy days in the city and it was very cool in there on hot days (rare for Seattle, I know!). Thank you Cecilia and Mr. Izzo for your hospitality!"
1429904,17295333,2014-08-10,6722743,Karsten,"Excellent room in a safe, cozy neighborhood.  These guys were warm, friendly and accommodating.  Would love to stay here again!"
1429904,18799929,2014-09-01,16961941,Karen,This was the cutest cottage. It had everything we needed for our stay. It is located in a great neighborhood and really close to the city. Cecilia was very warm and welcoming.  I highly recommend this cottage to anyone visiting the area. Her gardens are fabulous. 
1429904,19042984,2014-09-05,13312843,Christie,"This was truly a lovely place to stay! Cecilia is a wonderful host and the cottage was adorable.  Located on a quiet beautiful street, you're close enough to everything you want to visit in Seattle. 

Absolutely make the decision to stay here! :) "
1429904,19544445,2014-09-14,20363523,John,Cecilia is a fantastic host and her place is beautiful. We can't wait to go back.
1429904,19960384,2014-09-21,1522416,Chris,"We loved our stay here. The guest house was amazing, and I can't say enough about how comfortable the bed was. Cecilia made us feel right at home, and I only wish our trip hadn't been so short so we could have gotten to know her a bit better. We will definitely look her up the next time we are in Seattle!"
1429904,20369536,2014-09-28,2688902,Riley,We had a great time staying at Cecilia's cottage. Very comfortable place and accommodating host. Would definitely stay there again!
1429904,21874784,2014-10-26,16725811,Tom,"Cecilia was a great host. Her place is in a nice quiet neighborhood. Convenient to Children's Hospital and the U district. It's also not far off the Seattle bus network, so relatively easy access to the rest of the city using public transportation. Overall a great experience."
1429904,22924148,2014-11-17,52097,Arin,"What a cozy, comfortable place. Cecilia made check in easy and convenient. The heated floors were wonderful on such a cold weekend. The coffee and organic cream were so nice to have in the morning. The bed was warm and comfy. Location was perfect for what we needed. Lots of conveniences very close by.

I would love to stay here again when we're back in the area."
1429904,28323621,2015-03-22,3032931,Judi,"Lovely, warm & cozy cottage...perfect location for me to attend a yoga workshop. Cecilia was so helpful and kind."
1429904,28759134,2015-03-29,3032931,Judi,Cecilia was so kind to make sure I had what I needed to make coffee in the morning and feel so welcomed.  :)  This is the SECOND time I stayed in her cottage -- it was so nice the first time that I came back for more.  (see my previous remarks... which are also glowing with compliments)
1429904,30727996,2015-04-26,29992050,William,"Lovely cottage in a very nice neighborhood. Our host made sure we had everything we needed, and the description was entirely accurate. Great location."
1429904,31232037,2015-05-03,7392019,Janavi,Cecilia was a lovely host. She was very responsive to our needs and made sure we had a comfortable stay. Her apartment is adorable. I would definitely stay here again. 
1429904,33708553,2015-05-31,32995073,Janet,"The cottage is beautiful, clean and in a lovely setting. The location is awesome as it is accessible to shopping, parks and entertainment. Cecilia is a great hostess as she is very friendly and provides information about the area. We had a lovely time and I would recommend this place to others. "
1429904,34675884,2015-06-10,34963648,Jo,"This was my first Airbnb experience, and overall, it was a very positive one.  I had a bit of uncertainty as to how to get back to the cottage.  Once you arrive at the house walk up the driveway and take a right.  Follow the small stepping stones all the way to the side gate.  Once inside the gate, you will see the cottage.  The cottage is lovely and peaceful.  It has everything you need as far as conveniences, and the private garden area with the fountain and flowers was an added bonus.  You won't find that at any hotel.  The bed is very comfortable! Cecilia was very helpful and made sure I was settled in the first night and checked in the following night to see if I needed anything.  The neighborhood is beautiful and located in an area close to everything in Seattle.  I would stay here again.  Thanks Cecilia!"
1429904,35374047,2015-06-18,29995628,Kelly,My daughter and I were here for college visits. Cecilia and Jeff were so gracious and warm. The cottage is lovely and the stay was perfect. 
1429904,36269337,2015-06-27,320541,Rosemary,"Cecilia and her family are ideal hosts - warm, welcoming and helpful - and her cottage is well-equipped, clean and situated in a beautifully landscaped backyard. The neighbourhood is quiet and great for walking. I hope to stay there again! "
1429904,36585670,2015-06-29,35522501,Sun Fai,"The house  were nice for the price. Super clean with comfortable bed. Location is excellent, Cecilia was very friendly and helpful.thank a lot"
1429904,37045826,2015-07-04,228540,Diane,"This is truly lovely - a little bit of Narnia in a quiet corner of Seattle. Cecila & her husband are lovely: very welcoming and eager to share their local knowledge. A huge bonus was the bikes they let us use: this truly made one of our days amazing while we were there. Also if you like cats, you'll have lots of furry guys to pet as they like to hang out on the premises (this was a big plus for me). Truly a cozy getaway in the city!"
1429904,37483586,2015-07-07,18003335,Mary,"This was a lovely experience at Cecelia's cottage. I loved the quietness, the sound of the trickling fountain outside the windows, and the wonderful coffee and other surprises she left for us in the fridge.  Because we were arriving VERY late, our beds were ready and waiting for us ( including the futon). Our host and hostess were also very personable and eager to help in any way they could. I would definitely recommend this property. "
1429904,38279405,2015-07-14,11088381,Henriette,"Cecilia's cute little cottage is very conveniently located for the University district and the Burke Gilman trail. It is very cozy and cute and has all amenities except a cooking stove. Cecilia and her husband were very welcoming with even beer and cream in the fridge and coffee and tea ready to make. Tehe bikes were nice but unfortunaty too small for me to be comfortable. But I am a tall Dutch girl, and used to larger bikes"
1429904,38607009,2015-07-17,5008569,Lindsay,"Upon arrival we were greeted by Jeff who was friendly and offered some helpful tips! The cottage itself is really cute and has all sorts of amenities (phone chargers, a hair dryer, books, tea, etc). It's set in a gorgeous and pretty well-located neighbourhood for getting into downtown Seattle. It was also nice to know that Jeff and Cecilia make themselves available for help/questions via text. We had a great stay!"
1429904,38860919,2015-07-19,35042874,Krystal,"We had a seamless sand wonderful stay in this cottage. The listing was described accurately and was in one of the best neighborhoods I've been in in Seattle. The host was very helpful and explained the door code for us and after inquiring about a beach towel they immediately retrieved one for us :)


We were glad to see all the extras they offered; 2 bikes for our use w/ helmets, oatmeal packets with hot water heater, games and super soft sheets! 

We will definitely stay again if it's available."
1429904,40098860,2015-07-28,5414961,Henning,"We warmly recommend this airbnb!! Cecelia's cottage is a cosy oasis to come back to after a day in bustling Seattle. Tucked away in her garden it is quiet and peaceful. The neighborhood is a lovely residential area from which you can quickly reach the university district - be aware though that if you don't have a car the bus commute to downtown can take about 45 minutes. Cecilia was a great host, providing us with everything we needed (she was even kind enough to pick us up from the light rail when we arrived!). All in all a great experience, we would definitely stay here again!"
1429904,41225152,2015-08-05,36630215,Brian,"Cottage is exceptionally comfortable, quiet, clean, all the little things that make being away from home bearable. Location is ideal, wonderful neighborhood."
1429904,41350031,2015-08-07,7553534,Renate,"Both Cecilia and her husband made us feel welcome when we arrived. They explained everything to us with regards to the functioning of the cottage. The beds were comfortable, and we enjoyed the privacy of the cottage as well as quiet neighborhood."
