listing_id,id,date,reviewer_id,reviewer_name,comments
5862552,36542538,2015-06-29,32696785,Melaine,Working with Krystal was so easy! She responded so quickly to all my questions and was very helpful during the process. This rental is very nice! The view of the water at sunset offered a great backdrop for pictures and the beds were comfortable. You can tell that the place has been well cared for. 
5862552,38260405,2015-07-14,29293905,Martin,"Krystal is absolutely tops in customer service!  I was setting up this house for several family members who were coming to Seattle, so I had more than a few questions coming from a few people to pass on to Krystal, and she responded so quickly and so thoroughly every time!  My family had a very good time at the ""Sunset Villa"" and ""Sunset Grotto"", and the space met all of their needs. It was clean, organized, and comfortable, with both good common space and private space.  And what a great neighborhood! Beautiful walks through curvy streets leading to Alki Beach; great living room views of the water and the mountains.  The outdoor table and chairs also meant some nice casual dining in the delightful Seattle summer weather.  I would eagerly work with Krystal again and would recommend her to everyone.  "
5862552,39015572,2015-07-20,15899024,Patrick,"Great neighborhood and a great place to stay! A few friends and I stayed at Krystal's home for a wedding, and we loved it. The view of the sound was a great perk - I'll be back!"
5862552,39912415,2015-07-27,6991416,Cindy,What a fantastic location!  Krystal was very responsive both before and during our visit.  She made us feel very welcome.  The house and grounds were in great condition and that view!  We had a large group and everyone enjoyed themselves and had plenty of room.  Would definitely recommend.
5862552,40631257,2015-08-01,3177736,Zheng,"My family and friends stayed here for 3 nights. We loved the location and view. It's just a few minutes walk to Alki beach. And we did bbq, which is an amazing experience."
5862552,42670062,2015-08-15,30402013,Ivana,"It is a great and spacious house with a beautiful view. The neighbourhood is very nice and quiet. Kitchen is great!

Krystal was very helpful with all of our questions. 

Best recommendations for this house!"
5862552,43105878,2015-08-17,36104542,Garet,"Loved this place and everything about the transaction.  Krystal was great to work with, checked in on us to make sure we were ok, and the place was furnished and very nice with an amazing view.  We got to watch a beautiful rainstorm over the ocean from the living room.  Its also in a very nice neighborhood area.  One thing to note, there is another apt(?) for rent under you so you may have someone else there, but it is very separate and we only saw them, never heard them or had any problems.   over all it was a great experience."
5862552,45141826,2015-08-31,5040062,Michael,"A group of 10 of us stayed at the Sunset Villa and Sunset Grotto. It was perfect for us! Krystal was a fantastic host, super responsive and helpful!

The location is great, it's a different feel from downtown Seattle which was kind of nice to see different sides of the area. The view is spectacular and you're just a mile from beach. It's about a 15-20 min Uber ride to downtown and once we were downtown we walked everywhere.  

The house was clean and the king bed in the master was really comfortable.  "
5862552,47012514,2015-09-14,43882783,Drew,"Altogether great experience. The home was just what we were looking for and had everything we needed. It felt comfortable and inviting, and provided easy access to the beach, proximity to stires and restaurants and an amazing view. 

Krystal was a great host and respoused quickly to any questions we had. If you're looking for a place in the Alki area, this is a must. If you're looking for somewhere anywhere on Seattle, this is definitely high on my list."
5862552,49353890,2015-10-03,6448382,Tracy,我们一行6人住了7个晚上，房子景观很棒！客厅里是180度海湾景观，可以静坐阳台欣赏日落。交通也非常方便，门口有公交到Downtown。开车到Seattle Downtown仅需20分钟。
5862552,49661130,2015-10-05,43721835,Corbin,We really enjoyed our stay at Sunset Villa. It was a beautiful home with an amazing view of the water. 
5862552,52157421,2015-10-26,23231318,Andres,"The  Sunset Villa had a great location in West Seattle with a lot of attractions near by and just a quick car ride away from downtown. The house was comfortable, clean, and had all the essentials you need. We had a slight issue with the bathroom upon our arrival but that was quickly resolved by Krystal and we all really appreciated that. Krystal is always ready and available to help out and make your stay as enjoyable as possible. I would really recommend staying at this listing! "
5862552,55844923,2015-12-06,27596564,Beth,"What a view! This is a lovely little place, and we were cozy for our one night stay. The water is a nice walk down the hill, although the hike back up is a little challenging! Everything was easy to use and in good repair. Extra comfy beds, too!"
5862552,57520546,2015-12-27,46574674,Maureen,"The house has an incredible view of the Sound. It was a lovely neighborhood and located very well for our family's needs. The ease of entry with the lockbox worked well. The house was warm and the temperature consistent despite some rather cold rainy weather, the house stayed nice and warm. There were, however, not a lot of amenities for our party of 7 adults, with insufficient seating in the living room and dining area. The pull out couch was very uncomfortable and the remarkably limited cable service was disappointing for a winter stay that included a lot of inside time. Throwing the trash away was also a bit of a challenge, since the trash bins were located in the alley way behind the property, and we could find no way to access from the house without walking around the corner to empty our trash "
2486612,10790788,2014-03-07,44934,Darren,"Thanks so much to Genjo, Dana and Michael for welcoming us at a moment's notice. We were rolling into Seattle after a long road trip not sure of where we were staying that night and within minutes of requesting, they replied and readied the place for us. We were honored to be their first airbnb guests in their beautiful and quiet apartment atop a zen meditation center. It's located in a nice suburb within walking distance of some great restaurants (try the Mexican place around the corner) and very easy and close to all major metro areas. My only regret is not taking them up on their offer to join the meditation class but we were all to tired after the trip. I definitely will if I find myself In Seattle again. They were also very flexible with our schedule and let us book a second night on the spot. I can't recommend their accommodations and hospitality highly enough. Thanks!!"
2486612,11388109,2014-03-31,887583,Charlie,"Dana who is the building manager met us promptly when we entered and we did not even give notice to when we would arrive (we didint know) The apartment was quite large and lots of room for two people. It was colorful and lots of windows on the second floor. Furniture and decorations were cute and didn't take up too much room. We were left peacefully although we were mostly out in the city. Dana also recommended some food and parks around the area to see. 

There is a meditation center downstairs and we were offered to join in but had no time. The back yard is gorgeous with plenty of parking on the gravel spaces. We will definitely come back on our next trip down. "
2486612,11808323,2014-04-15,1991489,Andrea,"I was in Seattle on business and wanted a quiet, restful place to stay and sometimes work. The ""Zen"" apartment was just what I needed. The apartment was larger than I had expected, airy, peaceful, and bright. The neighborhood was quiet and full of spring.  We enjoyed the garden behind the house, Genjo was an excellent host, responsive to emails, and accommodating when we missed a ferry. And Dana was great in showing us around. We'll be back!"
2486612,11902534,2014-04-18,3886462,Caroleen & Tjard,"We only stayed over night, but the place was clean, comfy and well kept. We we greeted and treated really well and had a great stay. Thanks!"
2486612,12011041,2014-04-21,13545086,Katarzyna,"Had a perfect stay -- very easy to check in and out, the apartment was *great*! We had everything we could want -- kitchen, table, bath, towels -- and we slept soundly. The apartment was as well taken care of as the pictures look.

We are looking forward to staying here on all our return visits to Seattle."
2486612,12242076,2014-04-27,4170005,Fred,"This was the best place to stay. It was so clean and quiet that it was easy to concentrate, meditate and get centered. The garden was lovely, and the kitchen was perfect for me. I hope that I can stay here again in the future (but actually join the larger group for meditation!).

Thank you again. Lovely people and a lovely place."
2486612,12505062,2014-05-04,1336479,Kristoffer Vik,"Genjos apartment was a good place for a night. The Zen garden is very nice, and the neighborhood seemed quiet with lots of cool restaurants nearby.

Even though the listing says it sleeps 5 people, please bear in mind that the apartment is optimally set up for two people.

The location is outside Downtown Seattle, so be prepared to take transit or drive."
2486612,13146329,2014-05-20,6714567,Patricia,"The Zen apartment is an oasis of peace, with a lovely garden, in a quiet neighborhood.   I felt completely safe walking around in the evening.  A public bus was a block away, making it easy to get around the city without taking our car.  Having an off-street parking space to leave the car was a plus.  Two of us stayed in the apartment and I slept on the pull out single bed----it was amazingly comfortable!  The two hosts, Dana and Genjo, and both were very helpful and made check in and check out easy, and they provided information about the neighborhood, making it easy to find what we needed.  I would definitely stay here again, primarily because of the quiet atmosphere.  The building does house the meditation center, so I would hope guests would both be attracted to it because of that and respect the peace and quiet of the building.  "
2486612,13675135,2014-06-02,474767,R.,"This place is awesome!  Host and place are perfect. Bring your own food. Nearby aGreat Indian, coffee, and market within walking. Very easy to either take public transportation or drive your own car to see all the sights in the vibrant city of Seattle. Enjoy"
2486612,15859843,2014-07-17,2089499,Jean Et Chantal,"Our stay at the ""zen"" appartment was   enjoyable. The appartment is conveniently situated in a quiet neighbourhood and it is easy to access downtown Seattle. Dana was a perfect host and she was available to help us.

Merci beaucoup.

Chantal et Jean"
2486612,16458196,2014-07-28,12723160,Kelsey,"A friend and I traveled to Seattle as part of our West Coast vacation and stayed in Beacon Hill on a recommendation from another friend. This apartment was comfortable and quiet -- perfect for a three-night stay at the tail end of a long trip. Our host welcomed us warmly when we arrived, and we immediately felt at home in the bright, spacious living room. Everything was clean and neat, and we loved the little extras, like the high-quality handsoaps and the handy packet of information about the neighborhood. We left on Sunday morning feeling rested and grateful. Thank you for such a wonderful experience!"
2486612,16687663,2014-07-31,4514077,Laura,"Lovely simple apartment, quiet with all the necessities."
2486612,16747626,2014-08-01,18234788,Anchor,"Genjo and Dana were wonderful hosts. Good communication prior to the trip, met us when we got there to let us in. The apartment had everything we needed, great location, short and sweet stay. Thank you for having us. "
2486612,16973170,2014-08-05,10095509,Wilf,"My wife, 13 year old son and I are from England and we recently spent 4 nights at the apartment.  Firstly do not be put off by the title - this is a great place to stay.  The location is good - a quiet residential neighbourhood with restaurants and a very good grocery store close by  (lots of information made available by the host) and the bus stop to get down town (15 mins on the bus) is only a couple of blocks away.  The apartment is comfortable, spacious and very good value for money - large living room, with good sized kitchen, bathroom  and bedroom.  We didn't meet Genjo as he was away but Dana and Carolyn who also live in the block couldn't have been more helpful - thanks ladies for being of assistance.  "
2486612,17122621,2014-08-07,18660461,Ryan,"Staying at the Zen apartment was an excellent experience. The place was clean, nicely furnished, the bed was comfy, and the building was very peaceful. We were also happy to have good food and coffee within walking distance. Sally, who greeted us, was very kind and made us feel right at home. I would absolutely stay there again."
2486612,17141645,2014-08-08,10473218,Jenny,We had a great stay at the Zen Apartment. Lots of light with the large picture windows. We came in at the end of the day and left early the next day. The apartment was a  great size. It was quite warm but the space had great ventilation. The grounds are beautiful!
2486612,17240717,2014-08-09,13325456,Cori,"Very friendly and communicative.  We were booked to stay at the Zen apartment, but due to my mother falling ill, was not able to make the trip to Seattle.  What I can say is that Genjo was understanding, and communicated well, and the next time I am in Seattle I will be looking to rest here first."
2486612,17431723,2014-08-12,5106872,Jenny,"The apartment was exactly as listed. Dana was a great host, and was accommodating with our late night arrival. The area around the apartment was nice and quiet at night, and the apartment was very clean. It was about a 10 minute walk to the light rail, which was very convenient to downtown and the airport. I would definitely look at staying here again next time I am in Seattle!"
2486612,17573134,2014-08-14,11528828,Maggie,"We had a great stay at the ""zen"" apartment. The apartment was comfortable and spacious. We did not meet Genjo during our stay. However, Dana, 
who lives in the same building was extremely kind and helpful. She made check in/out easy and was available when needed. She also provided some helpful hot spots to check out. The location was not too far from downtown. We had a car and there was always parking available on the block. Overall, we had a wonderful stay and hope to visit Seattle again soon! "
2486612,17693982,2014-08-16,13641969,Jessica,"The zen apartment was very spacious and clean, and the neighborhood had some cool restaurants to check out. Unfortunately, we were only able to stay one night, but the time we spent there was enjoyable. No complaints!"
2486612,17787326,2014-08-17,2255576,Irma,"We had a lovely stay at Zen Apartments. Genjo contacted us before our visit to give us directions and it was easy to find. We felt safe leaving our car parked out the front. Jaye met us with a warm and friendly welcome and helped us settle in with lots of recommendations of the area. The apartment was clean and peaceful. Plenty of room for 3 people - 2 in the bed and 1 on the couch. We appreciated the clean towels and bathroom products that had been left. Some coffee would have been nice for the coffee maker but there was a great cafe around the corner that did really good espresso! Wish we had tried some of the bars and restaurants, nice area! Great stay for one night. Thank you! Some guidebooks on Seattle and some more brochures/flyers would have been nice! :)"
2486612,17820628,2014-08-18,14698650,Amber,"We were met by Dana, who was extremely accommodating by letting us check in a little early. Dana was very kind and helpful. She had even left a little plate of brownies for us. There was a printed version of the guidebook, so we could find places in the neighborhood.

The apartment was everything promised: quiet and clean, quite comfortable, and exactly the type of place where I would take my mother when she comes for a visit. The gardens were amazingly beautiful, much more so than the pictures here represent. I highly recommend spending some time out in them. The kitchen was adequate for our short stay. The stove was great, and we had the wonderful surprise of a brand new waffle maker.  It even had a blender if one wanted to make smoothies. When my mom comes, I'll also have to set something to cooking in the crock pot while we explore the city. Fridge was great, clean and plenty large enough, and had a large amount of ice ready for our use. Thanks, Dana!

There were three of us staying, and we had considered staying in the ""nice"" hostel, but we wanted more privacy and quiet. We totally got what we wanted and felt this apartment was a great value. We were minutes away from where we wanted to be, but we felt isolated from the noise of the city. The neighborhood was really nice and friendly. We definitely want to stay here again so we can spend time exploring the neighborhood."
2486612,17948535,2014-08-19,17676683,Stephanie,"Clean, bright space. 4 adults stayed very comfortably at this apartment. The host was very kind and welcoming, and even provided a list of nearby amenities. Close to the highway, which is very convenient but can be a bit noisy if you are a light sleeper. All in all a good experience. Thank you!"
2486612,18067328,2014-08-21,1862154,Remo,"Could not have picked a better place to stay. 
Genjo and Dana were very responsive and helpful with advice on what to do around the area. 
I recommend taking part of the various zen activities that take place throughout the week--a true gift. "
2486612,18502111,2014-08-27,2366361,Jake,The place was clean and definitely Zen. Not far from downtown at all. Jaye was super helpful and full of positive energy! I would definitely recommend.
2486612,18944603,2014-09-03,17935854,Katrina,"We thoroughly enjoyed our stay!! The apartment is so centrally located, only a 20 minute bus ride to pike place market and downtown. Jaye was so friendly and helpful, the next time we are in Seattle, we will definitely be staying here!!! Thank you so much!!"
2486612,19146577,2014-09-07,10238685,Alex,"Awesome, loved it. 

Very peaceful, great neighbourhood. Exactly what we needed. We'll be back!!!

"
2486612,19676159,2014-09-16,2934716,Margaret,"The host rep Jaye, was available and made us feel welcome. The apt is as pictured;  wifi available, no tv (which I loved)!  Great neighborhood, especially since our oldest son and family lived about 6 blocks away.  Light rail, grocery store, restaurants and great park for kids but a few blocks away.  We would stay here again"
2486612,21085762,2014-10-11,21050295,Wlodek,"The apartment was spacious, as described, with easy access to buses and the rail. 

We could check in once we arrived in Seattle, before the ""official check in time"". We were warmly welcomed at the door. 

We enjoyed our visit to Seattle."
2486612,21127250,2014-10-12,19466890,Stacey,"Genjo was so accommodating to us to check in early and  set up the apartment very nicely. While we only stayed for one night, the space was great for the five of us and the neighborhood is beautiful. "
2486612,21656165,2014-10-21,20019571,Jesson,"What a fantastic, cozy, and peaceful respite from the busyness of our trip! My mom and I stayed here with my 16-month old don and couldn't have been more pleased with our choice. The rooms were comfortable and spacious, the hosts very welcoming yet not intrusive, and we discovered one of the best coffee shops we have ever been to right around the corner from us. All in all a fantastic place to stay. We will definitely be back!!"
2486612,22061603,2014-10-29,17282010,Grace,"Our host's assistant was very welcoming but looking back we would have found a caution about the uneven front steps and info about the coin laundry more helpful than the introduction to the toaster and coffee maker. This apartment would be better advertised as a comfortable place for two sharing the very nice bedroom. The bedding and extra beds in the living room were inadequate for an 8 day stay. My friend and I were dismayed that it took over a day for a response to a complaint about the clunking refrigerator (compressor) and that it was not repaired or replaced (we turned it off at night, which was a poor resolution). The neighborhood was wonderful: beautiful, quiet and convenient to everything we wanted to do and see."
2486612,22468865,2014-11-07,22927381,Sandra,"Our host was very warm and helpful.  My questions were answered almost immediatly.  I loved the place very clean, quite, comfortable, spacious and welcoming.  I was in town for a conference and was able to get some work done while in the apartment. The apartment is in a central location with serveral restuarants and coffee places to go to if you want to dine out or a well equiped kitchen if you want to prepare your own meal.  Genjo and Jaye were very nice and helpful. "
2486612,22559631,2014-11-09,20289132,Jeni,"Enjoyed our stay at this very cute, ckean, quiet apartment on Beacon Hill. Host was very responsive and friendly,  check in and check out were easy and convenient.  Would definitely stay here again!"
2486612,24343715,2014-12-26,15814422,Jean,"Nice welcome, waiting for us at the door. A small booklet with information about the neighbourhood is provided, which is a nice touch. 
Bedding was OK for 5 people (two couples and one person flying solo) for one night, but would not recommend that much people for more than a few nights.
Bathroom was kinda old, but clean. Linen and soap provided."
2486612,24516386,2014-12-29,3708380,Steeve,"The place was perfect for our time in Seattle. Quiet and perfectly located, this appartment had a lot of character. There were coffee shop, pubs, and good restaurant around, which was very convenient. 
I will definitely stay there again!!
Thanks for your hospitality, Genjo! We had a great time!"
2486612,25458404,2015-01-16,20523702,Gabe,"The apartment was really nice and quiet. The neighborhood is safe and close to a number of amenities. No TV in the apartment, which makes sense given that it's in a meditation center. Host was gracious and accommodating. "
2486612,26408434,2015-02-11,17102524,Sherri,"Genjo's place was in the perfect location, 2 blocks from the light rail, in a clean, quiet neighborhood with great street parking. There was plenty of space for the two of us, and when a third friend joined us it was still roomy with plenty of beds. Great kitchen amenities and bathroom. Excellent stay for the price- great value!"
2486612,26986482,2015-02-23,2934716,Margaret,"The ultimate recommendation is that this is a return to the zen house for Jim and me.  Quiet, clean, everything we need w/in walking distance. The best is that it's only blocks from our son and his family!  Nice to see Jaye again and know he's just across the hall if we need anything.  Reminder, no tv (wonderful) but internet is on site and readily available."
2486612,29473959,2015-04-07,3927977,Bobbi,Genjo and his staff were very accommodating as our flight was late and so we were late in arriving at the airbnb. The location was in a nice quiet neighborhood very convenient to the city.  We enjoyed our stay there.
2486612,31658522,2015-05-08,12912420,Peter,"Genjo and Seiho were wonderful hosts and we had an amazing time staying here. The apartment is extremely quiet and close to Jefferson Park, as well as some small shops. Parking near the apartment was easy; there was always a spot in front of the building, even closer to the front door than the parking lot in the back.

Seiho, especially, was really wonderful and accommodated all of our needs. We have a 9-month baby, and Seiho went above and beyond by bringing us extra supplies and baby wipes. He was so kind and understanding, and such a friendly person.

Thank you so much for a great stay in Seattle!"
2486612,32084069,2015-05-13,26636119,Kim,The host canceled this reservation 40 days before arrival. This is an automated posting.
2486612,32177144,2015-05-15,1102082,Jess And Josh,Great location and cute apartment. We booked this unit for family who was coming to town to help assist after the birth of our baby. Unfortunately the baby ended up getting sick and our family felt that it was better to stay at our house to better help us. They stayed one night and ended up canceling the rest of the stay. Genjo was very accommodating to our unforeseen cancellation and quick to respond to our emails. 
2486612,32440457,2015-05-17,1465835,Alex,"This place was very nice, clean, peaceful, and comfortable. I would definitely come back to stay here again."
2486612,32799923,2015-05-21,20378169,Rick,"Quiet and clean apartment with restaurants and other amenities nearby.  This part of town is a bit outside of the normal areas I stay, but I definitely would stay here again."
2486612,34139749,2015-06-05,6204633,Carolyn,"We felt very welcomed indeed by Seiho. He was enthusiastic and helpful and gave us advice on where to eat as well as encouraging us to visit the park close by which did have ""killer-views""! "
