listing_id,id,date,reviewer_id,reviewer_name,comments
522287,4605467,2013-05-14,6146802,Stephan,"Roger was friendly and very readily accessible. When I wanted the wireless internet access code, I simply texted him and he replied promptly. Room & amenities were clean."
522287,4643303,2013-05-17,6071202,Edward,"Had a great time. 
Roger was a great guy to chat with and I really enjoyed my time.
He was a fantastic host, and made me very welcome in his homely house.
Perfect location and a great neighborhood."
522287,4691059,2013-05-20,2927940,Carrie,"Roger was a great host and very easy to coordinate with on my visit.  He was very helpful and courteous host, and great to share conversation with!"
522287,4817514,2013-05-27,380034,Stephen,"Roger was a great host, interesting guy and a pleasure to be around. I spent very little time at the house, but the location was great and the bedroom functioned just fine. The place was clean with space available in a dresser and closed. Internet worked perfect. Bed was comfortable and warm. All in all Roger's place provides visitors with an excellent Seattle experience"
522287,4841688,2013-05-28,3597702,Joseph,"We had just a short stay here but it was perfect for our needs. The place is walking distance to some great Seattle neighborhoods. 

Roger was very welcoming and a great host. "
522287,4910345,2013-06-01,5008344,Ben,"I stayed in Roger's guest bedroom for three nights.  It's homey -- not a fancy hotel-room feeling, but as though you're staying with a friend (which you are while you're there -- Roger is great).  Everything was tidy and clean.  It's a pleasant 30-minute walk from UW campus and there's a bus stop nearby.  I'd choose Roger's place again!"
522287,4971758,2013-06-04,1453199,Christine,"My grandson and I spent three nights at Roger's wonderful house and garden, I in the upstairs bedroom and my grandson on the porch.  Both were clean and comfortable.  I enjoyed making coffee in his meticulous kitchen in the morning and chatting about what to do for the day.  At Roger's suggestion, we toured both the Flight Museum and the Boeing factory, both big hits with a fourteen year old. It's a great price for a homey stay at a home away from home."
522287,5094505,2013-06-11,850221,Lori Michele,"Roger's place was in a perfect location, close to where I needed to be, clean and quiet. Roger is a gracious host and an excellent person.  I highly recommend staying with Roger.  "
522287,5110255,2013-06-12,5553545,Yvonne,"I had just a short stay here but it was perfect for my needs.  Roger is a wonderful host and his place is in a great location!  House infused artistic touches create a harmonized charm, my cup of tea!!"
522287,5204465,2013-06-18,5141529,Nancy,"It was great to meet Roger and to stay at his lovely place. It was very conveniently located. Being artists, Roger and I had a lot in common and we hit it off right away. I would come back again."
522287,5286659,2013-06-22,6950125,Greg,"Roger  is a thoughtful, organized person.  It shows in his home and his caring attitude towards his guests.  We didn't personally meet during my 3 night stay, because of different schedules, but I feel that I know quite a bit about him.  

His 1910 vintage home is well kept and very convenient to Seattle activities.  I'd recommend staying here if you need a simple, stylish home away from home!"
522287,5345614,2013-06-25,2380298,Yves,"Very nice stay at Roger's. Interesting, quiet and friendly neighbourhood. Roger's passion for the Japanese culture was good to hear and share. The Fremont Solstice Festival is a must event to attend in that city. Thank you for your company !"
522287,5467426,2013-07-01,2650165,Deborah,"This was our first time booking a private room rather than an entire apt on Airbnb, and it turned out to be one of our best stays yet! Roger was very easy to coordinate with and fun to talk to. We very much enjoyed hanging out with him on the porch and talking about traveling, his work and life in Seattle. We wished we could have stayed longer and look forward to staying with him again next time we visit Seattle."
522287,5610843,2013-07-08,6826120,Eleanor,"I came into town a few days before a convention; as a previous Seattle resident I wanted to stay in a place that was located near some of the many wonderful neighborhoods the city has to offer. Roger is a gracious and kindly host, directing me to the choicest place for latte's and Vietnamese pastries, and ensuring I was both oriented to the area and comfortable in his home. The house is comfy, quaint and makes one immediately feel as if they are visiting an old friend. He made me a latte, offered up a few snacks and we chatted on the front porch for a time before I set off for a short jaunt over to the main Fremont area. I will absolutely stay here again on my next visit; I deeply appreciate Roger opening up his home to travelers. He also is a marvelous glassblower - it just so happened that the hotel I stayed in for the convention downtown has a wonderful and enormous art installation of his directly in the lobby - so check out the Grand Hyatt! Lovely time, highly recommended. "
522287,5653757,2013-07-09,29918,Torr,"Roger was kind enough to quickly respond to our inquiry for a single night in Seattle. He was hospitable, kind, open and accommodating. Highly recommend."
522287,5710606,2013-07-13,5820436,Patrick,My stay with Roger was restful.  He is quiet but also open for a little conversation.  From his place I walked down to Gas Light park for dinner one night.  The home is clean and well represented on the airbnb site.  I'd recommend a stay with Roger.
522287,5802835,2013-07-16,3097447,Karina,Roger is an amazing host.  We had lots in common and enjoyed visiting with him.  His house is very cute and conveniently located.  We hope to stay with him again sometime.
522287,5831111,2013-07-18,7111270,Benjamin,Roger was the PERFECT host. We stayed two day in his very nice House and he actually took a day off and showed us around Seattle! This was absolutely amazing! He is the nicest guy you can imagine. The neighbourhood is really lovely and he can point you to all the best spots and food. If you stay in Seattle and stay anywhere else you fail at AirBnB. I would give six stars if I could.
522287,5883762,2013-07-21,2108557,Susan,"Roger was a superb host. He was very knowledgeable of the area and gave us great tips. He was kind, warm and welcoming. I'd return in a heartbeat! Thank you very much, Roger."
522287,5944267,2013-07-23,6121800,Lucy,"We had a wonderful, relaxing two-night stay with Roger, who could not have been a more welcoming and accomodating host! The location is wonderful for exploring Fremont, which has plenty of good places to eat, and hosts Theo's chocolate factory (which runs a great tour as well). Highly recommended, would definitely stay here again!"
522287,5997209,2013-07-25,7218901,Simone,Roger is a congenial fellow and nice host.  He made sure I had everything I needed.  I had a pleasant stay.
522287,6037400,2013-07-27,7626484,Aman,Roger is a great host. We enjoyed his company
522287,6077310,2013-07-29,6941097,Ricky,Roger is a kind holder. He could offer guests a lot of helps. And the room is very comfortable. The location is very convenient for traveller
522287,6136627,2013-07-31,2478813,Ioanna,"Roger was very friendly and welcoming, we very much enjoyed our stay, thanks! "
522287,6304398,2013-08-07,6935079,Diane,Roger's house is in a very nice area and very close to buses which was great. It was very easy and quick to get into the city and other places. The house is lovely with lots of art works around and the beds were comfortable. Roger was flexible in letting us use the sunroom as well which we really appreciated. He was also helpful in providing maps and transport information and trusting in that he left us in the house while he went on holiday. It was also good to be in an area of the city that was familiar to me and we had a good time there.
522287,6373065,2013-08-10,5823305,Abi,"Roger was away during our stay, but was super-helpful and friendly in all our communications. This house is in a lovely neighbourhood, close to restaurants and to Downtown. Very welcoming and comfortable. We would definitely return."
522287,6601718,2013-08-18,8009024,Ashlee,"Roger was a wonderful host! Great house, everything was just what I needed. Thanks for a memorable trip. "
522287,6649550,2013-08-19,8185984,Shannie,Roger was very responsive and accommodating. His space was cozy and his personality warm. He gave some great suggestions for interesting sights in the area.
522287,6710953,2013-08-22,7074473,Carol,"Roger is a very friendy host who gave helpful information about Seattle.  The neighborhood is very walkable and has many stores, restaurants, and is on a busline."
522287,6742064,2013-08-23,955935,Garrett,Roger is a fantastic host. Made my wife and friend very welcome. Very easy to chat with and the accommodations were very clean and comfy. We will definitely call on Roger again.
522287,6849853,2013-08-27,7354233,Regine,We were very content to stay in Roger's wonderful little house. He was a very good host with a lot of helpful informations. We will enjoy to stay there soon. Thanks!
522287,6945535,2013-08-31,1098250,Jonny,"Roger is a very kind and informative host. The house is charming and conveniently located near Fremont, Ballard, and Wallingford. Highly recommended."
522287,6977096,2013-09-01,8437884,Rick,"My wife and I wanted a short getaway to Seattle. However, this time we were looking to venture out of downtown and experience the neighbourhoods. It only seemed natural to book a place through airbnb for a more local experience. We were not disappointed with any of our arrangements, this being the first time using airbnb.

Roger was very hospitable and welcoming, taking the time to show us where everything was that we might need, and ready with suggestions as to what we might see or do. He made us feel right at home.

The historic house is tastefully decorated with Roger's art and that of his friends. Be sure to take some time to appreciate it. Note that there are shared living arrangements. However, we did not find this to be an inconvenience, nor an encroachment on our privacy. 

Our experience with Roger was like visiting a relative. If we have the chance to stay with him again, we will definitely plan a longer visit. "
522287,7010873,2013-09-03,7307800,Kimberly,This was our first time using airbnb so we were not sure what to expect. Roger made us feel right at home. His 1911 home is filled with character. The location and proximity to a main bus line made travelling to Seattle effortless. We were very pleased with our stay and have already told Roger that we will be back!
522287,7072999,2013-09-05,8060362,Christian,"Un hôte extrêmement gentil et prévenant, n'hésitant pas à nous faire visiter sa ville. Un lieu que nous recommandons chaudement"
522287,7108550,2013-09-06,8575094,Garett,"Fantastic experience. Great, clean place, and Roger responded to all our correspondences quickly. Accommodations aside, we were able to explore some of the most down-to-Earth thanks to Roger's great advice. "
522287,7234262,2013-09-11,2972262,Sean,"Roger's home, conveniently located to Metro bus lines, provides a quiet interlude when visiting Seattle, and he is an excellent host willing to share his enjoyable life with guests. "
522287,7295940,2013-09-14,8752164,Kate,"This was my first time visiting Seattle and staying in Roger's charming, clean and comfortable home in a great neighborhood and convenient to major bus lines was the perfect introduction. Roger is a wonderful host and his generous advice and recommendations were invaluable. Thank you, Roger!! I look forward to coming back!"
522287,7328512,2013-09-16,2632169,Alicia,"Roger was super duper friendly, helpful and easy to be around.   The house is in great location and totally comfortable.  I would stay there again for sure!! "
522287,7387825,2013-09-17,8831762,Ann,"Although Roger was not home because of a previous commitment, he left good information on how to check in and was very gracious when we met him the next morning.  He was also very helpful in giving me information on how I could become an airbnb host."
522287,7507453,2013-09-23,208111,Rob,"Roger's home is clean, comfortable and well-located in Freemont-Wallingford.  He's a relaxed,knowledgeable and helpful host, and graciously accommodated our (preplanned) late arrival.  Would happily return."
522287,7617106,2013-09-26,4923813,Chad,Awesome host.. couldn't have been more accommodating!
522287,7637940,2013-09-27,81644,Jessica,"Roger is a great host! Although I just stayed for one night, he was very welcoming and his house it's very cozy and clean!.
He has a nice flow at the house so it makes you feel comfortable.
Totally recommended! 
Thanks Roger!!!"
522287,7795910,2013-10-03,196804,Donna,"Roger's  home was just perfect for my trip to visit my son and his family. As  Roger was away I had his lovely cottage to myself. The bed was very comfortable and the artsy decor wAs nice to come home to. The location within a short walk to all the trendy restaurants in Fremont was great. I also appreciated that this home is not on top if a hill!
I would definitely plan to stay here again if it's available on my next visit.  
Donna"
522287,7923201,2013-10-08,8695015,Sharon,"Lovely bachelor pad, very clean and comfy. 2 blocks from the bus to downtown ( a 15- 20 min ride) and in a quiet neighborhood. I did not get to meet Roger as he was away, but he made sure I had everything I needed.
A great bargain!"
522287,8030706,2013-10-13,9195500,Berry,"I had a comfortable stay (though short) in this charming home. Roger is kind and welcoming and I felt right at home. We had opposite schedules, so I only talked to Roger briefly in the evening. He made sure I had everything I needed. The house is welcoming and clean. Street parking was available. I didn't use public transportation this time as I was dropping off things at my son's dorm at UW, just a short ride away. If available, I will stay here again and then hopefully get to know Roger and the neighborhood. "
522287,8223534,2013-10-21,9036567,Kate,"Roger's home was awesome and even though he wasn't in town during my stay, he was a courteous host and I felt very well taken care of. He left me notes about the house to make it easy to figure things out, and he even ensured that there was coffee for me to make in the morning!

The home itself was quaint, warm and cozy. I loved staying at Roger's home and I will book it again in a heartbeat.

Thanks Roger!

: )"
522287,8316594,2013-10-25,8629199,Carol,I was only in town for 24 hours for an interview at Seattle Children's so really just needed a place to day. Roger's was perfect. The home is well kept and the bed was comfortable to sleep on. Sadly I only got to meet Roger on my way out the door in the morning - he seemed very nice however and I would definitely stay again. The location is great - just a couple of blocks from the restaurants in Wallingford - had a fabulous meal at Tilthe - and then took the bus through UW to Seattle Children's. Also took the train/bus from the airport (1.5h time). 
522287,8410949,2013-10-29,9127540,Ann,"Roger provides a clean, well-organized, and friendly environment. We had a great stay. Thank you, Roger! We'll come again."
522287,8436444,2013-10-30,8021,Becky,"I stayed at 1911 Wallingford/Fremont house while on a trip to Seattle to interview and consequently decide if i want to move there.  It was very helpful to be in an actual neighborhood for a night to get a more realistic feel for the city.  

Roger was very helpful in directing me to the best coffee and exploration places nearby.  He had preprinted day trip ideas and had maps and brochures for the city.  He also went above and beyond by offering me a home made Latte to take with me the following day… so thoughtful!"
522287,8488447,2013-11-02,8736911,David,This is my second stay with Roger so I'll be brief. He's a great host and the place is really well located. 
522287,8545702,2013-11-04,9621188,Majken,"Tidy and clean place. Roger was very responsive and friendly. Walking distance to restaurants. Though we didn't see any cats at the home, we did have reaction to cat dander. It wasn't a problem for just one night, but worth knowing in case you're sensitive."
522287,8754238,2013-11-16,8736911,David,Staying with Roger for the 3rd or 4th time. He must be doing something right.
522287,8786076,2013-11-18,8138208,Alonzo,"My stay was amazing! Roger was out of town while I was there but he accommodated me so nicely that it was hard to tell! The communication was clear and concise. He wrote little messages all over the house that were super detailed and helpful. His house is very homey and walking distance from restaurants, bars, grocery, pretty much anything! If you havent gotten it yet, I was very pleased with the hospitality and location! Definitely would stay with Roger again, and hopefully next time I'll get to meet the man behind the amazingness!
 "
522287,9103065,2013-12-07,2401838,Emma,"Roger was very accommodating - I had to check in a lot later than originally planned but Roger was flexible with the last minute change. I was only in for a very short visit, but Roger made sure that it was pleasant and comfortable. It was the perfect set-up for what I needed!"
522287,9357798,2013-12-23,10635236,Jackson,Roger is super friendly and if u r travel with small family or less than 4 person than it is a great place to stay. Roger is very a very nice person even bought fancy donut for our breakfast recommend the place for who wants to stay in Seattle. 
522287,9529689,2014-01-01,10703453,Mike,"This was my first time using Airbnb and being in Seattle - I had a wonderful time. Roger was an excellent host, he handled my stay professionally. He was friendly, cordial and punctual. He has intricate knowledge of the area that he willingly shared. 

His house is at a great part of town, it's right by a bus stop which goes directly downtown in about 10 minutes (for those not renting a car in Seattle - which is totally doable). It's also about a mile away from the UW campus. My favorite part about his location is that it's right by Green Lake - I jogged every morning around that absolutely stunning track. 

Overall I recommend this location for those visiting Seattle. I had a great time with this accommodation and I'm sure you will too. "
522287,9579374,2014-01-02,1715759,Adrianne,"Roger was a helpful, hospitable, and thorough host! We stayed in his very cool studio and it had everything we needed and more -across the street from public transport, 2.5 baths, kitchen, portable heaters and refreshments all supplemented our quick but comfy stay! Accessibility was primary and we enjoyed that everything we needed was within reach. "
522287,9928924,2014-01-20,9271360,Khalil,"Roger's house was very nice any cozy. I must say I wish I could meet him in person. That's one of the reasons I book my place through Airbnb.However his notes are going to be your friends. They are everywhere telling you exactly what to do. I was amazed by how nice and clean the whole house was. The neighborhood is nice and clean too.
I totally recommend staying at Roger's place.
I want to thank him for supporting me and answering my questions along the way and very quickly."
522287,10171920,2014-02-03,348836,Sacha,Roger's place was exactly as advertised. Good location (a 15-20 min. walk from Fremont shops) and very homey. 
522287,10286105,2014-02-10,4367226,Shane,"Roger's place was great. It was warm, cozy, and clean. I found the bed to be extremely comfortable. I didn't have the pleasure of meeting Roger, but he had notes everywhere, so it was almost like he was there. I couldn't have asked for a nicer, smoother stay. Thank you Roger."
522287,10415573,2014-02-17,9464556,Gail,"My friend Sarah and I stayed at Roger's house. We did not get to meet him, as he was traveling, but he communicated well with us online and gave good instructions regarding where to find keys, towels, etc. We found the house quite cozy. It is an old house with good karma sandwiched in between two apartment buildings."
522287,10549525,2014-02-24,8040131,Justin,"Great little house. Stayed in the laundry/sun room and it was comfortable, especially with the little heater provided."
522287,10700089,2014-03-03,12420707,Susan,Darling little house in a lovely neighborhood.  Roger wasn't there but left directions for everything.
522287,10770486,2014-03-06,11899498,Lynn,Perfect! Just as described and bed is delightful! I'll be back again!
522287,11461636,2014-04-03,1814035,Toni,"Roger was a terrific host. The house was cozy with great energy and the bed was comfy. It is a great neighborhood, near everything. I definitely recommend this spot for your visit to Seattle. "
522287,11498097,2014-04-05,11083172,Todd,Roger was a wonderful and accommodating host. It was great to sit down and play a bit of guitar with Roger at his place. Its a great location and a quaint house. Cheers Roger!
522287,11627653,2014-04-09,13758373,Janet,"My daughter and I stayed at Roger's airbnb for 3 enjoyable nights. At first, my 18yo daughter thought that this would be ""awkward"". Once we found our way to his conveniently located house she was ok with the situation. Roger was very inviting and informative. He was a wealth of info for us clueless newbees to Seattle. The house was close enough to UW for us to walk to/from numerous times. and also, located in a safe and charming area of Seattle. If UW is her choice, we will be back!! Thank you Roger for the morning Lattes!!! "
522287,11868890,2014-04-17,13620567,Jane,"Roger's place in Wallingford was the perfect place for me while visiting my son in Seattle. It was calm and peaceful start and finish surrounding some pretty busy and hectic days. A friend was able to visit for a night from Portland and was very comfortable on the twin bed in the sunroom. The bed upstairs was just as comfy as everyone says it is. We were fortunate Roger was around during most of my/our stay and we enjoyed many conversations. It was miraculously sunny for three entire days at the beginning of my visit and the front deck was the perfect place for a relaxing cup of coffee prior to the day's activities. Thanks for the lattes Roger. The garden behind the house was private, cozy and just beginning to burst into spring growth. I could not have chosen a  more beautiful time to visit Seattle as all the trees and tulips and many other flowers were in full bloom. It was gorgeous! 
I had a car Sat-Mon and parking was always available within a few doors of the house. I returned the car at the end of the weekend and used mass transit for the rest of my visit. The house in Wallingford was very accessible with multiple lines running within 2-6 blocks away. After climbing almost 300 steps straight up at a stop near my son's apartment in another area of town, I appreciated the accessibility in Wallingford even more. I also appreciated a soak in the tub-no sore muscles! 
I was fortunate to get a host-lead tour of neighboring Fremont prior to the end of my stay. I saw many things I would have otherwise missed with many remaining to be seen on my next visit. Before you leave the house, be sure to check out Roger’s handmade glass bug collection (read the names) and play a few tunes on the guitar if you get the chance.
I definitely recommend staying here. It's clean, relaxed, comfy and cozy, and convenient."
522287,12186121,2014-04-25,13771589,Reed,Roger was a perfect host.  He is very personable and his home is comfortable.  It is a great location with easy access to all of Seattle.  This was an ideal way to start my Airbnb experience.
522287,13683810,2014-06-02,14943776,Chris,"This was my first time using Airbnb so I did not know what to expect at first. However, Roger was very welcoming and made me feel right at home. His house is in a nice quiet neighborhood but has plenty of resources nearby: restaurants, groceries, and even the zoo! Over the weekends, Roger always had great recommendations of where to visit in Seattle and I had fun exploring the area around Wallingford. I'm glad my first experience with Airbnb went well and, thanks to Roger, hope to visit more places while staying through Airbnb hosts."
522287,13903229,2014-06-07,2569771,New,"Had a nice stay. Roger was welcoming and helpful, but at the same time gave you your space and privacy. 
The house was clean and located in a quaint neighbourhood. 5min walk to Wallingford Main Street with some nice restaurants etc. "
522287,13917924,2014-06-08,2437456,Elaine,"Three of us had a good stay at Roger's homey Fremont abode. I appreciate Roger's communicative, welcoming, and easy going style of hosting. We would definitely stay with him again."
522287,14091574,2014-06-11,15399298,Elizabeth,"The house is perfect and Roger is a very nice host. He picked me up at the airport, introducing the city to me on the way. It's really kind of him. The house is very quiet at night and it's also very convenient to go anywhere I wanna go, the bus stop is just five minutes' walk. An excellent place in this beautiful city."
522287,14176746,2014-06-13,9271060,Eva,Roger was great and the house in Wallingford was clean and cozy. Recommended.
522287,14214559,2014-06-14,12878649,Janine,"It was so nice !   I felt comfortable instantly,  walking in to Roger's unique, not fancy but artful, thoughtfully appointed, clean little neighborhood home. Roger is generous and helpful, but never did I feel he intruded into my need for privacy. I wish I had had more time to explore, but it was the perfect little stop along the way with a great breakfast place within walking distance."
