listing_id,id,date,reviewer_id,reviewer_name,comments
1307898,38091551,2015-07-13,24339293,Katherine,"The house was clean, well stocked (including the refrigerator!), and very inviting.  We loved the location and the neighborhood, which was perfect for our needs.  I would highly recommend this home to anyone needing accommodations for a large group - perfect for family reunions or weddings!"
1307898,38977185,2015-07-20,1516847,Angela,"Myself and nine friends stayed here for a recent wedding. It was the perfect spot for us. Fantastic location, beautiful and spacious house and fun area. During our 5 day stay we truly got to know the exciting and diverse area that is Capitol Hill. Glenn was super helpful and very quick to reply during all communication. Would highly recommend staying here "
1307898,39899700,2015-07-27,25661416,Lynn,"What a lovely home in a beautiful, quiet, yet convenient part of Seattle. Our family enjoyed having a place to gather as we celebrated our daughter's wedding. Glenn was a wonderful host, providing us with all of the information we could possibly need, not only about the home's amenities but also about the surrounding shopping and restaurant scene.  Many wonderful family memories were made during our stay there.  It was everything we hoped it would be and so much more."
1307898,41716755,2015-08-09,9963216,Hélène,"My family and I had an amazing time in Glenn's house. 2 couples and 2 single people had more than enough space in the bedrooms. Glenn provided everything we needed; including baby adapted furniture. The house was spotless when we arrived, making it very easy to settle in.
We made the most of the kitchen and barbecue. There is more than needed.
The location is really good, with plenty of shops at walking distance, three nice parks, and restaurants. It is easy to reach Seattle and the airport by bus. It's also very easy to park if you come by car. "
1307898,55182095,2015-11-29,10608222,Peter,"My family and I celebrated Thanksgiving and my 60th birthday.  We couldn't have been happier with this home.  It's such a warm and welcoming environment.  We really felt like we were in our own home.    This is in no small part due to the fact that the owners actually live in the home; it is not used exclusively as a rental property.  The kitchen is fantastic.  Very well equipped.  We found everything we needed for our Thanksgiving feast and more (they actually left quite a number of treats for us in the refrigerator).  We wished we had more time to have fun in the kitchen!  The house is as you see in the photos.  Well maintained.

The neighborhood is really lovely.  Volunteer Park is very close.  Restaurants and shopping are convenient.  We had an easy time getting around town from the home.

My family and I would stay in this home again in a heartbeat.  It will be outstanding for any family or group of friends.  I can't imagine a better experience.  The home was the main cog in what turned out to be and incredible Thanksgiving and 60th birthday.

All in all, we had a fantastic experience."
3121829,16118018,2014-07-22,3005115,Theresa,"We really enjoyed staying in this townhouse in the Ballard neighborhood of Seattle. It's very spacious and in a great location! We could walk to bars, restaurants, parks, the locks and more. It's a very clean house. We had three guests, so one person slept on the couch, which was really comfortable. "
3121829,16488838,2014-07-28,2434184,Rachel,"I was in Ballard with 2 friends to do some wedding dress shopping, although we did not have a baby, the baby friendly townhouse was great for us. Plenty of space and everything we needed for our stay. The location is fantastic, we loveeeeee Ballard! We were there in July and it was great to be able to open all the windows and get a nice cross breeze! One of us slept on the couch which was big and comfortable. Barrie was a breeze to communicate with and we had no trouble getting in to the house. "
3121829,24403213,2014-12-28,1925083,Allison,"We had a lovely visit in this house. It was clean, comfortable and well stocked with toys for a family with young children. It's very close to the main drag in Ballard as well as several other amenities such as the library and supermarket. Description is very accurate!"
3121829,38864862,2015-07-19,13384257,Christine,"Barrie's home was a lovely place to stay with our little daughter. We were so happy to arrive and felt right at home. The house is well laid-out and super clean, and we all slept soundly. All the toys and books were much appreciated. We used the bikes to go to Portage Bay Cafe (amazing) and the locks. Great neighborhood and wonderful accommodation. Many thanks!"
3121829,40763753,2015-08-02,36282090,James,Absolutely great location and house was just as described.  A very cozy place with everything we needed.  We loved being minutes from the Ballard Locks and the cute breakfast places.  Barrie was very good at communicating with us and left lots of great instructions and local suggestions once we arrived.  We had a great stay and will stay again if we're in Seattle.
3121829,57899658,2015-12-30,28782224,Patrick,"We had a bit of trouble getting into the house, some trouble with the lock sticking, but after we got in it was smooth sailing. The house is very cozy and comfortable and my son loved playing with all of the toys. It was very easy for us to walk into downtown Ballard from this location. "
6249536,32426378,2015-05-17,9762661,Lan,房间里设施齐全，住得挺舒服。就是西雅图停车费真的挺贵，尤其是早上五点要去续费真是令人无语啊…
6249536,53260226,2015-11-07,41910772,Yiwei,"Melissa Yao is a nice host who is really helpful and cares for the experience of your living. Besides, the apartment is clean and neat, highly recommended."
7808495,42791627,2015-08-15,38761858,Zach,"This was a great airbnb experience! The house was very nice. I didn't have much interaction with Dan since I was busy, but the interaction I did have was positive."
7808495,44975259,2015-08-30,14857936,Zi-On,"We didn't see each other a whole lot because our schedules didn't line up and we were out for most of the day, but when we did run into each other, Dan was very friendly and helpful. The house is very clean and tidy, and the room was set to go with fresh linens and towels for us to use. Accessing the house is really easy because there's a keypad with a code that he provides on check-in day, so you don't have to worry about losing your key or arriving when he's not there.

The location is really close to downtown and Cap Hill, and just around the corner there plenty of bars and coffee shops that are usually bustling. Won't have a problem finding things to do here!"
7808495,49851890,2015-10-06,3520917,Jonathan,Dan is really nice and he's got a great place. The location is excellent as well. He's pretty busy with work but we managed a few interesting conversations. Really happy with the experience. Would definitely stay there again. 
7808495,51397404,2015-10-19,46472669,Maneesh,"I had a wonderful trip, and staying with Dan was a ton of fun. The room was clean and comfortable, the location was great. Everything like access and internet and sheets/towels was taken care of, and everything went smoothly.

Dan made my first trip to Seattle very welcoming and I had a good time hanging out with him and his friends watching football."
631445,1975387,2012-08-13,3021444,Andrea,"Our stay in Seattle was lovely. Alicia was nice and extremely helpful. The space was great and had everything one might need. All the rooms are spacious and welcoming, an overall nice and comfortable layout. Located in downtown Seattle allowed us to have access to so much. The view was amazing! The only challenge was parking at times (late nights on the weekend). Great spot and great host. Seattle is beautiful, Alicia's space is representative of the same beauty. "
631445,2044972,2012-08-20,312289,Brett,"No complaints here.  Alicia was courteous, prompt in her responses, and timely when it came to meeting me for check in.  Her place is in a great part of town, probably the best in my opinion for a visit to Seattle.  Her place was clean and very livable.  I've stayed in other vacation rentals and what I liked most about Alicia's place is that you feel at home, but not as though you're in someone else's home.  It's got everything you need to cook and keep the place clean, a great view of Belltown and a great balcony.  Highly recommended."
631445,2083620,2012-08-24,3149823,Carly,So clean and comfortable. Perfect area. I got up early and ran to Pike Street Market everyday and there was a great bakery right below the apartment with coffee and amazing baked goods. Would definitely stay again!
631445,2144125,2012-08-30,3132305,Brandon,"The apartment was nice and right by the water. I have my own photos from the place that look just like the view in the room description. It is in a really good place to walk to the Space Needle and Pike Place Market (Tip: If you go to the space needle, just go to the restaurant and eat some awesome locally sourced food. Then, go up to the observatory for free afterwards. I liked the rotating view from the restaurant much better than the cramped, blocked, and loud view on the upper deck.).

We got food several times from Pikes and the apartment had everything (even spices) we needed to cook a delicious meal. There was a trash shoot down the hall, but we didn't know what to do with the recyclables (i think we were required to recycle). We brought our baby, and she did really well. While the rooms are not ""Baby-Proof,"" we didn't really have any issues with her in the place. We just shifted the items that the baby might get in trouble with out of her way. Watched some TV after the baby went to bed, but the channel selection was pretty sparse. Probably a motivator to get out and do something!  It got a bit rowdy outside on Fri and Sat night (there are several bars located on/around the block), but maybe that's only an issue if you aren't partying anymore (like us). There is a mini grocery store just on the corner. This was nice for the ""oops, I forgot..."" moments because bigger stores are a bit of a walk. Really nice weather. It felt like a Houston winter, but it was August.

We didn't get a chance to meet Alicia, but the cookies for the Macrina bakery she left us were probably some of the best I've ever had. The bakery is awesome and just outside the entrance of the building. We got coffee and breakfast there just about every morning on the trip (my wife was obsessed)."
631445,2250805,2012-09-10,3191849,Annette,"Stay was great.  Location and view perfect only downside, PARKING. We walked everywhere but had to get in and out of town with a car so parking was a pain, just beware.  Check in was easy, Alicia gracious with our novice status. The space was beautiful, pool nice and roof wonderful.  Would do again."
631445,2408171,2012-09-25,2908958,Soumya,"I booked this unit for my family who were visiting from out of town. I had the opportunity to meet Alicia and view the unit before she handed me the keys. I felt the unit was decent sized for a couple (3 would be the largest I'd recommend). Both living room and the bedroom had a water view. With the amenities the building had to offer, and the location of the place, I'd say the price point for renting this unit out was excellent. I'd recommend this unit and Alicia as a host to anyone."
631445,2563088,2012-10-09,1709060,Joyce,"Beautiful condo, great location, can walk to everything, great view and very accommodating host. I will stay here again when I visit Seattle."
631445,2824181,2012-11-07,549934,Lucy,"Our stay was wonderful! Located in Belltown, we had access to restaurants, bars, shops, and the waterfront. While the neighborhood can get a bit lively on the weekends, the windows in the apartment were able to lock out much of the noise. The bakery located just downstairs was a dangerous indulgence to have so close but we loved it! The bed and the sofa were comfortable and Alicia was a pleasure to meet. We stayed for a month as we arranged for our permanent move to Seattle, and she made sure we had everything we needed (and even set us up with wifi). It was a lovely experience.  "
631445,3041137,2012-12-08,1621299,Penny And Tony,"Alicia's condo was very clean and the location was perfect; within walking distance of the water front, Pike Place Market, the Space Needle and Macy's. Alicia greeted us when we arrived and checking in was a breeze. We cannot wait to go back and stay at Alicia's place. "
631445,3124419,2012-12-20,4162875,Mark,"We spent 4 nights at the condo and really enjoyed our stay. The location was perfect as it offered a more local perspective on the city while still being very close to downtown. We walked everywhere and enjoyed exploring the neighborhood and surrounding areas. The bakery/coffee shop downstairs was both convenient and a welcome alternative to our usual Starbucks habit. 
While we didn't end up cooking, the condo has all the kitchen basics to make a meal and we appreciated the option.  Overall, the condo is cozy and a comfortable place to start and end each day.  Our only complaints were the street noise and squeaky bed, but we would def. stay here again."
631445,3246479,2013-01-03,4209244,Frances,"My son and I enjoyed our 8 night stay at Alicia's condo in Seattle.
She met us with a key on our arrival and showed us around, even though it was late afternoon on Christmas Eve. The location is excellent, an easy stroll down to Pike Place Market and the Waterfront.
The main drawback with this property is the lack of onsite parking. If you arrive with a car, be prepared to constantly have to move it and pay for parking. There is free street parking from 8pm to 8am, but as this is such a popular area with lots of restaurants, most times you have to park far far away. The small lot opposite can be used overnight but you will have to move your car before 6am !!! There is 3 minute parking out front for loading/unloading only. 
The condo is comfortable and has water views.There is  a queen bed in the bedroom, but only a sofa (not sofabed) in the living area."
631445,3447011,2013-01-31,4464838,David,"Exactly as advertised, the apartment was immaculate in every possible way. Alicia was very helpful and friendly. Highly recommend!"
631445,3573336,2013-02-18,349652,Carl,"Alicia's was a wonderful host - efficient, friendly and a good communicator. I had an evening flight home and she very kindly allowed me a late check-out. The apartment is delightful. It's set in a safe, modern block and is clean and comfortable. Best of all is the location in the heart of Belltown, a buzzy neighbourhood with loads of great eateries and bars. Don't miss the Macrina bakery nextdoor. Some people might find the street noise (traffic and revellers) a problem but not me. I slept like a baby.  Highly recommended!"
631445,4063077,2013-04-07,5126333,Amy,"The condo was a perfect place for my husband and I during our stay in Seattle. It had everything we needed and was walking distance from major attractions. The condo was clean, cozy, and offered a nice view of the Sound. We would definitely recommend this condo to others and request it again, should we ever return to Seattle. Thanks, Alicia!"
631445,4071571,2013-04-07,1980128,Caspar,"NOTE: Because the host canceled my reservation 7 days before arrival, I did not actually stay. Nevertheless, I want to share my experiences.

I emailed the host twice, six weeks before the booking date, and the host did not reply to any of my questions. A week before the booking date, the host canceled for personal reasons (which is understandable, and I sympathize). However, as a cherry on the cake, she sent me a copy pasted message with somebody else's name on it. Overall, I must draw the conclusion that this host does not communicate well with guests, personal crisis or not."
631445,33842275,2015-06-01,3989578,Mark,"Alicia was a great host I drove 12 hrs to get to seattle from San Francisco so I was super tired,  Alicia suggested to come by early to get settled in so I thank her for doing that,  she checked us and showed us around the apartment,  looked just like the photos,  the Internet worked just fine as well, the balcony has a Amazing ocean view, the location on this place is the best,  it's situated right in the middle of everything,  u can drive or walk to most tourist locations in less than 20 min,  there is so much to see and do we stayed an extra day! Loved staying at Alicia place and would recommend it to anyone"
631445,34298343,2015-06-07,12528273,Ruth,"Great apartment in a great location! For visiting Seattle for the first time, this apartment is in the perfect neighborhood to start exploring. Alicia welcomed us as we arrived and showed us around the building. The apartment was just as described and has great views from the balcony, including Puget Sound. Would definitely recommend this place for a first time visitor to Seattle."
631445,35294764,2015-06-17,7070839,Karen,"Alicia was fantastic from start to finish. She contacted us early on to plan when we could get the keys. The property was beautiful, the view fantastic, the building and amenities were very clean and well kept. There were a huge variety of places to eat and to buy groceries all on the same block. We walked everywhere in the Seattle. The only con was the noise, many sirens both day and night. Alicia warned us and provided a fan for white noise. Well you are in the city and should be prepared to take the good with the noise. Bottom line, is that I would stay here again when I return to Seattle. "
631445,36003754,2015-06-24,17671491,Oscar,"The listing was 100% accurate, the place is as pretty as the pictures and very comfortable.  Alicia was a very gracious hostess, she met us on Saturday night, even through it was later than we had expected to arrive in Seattle.  She walked us through the apartment and explained where everything was located.  She also had a few suggestions with regards to places to eat and things to do in Seattle.  The apartment is in a very secure building, we always felt safe, it has a nice pool and a good gym.  Additionally, it is located a few blocks from many of the prime tourist sites.  The apartment is in the city, so it may be a little noisy at times, but once we were asleep, we didn't wake up until morning.  I would highly recommend this location.  "
631445,36364664,2015-06-28,28048385,Rose,"Excellent condo, great location with a great view.  The place was nice and clean, everything you needed, felt like home. The wieghtroom has all modern equipment. Bike eliptical, treadmill and weights.  My wife and I have stayed in Seattle before but not in Belltown. It was perfect.  Lots of places to eat and drink nearby.  We walked every where to Pikes Market, the waterfront, Key Arena and the Space Needle. We even walked to Safeco Field! The bakery and pizza place next door were both convenient. I would recommend this place and definitely will be back.  Thanks Alicia for being a great and accomaditng host."
631445,37054705,2015-07-04,33069671,Sean,"Alicia was a fantastic when I visited Seattle.  She was able to work around our early flight schedule by meeting us at the apartment when we arrived, and by allowing us to just leave the key on our way out.  

Alicia gave us a tour of the place and it was perfect for a 5 night stay in Seattle.  She was always quick to respond to any of my questions, and showed us around the building so we could use the pool and jacuzzi.  I couldn't have picked a better place to start off my day and rest at the end of the night.
 
The location is amazing, with a great cafe, diner, and many restaurants within a block's walk.  I walked to most of the places we wanted to see since the Seattle Center and Pike Place Market are right around a half mile walk from the location.  There are so many great places to eat nearby, I just explored nearby to find delicious food.

I could not have been more satisfied with my stay at Alicia's place.  I will definitely point anyone visiting Seattle to stay here."
631445,37737525,2015-07-10,18421323,Sean,"Alicia's place is clean, nicely furnished and welcoming.  Alicia is an awesome host and was attentive to our needs.  "
631445,38982768,2015-07-20,3117999,Owen,"Alicia was awesome!  Contacted me well in advance to inform me of potential issues due to my late arrival, and all worked out great, contacting me during my family's stay to make sure we were comfortable and knew about current events around town.  The space itself was great!  Nice and clean, perfectly located near a lively strip of restaurants, and well appointed.  10 minutes walk gets you everywhere from the Space Needle to the waterfront, so we didn't need to rent a car.  Couldn't have asked for a better place or host for our vacation."
631445,40562073,2015-08-01,29179348,Kyle,"Alicia's condo was great. The place was clean and felt very welcoming. The rooftop was great for relaxing and enjoying the view, The condo is in a great location, it's close to the market and the space needle/seattle center. We walked everywhere and it was nice being close.  We ate a many great restaurants close by as well. Alicia was very easy to communicate with when we arrived and when we left. She was very polite and even gave us a heads up about road closures near by due to a parade. Overall I had a great experience and would recommend this place to anyone."
631445,41729942,2015-08-09,12771746,Danika,"Alicia was extremely helpful and accommodating, making our trip a pleasant experience! The apartment is very clean and located in a prime spot with lots of good food around -- including Shiro's! Would definitely recommend staying at this cute unit in downtown Seattle!"
631445,44278644,2015-08-25,29727548,Maria,"We did not meet Alicia in person, we communicated via text.  Alicia responded very promptly to all our questions with helpful information.

Pros 
The apartment was centrally located on 1st Ave., very much within walking distance to Seattle Cente, Pike's Place Market, the ferries, and the waterfront.  The place was clean, well appointed, with ample closet and drawer (website hidden) and fan were available if needed.  Kitchen was well equipped with a full size refrigerator, coffee maker, and cooking implements, including cookbooks!  Use of washer and drier.  Lovely little balcony facing 1st Ave.  Free street parking after 8pm.
Cons
Smaller than it looks based on the pictures (aren't they all?).  Windows and balcony doors face 1st Ave, so it tended to be noisy when the windows were open to let the breeze in.  Also got hot since the windows face west, closed drapes solved that problem.   "
631445,45104677,2015-08-31,7524671,Mario,"Alicia was awesome. Met me at the apartment and showed me around, as well as gave me great advice for some of the best restaurants, coffee and glasses of wine in Belltown. Would, without hesitation, stay there again. A truly top AirBnB host."
631445,45575653,2015-09-04,34777707,Anna And Bill,"Alicia went out of her way to make our 2:30am arrival painless. She is pleasant and helpful. The apt was clean with  a beautiful view of Puget sound. It is within walking distance to Pike's market, Space needle, ferry and many restaurants. "
631445,46129962,2015-09-08,36297762,Jeanne,"We were in town for Bumbershoot and Alicia's apartment was the perfect location. The apartment t is lovely and we'll furnished. Her neighbor Ed was great and met us with the key and showed us around the building. The apartment complex is secure, well taken care of and the maintenance staff very friendly. I took advantage of the pool access to swim some laps. Great stay."
631445,46717296,2015-09-13,14519239,Margaret,"We were met at the door and 
Alicia showed us around the apartment.  It was very conveniently located and comfortable.   The unit only lacked an iron and she very promptly bought one!  We were impressed."
631445,48184170,2015-09-24,8932643,Matt,"The condo was clean, the location was great and Alicia was quick to communicate in order to make sure our stay went well."
631445,49596397,2015-10-05,22502198,Sharon,"This condo was in a perfect location, close to the market and the water. We walked just about everywhere. Also close to awesome restaurants, coffee, bars. The bakery downstairs has fantastic pastries!  The condo has Views of the water and a cute patio for a nice day and also a rooftop patio with a grill and more views! The condo itself has everything you could beed. It's clean and so well decorated! Alicia communicated well to make for an easy arrival. She made accommodations for our early check in and late check out, which we very much appreciated! I highly recommend this place if you are visiting Seattle."
631445,50085827,2015-10-09,10564788,Nikki,"Alicia's apartment was perfect for my husband and I! It was our first time in Seattle, and the location was great. Not only were we close to all the big tourist attractions (Pike Place, Space Needle, etc.), but we were also close to bus lines so that we could go out to some of the other neighborhoods. Alicia was so wonderful to work with as well! We were not sure what time we would be arriving, so she arranged to have her neighbor meet us which worked out perfectly. Her apartment is super cute, clean, and well stocked. If we are lucky enough to make it back to Seattle in the near future, I will definitely be contacting Alicia to stay at her place! Also, check out the bakery downstairs - amazing! "
