listing_id,id,date,reviewer_id,reviewer_name,comments
4616634,34598331,2015-06-09,1345988,John,"Loved the studio.  Modern, clean, and with lots of natural light.  Comfortable bed.  Very private too.  Good communication with Cindy, who will provide any assistance that you may need, otherwise she stays out of your way.  We wanted to stay in Ballard, so the location was great for us.  Definitely one of my best airbnb experiences!  Thanks Cyndy."
4616634,35018912,2015-06-14,26297777,Chris,"What a wonderful place to stay in Seattle!  It's a charming a quiet studio nestled in the treetops.  Cyndi provided us with clean towels and sheets as well as her contact info for any reason.  We loved how close this studio was to Golden Gardens park.  If you are looking for an extremely pleasant experience, look no further.  Thanks again Cyndi!"
4616634,35334595,2015-06-17,34931252,Steven,"The space was great, very comfortable and convenient. The neighborhood was very peaceful and pretty. Cyndy was a fantastic host."
4616634,35592840,2015-06-20,3518456,Emily,"I rented Cyndy's apartment for my mom while she was in town.  My mom really enjoyed her stay- the space was clean, modern, light and really well taken care of.  The location is quiet and residential but very close to the heart of Ballard- just perfect!

Thanks for a great experience, Cyndy! "
4616634,35920933,2015-06-23,28944314,Kristy,"What a wonderful experience for our first AirBnB stay! Cyndy and her husband were welcoming and great hosts. We didn't see much of them, but when we did they were very kind. The suite is beautiful, the photos don't do it justice! So much light, so many windows, and the skylights over the bed are a beautiful touch. It was great to be within walking distance of some lovely shops, and only a half hour bus ride to downtown. We loved our stay here, and would definitely stay again if we return to Seattle!"
4616634,36108948,2015-06-25,33783884,Jordan,"My girlfriend and I stayed in Cyndy's wonderful studio apartment above the garage for two nights. Its the most spacious studio I've ever been in, with tons of natural light! Open all the windows and it feels like you're up in the trees. The apartment comes with basic amenities if you want to stay in and make dinner at home (which we did one night), but its also an easy walk down to the shops and restaurants of Ballard which are plentiful and worth exploring. You can also walk 5 or so blocks east and catch a bus straight to downtown Seattle. If you're looking for a quiet, private, cozy place to hang your hat after exploring what Seattle has to offer - Cyndy's apartment is the perfect place for it!"
4616634,36236812,2015-06-26,36226546,Krista,Great place! Thanks so much.
4616634,36780321,2015-07-01,32077174,Diane,"Cyndy graciously met us upon arrival.  The apartment is bright, clean and welcoming. It had everything we needed for a 5 day stay. The neighborhood is quiet, and we enjoyed beautiful flower gardens on our short walk to shopping and restaurants.  The location is great. "
4616634,37052853,2015-07-04,10198507,Sean,"Cyndy was very nice and responsive and the place was perfect.  The apartments was clean and stocked with everything we needed.  There was no iron, but I asked Cyndy about it and she promptly brought one to us.  I would absolutely stay at this place again."
4616634,37165406,2015-07-05,26228517,Martha,We really enjoyed our stay! The apartment has plenty of room and is very comfortable. The apartment is secluded and quiet and also very convenient to several restaurants. 
4616634,37450485,2015-07-07,29642270,Rick,Place was very nice and clean.  It was just what we needed to get a good rest.
4616634,37610719,2015-07-08,3223193,Jessica,"Cyndy's place was perfect! Clean, comfortable and spacious. Cyndy greeted us and offered coffee in the morning. She let us do our own thing but was available if we needed. I will definitely stay at Cyndy's place next time I'm in town. "
4616634,39903168,2015-07-27,27563784,Christine,"The cozy studio apartment is wonderful!  Clean, fresh, and beautiful!  It met all my needs!  I was able to read, sleep, exercise, cook and still had room left over.  The host is very friendly and always was available for any needs I had. I highly recommend the cozy studio apartment.  The neighborhood is safe and friendly and within walking distance of parks and restaurants.  What a great place to stay!  Thank you! "
4616634,40225225,2015-07-29,35521373,Kevin,"Cyndy and her place were both great! We didn't need much from her, but she was quickly and helpfully responsive when we reached out with questions. Her place was just as described, and was perfect for our stay. Highly recommended!"
4616634,40598175,2015-08-01,35245451,Kim,"My husband and I really enjoyed our two night stay in Ballard! We were within walking distance of everything we wanted to do there. Cyndy made it very easy to arrive and get settled into her beautiful space. Everything was clean and like new. Nice shower and spacious enough to relax at the end of the day. So much nicer and affordable than a hotel. We will certainly go back.
Kim from Colorado"
4616634,40910935,2015-08-03,33943262,Matthew,"Our stay at the cozy studio apartment was fantastic. The location was great, walking distance (about 15 minutes) from the downtown Ballard area and right off the 40 bus line for easy access to the rest of the city. The apartment was charming, clean, and nicely decorated. The Murphy bed is a fun touch though in our personal experience we left it in bed mode the entire time, never in the ""up"" or table positions. The apartment is detached from the rest of the house above a garage, so it was nice and quiet. The kitchen is modestly stocked with eating utensils, instant coffee, tea, glassware, plates and bowls, an electric kettle, and other niceties. Wifi was reliable. Overall a great stay, thanks Cyndy!"
4616634,41937600,2015-08-10,16971508,Stephanie,"My boyfriend and I spent one night in Cyndy's studio apartment and overall we had a great time. The apartment was very clean and cutely decorated. For staying in an apartment above a garage in the middle of August, it stayed comfortably cool in there. I just loved the adorable bathroom and really appreciated that she provided shampoo and conditioner because I forgot mine. Her street is so quiet which we also appreciated. We live in a busy part of Portland where we constantly hear cars drive by so it was almost eerie how silent her street is. Aside from hearing a neighbor kid play in his yard for a few minutes, we heard nothing the whole time we were there. Just a note: if you're like me and don't pay close attention to the listed Amenities, this unit does not have a TV so be sure to bring a book or your own device for entertainment purposes. I feel I should also mention one more thing: we saw a few ants in the apartment the night before and when were cleaning up the next morning to leave, the kitchen counter was positively CRAWLING with ants. I know its normal for ants to come in doors in the summer (and I promise, the place is very clean!) so I'm not holding that against her, I'm just saying...there may be ants. Other than that, the place was perfect and is such a steal compared to hotel prices. Lastly! We recommend Portage Bay Cafe for breakfast about a mile away. CRAZY GOOD FOOD!"
4616634,42271408,2015-08-12,35429426,Alan,"Simple easy stay! The place was awesome! Clean, professional, private. A+!"
4616634,43672057,2015-08-21,36568480,Jesse,Cyndy's apartment is very cozy and comfortable. It's in a great location and overall a great place to stay. 
4616634,44122352,2015-08-24,35965881,Jeanette,We were lucky to stay at this cozy little private studio apartment for a weekend. It had everything we needed and the location couldn't have been better for us. The area is great for walks. There's a park nearby and a great little bakery. We loved the skylights and the accessibility of the place!!
4616634,44317675,2015-08-25,3416512,Heidi,"It was a cute place that was very clean, private, and comfortable. They had a stereo to hook our phone into for music which was a nice perk and wifi. Cyndy was also very friendly. "
4616634,44506204,2015-08-26,42325087,Sidney,"Listing was completely accurate. Beautiful neighborhood, cozy and comfortable space. Favorite thing was the trick murphy bed / dining room table combo. Small space with the perfect furniture to use the space as one sees fit. Loved it."
4616634,44576477,2015-08-27,7263451,Michelle,"Simply LOVED this place! What an amazing concept. Fantastic neighborhood, never any concerns returning at night or parking on the street. Great host and Cyndy's on top of communication. Would stay here again in a heartbeat, so close to Ballard, and a short drive to Queen Anne, Belltown and Seattle Center. Thanks again for everything and we hope to return sooner than later :D"
4616634,44818225,2015-08-29,17784900,Aaron,"Cyndy was really nice and the apartment was incredible. Made for a great night and gave us lots of ideas for our own place, dream place anyway."
4616634,45251036,2015-09-01,35168402,Whitney,Cyndy's home was beautiful! Very easy to locate and a perfect amount of space.
4616634,45427749,2015-09-02,42157022,Melissa,"The cozy studio was just what we were looking for. The keypad entry system made for a very easy check in and check out. The studio itself was the perfect size to accommodate 2 of us and though we did not use it, there was a a very functional kitchen provided. Our hosts were very willing to provide recommendations for things to do. We will definitely be returning here if the opportunity arises. "
4616634,45594648,2015-09-04,17220660,Katharine,This place was so much better than the pictures. It's perfectly designed. We loved the decor and set up of the studio. I would love to stay again. It felt very safe. 
4616634,45946813,2015-09-07,37078134,Tami,"PROS: My boyfriend and I LOVED this studio!!! It was super cute, had tons of quality upgrades (heated bathroom floor!), was cleverly and efficiently designed, and immaculate! Cyndy, our host, welcomed us by having the Murphy bed out and made, ready to crawl in! (not sure if this was because I advised her our plane was delayed 3 hours or not, but appreciated nonetheless!) Additionally, I was pleasantly surprised to find many extras: soap/shampoo/conditioner in the shower (and quality to boot, in my opinion), tea & instant coffee in the kitchen, quality dishes and silverware (no shortcuts here) and more hangers than most hotels!  The wi-fi was faster than most hotels, too! There were also extra blankets and pillows: I'm a bit of a princess-and-the-pea about my bed, and I needed the flatter bonus pillows. :o) The bedding was comfy and homey, the bath towels sparkling white and soft, and the whole place just felt welcoming. Cyndy had conveniently provided easy-to-use recycling and compost bins, and helpful notes to call out less obvious features (reading light above bed). These things speak volumes about the host's dedication to providing her guests a positive experience!
 
I loved the neighborhood - both because it was quiet, and because I grew up in Ballard. ;o) The only neighbors we encountered were friendly. I was in town for a wedding at the Seattle Aquarium, and it was an easy drive from the studio.

I'd emailed Cyndy with questions prior to our arrival, and she was always quick to reply and helpful. Because of the timing of our arrival, and the fact that we were in town for a wedding so almost never there, we never got to meet our hosts. :o( I wasn't sure it was rude not to make a point to check in - or appreciated: I hope the latter... ;o)

CONS - with caveats: It's no surprise - being in Seattle - that the unit had so many large windows, and the two skylights: I loved and appreciated the natural light! That said, sleeping in (especially after our very late/early arrival) was challenging (seasonal, of course). The Murphy bed - while VERY comfortable and a great way to take advantage of the small footprint - was a double bed (not a queen). The description may have mentioned this, I don't remember, and it certainly wasn't a deal-breaker for us. However, if one or both guests happen to be tall (I'm not) or both above-average builds (I am), it would probably be snug. 

All-in-all, the place was practically perfect! We would definitely stay here again. It feels very much like a home-away-from-home!"
4616634,46117764,2015-09-08,31976686,Josie,"Cyndy's rental is beautifully maintained and our stay was everything we expected. Nice home, nice neighborhood, fun stuff to do only a mile away. Clean and comfortable, a great place to stay in Seattle's Ballard neighborhood."
4616634,46298627,2015-09-09,19450709,Matt,"The space was simply beautiful! All details were covered. We even took pictures of the space of how well it was designed and laid out. Exactly what Airbnb should be. Great communication, beautiful and comfortable space, and all amenities needed to enjoy your stay. This place felt like a luxury resort not just a spare room.  Do not hesitate to book. Thank you!"
4616634,46437618,2015-09-10,2116330,Alexandra,"We had a great time staying with Cyndy! The studio is just as described - cozy and welcoming. And it has great light! We easily walked (about 20 minutes) down to the locks and around Ballard for the evening - lots of lovely shops and fun places to eat. Dealing with Cyndy was super easy - she was responsive and logistics were smooth. If you are looking for a relaxing, quiet place to stay in Seattle, this is a great bet."
4616634,46559448,2015-09-11,43634520,Jonathan,Fantastic studio! Very clean and comfortable. I loved staying here. 
4616634,46661295,2015-09-12,6122289,Ronan,Was a very warm and welcoming studio.  Will definitely be staying here again on my next trip.
4616634,48505796,2015-09-27,29737381,Linda,"My husband and I (both retirees) travelled from Ireland to Seattle to visit our son and his family who live in Ballard.  We arrived late in the evening and Cyndy welcomed us and then left us to get settled in. 

We were delighted with the apartment. It was spotless and fully equipped. The Murphy bed (which I must admit I was a bit dubious about) was wonderful!  It was comfortable and easily turned into a good-size table.

The location of the apartment is ideal. The bus for Ballard and downtown Seattle stops about a 5-minute walk away and Ballard itself is a 10-15 minute walk (a bit longer returning because it's uphill).

All in all we thoroughly enjoyed our holiday, helped in a huge way by knowing that we could come and go as we pleased and could relax in the lovely cozy studio apartment. We would certainly recommend it."
4616634,48902074,2015-09-29,21789806,Jamey,"Cyndy's place is absolutely gorgeous. This was our first trip to Seattle and we couldn't have chosen a better location to call ""home"" temporarily. We could have spent all or our time in Ballard, there were so many cute shops and restaurants around the house (we tried out Pie Bar and Walrus and the Carpenter both were excellent!) Cyndy's apartment was very clean and bright. The skylights above the bed were beautiful. It was also nice already having shampoo and conditioner to use, and the little extras were definitely appreciated. Cyndy also kept in contact, which was nice. We couldn't have asked for anything more."
4616634,49004467,2015-09-30,31260260,Kyeonghui,Cyndy's place is very nice and unique. I really enjoyed staying at her place and she was kind.  Recommend! !!! :)
4616634,49193944,2015-10-01,2916288,I Ride Bikes,"We came and stayed for one night to see a concert. Looked a a lot of options but chose this because of what it offered and the area it is in. 
What we look for in a place is for it to be clean, quiet and bright which this place has in spades. It is like having your own little house with all the necessary accoutrements. 
The owner was very helpful and personable. I would say that she extended courtesies that you would otherwise not expect. 

"
4616634,49290025,2015-10-02,39071409,Cory,"My stay went perfect here. It was very easy to find and I was impressed when entering the apartment.  The apartment was extremely clean, peaceful, modern, and included eveything I needed for the stay.  Cyndy and Tom were great hosts. Cyndy always communicated quickly and was helpful when suggesting places to eat.  Tom even called a friend to help me find a bicycle rental.  The neighborhood was very nice, safe, quiet, and close to downtown Ballard."
4616634,49648906,2015-10-05,43285431,Natasha,"We had a lovely stay here. The air B and B was really cute and just as charming as the pictures showed. The neighborhood was wonderful to stroll around and, within about a 10-15 minute walk, there were restaurants and cafes to enjoy. The bus took us directly downtown and made it easy to get around. We loved it all!"
4616634,50022380,2015-10-08,921369,Rick,"We very much enjoyed our stay at Cyndy's studio in Ballard. It is a convenient, walkable neighborhood. The studio is perfectly designed with efficient and remarkable use of space, and everything was spotless and inviting."
4616634,50500855,2015-10-12,44207265,Ashlee,We fell in love with the Ballard neighborhood instantly. The studio was absolutely perfect.  Just as pictured. We can't wait to come visit again and hopefully be able to stay with Cyndy again.  Thanks again Cyndy for everything.
4616634,51311166,2015-10-19,7572018,Steve,"Great space in a quiet neighborhood, close to all of the wonderful attractions of vibrant Ballard. The apartment is cozy, modern and comfortable and we look forward to staying at Cyndy's place the next time we come to Seattle."
4616634,51516720,2015-10-20,22149104,Amber,"Clean, easy, comfortable, cozy. It was exactly what we needed for a quick overnight in Seattle.  Great spot and super organized owner! And in my favorite Seattle neighborhood.  "
4616634,52047828,2015-10-26,10636987,Nancy,"My husband & I thoroughly enjoyed our 2 night stay in this lovely apartment!  It is located in a very quiet neighborhood with easy parking.  This newly constructed studio is bright and clean with tall, open beam ceilings & lots of windows overlooking the surrounding tree tops.  The bathroom & kitchen are top-notch and the bed is quite comfy.  We appreciated being able to come & go as we pleased and definitely plan to return in the future."
4616634,52865147,2015-11-02,12879602,Douglas,The location was perfect for me and the hostess was very welcoming and helpful. 
4616634,53733163,2015-11-11,479502,Steve,"What a great experience! Thanks Cyndy for making your studio available. With options like this, why would anyone choose a hotel? 

Pros: Excellent location in Ballard and a great value. Safe, quiet, beautiful and not far from shops and dining; quick trip to downtown; comfy bed. The studio feels new and clean and secure, with tasteful decor and high end interior finishes. I loved the retro-modern feel and the great layout - everything you need (two people best) without feeling cramped. 
Cons: No TV, but otherwise perfect!

I also loved the easy check in and out - Cyndy was responsive to my texts (I had a very late check in) the keypad on the door eliminated any key concerns and parking was plentiful and free! 

Thanks Cyndy - I'll be back again.
"
4616634,53758241,2015-11-12,15451351,Kelly,"Staying at Cyndy's couldn't be more perfect. Easy communication and great little apartment in a favorite neighborhood. Very clean and cozy, would have loved to stay longer!"
4616634,53975484,2015-11-15,45307980,Scott,"Great neighborhood, new, cute and incredibly clean studio! Even heated floors in the bathroom. It is the perfect location to explore Ballard and Seattle. "
4616634,54244781,2015-11-17,24211868,Natalie,"Cyndy had everything prepared for my arrival. The studio had all of the conveniences of a hotel in a residential neighborhood. Originally I thought the studio was going to be in an apartment building, but it was actually built above the garage in the back of the house. They did a really nice job with the space and everything is clean and updated. It's small, but it is the right amount of space. As other reviews have mentioned, the bathroom with the heated floors was a nice touch. I would recommend staying here to other guests."
4616634,54810009,2015-11-23,20629942,Erik,"Listing was perfect for our needs. Warm, clean, quaint studio apartment above the garage. It was the perfect little base from which we could explore Ballard and Seattle. Thanks Cyndy!"
4616634,57402639,2015-12-25,10459887,Jill,"safe, nice neighborhood. Easy to find parking, very clean, comfortable bed, extra airbag for my child to sleep on. Instant Starbucks coffee, tea, extra blanket, iron.
Very nice pans, plates."
4616634,57682604,2015-12-28,43956764,Geneva,"This was the perfect location for us this Christmas; a lovely, cozy place to end our days, a sweet little neighborhood within easy walking of cafes and shops and hosts who were present and attentive but not intrusive. For some inexplicable reason the shower rod/curtain fell down in the middle of the night and Cyndy promptly had it replaced the next day. I highly recommend this apartment.  As long as my son stays living in Ballard (and continues to have 4 roommates) I will be back to stay. Thanks Cyndy for creating such a beautiful little retreat."
2905375,13258983,2014-05-23,13692519,Diana,"I had a lovely stay at this apartment.  I was met immediately upon arrival -- even though I was late and given a nice tour of the building.  There was a hot tub, pool, and roof top deck : )  I was able to easily walk to Pike's Place market and other areas in downtown Seattle.  I also enjoyed eating at Vita Bella & Bronzina which were located on the street level of the building.  Another plus, was that parking is included!"
2905375,14129777,2014-06-12,4461053,Allen,Lovely Seattle.  Great place in best part of town. 
2905375,21835853,2014-10-25,10316960,Joli,"The best air bnb experience we've had yet!!! Amazing service and great communication. Like a hotel in some ways, because they really acted as a concierge  but so much better.  The view was spectacular and the bed super comfy.  We will be back for sure!!"
2905375,24148654,2014-12-21,17172384,Sean,"We had a fantastic stay at the unit. It was well appointed, and was in a phenomenal location in Belltown. Amy worked with us on arrival time (traffic on Friday afternoon leaving Portland was heinous) and she got us set up very well with all the info we needed. I wouldn't hesitate to stay in a unit with these guys again."
2905375,26264708,2015-02-08,3263745,Chris,"Other than the shower handle being a little funky to navigate the place was awesome. 

If clean, safe and convenient is what you want along with a bunch of amenities, then there is no where else you need to look. What you see is what you get. A very well designed apartment with plenty of space.

The building itself has plenty of restaraunts right downstairs that are pretty awesome and the garage is easily accessible. 

Walking distance to most local attractions. If walking is not your thing, a $10 uber ride will get you to most places.
"
2905375,27268861,2015-03-01,25476114,Sara,"Darik was great! We got there a little earlier than expected, so I called him and they were able to meet us in 30 minutes to check us into our room. The place was everything I'd hoped it would be and more! It was just like a hotel, but felt much more like home. My boyfriend and I plan on coming again soon in a couple months. (: "
2905375,35273144,2015-06-16,28836814,Matthew,"I'm so glad that we found this gem of an apartment.  It's located in Belltown which is a great neighborhood with many restaurants to choose from.  Pikes place is a few blocks down and very walkable.  This apartment was exactly as shown in pics.  It's beautiful and you can tell that they are no stranger to hosting guests.  The complimentary waters, coffee, plenty of extra toilet paper, and paper towels, the robes; everything was well thought out to make us feel at home.  Everything was labeled so it was easy to find things.  It was great that there was cable for us to watch tv at night.. and they have 1 in each room!  Another plus, AC in the living room!!  I liked that parking was included and that there wasn't an assigned stall as we had a huge rental.  I would definitely recommend anyone staying here. "
2905375,45920227,2015-09-07,7808701,Carroll CC,"Great location. Allowed early baggage storage! Complimentary waters, fully stocked and clean and comfortable. Safe and secure. Only drawback location directly across from Buckleys Bar thus very loud Friday and Saturday nights. Much quieter on Sunday!"
2905375,50453536,2015-10-12,19044525,Jim,"The unit was in a great location, easy walk to everything. The unit was well appointed, had everything you could need, plenty of towels, pillows, blankets and the robes were great.  The welcome basket is a nice touch.  The only down side is the noise from the vents from the buildings across the street, but we brought ear plugs, which helped.  All in all a great unit in a great place.  Upon check in we were met by a member of the management stage who was very informative and helpful."
2905375,50610041,2015-10-13,12898470,Cristina,The host canceled this reservation 297 days before arrival. This is an automated posting.
2905375,51374766,2015-10-19,22588558,Peter,"What a great place!  Everything you could possibly need is there which makes it very nice.  Location, can walk or use public bikes to get almost everywhere.  The condo; is extremely nice with lots of extras.  "
2905375,51714526,2015-10-24,42142375,Richard,"The host made us feel very welcomed. Explained a lot about the unit and complex. Neighborhood and location was beautiful. Would come back in a heartbeat!
"
