listing_id,id,date,reviewer_id,reviewer_name,comments
4546924,34446242,2015-06-08,4782975,Qiva,"Marlo and her husband Dylan were excellent hosts.  Their place was super nice and all newly remodeled.  It had brand new appliances in the kitchen and even included a washer and dryer.  It was also very clean and environmentally friendly.  They supplied us with everything that we would ever need from toothpaste and soap to nail files and kitchenware. 

Marlo and Dylan were really friendly and helpful.  When my husband and I told them we enjoyed hiking, they went out of their way to get us a hiking book to use.  They have two very adorable dogs that just want to be part of the mix and get lots of love.      

The neighborhood where the house is located is super cute.  It was on a tree lined street with lots of remodeled craftsman homes around.  The street was very bike and pedestrian friendly.  It was close enough to walk to great spots, such as downtown and Volunteer Park.  We would definitely stay with Marlo and Dylan again if we are ever in Seattle.       "
4546924,34753665,2015-06-11,1751504,Xander,The place and location was perfect. Was better than I expected.
4546924,34877857,2015-06-13,587053,Ben & Emily,"Marlo's home is an absolutely fantastic place to stay in Seattle! The home is beautiful and Marlo is a wonderful host. The neighborhood is extremely quiet and conveniently located near restaurants, stores, and even a short walk to downtown. We highly recommend staying here during your next trip to Seattle!"
4546924,35075209,2015-06-15,14400600,Cynthia,"We loved the place- it is so tastefully and ecologically done- lovely backyard and the neighborhood is wonderful. I believe that our hosts were away for the weekend, so all was quiet. Thanks so much!"
4546924,35420018,2015-06-18,4440899,Nicholas,"The apartment is incredible! I loved the neighborhood, and everything about the apartment is very well thought out and cared for, including the additional spaces the property. It is evident that Marlo put a lot of time and care into making the space unique and very comfortable. Access to the yard, bicycles, and other amenities was a huge plus. Another great addition is that any bathroom or personal items you may need for your stay are provided. Would absolutely stay again!"
4546924,36140699,2015-06-25,34455514,Chris,"Thank you Marlo and Dylan! We had a wonderful time and felt welcomed as soon as we arrived. The home is beautiful and it was a great experience. Marlo and Dylan gave us some recommendations for things to do while we were in the City. The location is perfect, as we were close to many different parts of the City. Thoroughly enjoyed our stay and will come back again!!"
4546924,36284178,2015-06-27,8015413,Cynthia,Host was very congenial. Unit was clean and attractive. Very dog-friendly. Perfect for our stay.
4546924,36732667,2015-06-30,36392621,Margie,"Marlo and Dylan have created a wonderful oasis in a cool neighbourhood of Seattle. They have put such incredible care into the details of their Eco-retreat, they even have a binder where you can read about all the environmentally friendly aspects of the suite. They are a lovely and welcoming couple who made us feel right at home. We even had use of the back yard, comfy lawn furniture and  herb garden. 
The location is in a quiet residential neighbourhood,   but it  is still  very accessible by bus or an inexpensive cab ride to downtown Seattle. We walked about 15 minutes to a great street with lots of restaurants and amenities.  Marlo and Dylan have a handy list of their favourite restaurants as well as tour brochures to plan the trip. 
The accommodations were impeccably clean and well appointed with a full kitchen, and a washer/dryer. There is even a cupboard of toiletries in case you have forgotten anything - so thoughtful!
We would definitely stay here again and would recommend this accommodation to anyone travelling to Seattle who does not want to stay in the typical big downtown hotel."
4546924,37188742,2015-07-05,34958031,Jeffrey,"Everything was perfect.  Check in was easy.   The house had everything we needed.  Location was great.  In short, we felt relaxed and at home staying here.  "
4546924,38606304,2015-07-17,33305211,Brian,"The listing was as described, very quiet and private, and close to Capitol Hill.  Marlo was very nice and accommodating.
"
4546924,39337490,2015-07-22,38282395,Sherri,"Marlo's place was fantastic!  It was a wonderful place to stay prior to surgery, including availability for my dogs.  Great sanctuary in the CD area.  "
4546924,40264883,2015-07-29,38294194,Jong Sik,"We stayed in Marlos house very comfortably.Even we stayed with 4 people it was nice and not any problem. 
Our family enjoyed wonderful dogs also."
4546924,40501909,2015-07-31,17273952,Adam,"Marlo was such a sweetheart! We felt very welcome in her basement apartment, and stole some decorating tips while we were there. She clearly has talent for making the most of every inch of space, and being eco-conscious while doing it. The bed and seating were very comfortable, the kitchen was perfect for some light cooking with the ingredients we bought at the local market, and the bathroom was immaculate. Although we didn't end up using them due to our short stay and tight schedule, we love that bikes were available for guest use, not to mention the gorgeous backyard area. ALSO: Marlo has the very best Guest Manual I have ever seen at an airbnb location, hands down. I highly recommend this spot, and have nothing but fond memories for our brief stay there."
4546924,41731221,2015-08-09,30130581,Allen,"Marlo's apartment was the first ever airbnb I stayed in and it has convinced me to never book another hotel in the United States again. Her apartment had everything a hotel room does plus much much more. Things I didn't even think to bring but ended up needing, like cold medication and earplugs for the blue angels show. 
Marlo was a very gracious host and provided us with everything we needed during our stay. Airbnb messages were responded to quickly and her cell number was always available as well.
A couple things about the place that I really liked, were the firepit and tv/internet. Marlo provides guests with graham crackers, marshmellows and chocolate along with firewood in order to make s'mores which I thought was pretty cool. The tv comes with Netflix and Amazon Prime instant video and the internet has a strong connection throughout the apartment.
Beds were comfortable with great down comforters and plenty of pillows.
Overall, I rate my experience at Marlo's 5 stars."
4546924,42412976,2015-08-13,19359948,Lior,"The place has everything mentioned in the description and Marlo even included a closet full of toiletries, which came in handy since both my roommate and I forgot toothpaste. The neighborhood is very nice, and within walking distance to downtown Seattle. Overall, the stay was great and I would recommend this place to anyone. "
4546924,42736922,2015-08-15,5147918,Jonny,"Marlo is a fantastic host! Exceptionally easy to communicate with, and also very helpful and accommodating. I would highly recommend her as a host! Thank you for everything, Marlo."
4546924,43421358,2015-08-19,1671927,Jason,"Marlo was a wonderful host, the accommodations were top notch, quite possibly the pinnacle of air bnb apts. location is great. Overall, a spectacular stay!"
4546924,43812218,2015-08-22,17382339,Charles,"The unit was beautiful, very clean and comfortable. Very good location and accessible to downtown. Marlo our host was super nice and accommodating. Will definitely recommend to friends."
4546924,44299412,2015-08-25,1717105,Dara,"Marlo's place was perfect!!! We hope to return soon!! Marlo and Dylan are gracious hosts who were very friendly and helpful!!
The location is ideal and the apartment had everything we look for when traveling with our 18mo old!! "
4546924,45732491,2015-09-05,42671225,Jared,"Great place, great location, great host!  I would highly suggest this for anyone wanting to be in Seattle at a great price."
4546924,46332935,2015-09-09,22772,David,"Marlo welcomed us to her wonderful apartment which had everything we needed. The rooms were large and very clean.
Very quiet neighborhood and we walked to many coffee shops and restaurants, so location was perfect. "
4546924,47212423,2015-09-16,43636712,Kelsey,"This place was amazing!! Beautiful and very clean space inside, and really nice outdoor space too! Marlo was so accommodating the entire time, and they even left a book of great things to do in town! Would recommend to anyone! Really good location too, very close to great places in town. Loved it!"
4546924,47822582,2015-09-21,43635801,Peter,"Marlo was awesome. She was so nice, helpful and thoughtful. Her place was great too. The place looked great, it was clean, and had everything we needed. The neighborhood was great too. It was pretty quite, but walkable to Capitol Hill or downtown. We didn't need a car."
4546924,47942840,2015-09-21,1272609,Vanessa,"Beautiful place and Marlo was not only extremely hospitable, but went beyond to make the place feel like home: This is the perfect place to stay and great location. "
4546924,48755317,2015-09-28,32224943,Cameron,"The stay at Marlo's was seamless from booking to checking out. The listing description was completely accurate and then some. The space they provide their guests is beautiful and comfortable with all the commodities you'd ever need. Marlo went out of her way to make sure we were accommodated and comfortable with what we were provided with. Did you accidentally forget to pack something? No worries, they probably have you covered! 

The house and hosts are a great representation of the Eco-minded forward thinking state that makes Seattle great. The outdoor space also rivals the house in terms of beauty and forward thinking with the ""green roofs"" and inviting fire pit on the backyard patio space for guests to use. Plus, the location of the house only a 5-10 min Uber ride anywhere downtown. 

I highly recommend a stay and Marlo and Dylan's if you're trying to decide on where to stay while visiting the Seattle area. "
4546924,53910243,2015-11-14,47591921,Dan,"The home is really cute and spotlessly clean with eco-friendly and modern amenities. Online pictures of the home are accurate.    The bed was very comfy also. The location was close to our daughter's apartment, Safeway and Trader Joes, which made it very convenient. We were able to fix meals at home and have our daughter and her fiance over for dinner.  The home has a nice secure backyard for our dog...Our host's dogs are sweet and good-natured.  Marlo and Dillon made us feel very welcome.  They encouraged us to contact them if there was something they might have that we needed.  Parking on the street was easy and hosts provided a parking pass for our use. Would definitely book here again."
4546924,55067272,2015-11-27,9076866,Alisa,"Marlo was a lovely host and I still can't get over how great this apartment is. Super cozy and quiet, and near all the best stuff on the Hill and the ID. It was the perfect place for me and my pup. Thank you for such a wonderful home-away-from home, Marlo!!"
4546924,57628523,2015-12-28,43196393,Rita,"This sleek, comfortable, nicely furnished apartment was exactly what we were looking for. Approaching the private entrance at the end  of the driveway makes you aware of the beautiful backyard that, weather permitting, would provide a lovely outdoor space. There is nothing that our hosts forgot from the Keurig to the well stacked sundries closet that mimicked a CVS.  
Take-out menus are on hand and restaurants are nearby but if you choose to cook Trader Joe's and the Co-op Market are not far.
Located in a quiet neighborhood it will provide a respite after a busy day of touring downtown Seattle. Buses are nearby.
Our thanks to Marlo for being very attentive to our needs and making our stay most enjoyable."
1815304,8619936,2013-11-08,1105708,Jason,"Just looking for a quick overnight in Seattle and this spot was perfect! Steps away from everything on Capitol Hill. We absolutely lucked out on this location. 
Michael is awesome. He's an extraordinarily welcoming and genuine host who opens up his unique home to you. The accommodations are in a second floor loft and while an air mattress is not the most immensely comfortable arrangement, the location, space, and value made up for this aspect. 
Thanks Michael! Good luck in Seattle."
1815304,8650470,2013-11-10,9893319,Holls,"I had an incredible experience staying with this host family.  Such great, loving people who are very hospitable and recommend the best restaurants and attractions around town.  The condo is situated perfectly in downtown Seattle, which was great for walking and site seeing. The room provided is a loft which is cozy (provided with privacy curtain) and has a luxurious queen sized air mattress to sleep on. Getting in and out of the condo was easy and we were provided with a set of keys. There are two dogs named Zero and Frida. They are very cute fluffy buddies that you can never give enough hugs. They are fairly quiet and mild tempered dogs, which is a plus. Michael and Lily are incredibly giving and easy going, and make for super interesting conversations! Overall, I give this 100% A+, and if I were in the area again I would definitely stay here again, no questions asked. "
1815304,8826617,2013-11-19,981071,Craig,"Awesome couple, awesome location, super friendly and hospitable and willing to do more than most. Very glad I chose their place. Would definitely recommend to anyone and everyone!! "
1815304,8986980,2013-11-30,10139489,Eugene,It was a great experience!  They provide family atmosphere.  I highly recommand it! 
1815304,9035702,2013-12-02,4831818,Geoff,"Michael and Lily were both wonderful hosts! We needed a place downtown and close to the action. Pike's Place was walkable and so was Capitol Hill. We used Lyft to get to Fremont neighborhood and see the attractions there.

Michael and Lily's place was comfortable and they made us feel at home (though we weren't there too much, since there was so much to see around their place!) They provided breakfast stuffs and coffee, and had a computer set up with a slideshow of things they'd done so far. We got locked out once because their the door to their apartment complex was busted for everyone, and they left what they were doing down the street to come let us in. Lovely.

Only small downsides: The air mattress would deflate (as air mattresses do) which would make the sleeping uncomfortable towards the morning. Not a huge issue if you're just staying a couple of nights. Also, they have small dogs, which would occasionally yip during the night. It only got to be a problem one night when Frida ostensibly needed to use the doggy bathroom. But Michael and Lily came back shortly after I texted them to let her out.

Michael and Lily were wonderful hosts, you can't really beat the location / price as far as we could see, and would recommend staying with them again. Cheers guys!"
1815304,9187037,2013-12-11,3116456,Kristina & Andreas,Michael and Lily are the perfect hosts for your stay in Seattle. They really like to host people and show them their neighborhood. We just stayed with them for one night and had a very good and fun time. The appartement is in the middle of everything. You can walk to the best places in town and it is just 5 blocks from the lightrail station. We would stay again.
1815304,9203411,2013-12-13,4037783,Ricardo,"Super friendly hosts, very clean place, plenty of privacy, friendly dogs, central location--you can't go wrong!"
1815304,9271140,2013-12-17,2903467,Brenda,Amazing and fun times at this great place in a wonderful location! 
1815304,9334983,2013-12-22,10319715,Dennis,"Great airbnb. Michael, Lili and the doggies were extremely welcoming and friendly. They were more like friends I have not seen for ages rather than strangers. 
The space is conveniently located. 10 minute walk to the shopping zones and 15 minute walk to the Pike Market. The space is also well-equipped with WiFi, computer and Netflix. The only down side was the air bed, but it would not matter for just a few days. Overall, highly recommended!"
1815304,9450985,2013-12-29,8324357,Shunfu,"Michael and Lili were awesome, generous hosts. I arrived on Christmas Day when most places were closed. Michael brought me around Seattle and even found places for dinner. They were both very friendly and great to talk to and had great tips for sightseeing and food. The apartment was very tidy and the loft was just amazing. They provide so many facilities that you won't be bored even if you decide to just stay in and chill. Definitely a place I would love to stay at again if I return to Seattle."
1815304,9710334,2014-01-06,9842156,Allen,"I was in Seattle for a decently long 8 days and my stay with Michael and Lily was an amazing experience. They are very friendly and accommodating to me. They had lots of advice for different hotspots to visit while I was in Seattle and helped me a lot in getting to explore the entire town at large. We even went out together at times and they know how to have a great time in such a large city. Michael and Lily are excellent hosts.

The location of their apartment could not be in a more convenient place, situated in the middle of Downtown Seattle close by to virtually everything you would ever need. Bars up the street, Pike Market down the street, and a whole motley of other shopping centers and wonderful eateries in between.

The loft inside their apartment is spacious and comfortable. They provide a computer, printer, and scanner all by the desk which was incredibly convenient for me, meaning I didn't have to use my laptop for any of my work. Their dogs Freida and Zero are adorable bundles of energy, although they sometimes bark at night. The air mattress is a little odd to sleep on at first and you have to refill it each night, but you get used to it.

All in all they were wonderful people, the loft is well equipped for most of your needs, and the apartment is in a fantastic location. You can not go wrong staying here."
1815304,9751652,2014-01-07,10977622,Alok,It was an awesome stay at Michaels place. Although we stayed only for one night we were made to feel completely at home. Michael is a very good host and we had a wonderful time with him going to bars and having the best possible hot dog so far in my life. Thanks Michael!!
1815304,9767069,2014-01-08,895258,Aaron,"I would strongly recommend MIchael's place to anybody. The hosts were incredibly gracious and hospitable. It's a beautiful apt in a central location. I couldnt have asked for much else, I had a lovely stay. I wish I had more time to hang out with them. "
1815304,9813262,2014-01-12,8216058,Eva,"Michael, Lily, Freida and Zero are nice host.
They gave us a lot of advice about Seattle.
Their apartment is very cozy, providing we have a wonderful time in Seattle
"
1815304,9856820,2014-01-14,6825142,Kate,"Michael and Lily were super nice! We checked in fairly easily, the location was very central in a decent building. We only stayed one night as we were just flying out of Seattle the next day, but it worked well for us. I would not recommend it for a long-term stay because of the lack of privacy in the loft area, but great for a couple days. Their dogs were really cute, but if you are picky about dog hair/smells then they might bug you. It was awesome having use to the desktop computer in the loft space with Netflix so we could watch our favourite shows in bed. The bed was inflatable, but you could adjust it quite easily to make it firmer/softer and it was fairly comfortable. It was nice having a kitchen there with complimentary coffee/tea and bagels. Lily even made us a delicious breakfast! Great hosts, and overall a great stay. "
1815304,9886796,2014-01-17,9862062,Mindy,"It was a great stay! Michael was extremely accommodating. His partner in crime gave some great recommendations for restaurants in the area and ideas for what to do. The air bed was not a problem much. If only one person was staying, the air bed would actually be perfect. For two people I think it's still ok to some extent. It did get really really hot during the night though. So DO pull the air bed away from the wall. Their dogs are quite well behaved and adorable. I would say that staying here made traveling in Seattle so much more fun and affordable than staying in a hotel that was equally as close to downtown. Plus it's great having a refrigerator and computer to use!"
1815304,9952670,2014-01-21,10003640,Riley,"Great place to stay in downtown Seattle, the Location was really the key factor. Their perfect 100 walk score is crazy awesome.

Michael, Lily and their two little dogs were great hosts and really helped making my stay in Seattle a truly fantastic one!

I fully recommend anyone staying in Seattle to consider staying here as they will definitely be glad they did."
1815304,10006413,2014-01-25,638861,Pete And Clare,"My wife and I recently spent a week in Seattle to scout out the various neighborhoods for a planned relocation later this year. Two of those nights were at this downtown location with Michael and Lily, who were fantastic hosts. The location was amazing! You couldn't ask to be more central. Parking can be a bit tricky, so if you are planning to drive make sure to speak with Michael ahead of time. There were lots of amenities and public transport links within walking distance, so you really wouldn't need a car if staying here. Michael and Lily were kind enough to show us some of the great bars and restaurants in the First and Capitol Hill districts. They also provide some great advice for those thinking about relocating to Seattle (they were in our shoes 6-months ago). Great hosts, awesome location, comfortable bed, clean bathroom and friendly dogs! Highly recommended!"
1815304,10123125,2014-02-01,1640335,Cynthia,"I absolutely enjoyed my stay with Mike and Lilly. The doors and the building were easy to find and get into. Mike was super friendly, super hospitable, and helpful. As soon as we walked in he handed us the key to the place. The place is comfortable, clean & welcoming. They have two small dogs but when Lilly and Mike go to bed the dogs go with them. The place is very central and can walk, bus or lyft it anywhere. They offered us bath towels, orange juice & bagels (even though we could not find any cups in their kitchen). I cannot say enough of how helpful they were with recommendations on itinerary and places to eat. Their place was central to restaurants, bars, coffee shops, and shopping! There was a bit of confusion on booking so we had to book another Seattle location the same day we left our home city, but Mike was kind enough and gave us a ride the next day to our second airbandb in Seattle. If you do not mind sleeping on air mattress I would highly recommend staying here. I would definitely come back to stay with them again if I am ever in town again!"
1815304,10155252,2014-02-03,11207099,Breanne,"Michael and Lillie were phenomenal hosts! This was our first Airbnb experience and we could not have found a better home to start our adventure. From the moment we got there, we felt right at home and very welcomed. They had such a fun energy and were extremely helpful recommending the best bars, restaurants and things to do around town. I wish we would have had more time to spend with them! The view from their place was beautiful and the location truly is ideal: safe and literally a hop and skip from just about anywhere. I never thought that the hosts would be such a highlight of our trip of exploring Seattle. Thank you for everything Michael and Lillie! :)"
1815304,10195748,2014-02-05,10438565,Taggart,Micheal and Lilly were awesome hosts! Their place is clean and in an awesome location. They took me out the night I got there and showed me a great time. They know a lot about the city and really helped me get to know the area. I highly recommend them to other travelers headed to Seattle. 
1815304,10418061,2014-02-18,8274180,Monika & Martin,"Michael and Lili were exceptional hosts, they provided not only space - they invested their time and energy to show us the city personally. And we can assure you there is a lot to see! 
Apartment is in walking distance to the centre and many little (and inexpensive) restaurants and bars. It is warm and welcoming place with everyhing what you need for your stay. There's only one drawback - the air mattress doesn't provide high comfort... 
Overall, we've been very satisfied."
1815304,10528679,2014-02-24,2307576,Katherine,"My friend and I stayed with Michael and Lili while we were in town for a conference. They were very nice and helpful (great restaurant recommendations) during or stay. Their place was perfect for us and we couldn't have asked for a better experience. Even though we are all busy, it was great to hang out with them and get to know them at the end of the day. Plus, their two dogs are absolutely adorable and very sweet. I would recommend them to anyone wanting to stay in/near downtown."
1815304,10569892,2014-02-25,11394564,Destinie,"Michael and Lili were great!  Unfortunately, we were only there for one night, but a great night it was. Lili greeted us and immediately showed us around the place. Also offered us a lot of information about the sites to see and how to get around. At night, they suggested really great bars that quickly became my Seattle favorites. Their dogs are SO adorable and well behaved. Michael and Lili are so friendly, informative, helpful and always made sure we knew that if we ever needed anything they were there. It was because of them our stay was easy, nice, enjoyable and especially memorable."
