listing_id,id,date,reviewer_id,reviewer_name,comments
5805162,43766501,2015-08-22,28591863,Molly,"We had a great stay at Amy and Riley's apartment.  We are a family of four, and it was plenty of space for us. (our two kids shared a bed.)  We had a minor problem with some tiny ants in the apartment (mainly in the kitchen), but Amy dealt with the issue quickly and professionally.  The location of the apartment was fantastic; close to U Village Marketplace and Ravenna Park.  The apartment is exactly as pictured - very clean and neat.  The neighborhood and home are quiet, making it a great retreat in the city.  Thank you, Amy and Riley!"
5805162,45066242,2015-08-31,3251339,Betty,"There are so many things I could list about this place that I love. I will try my best to keep it short. 

First off, Amy was a wonderful host. Although I didn't meet her personally, I was in contact with her before and throughout my trip to Seattle. She was super welcoming and was able to accommodate my needs. In fact, she even made sure I didn't forget anything by texting me after cleaning the place up.

About the place: it was cozy, it was cute and it was awesome. I came as a group of 4 and all of us loved it. We had someone who was 6'4"" and was able to fit on the couch perfectly. He was quite surprised and please. 

The place was clean, well kept and had so much space to walk around that it felt so roomy. There was a place for all four of us to be without bothering each other. This was great after walking 8 hours in a convention. The living room had enough space to host a get-together of 7 people to play a board game on the (website hidden) provided great entertainment for us. We used our Netflix account and was able to enjoy a show all four of us liked. It was great to have that option. The couch is super comfy and could fit the four of us with a bit of room to spare. 

All the furniture was super comfortable. This made our experience amazing as we were all so tired from walking all day.

We will DEFINITELY come back here again. Definitely yes. "
5805162,45389496,2015-09-02,39052525,Susan,"We were very comfortable in this cute, quiet condo. Amy lives upstairs and was there when we arrived to show us around and give us a parking permit that allowed us to park on the street in front of the house at any time. She was helpful in pointing out a nearby grocery store. We ate at two of the restaurants that were suggested and they were both excellent. The heated floor in the bathroom was a treat and the washer and dryer were very convenient."
5805162,46529473,2015-09-11,22077189,Dario,The apartment is just great. We loved to stay there and we felt home immediately. It is very spacious and has therefore plenty of room. We also found the shampoos and the cremes in the shower a very nice extra. The tipps and tricks for Seattle upon arrival written on a paper were very helpful. We fully recommend the place of Amy and we can assure every future guest of Amy to be fully happy there.
5805162,47038751,2015-09-15,36202507,Don,"We stayed here 4 nights.  Advantages: a 2 bedroom apartment for the price of a hotel room, private entrance, spacious, recently renovated, comfy beds, bathroom has heated floor, hot shower, Netflix on the big screen TV, fully equipped kitchen, washer and dryer, free parking, free Wi-Fi, windows can open, close to University of Washington and several restaurants at University Village.  Wife loved the gadget by the bed which played nature sounds.  Disadvantages: 4 pm check-in, not as soundproof as some hotels, no live TV so I had to go to a sports bar to watch football (which may not be a disadvantage).  Overall we recommend it."
5805162,47395134,2015-09-18,42775462,Ryna,"Amy was such a great host. Not only were the accommodations beautiful, clean and quiet, but Amy was also extremely nice and approachable during every interaction we had. Unfortunately, we did not have the opportunity to meet her in person, but I am so glad we had this place to come home to for two nights in seattle! "
5805162,47665753,2015-09-21,38793681,Grace,"Everything about this place was perfect! The location was phenomenal, the house was beautiful and Amy and Riley were so accommodating! "
5805162,48410556,2015-09-26,12135170,Cynthia,"Although we were unable to meet Amy during our stay because she was out of town, she was quick to respond to any concerns we had before our stay or problems we experienced during. The place itself was pretty clean and very spacious

My pros: 
Loved the heated bathroom floors!! 
Comfy couches were great for lounging and watching Netflix. 
Plenty of parking. 
Cute neighborhood, walkable to uVillage and some nice local establishments. 

My cons: 
The house is definitely a little older and you can hear all the creaks and moans of its old bones. It took myself some time getting used to it but it's probably because I'm a light sleeper. Also, the bed is on an old metal frame so it was pretty squeaky everytime you move. 
It didn't end up being too much of a problem, but the basement windows did not have curtains, so it didn't feel as private as I would have liked. 

All in all,  it was a nice space for a good price in a quiet neighborhood. Just be mindful that being in a basement type of living space, you will hear footsteps above in the main house."
5805162,49604097,2015-10-05,31409615,Judy,"This apartment was a joy to stay in. It was lovely and thoughtfully organized. Amy communicated with us well. We loved our stay, the location and the attractiveness of the physical space.  We can't wait to stay here again!!"
5805162,50003127,2015-10-08,35012917,Fritz,"Die Ankunft war unkompliziert. Die Lage ist ruhig und die Parkplatzsuche kein Problem. 
Die Wohnung ist sehr schön eingerichtet, es hat viel Platz, alles Notwendige ist da. Die Bilder in der Beschreibung zeigen die Wohnung, so wie sie ist. Es ist eine sehr ausführliche und hilfreiche Beschreibung von der Wohnung und zu Restaurants, Aktivitäten, Geschäften, ... vorhanden. 
Amy war sehr nett, unkompliziert und hilfsbereit. 
Alles hat bestens funktioniert. Wir würden jederzeit gerne wieder kommen.


"
5805162,50467663,2015-10-12,527947,Marie,"Amy's place was perfect for my brief stay in Seattle. It was as lovely as it looked in the photos. It was so spacious, comfortable, and clean. The kitchen appliances were new and modern, as was the bathroom. I love the heated floor and the strong water pressure. It was easy to see that Amy pays attention to the smallest details and thinks of everything to make her guests' stay as convenient as possible. The toiletries were high-quality products, and there was more than ample supply of towels and linens. The location was ideal, as it was in a quiet neighborhood, close to the University of Washington and to shops and restaurants."
5805162,51115346,2015-10-18,7684164,Kimberly,We had a great experience here! Checkin/out was easy. The place was clean and very comfortable. We had everything we needed.
3986793,18701063,2014-08-30,8250339,Mark,"Fang is a great host, her house is very clean and light, in a nice part of town. Her service was impeccable, we received all the info we needed right away as well as towels and keys, we didn't need to ask one single question! I'd definitely stay again, her place was very relaxing after days of hiking in the Olympic national park"
3986793,18928094,2014-09-02,5959293,Willow,"It was quiet and very comfortable, she provided coffee and tea (which I didn't use), towels (which I did use), let me know any rules right away. Plus, she's on the edge of a beautiful park that leads to a small beach. "
3986793,19584279,2014-09-14,8168296,Annick,"Fang is the sweetest !  Everything about my stay was perfect: quiet and clean and bright. Just what I needed.
Thanks Fang !"
3986793,19853315,2014-09-19,21082261,Candace,Hostess was there to greet me the evening I arrived. Room was clean and I had the place to myself.
3986793,19910874,2014-09-20,21357192,Trevor,"Fang was a wonderful and gracious host who saw to it that we were nothing but comfortable and attended to.  The house is located in a wonderful, quiet neighborhood that provides a real sense of peace and privacy while still having all the amenities one could want close at hand.  Should I need a place to stay in that part of town again, I would not hesitate to see if her lovely home was available.  Thank you!"
3986793,19993844,2014-09-21,10969360,Malte,"Fang gave me a warm welcome and told me some great places to visit in Seattle. The room was as expected, everything was tidy and clean."
3986793,20394734,2014-09-28,15541144,Stacy,"Nice, clean, comfortable and peaceful. Thanks, Fang! "
3986793,21931217,2014-10-26,2351494,Andy,"The room is quiet and spacious. We really enjoyed the night in Fang's house. She gave us lots of suggestions about food, transportation and attractions. I will recommend it!"
3986793,22574462,2014-11-09,8136722,Naomi,"This spot was perfect! The entire experience was seamless. Basically, we found out we had a chance to spend and extra night in Seattle, we contacted Fang, and the rest was easy. The place was EXACTLY as pictured/described, it is super quiet, the garden as gorgeous and you can check it out from the shower. The house and room is super clean, and a par drive to downtown Ballard. We would definitely stay here again!"
3986793,32026983,2015-05-12,11609228,Christina,"I had a great experience staying at Fangs home. She was there to greet me the moment I arrived and gave me a nice walk through of her home. She was extremely welcoming and made me feel very comfortable. The description of her beautiful home was extremely accurate! It was located in a safe and quiet neighborhood, only a 20 - 25 minute drive from downtown Seattle. I would definitely stay there again!"
3986793,32405823,2015-05-17,3641741,Jenn,Excellent host.  Great space very helpful for check in!  Thanks.
3986793,32946431,2015-05-23,32946360,Adrian,"My wife and I had a fantastic experience at Fang's home, she was very kind and helpful throughout our stay there. The location is fantastic and beautiful carkeek park is 5 min away. Her home is beautiful and spacious, she even left a lovely welcoming basket on our bed. We will definitely be booking with Fang again."
3986793,33013221,2015-05-24,29445808,Brenna,"I enjoyed staying at Fang's home. It was clean and comfortable. Our room was just what we needed for the night, including some chocolate! Her boyfriend stayed the night. She let us know after we had settled in, but we didn't even see him, so he didn't bother us at all. It was a nice neighborhood. "
3986793,34988540,2015-06-14,21573712,Tim,A very accommodating experience. Super-clean and quiet with easy parking.
3986793,36460380,2015-06-28,2744983,Audrius,"I had a wonderful time staying at Fang's. Host is really lovely and the place is clean, quiet and really beautiful. Truly recommend for others."
3986793,37107372,2015-07-04,36877446,Antonio,"Warm, welcoming and friendly a guest could not expect a nicer host than Miss Fang. Her happy and smiling face brightened each day and her helpful suggestions made getting around Seattle easy and fun. I really enjoyed my stay and look forward to experiencing her charming hospitality again. I will surely recommend her to my friends and relatives traveling to Seattle. One more thing, a beautiful, quiet and peaceful garden just outside the back door gave me the feeling of being on a meditation retreat. It made me want to linger and relax in the inviting atmosphere."
3986793,37390582,2015-07-06,34445883,Eun-Jung,Fang is very kindly host. She's lovely house is very queit & comfortable. 
3986793,37669093,2015-07-09,34797354,Carlos,My girlfriend and I had a wonderful time staying at fang's. Her home is very clean and the backyard is a beautiful place to just sit and chat. Defined staying here again if I go back to Seattle. 
3986793,37898002,2015-07-11,36720294,Mi Ryang,"The place was just as listed. 
Quiet and safe neighborhood, with a beautiful garden and detailed instructions.
I loved the little basket with the towels and chocolate. It made me feel welcomed."
3986793,38305064,2015-07-14,31277772,Bonnie,"Fang was very welcoming, but also considerate of our privacy.
The room overlooked a quiet serene garden in which to read. The neighborhood was lovely and a 5 minute walk got you to Carkeek Park and another 10 minute walk gets you to Puget Sound within Carkeek Park. "
3986793,39190157,2015-07-21,36119314,Betty,"Her home is in a very safe neighborhood and it is easy to get around Seattle from this address. The best word I can use for her home was ""Serene"".  We had been traveling for 10 days and this was the perfect place to take a deep breath and relax. Also, the shared kitchen gave us the chance to fix a few healthy meals!"
3986793,40781375,2015-08-02,67054,Patricia,"Had a great stay at Fang's home while mine was being readied for sale. She had some wonderful touches - a basket filled with chocolate treats, fluffy white towels, hand towels, and a clearly communicated sheet that explained how to use her lock system, as well as her house use preferences.  Everything was clean and well maintained.  I'd recommend this spot for any traveler to Seattle - thanks, Fang!"
3986793,41107931,2015-08-04,21617627,Brooke,"Beautiful house, very quiet, clean, peaceful!"
3986793,42300074,2015-08-12,25843338,Cara,"Clean and close to downtown (20 min drive). Feng was a good host, she gave us food recommendations for food and parking tips."
3986793,43134600,2015-08-17,40214934,Jim,This was a great experience for us. Fang was very nice and gave us some good tips on things to see and do in Seattle. Bus service to downtown is available and easy to use. The room  was very nice and quiet. It was very comfortable place to stay. 
3986793,43998293,2015-08-23,39474330,Royal,Fang was extremely nice & accommodating. Her house is incredibly clean and well kept. I highly recommend staying with her! 
6185083,32406518,2015-05-17,403337,Rami,"Noah's place in a calm and leafy part of Seattle is a comfortable place in a comforting city. The whole place was clean and has a touch of character to how it's organised, which I found quite relaxing. Great amenities. Near a whole slew of fun things to do. If you don't mind hills you can practically walk everywhere otherwise it has great bus links. I can't think of anything that could be improved upon. It's already a pretty great place to stay and call home base."
6185083,41740545,2015-08-09,31043566,Madan,"Noah's place was very homely and the location was excellent in terms of connectivity to downtown or elsewhere.  We stayed 3 months and Noah was quite accommodating.  He was mostly not home, but whenever he was around, he was quite fun to talk to. When he was going to have friends over, he would inform us way in advance so that we're not surprised. 
There was a time when the WiFi wasn't working for 2 weeks, but that was because he wasn't around to deal with the cable company. So really no complaints! Like everyone else, he has some quirks that you will have to accept. But all in all, we had a really good time staying at the Art Lair."
6185083,43258137,2015-08-18,22224985,Reynaldo,"Noah is an exceptional host! I have no complaints. His communication was quick and he's a very friendly person. His place is walking distance to Capitol Hill and there are plenty of bus stops near to get you to other parts of the city. 

Thanks Noah!  "
6185083,44128529,2015-08-24,5559705,Caleb,"Noah is as radiant and lovely as he appears on his profile. Staying with him was an absolute delight. The house is clean and homely, and the room is comfortable - even the firm futon provides a great night's sleep.
The neighbourhood is conveniently located. A short walk to local cafes, shops and restaurants, or a quick (20min) bus ride will get you downtown.
I recommend staying with Noah to anyone who wishes to ditch the hotel scene, and swap it for a home away from home, and making a new friend. "
6185083,44584467,2015-08-27,34744126,Robert,"A great place at unbeatable value! Noah's place is extremely cute, and we loved the decorations. We unfortunately didn't see much of Noah, but he seems lively and friendly, and certainly has great taste if his home is any indication. The big highlight of this listing however is definitely the location at the price! We were super close to the heart of the city at a price that was way better than basically anybody else that we looked at in the area. The only possible concern is that the bed is incredibly firm. However, it was only a very minor issue for us, and nothing Washington's wonderful legal cannabis can't help fix if you're a light sleeper. A wonderful place to stay and highly recommended."
6185083,44742997,2015-08-28,42596896,Noah,"We only stayed with Noah for one night and most of our time in the apartment was spent sleeping but I still have real nice things to say. The place was super clean and comfortable, and communications with Noah were totally friendly and easy. A total pleasure! "
6185083,45097484,2015-08-31,20382146,Greg,"So, Noah's awesome. We had a great time from start to finish. Even though we didn't meet him right away due to our travel time and how busy our first day in Seattle was, we still felt very welcome the moment we walked in the door. His personal touch is in every part of his apartment and it's a delight. From the photos and how he's described his home, it's bang on - an artsy little pad where anything goes! Also, his neighbourhood is lovely, easy to get in and out of and park, plus a short walk down to the downtown core, which was pretty key for us as well.
Once our schedules overlapped and we were able to catch up with Noah, we found him to be a wonderful, swell person. Just a kind, generous soul that is very easy to get along with. Lovely to chat and laugh with, which is rather key.
So, like I said, we had a wonderful little adventure in Seattle, and Noah's home was key to the whole excursion! We will definitely be back to Seattle, and will always check in with Noah first, if only to say, ""Hi!"", but hopefully to find a small home-away-from-home!"
6185083,45803777,2015-09-06,3108811,Erik,Noah was fantastic. What a gem of a person and an abode. Instant friendship. The place was really clean and had fun art everywhere.
6185083,46331124,2015-09-09,42174259,Seth,"Noah was a good host. He gave us everything we needed and a quick rundown of the place, good place to chill after a bunch of long walks in Seattle. Would recommend."
6185083,47044414,2015-09-15,28401554,Joanie,"Staying with Noah was definitely a pleasant experience! His home was very comfortable and well decorated. He was a great host providing places to see and eat all around Seattle. He was always there to help. His location was great as it was steps away from bus stops to help get around all over the city. All in all, awesome experience!"
6185083,47628974,2015-09-21,395554,David,"Noah is an amazing soul, energetic and aspiring. Just lovely in general.

The apartment is very cool and relaxed. Well located; an easy walk or Uber down Pike and Pine street, or downtown.

An excellent way to introduce yourself to Seattle."
6185083,56469835,2015-12-14,33481294,Francesca,"Noah is a great host! The house is very nice and clean, and the location is super convenient. Strongly recommended!"
6554352,34394452,2015-06-08,10613766,Andrew,The host canceled this reservation 82 days before arrival. This is an automated posting.
6554352,35696136,2015-06-21,33865464,Camillo,"Scott was very helpful by letting my daughter pick up the key since we would be coming in late. Nice neighborhood but with construction still in process on the building next door and the street outside.  It didn't bother us much since we were out most of the time.  Brand new bed that slept great, the modern bathroom was next to the bedroom with plenty of hot water and bright sunlight. For extended stays, Scott should consider washer/dryer access.  To sum it up, it was a pleasant experience."
6554352,36884437,2015-07-02,28885080,Daniel,"This was our first experience in a private room, and Scott and Jeremy made it so wonderful! The lodging itself was great. We had a spacious bedroom, own living room with cable and bathroom. It was very clean. It was a beautiful house with a gorgeous view of the water from the roof! It was in the perfect location too. Scott and Jeremy were very kind and great hosts. They even made us breakfast one morning! They were both very helpful and knowledgeable in things to do/don't do in Seattle.  We felt very comfortable and welcomed there. We really enjoyed our time and are very thankful we chose this Airbnb.
"
6554352,37795886,2015-07-10,17900708,Flavia,"I really enjoyed staying at this very clean, new and organized apartment  in West Seattle. It was 15 minute drive to Downtown Seattle but we could also take the bus, which we didn't. We drove and it was fine. It was a short drive to Alki beach in Seattle where there were some nice restaurants and great views.
Scott and Jeremy were both very helpful and made us feel welcomed in their home. They were attentive to our needs and made sure we had what we needed. I would recommend them as hosts. "
6554352,38139030,2015-07-13,34600689,Paul,"Scott was very cordial.  The room was comfortable & clean.  With the room being downstairs from the quarters of our hosts, it was a very private setting for us, plus the extra sitting room was a nice feature for watching TV when we wanted to."
6554352,38630742,2015-07-17,10975842,Afton,"Visiting Seattle, STAY HERE!!!

Scott and Jeremy were wonderful and gracious hosts. The accommodations they offer are impeccably clean, comfortable and extremely private. The location is prime and cannot be beat. Scott was kind and available to answer any questions I needed. If I'm back in Seattle, as a visitor and not a resident, I will be back here, hands down!  "
6554352,39024083,2015-07-20,25644543,Alyson,"We had such a wonderful time with Scott and Jeremy as hosts! They made us feel like family during our visit to Seattle. They were so thoughtful, helping us with bus routes and giving us movies to watch one evening. We had so much fun and feel like we made two new friends. We hope they will still be hosting next year when we travel to Seattle! "
6554352,39663832,2015-07-25,27558417,Chelsea,Communication and check in was great and stress free. Scott and Jeremy's home was beautiful and a great way to spend our last night in Seattle! Parking was not an issue and the roof deck was great! Highly recommend. 
6554352,40044866,2015-07-27,899899,Andrew,I had a great time staying with Scott.  My hosts were friendly and made my stay very comfortable.  I highly recommend their place to anyone staying in Seattle!
6554352,42132144,2015-08-11,28780093,Michelle,"We're 4 students traveling to USA for the first time, and Scott's home was a great starting point to explore Seattle for 5-6 days.  Buses to downtown stop nearby, and there were supermarkets and fast food joints within walking distance, which was very convenient for us. The hosts were friendly and helpful in recommending us places to check out during our stay here, and the home is very clean and organised. One thing that could improve the whole experience would be maybe providing washer/dryer access for longer stays? However, overall a great stay! :)"
6554352,42868234,2015-08-16,28883231,Samantha,Beautiful accommodations with Scott & Jeremy!  Had lots of privacy on their first floor with our own bedroom and bathroom. They were very accommodating to our travel schedule as well. Easy access to buses all over Seattle! We absolutely loved the Seattle area and look forward to staying here again for our next visit! 
6554352,43080099,2015-08-17,37244305,Terry,"The room was great, location was perfect. Room was very clean and the bed was super comfortable.
Scott was the perfect host and would highly recommend this unit to others"
6554352,43665797,2015-08-21,19992908,Siyang,"We really like this clean and wonderful place. Jeremy and Scott are very nice. The bed with grey sheets was very comfortable. Two bedrooms and a bathroom were located in the first floor, which is private. The roof deck had pretty ocean view. Street parking is easy to find. We had a good time to stay there. Highly recommend."
6554352,50342013,2015-10-11,30305543,Jofelyne,"I couldn't have picked a better place to stay, especially for my first time using Airbnb. The space was very clean and quiet. It felt like home. Scott and Jeremy are friendly and knowledgable. They helped us a lot by giving us tips on where to go and what to see in Seattle. Bono, their dog, was pretty awesome too! He's friendly and curious and loved to keep us, me and boyfriend, company in the kitchen. 

Overall, we will definitely consider to stay here again the next time we come to Seattle. 

Much Mahalos, Scott & Jeremy! "
6554352,53310077,2015-11-07,47405776,Sean,"Great location for getting out for a run or walk.  The private room was as advertised and very comfortable.

Highly recommended."
3888924,30980531,2015-04-30,12362661,Erin,"Great experience. The cor36 is just as advertised, great young tech talent sharing a big, beautiful house. "
