listing_id,id,date,reviewer_id,reviewer_name,comments
3041619,52617759,2015-10-31,45925273,Shams,"This is one of the best AirBnB experiences I have ever had! Sven is a wonderful host.  Everything was prepared as stated and I had no issues during my stay. 

The place is even more beautiful in person as the photos show. There's plenty of space for a large group to stay over. 

The location is very convenient if you are planning on exploring not just the downtown area but the greater Seattle area as a whole as it is located right by the highway. If you are planning on just doing downtown, just make a note that the afternoon rush hour traffic can get a bit heavy so plan accordingly. 

Overall, this is a great place to stay in. I'd highly recommend it for anyone staying with 5 or more people in the Seattle area."
3041619,52841913,2015-11-02,44028559,Varun,"Sven was a great host! He was very friendly, available for questions if needed, and was flexible. The house was clean and well supplied. I would recommend him to anyone going to Seattle. "
3041619,54870669,2015-11-25,2336173,Yonnie,"Great apartment ,great location,just wonderful waking up in the morning  and looking at the view.Sven the host although i haven't met it him in person was very responsive efficient and very kind through our correspondence."
7969698,53589154,2015-11-09,48444755,Rachel,The host canceled this reservation 16 days before arrival. This is an automated posting.
3085726,21437439,2014-10-17,679048,Lacy,"Neighborhood was AMAZING! I walked everywhere. The floor was very creaky and the kitchen had no utensils. But everything was clean which I appreciate highly, and it was a very quiet building. Positive experience, fell in love with the U District! "
4025954,19449422,2014-09-12,5825506,Amy,"This was the perfect place for us for a couple of quiet days away! James was an attentive and communicative host who gave us plenty of helpful tips for enjoying the neighborhood. The place was quiet, clean, and just felt like home, with coffee and tea and a basket of fresh fruit on the table. Steps away from beautiful Green Lake and an easy bus ride to downtown Seattle. We loved it!"
4025954,21851681,2014-10-25,22552125,Kara,"I loved my stay!! It was wonderful. A++++++++++++++++ experience. James is a gracious and thoughtful host. He went out of his way to make sure I was taken care of. Lovely touches like fresh flowers and a basket with fruit made me feel welcome. The apartment is great! It's charming, clean, and comfortable. The neighborhood is quiet and just a quick commute to downtown. It felt like a little home away from home. Highly recommend. Thank you, James!"
4025954,21986555,2014-10-27,22555227,Sima,"I booked this little basement apartment for my parents when they were in town visiting for the weekend. Jim and his family were very flexible and accommodating, and the location was ideal - right next to the little shops and restaurants on the south end of Green Lake.  Parking was a little bit haphazard, but totally doable. I would definitely book again, this was wonderful!"
4025954,22275306,2014-11-02,6574620,Rusty,"My girlfriend and I really enjoyed our stay.  The apartment is clean, comfortable, and pleasant.  Jim was a great host - responsive and accommodating.  The neighborhood is safe, centrally located, accessible to everything, and just an overall great place to experience Seattle. I'd definitely stay again."
4025954,22566817,2014-11-09,23350107,Lauren,"Jim was accommodating, and made sure to let me know that the apartment is the basement of the house in the main photo before confirming. Everything was really easy and went smoothly. The apartment itself was very clean. The bed was quite uncomfortable, but for a two day trip it was fine. The location is great, really close to the 5 and the 99, and lots of restaurants/shops nearby. We didn't walk anywhere, and parking wasn't a problem for us – there was plenty on the street out front. It rained overnight and the walkway to the basement entrance got quite muddy, but when we got back later in the day they had placed some stones on the path to walk on, which was nice. Overall, a pretty good experience if you want something affordable in a convenient neighborhood location. "
4025954,23527254,2014-12-03,11387249,Roz,"We had clear instructions about getting into the apartment. We were greeted by fresh flowers and lots of specialty items in the kitchen. In addition, the bath was very comfortable and there were plenty of items there too. Our host communicated by email to make sure that all was well."
4025954,25110819,2015-01-06,25206754,Chigusa,"Cannot be better than this!  

My kids and I needed a place where we could stay comfortably while packing stuff and cleaning our house to move out. Kids were excited to stay at a hotel. Now they say that they call this place apartment and they love it!  It became our home immediately. Everything we needed was here. As I step inside the house I could not stop sensing the warm hospitality all over.   You can tell that you are welcomed. 

Nice private entrance. Warm rooms (it is winter now).  Good layout. Lots of storage space.  Cleanliness everywhere. Toys, games and books. Kids DVDs. Cozy kitchen with complimentary coffee and tea, perfectly functioning for each meal. Great location. Walkable!

 If anybody stays in Seattle I highly recommend to consider to be by Green Lake. One of the best spots in Seattle. It really does represent the city. 

We have stayed here for a week. Then in fact we decided to extend our stay for another week till our departure. For sure we will miss this place once we leave. We are planning to come back to Seattle this year. Absolutely we would like to see its availability. 

Now I am off running around the lake!"
4025954,25786530,2015-01-26,9918729,Linda,"Jim made us feel very welcome and the basement apartment had everything we needed, plus some extra special things like fresh fruit and flowers.  It made very efficient use of the space, and when our granddaughter was visiting with her mom and dad, she really enjoyed the musical toys and instruments provided.  Parking was not a problem, especially on the weekend when the school across the street was not in session.  Jim gave us all the info we needed, coming and going, so we knew exactly what to expect.  We were not disappointed.  We would go back again."
4025954,26226262,2015-02-07,48938,Mahad,"Jim and his family have a lovely home in the best neighborhood in Seattle. It was so nice to be able to walk to so many nice restaurants, cafes, and bars. Access to the 5 was very easy. We found very convenient to get around from the apartment. Check-in was a breeze. Jim checked in on us multiple times. The apartment itself was as advertised with everything a person needs to feel comfortable. I would most definitely recommend staying at Greenlake Getaway! "
4025954,28306558,2015-03-22,26411638,Sarah,"Awesome location! We booked this cute little apartment as a long term rental. Jim was a great host & quick to respond to questions. The apartment was all set up with nice little touches like fresh flowers, coffee, tea and even cream. It was a great landing place after a long move from Dallas to Seattle. The location was steps away from greenlake & easy to access the rest of the city. There is so much within walking distance, we hardly ever drove. Overall a great experience. "
4025954,28739663,2015-03-29,2252332,Sue,"Our stay was perfect- great communication, adorable place, very clean and exactly what we expected. They even left us a bowl of fruit and some half and half in the fridge for our coffee! The neighborhood is really walkable--  parks, bars, breakfast restaurants, all an easy walk. We will be staying again the next time we're in town! "
4025954,32833748,2015-05-22,11796605,Terry,"Apologize for delay, returned to lots of water in Texas!  However, I could not delay this review any further.  This was the most fantastic place I have ever stayed at in Seattle.  Very close to surrounding parks and lots of activities from walking trails to renting canoes.  Host was excellent in staying in contact with emails and texts regarding any questions I had.  Only complaint was not being able to stay longer! Will definitely be on our place to check first while visiting Seattle."
4025954,34146625,2015-06-05,14301609,Diana,"Had a wonderful stay at the Greenlake Getaway!  First off, the location was perfect.  The unit is walking distance to many eateries and also a couple block to the beautiful lake.  The apartment is located in the basement of the hosts home and has everything you need to have a nice stay.  It was cozy and clean.  We were greeted with fresh flowers, breakfast snacks, coffee and tea, and lots of different kinds of milks!  The space was perfect for two and I could easily see three or 4 stay there with no issue.  There was always parking on the street.  It was such a cute spot to spend out nights after long days of exploring greater Seattle!  Thanks, James!"
4025954,34423586,2015-06-08,5445847,Victoria,"First of all the location is perfect. It's a block from the lake where you can rent boats, run or just walk. Coffee shops, restaurants, yogurt and a very good grocery w/ premade food is nearby. Place was very bright and clean. Has the full cooking facilities if you wish to cook. Provided nice amenities such as coffee, tea, granola, and basic cooking items. Loved his bathroom touches of spa salts. Overall, very good location, place itself was quiet. Parking was a non-issue. Short distance to the university. Short drive to downtown. Definitely will recommend "
4025954,34656520,2015-06-10,33772838,Ann,"Jim was a warm, laid back host. He was really attentive to our needs, and also respectful of privacy which is the perfect balance, in my opinion. I even asked if there were chairs to sit outside in the lovely weather, and a half hour later a new table and chair set arrived! We also asked for something outside the expected: a place to store and possibly charge a mobility scooter, and he went out of his way to make it happen which was a great help. The location is fantastic: 2 short blocks to beautiful Green Lake, with cafes etc. Great spot and great host."
4025954,35059739,2015-06-15,12744237,Bruce,This has been our best Airbnb ever. Everything about it was delightful. Will definitely stay here again. 
4025954,35398315,2015-06-18,33845936,Shiyang,The area was peaceful and convenient. Almost every stuff is provided. It is a great place for a rest on your journey. 
4025954,35911430,2015-06-23,7222114,Benjamin,James was a gracious host. I chose this listing in part because of the proximity to my house (I was putting up my parents for several days). The place was clean and comfortable. The apartment has a small but full kitchen a living sitting area and a separate bedroom. My parents were both quite pleased. 
4025954,36653164,2015-06-30,19258766,Sara,We loved the location! It was easy to take public transportation! The apartment was fantastic! It had everything we needed. James got back to us quickly anytime we needed anything!
4025954,40313507,2015-07-30,5687705,Chun-Yen,"Other guests have said it all -- great location, clean and well-equipped apartment, and wonderful host. James was easy to communicate with, accommodating, and thoughtful with every detail. We stayed for a month and had a blissful time. "
4025954,40992806,2015-08-03,8598835,Raeann,Jame's apartment was very comfortable & very thoughtfully equipped. It was super easy to get around Seattle from his place. 
4025954,41450157,2015-08-07,38959547,Kirstie,"This was my first AirBnB experience and I was very pleased. The place looks exactly like the pictures and was very clean. The location was amazing - next to public transportation that takes you right downtown Seattle with no transfers needed. We never had the pleasure of meeting the homeowner, but his messages were extremely friendly and he always replied very quickly. He made us feel very welcome with a personalized welcome sign, fresh fruit, flowers, coffee, milk, and a little guide to the beautiful surrounding neighbourhood. My only complaint is that the bed was very uncomfortable so we ended up moving to the futon, which was a little better. Also, for some reason the wifi connection was very hit or miss, but not a huge deal since we didn't travel to Seattle to play on our phones. Overall I would highly recommend this adorable rental suite !"
4025954,43515095,2015-08-20,37622471,Wendi,"I enjoyed our stay there very much. Loved the surrounding area, you could walk to coffee, pizza or best of all the lake. Easy public transit lines downtown. Helpful signs and dining suggestions. Only drawback, the bed was a bit beat, although that didn't stop me from having a good night's sleep. My son seemed to sleep well on the futon. Wi-Fi was a little weak too. Loved the fruit, coffee and stocked kitchen. "
4025954,44783330,2015-08-29,37833789,Kriss,"James made me feel welcome at the very beginning by posting a sign with my name on the door that  said ""Kriss this is the place"", also  Starbucks coffee and non-dairy creamer options, fruit and fresh cut flowers graced the dinning table.  Very nice touches. The movie collection was spot on with cartoons from my boys childhood. We built more memories together as we laughed and rememered their youth. This is priceless!
This Greenlake location gave me a central access to lots of Seattle activities and restaurants within walking distance. When I did use my car It was very easy to find parking, most of the time I found a spot right in front of the house.  As a guest I should have thought it through a little more. Me being a light sleeper, the basement space was a little noisy a couple mornings. James made me feel welcome and promised to be quiet and he did. I  met many spiders and being terrified of them I did not feel welcome. This is something the host apologized for and promised to look into and remedy.  The space was cozy and roomy. The bed was a little too springy for someone with a bad back so I moved to the futon. The pillows and comforters were cozy.
Thank you again Jim."
4025954,45467000,2015-09-03,16831038,Bethany,We were both extremely welcome and felt right at home in this lovely apartment. It exceeded our expectations although we weren't sure what to expect with our first AirBnB stay but we highly recommend this getaway home. It's so close to everything in town and not far from the downtown area . Jim was great with communication and helping us with anything we may need. The apartment was clean and full of little amenities and utensils to cook with. We didn't want to leave! This was much better than a stay in a hotel.  Thank you!! 
4025954,46136993,2015-09-08,9588809,Jay,The place is very delightful. Very clean and cozy. Right next to Green Lake. It is very nice to jog around. We would love to stay again for next visit.
4025954,46898031,2015-09-14,27926126,Jon,what an awesome basement apartment. Was welcomed with signs pointing me in the right direction to everything. the apartment was spacious and beautiful. James included everything within walking distance which was a huge plus. The location itself is great too as it is a quiet block with a huge lake 2 blocks away. The local food recommendations were spot on. definitely staying here next time we come to seattle
4025954,47302437,2015-09-17,31302771,Karen,"This was a terrific set up!  Such a great location, nicely appointed and comfortable.  The host did a great job communicating, so there was no stress involved.  We will certainly stay here again if the opportunity arises!"
4025954,47633645,2015-09-21,32163590,Mark,"James is an excellent host and made us feel right at home. Our AirB&B was clean, quiet, and lnestled in a neighborhood near friendly coffee shops, parks, and a lake. We were close to bike paths and a bus line.

James communicated very well, offered timely information, and answered all of our questions.

This was our first opportunity to try an Air B&B, and we're very pleased with our experience!"
4025954,48513827,2015-09-27,22776656,Nicole,Great place!
4025954,50739075,2015-10-14,27494379,Lorra,"James is a wonderful host.  The apartment is spacious, immaculate, comfortable, and thoughtfully furnished.  The kitchen is perfectly stocked and the lovely surprise of tea, coffee, and granola (plus milk in the fridge!) made us feel immediately at home.
We love the neighborhood for it's centrality, walkability, and peacefulness."
4025954,52239603,2015-10-27,44831085,Amy,Lovely basement apartment right off of Greenlake - it was everything we were looking for. The host kept us updated and made sure we knew they were readily available if we had any issues. A++ would stay again.
4025954,53988630,2015-11-15,42071951,Kimi,"This place was absolutely PERFECT. You can tell that Jim is a great and seasoned host. Details were provided before and after the trip. Walking into the apartment was amazing, there were flowers, fruits, an umbrella, coffee, etc etc....so much more! We felt so welcomed. Every single room had ALL of the amenities that we needed. The location itself is close to everything, Pike Market Place, Space Needle, International District, University district, Shopping mall, Everything! The walk to Green Lake was only 2 blocks away. Finding parking on the street was never a problem. I'm sure there is tons more postive feedbacks that I have forgotten. Point is we are already thinking about our next trip and staying here again! Thank you Jim for everything! We had a lovely stay. 

Kimi"
5252877,28664645,2015-03-28,24594242,Emma,Great apartment. Everything was in pristine condition. Amenities for both us and our kiddos were great. Friendly meeting with property manager upon our arrival. Great location. Would highly recommend. 
5252877,29840563,2015-04-13,19357551,James,"A friend of mine checked on my behalf and Autumn, the apt manager made it very easy to accommodate this for us! The apt itself was awesome and the view from the Living room/kitchen was just beautiful! The amenities were plenty for 6 adults, and the guidebook provided included all instructions that we needed for check out."
5252877,32044360,2015-05-13,76725,David,The host canceled this reservation 30 days before arrival. This is an automated posting.
5252877,33058381,2015-05-24,20997395,Herbram,The host canceled this reservation 43 days before arrival. This is an automated posting.
5252877,36324259,2015-06-27,19242872,Jim,Everyone was great and communicated very well before and during our stay. The unit was immaculate.
5252877,38583938,2015-07-17,27498414,Ashley,"The apartment was just as described in the listing. The pictures were identical. You do have to walk up stairs, but that was mentioned in the listing. As for cleanliness, it was mostly clean. When we pulled the hide-a-bed out, there were so many crumbs that we couldn't get them all off. My friend ended up sleeping on the other twin bed in the second bedroom. 

The check-in process was a disaster. We arrived on time, but the apartment Rueben gave us wasn't the correct one. We had a major freak-out moment. Rueben wouldn't answer his phone, someone was parked in our spot, nothing was going according to planned. I even call the owner, Melissa because her number was listed on the listing. She didn't email me back until several days later. Rueben finally called back and said we were in the wrong apartment, but that we couldn't get into our because it was still being cleaned. We waited an hour and half before the cleaning lady left. We were not pleased as we had missed plans with friends due to not being able to get ready. Then Rueben, the apartment manager had to come by. Oh my word. He had trouble changing the code to the door. I finally told him to leave it and that I would just use my door stop alarm.  Even after all the paperwork was signed, he still wouldn't leave. I finally had to tell him very directly to please leave because we had to get ready for dinner. 

The space was fine once we finally got in and settled. As for the neighborhood, we didn't really have to time to explore it. The apartment has a great view of the city and Mt. Rainier (when it isn't cloudy)."
5252877,39559933,2015-07-24,37717226,James,Great place!  Extremely clean and well-stocked with more than enough room for our group.  Would definitely stay here again.
5252877,40537780,2015-07-31,24639348,Gayle,"Three of us stayed here on our trip to see Wicked. Very close to downtown- with awesome views of the water and skyline. The pictures were accurate, the cleanliness was superb, the beds were VERY comfortable (I would like to know what kind of mattresses they are so I can buy some for my house). They even had a bottle of my friends wine in the refrigerator for us! Perfect way to cool off while getting ready for the theater. Communication with hosts were prompt. We will definitely rent here again!"
5252877,47963134,2015-09-22,28356405,Lauren,"We had a wonderful time staying in Seattle! This was an AWESOME location and very modern apartment. We had everything we needed when we arrived. We even had a parking spot so that we didn't have to look for a place on the street. The only thing we would have loved was more seating in the TV area. We had 6 people staying in this location so a wrap around sectional would have been perfect for when we all gathered to watch movies/sports. We would highly recommend this location, especially if you have fewer than 6 people."
5252877,52460265,2015-10-29,23510694,Angela,"This place is great! Really beautiful and close to everything you need. The bed was super comfortable and the apartment overall was very liveable and spacious. The host was great, very easy to deal with and made sure I had everything I needed. I would definitely stay here again."
5252877,53692715,2015-11-11,7753870,Matthew,"Spacious apartment in a quiet neighborhood within walking distance to interesting shops and tasty restaurants.  The beds were so comfortable, great to fall into after a day of exploring. The private parking spot is super helpful for those who wish to explore further than Fremont. Autumn was very helpful and responsive in getting us situated. Very nice place."
5252877,57704659,2015-12-28,25006393,Linda,"This is a review for the ground floor unit in the building.  We booked at the last minute and the top floor was already taken.  Everything in this apartment seemed new and in great condition.  Kitchen was well equipped .   The  beds were super comfortable and the apartment very clean and quiet.   The manager, Autumn was very helpful, communicated well and was there to meet us on arrival and walk us through the apartment. 

 Fremont is a fun location to stay in while visiting Seattle. convenient and safe.
"
5175631,27592631,2015-03-08,4157947,Gabrielle,"Jeremy was an incredible host and his place is the best Airbnb apt I've ever stayed at without a doubt. Everything was impeccable, clean and the space was fantastic. Unbelieveable views from all rooms, washer/dryer, parking space, a balcony and a very cozy feel that makes you feel right at home. I unfortunately did not get the chance to meet Jeremy but his instructions were very clear, was easy to get in touch with and he made us feel very welcome. Top notch penthouse and host. Definitely will book with him again on our next trip to Seattle. "
5175631,29744708,2015-04-12,9260928,Lisa,"I really loved Jeremy's place - first off, the view of Lake Union and Gas Works Park/Aurora Bridge is spectacular! Le Penthouse ;) is filled with eclectic art, dry bar, kitchen and cozy master bed is a perfect home away from home...but better. I was staying here for a convention over the weekend and loved super quick access to downtown, bars and restaurants via Uber (5 minutes). Also appreciated being able to make an espresso every morning on his commercial espresso machine. Each of the rooms are large enough for two couples with the Master having an attached 2 piece bathroom. Big screen TV with apple TV. 

Seriously cool place"
5175631,30620150,2015-04-25,29825368,James,"Exactly as advertised and then some!  Neat apartment, fabulous view. Jeremy was a great host, easy to communicate with, available as needed. The location was perfect for us, accessible both to downtown and the U District. As our first AirBnB experience, it will be difficult to top!"
5175631,31959449,2015-05-12,475224,Rachel,"The view is amazing. There is plenty of space. The penthouse was very clean and comfortable. 
I rented the listing for me and father to enjoy. My father doesn't get around easily so we enjoyed the balcony very much. We watched boats and sea planes as well as enjoyed viewing Mt. Rainier. 
Jeremy was quick to respond. He was very sweet to offer us a bottle of wine, oj, yogurts and fruit. "
5175631,32474467,2015-05-18,10194729,Chris,"Wow, all the 5 star reviews are certainly deserved! What a great place--comfortable, homey, good location near but not too near downtown, on bus line and bike lane, with a nice small market within walking distance--all with that fabulous view. Beds were great, shower great, and Jeremy kindly left us some food for breakfast.  We could do laundry, and there was a BBQ we didn't use. A wonderful spot for 2-4 people; we were 3 and didn't feel crowded at all. Highly recommended!"
5175631,33112947,2015-05-25,5897385,Jane,"Warm welcome. Gorgeous view. Quirky style. Though we thought we might have been further out of the center than we wanted, it was perfect.....easy walk bus or uber to anywhere we wanted.
Great beds& very very clean."
