listing_id,id,date,reviewer_id,reviewer_name,comments
8412143,51809920,2015-10-24,46395023,Michael,"Kevin's listing is great for anyone visiting Seattle. It's conveniently located in Fremont, which is a short Uber ride to anywhere in the city. The apartment is clean and Kevin is easily reachable. Everything is provided for you and the property is very welcoming. Electronic locks make life easy. "
8412143,52977072,2015-11-03,20442667,Kal,Great and convenient place to spend the weekend while visiting friends in Seattle. Plenty of bars and restaurants within walking distance. Fremont has always been one of my favorite neighborhoods and it did not disappoint. 
8412143,54833714,2015-11-23,32215190,Francine,Great little place ver clean and tidy. Good walking distance to all shops and cafes in the Fremont area. The hosts were very prompt and accommodating. 
8412143,55497542,2015-12-01,3273603,Donna,"This flat was located in a perfect location for me, right near the Fremont shops and steps away from Queen Anne by a quick walk across the bridge.  The flat has the basics and was lovely for my needs.  The check in was quite easy which was nice on a late night arrival.  "
8412143,57021099,2015-12-21,46187201,Margo,"Host made certain we knew of possible interruptions in plumbing because of repairs in upstairs unit.
Coffee maker was quickly repaired.
Manager offered to meet us to help with tv."
8412143,57607744,2015-12-27,7876745,Kayla,"Everything was exactly as listed, and the apartment was cozy. Street parking was easy, and the location could not have been better! The keyless entry was very convenient, as well. I would absolutely stay here again!"
6378563,33314314,2015-05-26,19578891,Luke,"We had a great stay at Samantha's downstairs garden unit. Our original reservation was cancelled by another owner last minute, but fortunately, Samantha had just recently listed the Terrace Garden and booking with her was a breeze. She had a keypad lock installed a few days before our visit and it worked perfectly. Apparently there was a problem with being able to vacuum the unit before we arrived, but Samantha was very up front and even left us a 6 pack of her favorite local beer as an apology. We loved the brews and could hardly notice the vacuum problem. We loved wallingford's quiet streets and its proximity to ballard, fremont and the U-district (tons of cool places to eat, drink and shop). We had a great time staying in Wallingford and exploring Seattle. Would absolutely rent from again!"
6378563,34157846,2015-06-05,3010460,Tony,We stayed here for a week.  Samantha's rental is excellent.   It's in a really great location and had everything we needed for the week.  We stayed here with our 3-year-old and the apt is very child-friendly.  The apt is very clean and well-organized.  Samantha was very responsive and easy to communicate with.  Highly recommended!
6378563,37254145,2015-07-05,29422258,Justin,"Samantha is a really really good host, we had a really happy time in Seattle."
6378563,41760205,2015-08-09,34876323,Hanson,"Samantha and Casey were very welcoming and accommodating in terms of helping us set the place up for the trip with our baby and two dogs. They had an old crib and high chair that worked great. 

Great location, with lots of little restaurants nearby and a short drive to downtown or the University district."
6378563,45108521,2015-08-31,828031,Mike,"This was the best Airbnb I've stay at! Samantha was super easy to communicate with and answered questions very quickly. She left she had detailed directions for everything at the house which answered all our questions. Her home was super clean, beautifully decorated and an easy 10 minute drive into downtown. The air mattresses were super comfortable. We felt at home and relaxed with her place. Will totally seek her out again for a return trip!"
8902887,52664462,2015-10-31,14170770,Carolyn,"We had a great stay with Julie and George in Seattle!  Julie responded back within an hour to our request to book, and it was a very easy experience.  

The booking is a mother-in-law apartment on the bottom level of the house.  We were able to enter privately from around the side.  The apartment consisted of one bedroom (with a comfy bed!), one bathroom, a kitchen (with refrigerator and stove), and a living room area.  It was plenty of space for the two of us. The apartment was clean and we had everything we needed for our stay.  

The nicest part was the ease with which we could get into downtown Seattle.  There are two light rail stations within a mile or so from the house.  The closest one is a half a mile away, and it is very easy to get there.  The Westlake stop (downtown) is 8 stops away, and it takes less than 20 minutes on the rail.  We didn't travel on it to the airport, but Sea-Tac was 4 stops away in the opposite direction.  The location made it really easy to be in the city if we wanted to be.  There were also lots of other little restaurants/shops/etc within walking distance from the house.  We ate at a few great brunch places that were very easy to get to.  

Overall, we had a great experience.  We would definitely stay there again.  "
8902887,53414118,2015-11-08,43891565,Trilby,"This was a lovely place to stay! I had the best night's sleep as the bed was unbelievably comfortable and the bedroom was dark and quiet. The whole apartment is cosy and sweet, and Julie was lovely to correspond with. We definitely recommend this place!"
8902887,54040823,2015-11-15,655450,Tara,"This apartment was very comfy and cozy with lots of privacy and easy street parking. Julie and George had extra blankets, a space heater, tea and coffee for the cold rainy Seattle nights. Cute restaurants close by too!"
8902887,54663853,2015-11-22,8232822,Cady,Lovely homey experience!
8902887,55146214,2015-11-28,1518136,Melissa,"Julie and George communicated very clearly about how to access the apartment, where to park and answered all the questions I had before we arrived. The location was very central to where we were going and there were a lot of great stores and shops around. The apartment was everything we needed for a weekend. I would recommend Julie & George's space to anyone because the apartment was the perfect size and very comfortable. "
8902887,58184958,2016-01-01,34475960,Austin,Julie & George's place was fantastic! Really clean and had everything we needed for a great New Year's in Seattle. Close to the freeway and decent street parking right out front. The tenants upstairs were super nice and respectful. Also the bed was really comfortable. Would definitely stay again. 
7956337,56897997,2015-12-19,12762254,Marina,"Mehrit and Roco,
My stay at your place has been beyond my expectations. I feel blessed to have been your first guest. I loved the privacy, cute place you have set up here, full of love vibrations. The view and setting is amazing, only 3 minute walk for beautiful vieuw on Lake washington and much more. This place has real hosts, living from the heart and that's what touched me the most, and... Mehrit, i got so inspired by your stories of Ethiopia, you felt like a sister to me. All and only the best for you two. Marina"
7956337,57177013,2015-12-22,51371639,Sarka,"We really enjoyed our stay in this room and house. Mehrit is really nice host, she advised us what to see and even gave us a ride. Airbnb place including kitchen and bathroom is really nice and clean. We couldnt choose better place in Seattle. "
7956337,57841702,2015-12-29,24577442,Sean,"Mehrit is a very very sweet lady. She provided way more than what one would need. Great neighborhood, great host, great stay. 

heads up rules are strict for no friends over, you have to put them on your air b n b list , which can be very expensive. "
7873789,46243173,2015-09-08,35427163,Manrup,"We had a wonderful stay! Lisa and her husband were so prompt and accommodating to us. We were vey pleased with our stay, thank you so much! "
7873789,47299790,2015-09-17,14796039,Adam,"Lisa & Karl were outstanding hosts!  They began with clear, timely, friendly communication and were wonderfully accommodating.  When we arrived, they were so pleasant and welcoming and made us and our girls feel right at home.  We have two little girls and they embraced them and extended even their own personal living space to make our stay that much more comfortable.  Lisa and Karl have a Super friendly dog and our girls loved playing with her and taking her on walks!  The home is situated in such a beautiful family oriented area of North Seattle with great neighborhood walks and parks all outside the front door.  Safe, friendly, peaceful!  Inside, the home is so nicely lit naturally with plenty of windows and the layout felt wide open and super spacious.  And with a piano and wood stove, the space also felt very homelike.  Furnishings were ample and the beds were more than comfortable!  We completely enjoyed our stay with Lisa and Karl and highly recommend their home for a stop-over stay, transition, or extended stay!  Thank you…you made our return home to Seattle this year incredibly pleasant!"
7873789,48114940,2015-09-23,20213978,Mizuki,"Their house is very clean and has two bedrooms, and big living room. It so comfortable and quiet. They are so sweet, and very king. They payed attention for comfortable stay. "
7873789,48340472,2015-09-25,13202624,Goldy,"Lisa house was perfect for our quick stay. She was very easy to reach and her husband met us shortly after we arrived. The place is clean, comfortable and included amenities (e.g. coffee/tea).  I'd definitely recommend! "
7873789,48761135,2015-09-28,23047879,Peter,"What great hosts! I cannot express with words how overjoyed myself and my family were with our stay with Lisa and Karl. They made us feel warm, welcome and comfortable during our stay in Seattle. We would stay with them again in the future without hesitation! Looking for a great neighborhood with a great layout of living/sleeping/bathing accommodations? Look no further. The kicker is fantastic hosts that genuinely care about their guests! "
7873789,49663437,2015-10-05,30204818,Kit,Very warm and comfortable place to have stayed.The host couple is very nice guys ，we felt at home during the stay，highly recommended to others.
7873789,49869293,2015-10-06,45755952,Aaron,The hosts were very friendly and accommodating. The description of their suite was very accurate and it was neat and clean. The neighborhood was quiet and seemed to be in a safe location. We would recommend these airbnb hosts to anyone going through the Seattle area. 
7873789,50233371,2015-10-10,1353461,Nick,Lisa and Karl were very communicative in the lead-up to our arrival. They have a beautiful house in a beautiful neighbourhood! They even cooked us Banana bread. Twice! And it was delicious. Very kind and generous hosts.
7873789,50592299,2015-10-12,46044142,Vilde,"Lisa and Karl were really nice hosts! They showed us around in the apartment which was very clean and tidy. Me and my friends was staying over there one night to celebrate my birthday in Seattle and we are very glad we chose this place. It's in a really nice neighborhood and we felt very safe. Different kitchen equipment was available and we were also offered fruit, chocolate and coffee. 

Thank you for being so nice! It was perfect for my birthday get away :)  "
7873789,51400325,2015-10-19,6960367,Emily,Karl and Lisa were amazing hosts - went above and beyond in every way!  Their apartment is in a GREAT part of town - close to Ballard and bus line. This place was SPOTLESS clean and they had everything you could possibly want. I would definitely stay with them again next time through Seattle!
7873789,52186766,2015-10-26,47145091,Todd,"This was my first Airbnb experience and it was wonderful. We arrived a little earlier than planned and we were warmly greeted and shown the space. It was absolutely perfect for our group and had easy access to Ballard. The amenities were comfortable and the rooms were very clean. There were Seattle guidebooks set out, as well as other books if you wanted to spend some time inside reading. We all agreed that we would definitely return and stay here again."
7873789,52384900,2015-10-28,3570203,Jeff,We really enjoyed our stay here. Very clean comfortable place in a great neighborhood with lots of great bars and coffee shops nearby. Our hosts were very quick to respond to messages  before and during our stay. Would stay here again for sure!
7873789,53567202,2015-11-09,40993483,Omimah,That was my first try to book in airbnb and because of that clean nice home and the great hosts it's not going to be my last
7873789,54925365,2015-11-25,42491149,Yue,"Awesome experience:) Truly appreciate Lisa prepared everything and also important information warmly for (website hidden), house is comfortable, and with the yamaha piano must be an exciting moment for anyone who love music. Wish to visit again."
7873789,54979543,2015-11-27,2845554,Amy,Thanks for making us feel like family. :)
7873789,55560701,2015-12-02,2845554,Amy,"Lisa and Karl were great hosts. They welcomed and sent us off with freshly baked banana bread, which my family and I devoured! Treated us like family and very accommodating. Responded to communications quickly and place is very well kept and clean. Hope to see you guys again the next time we visit! Thanks!"
7873789,55736733,2015-12-05,8804351,Kelli,"Staying here was a 100% positive experience.  Everything was so well thought out, and the accommodations couldn't have been more perfect.  I didn't realize that we would have our own door to the outside...RIGHT to where our car was parked...perfect!  The hosts were so friendly and obviously do this not to make money, but because they love it.  They were so helpful, even when the other mom had some complications with a car situation and had to leave luggage to be picked up later.  The hosts offered dinner ideas and even gave us coupons.  But once all the chat was done, they left us alone to have privacy.  The suite itself was spotless and I just wished we could have stayed longer...next time for sure!!!  "
7873789,55929446,2015-12-07,2733142,John,"Lisa and her husband were wonderful hosts - so friendly and quick to respond to any questions before, during and after the visit.   the place is very cozy, impeccably clean, the beds comfortable and the neighbourhood very safe and quiet.   the kitchen truly is just a small kitchenette so no where to cook (that is not a complaint, just a point to note).   We would definitely stay again in the future."
7873789,56068766,2015-12-08,41853723,Mara,"My friends and I had a wonderful experience at Lisa's place! Her husband greeted us upon arrival and was very kind and welcoming, even though we arrived later than expected. They happened to be having people over for dinner and extended an invite to our group of 4, but we already had plans in the city. We had lots of privacy but felt that we could easily ask for assistance if anything came up. I highly recommend this location, we had a great time! "
7873789,56675714,2015-12-16,28812678,Yunjie,"Lisa and her husband are very nice person. They cooked bread for us when we arrived. And they provided maps, coupons for visitors. The house is nice and clean. Their puppy and cat are cute. 
One thing is we only found three not four.
All in all, it's a nice time!"
7873789,57045964,2015-12-21,46025672,Michelle,Lisa and Karl's home was in a wonderful area not far from many places to eat or drink famous Seattle coffee. The area was the perfect size and stocked with everything you'd expect from two of the warmest hosts I've ever had. I've never felt more at home! 
7873789,57509835,2015-12-27,2127907,William,Perfect accommodations. Quiet with attentive hosts. We would recommend!
7096107,37122989,2015-07-04,37278388,Manuel,"Perry was out of town during our visit, but was very friendly over the phone and quick to reply to any questions we had.  His backyard was very quiet and the tents were set up with an air mattress, blankets, and pillows.  We stayed 2 nights and found this location to be very convenient via drive or public transportation to downtown.  If you're into glamping, this is the place to stay!"
7096107,39349418,2015-07-22,2970216,Chad,"The camping in Perry's backyard is exactly as described, but the real benefit to his setup is Perry himself. We had originally planned to camp with Perry for four nights, but our plans changed unexpectedly after one night. Perry was incredibly gracious and immediately refunded us the three nights remaining on our reservation, no questions asked. I wish every host was this easy to work with! "
7096107,39852018,2015-07-26,20373329,Sarah,"Perry was a great host! He was flexible and welcomed us right in when we arrived earlier than expected. He provided a cooler with water, sparkling water, and beer, and later left a bottle of wine for us as well as a Keurig machine with lots of selections of coffee and hot chocolate for the morning. We were in Seattle for the Mariners game, and we arrived early enough in the morning to have a beer and a chat with Perry and his dad before we left for the 1:00 PM game. We were instantly comfortable with Perry and chatted easily with him about Seattle, and life in general. He gave us lots of good tips on places to eat and info about the area. His house was in a prime location for us, and he gave us great directions on how to get to Safeco Field which was fairly close by. Light rail is a short walk from his place and goes right to the stadium, and driving time was less than 10 minutes from his house to the field. The actual accommodations in Perry's backyard were rustic, with a smaller tent and combined outdoor shower and portable toilet. We didn't end up using those as Perry graciously offered us the bathroom in his house. The tent and mattress were a little small for us both, but it was manageable. We were late coming back to his place in the evening and we left fairly early in the morning, but coming and going was easy through the side gate. We enjoyed a glass of wine on the candlelit patio before bed. Overall it was a good inexpensive place to crash for the night, and we really appreciated the good location as well as Perry's great hospitality and thoughtfulness :) "
7096107,40182280,2015-07-28,39354696,Jordan,The tents were surprisingly cozy and the neighborhood was surprisingly quiet at night as well. It was great to be so close to public transportation and the have street parking as well! 
7096107,41153238,2015-08-04,38969647,Brian,Perry's oasis in the city was great. Perry was warm and welcoming to his space and city. I enjoyed my stay. The weather was great and the close proximity to light rail was huge for me. I would stay again in Sven or Ole's tent when I return to Seattle! Thanks
7096107,41299730,2015-08-05,40345695,Sam,"Camping was fun and Perry was great. Good time for sure. Also, I had to cancel early, which Perry was cool w/ and that was really nice. When I stayed, it was a little pricy for what it was, but it was a BUSY weekend in Seattle; supply and demand, amirite?"
7096107,41568148,2015-08-07,8493147,Brad,"Perry was awesome. Hooked me up with a great Mexican place for a late dinner, awesome tent, and one of the friendliest dogs ever. Would definitely stay here again. Thanks Perry!"
7096107,42081626,2015-08-10,3770406,Aj,"Perry made me feel like more like family than a guest. I had a great stay at Perry's glamping spot. The description of the site was spot on, couldn't have asked for anything else. The neighborhood was nice, parking was easy and right out front with a good amount of restaurants and bars within walking distance. I got to hang out and play with Walter as well, he was a great dog and glamping buddy. "
7096107,43003633,2015-08-16,41395525,Joseph,Perry was great. His place was chill. He provided awesome breakfast. The tent was ready before I arrived. The jacuzzi was nice after a long day. He even let me use his computer and loaned me a bike (though I imagine this was a bit unusual). We even did a crossfit class together. Perry and his Airbnb setup are legit. I highly recommend. 
7096107,44085449,2015-08-23,39299827,Chen,nice host，friendly dog，good location，low price。
6901218,37223599,2015-07-05,25242863,Denisse,Staying at Mark's place for our short trip was perfect! The location allowed us to get around seamlessly and his recommendations were well appreciated! Thanks again Mark! 
6901218,37890051,2015-07-11,36368625,Thomas,Everything was great and Mark stayed in touch and responded quickly. We enjoyed our stay and checking out the neighborhood. 
6901218,38025419,2015-07-12,12673433,Michael,"Mark was easy to reach and quick to respond, and he made the entire experience effortless. The property was described accurately and the photos gave us a good sense of the place -- it was just what we wanted. We had a great time!"
6901218,39789182,2015-07-26,34530429,Greg,"Great location, we had a very comfortable stay and economical stay given the hotel rates when we were booking.  

Host made it very easy and provided everything we needed.  Very responsive even before arrival to make sure we were up to speed as this was our first time using Air BNB.  "
6901218,40765609,2015-08-02,2287841,Shiva,"Mark checked with us in the morning to make sure we have arrived OK and was really communicative with any needs we had. Neighborhood was great, and apartment was as pictured. Nothing really to complain, overall a great experience"
6901218,45944353,2015-09-07,169365,Peter,"Mark's place was as he described it, and suited us very well for our weekend at Bumbershoot.  It was a quick 5-10 minute walk to the Seattle Centre.  It's an older walkable neighbourhood so lots of restaurant choices if you want - we mostly cooked in Mark's suite - full fridge and stove to use.  "
6901218,46804816,2015-09-13,43222157,Katherine,"A reasonable price for such a good location. We could walk to the space needle, kerry park, and even pike place market (about 40 mins). It was also nice to have the place to ourselves. The apartment is basic but clean and compared to a hotel in the same area, the price was good."
6901218,47773845,2015-09-21,21224024,Luba,"We had a great stay in Seattle. Mark was so nice to let us check out a little later so we didn't have to deal with headache of leaving our bags somewhere while still in town, our airplane was leaving later in the afternoon. Loved the city and the fact that we stayed so close to everything made it easier to get around and enjoy it. Thank you Mark!"
4417792,22549787,2014-11-09,5163876,Dean,"Amy and Darik were wonderful hosts.  Welcoming yet unobtrusive.  We were welcomed with a basket of treats and information for the area, shown the basics of the accommodations after being met according to our arrival time and then left on our own.  Everything we needed was there so we had no need to contact the host further however leading up to the stay I was always answered promptly and politely.  This particular unit does not have a dining area to accommodate 6 people but we managed to make it work.  The number of great places to eat in the area really meant we were only having breakfast or snacks in the unit.  Might have been different if we had not completely lucked out with great weather for the second week of November."
4417792,22959518,2014-11-18,4881797,May,Darik's team was very responsive and we enjoyed our stay. The apartment was just as described and well furnished. It was in a very convenient location and we would consider staying here again on our next visit to Seattle!
4417792,23638312,2014-12-07,2731344,Mathew,"Our stay at this beautiful Brownstone was great! Our flight was over an hour late getting in to Seattle, and didn't arrive until 8pm, but they still had someone waiting to let us in, give us a tour (all with a smile on their face!).

The apartment itself was great for what we needed. The rooms were good size, the bathroom was clean, and although we didn't use the kitchen, it was updated and had everything you might need.

This was our first time in Seattle, so we wanted to stay someplace where we could easily access everything. We didn't have a rental car, but easily walked to the Space Needle (10 min), Pike Place Market (10 min), and just about every Seattle landmark. When we did have to go further out of the way, it was easy to catch an Uber, Lyft or use Car2Go.

Our only complaint would be the noise. Because this unit is close to ground level, and the central location invites a lot of foot traffic (and regular auto traffic), it could be a bit noisy. Not enough to be a complete nuisance, but there nonetheless. 

We would definitely stay again!
"
4417792,24148380,2014-12-21,10383784,Erika,"The brownstone was great! A beautiful unit - exactly as pictured. It was super well stocked with dishes, linens, and toiletries, and everything in the unit was easy to find and well labelled. We only stayed two nights, but could easily have 'lived' there for weeks. Also - great location - walking distance to everything we wanted. And right beside Top Pot Donuts. ;)
Our hosts were lovely - friendly, accommodating, accessible, and professional. The instructions they provided for check-in and check-out were nice and clear. We would absolutely stay there again.   "
4417792,25970922,2015-01-31,24611047,Heather,"We stayed for 3 nights here, they were very welcoming in giving us an early check in and had someone waiting for us to show us the place. It was just as expected! My big thing in staying anywhere is how comfy the beds are and trust me when I say they were amazing! It has everything you need, the location is great. Do not worry about the noise, it dies down around 11 or 1130pm. All in all we loved every minute!"
