listing_id,id,date,reviewer_id,reviewer_name,comments
1493197,7612455,2013-09-26,5477016,Matthew,"The Space Needle Oasis was fantastic! My wife and I thoroughly enjoyed staying at Darik's place in Belltown, as it was perfectly situated between the Seattle Center, the waterfront and downtown Seattle with Pike Place, etc. You can walk to everything and the views from the apartment patio are amazing. You can fall asleep at night with the Space Needle glowing right outside your window. 
Sarah (part of Darik's team) was superb and made the check-in process a breeze. We had easy access to help but really didn't need it as everything was so simple and easy to understand.
The apartment itself is very nice, quiet, and modern with all of the amenities you could want. They even provide you with some nice little treats on the welcome tray! 
In short, I highly recommend Darik (as well as his staff!) and the Space Needle Oasis. It is well worth the money and will set you up for a perfect stay in the Emerald City. "
1493197,7815283,2013-10-04,3731551,Jesse,"Great place, wonderful location, easy check-in"
1493197,8613704,2013-11-08,7826822,Daniel,"Great location, impecably clean, nice ambient deco, rooftop was better than the needle itself, overall i would stay again if i visited Seattle!

"
1493197,9126746,2013-12-09,3947620,Tam,Wonderful stay and location! It was easy to coordinate with Darik and checking in and out was extremely efficient. We would definitely consider staying here again in the future as it was central to all restaurants and main attractions. The space was clean and and well kept.
1493197,10679954,2014-03-03,11237749,Kirk,"This was my first airbnb and man were we impressed. Darik was very helpful and responsive prior to our arrival and the space was incredible. The location was great and the decorating was very ""homey."" Thanks for such a great experience."
1493197,11080947,2014-03-19,2295747,Warny,"This place is so modern and automated that you dont even get to meet your host. Your beeped in and the key is a code and even upon departure you just shut the door after you. If you dont mind this somewhat impersonal rental, youre can look forward to a really nice place, with all thinkable amenities to give you a pleasant stay. Some people say noise and temperature are downside factors to this apartment, I had none of those problems. I enjoyed it very much. Especially the roof terrace!"
1493197,11124880,2014-03-22,12329865,Lynda And Scott,"Great place to stay! Very responsive, helpful and an awesome little neighborhood! Be sure to check out the local restaurants all within walking distance. "
1493197,16447769,2014-07-28,10076486,Telse,"The apartment is perfect - in every way. And the place on the roof  became a marvelous end of day ritual for us. We will come again, that is for sure!"
1493197,16709103,2014-08-01,5801274,Lindsay,"Darik left us an awesome gift basket with coffee, tea, and even popcorn!  It was definitely a warm welcoming.  There was lots of information provided about different places to go and see, which was very helpful.  The outside porch was amazing - breakfast outside every morning.  I can't speak highly enough about the roof top area.  The sights were amazing.  Definitely must hang out long enough to catch a sunset.  I would recommend this place to anyone and everyone.  It's also in a perfect location for museums and Pike Place Market."
1493197,17815163,2014-08-18,1870391,Alice,"Very new and well equipped. Location is very central with a lot of good food and pike place nearby but sorta far from the distinctive neighborhoods of Seattle with a car. The space is smaller than pictures but very comfortable for 4 people. Rooftop deck is amazing like everyone says. Overall a good experience and less costly than a hotel in the same area. Hosts are very responsive and helpful, even if it's run by a somewhat impersonal company."
1493197,20210340,2014-09-25,11164877,Steve,This place far exceeded my expectations.  The view from the rooftop is amazing and the view from your private balcony is fantastic too.  The apartment was clean had every amenity we could possibly need.  The location is close to a busy bus stop which made getting around by public transportation a breeze.
1493197,22678417,2014-11-11,23258106,Scott,"The listing was accurate and the unit was as pictured.  It's in a great neighbourhood with downtown/Pioneer Square/the stadium district walking distance away.  Check our 5 Points Cafe for breakfast/lunch and Street Bean for espresso to get a slightly rough-around-the-edges but delicious taste of Belltown.

Being in an apartment like this really felt like we were staying in Seattle as locals, rather than in a hotel.  Wi-fi worked great and we were able to plan our trip from the apartment without using expensive phone data roaming.

We couldn't have asked for anything more from Darik and the vacation rentals team.  The system is automated so we buzzed in as instructed and obtained our keys that way.  There were no issues so we never actually had any reason to meet them face-to-face.

The balcony is great, and the rooftop patio was a nice touch.  I didn't get a chance to see the gym, but maybe next time - yes, I'd definitely use Darik and the vacation rentals company again."
1493197,36384036,2015-06-28,6986751,Natasha,"Great host! The patio was the best part, large, with a wonderful view of the Space Needle. We had two cars, one parked in the garage, and the other on the street. I was worried about parking but it was easy to find and the meters have an app you can pay from with your smartphone. Super simple and we didn't have to worry about heading back to the car. 

The only downside were the room sizes, both are fairly small. 

I would recommend this place for a weekend trip!"
1493197,40880596,2015-08-03,23035575,Elsa,"We loved staying at the Oasis. The neighborhood was perfect for exploring Seattle.
The check-in was smooth, however we were supposed to get 2 sets of keys but only got one. Luckily it turned out not to be a big issue during our 9 days.
I will definitely recommend the Oasis!"
1493197,42390634,2015-08-13,34020575,Tc,"This house is perfect for families spend some time at Seattle! We really have some great time in Seattle. The decorations of this apartment is exactly what you can see online! The checkin process are very fluent. Dairk and his team also have a vocation guide (includes food, place you could go, etc) for travelers. Travel with families."
1493197,45236117,2015-09-01,10673901,Suzanne,Easy to check in. Apartment was very clean and rooftop was nice place to hang out. 
1493197,46877105,2015-09-14,12709676,Stephanie,The space was beautiful and the pictures are an accurate description of the space. The roof was also amazing and we went up there every night! The location was great and we would definitely stay here again when we visit Seattle. 
1493197,49089815,2015-10-01,7181977,Amy,The host canceled this reservation 302 days before arrival. This is an automated posting.
1493197,49592203,2015-10-05,17933027,Warren,"The apartment was great! The private deck was amazing as was the roof top deck - incredible views of down town Seattle. The location was excellent as well. Easy walk to Pike Place Market, SAM, and Serious Pie (the best pizza!).

Would definitely stay here again.
"
1493197,54573721,2015-11-22,993640,Carlos,Very nice apartment in a very nice location . We enjoyed the view from the roof terrace even thought it was cold . 
1493197,56010945,2015-12-07,3481329,Joe,"The host was very responsive as we needed a place at short notice after our original property fell through.  
Location was great as it's very central along with being close to the space needle and the mono rail.
Unfortunately however the property wasn't as clean as we would have liked and the heating didn't seem to work, which was a shame as it was a particularly cold and wet weekend.  When we raised these issues to the owners they were very quick to try to get it resolved but given we were only there 3 nights we didn't take them up on the offer.
Had the property been cleaner and the heating working then we'd have given 5 stars.
"
317248,1535141,2012-06-22,2341262,Kaci,"Great host - very quick to reply when I had any questions. Also a very nice house! The decor is great, it's comfortable and has all everything you could ask for!"
317248,1796792,2012-07-25,288553,Michael,"Joe was the perfect host...The property discription does not do it justice, it was very clean, comfortable, and the locaton was fantastic within walking distance of public transportation great dining and shops.
Communicating with Joe was seamless and responses were very quick.

This was are first time in the Seattle area and the property had the comforts of being at home without the stuffiness of the chain hotels. This made our stay very enjoyable and plans for a return trip in the future, with every hope of having Joe for our host again.

The Doran Family"
317248,2189967,2012-09-04,2282498,Mathew,"This place was perfect for our group - Way better than staying in a hotel.  Located right in the middle of a great neighbourhood, we were able to walk everywhere we needed to go, and if we were feeling lazy it was a $10 cab ride from the heart of downtown.  Will definitely book again if I visit Seattle in the future."
317248,2392931,2012-09-24,3281258,Anne,"My friends and I were coming to Seattle for a wedding and really loved this place - it was clean, modern, and had plenty of room for us all! The house is a great base to explore Seattle and the local neighborhood is really nice - we especially appreciated the recommendations for coffee shops!

Joe was a great host and answered all our questions promptly, including recommendations for the ever essential dry cleaners and pizza places. When one of our group arrived early on a red eye from Hong Kong, he let us check in early. He even mailed back a phone charger that one of us left behind! 

The house was great and all of us were commenting on the beautiful design and comfort of the rooms. A great place to stay!"
317248,5224174,2013-06-19,469839,Shirley,"Outstanding experience at this beautifully decorated and furnished home located within walking distance of cafes, pubs, stores, library, and grocery stores.  All the comforts of home for our multi-generational family from Los Angeles to attend our granddaughter's college graduation.  We had the ability to cook wonderful meals and be together as a group.  Our stay was for five days and we all went home wanting to stay longer.  
Shirley & Terry "
317248,7113153,2013-09-07,6836196,Kerry,"My friends and I had a wonderful stay at Joe's condo while we were in town for a wedding. Everything about the place exceeded our expectations. The place was exactly as advertised, and Joe was very responsive and professional. The location was perfect for us, near many restaurants in a trendy part of the city, but also within walking distance to the downtown area and all the attractions. We would definitely stay here again."
317248,9854017,2014-01-14,3401018,Steve,Cool place! We enjoyed staying there and the process was super easy. 
317248,10673554,2014-03-03,5016457,Tara,This is a beautifully well-maintained home in an excellent location in Capitol Hill. We easily walked to Volunteer Park and the great Volunteer Park Cafe and down the hill to Cap Hill staples like Eliot Bay Books. Coffee shops around every corner. A quiet retreat in the city managed by a very attentive host. This place tops our AirBnB experiences.
317248,46769329,2015-09-13,42069537,Maximilian,"While we didn't have the opportunity to meet the hosts in person, they made it very convenient for us to self check-in/out of their beautifully furnished modern home that's conveniently located within Capitol Hill.

At 3 bedrooms and 2 bathrooms, the house provided our party of 5 with the perfect base of operations for our 3 day stint in the Emerald City. The space is highly recommended.

Pros: Prime location, *multiple bathrooms*, clean, parking spot, comfortable bed, accommodating host let us check-in three hours earlier than we were supposed to. (This last bit was especially gratifying considering we landed so early!)

Overall: 5/5
"
317248,51064088,2015-10-17,24932393,Brian,"Joe's Vintage Capital Hill home is fantastic. We would recommend it to anyone who wants to stay close to downtown, but in a comfortable house and in a great neighborhood. Thanks for a wonderful stay!"
317248,52721431,2015-11-01,2589375,Austin,"The listing is almost better than was depicted. The space was perfect for 6 of us to stay. The kitchen was fully equipped to enable us to cook dinner and the common area was a great size.  Everything was very clean, well stocked, and comfortable. The location was also perfect to enable us to explore Seattle - close to downtown, bars, and everything else. Would absolutely stay here again!"
261912,1199873,2012-04-30,464662,Ruby,"I needed a place for my family to stay for a long weekend during our wedding.  Natalie's place was perfect for this - it was close to our venue & also close to our house.  Natalie was perfectly accommodating & perfectly hospitable.  She made everything so much easier & I never felt like I had to worry or feel the least bit stressed knowing that my family would be well taken care of in Natalie's beautiful home.  
The house is gorgeous & in a wonderful location close to Greenlake.  I highly recommend staying here if you're in Seattle.  Natalie was a dream to work with."
261912,1249738,2012-05-08,2230324,Aaron,"Absolutely beautiful, very clean and well decorated, and amazing neighborhood! Our hosts were very friendly and welcoming, and responded within minutes to a minor problem we had with the bathtub plumbing. Would /definitely/ stay here again :-)"
261912,1279855,2012-05-14,2265346,Lily,"We had a wonderful stay, the house is perfectly furnished and very clean. The location couldn't be better. Everything was awesome! 
Thank you!!! "
261912,1341074,2012-05-24,688142,Hannah,"We loved this charming house in a great neighborhood. The master bedroom was very comfortable and quiet with dark curtains, plenty of storage and a comfy bed, and the whole house was clean and modern, including a spotless renovated bathroom. Yet it still had the old touches of a classic, classy house that we love. Parking was not a problem - there was always a spot directly in front of the house. Natalie was communicative and helpful, and put us at ease, even though we had along a toddler. We would definitely stay here again. Handy hint: Zeeks has great pizza and they delivered to us in under 30 minutes, after ordering online."
261912,1381805,2012-05-30,1337962,Mike,The place was pleasant and clean.   We enjoyed the neighborhood a lot.  
261912,1589555,2012-06-29,1891520,Matt,"Natalie's place was in a great neighborhood, SOO close to Green Lake, and it was spotless with all the necessary amenities.  Natalie responded promptly to all our needs.  We'd definitely stay here again."
261912,1611434,2012-07-02,125991,Tobie,"my family and i could not have been happier with our stay at this lovely house at green lake! we were coming off an Alaskan cruise and craving a comfortable space and some home cooked meals. the close proximity to PCC, the natural foods store, was a huge bonus for us! we felt right at home. we enjoyed walks around the lake and cozying up in the couches as well as grilling up some fantastic local meals. it will certainly be the first place we will try for any future trips to Seattle!"
261912,1663793,2012-07-09,2347650,Janice,"We had a great time in the Greenlake area and very much enjoyed the Storybook Tudor house.  Our son and his family were just a few blocks away so we were able to spend most of our time with them.  We went to the Market and had lunch at Lowells, just a 20 minute bus ride away.  We went to the zoo which is not all that far from the house where we stayed.  We especailly enjoyed having the lake so close!  It was a treat to walk early in the morning and just people watch.  We would recommend this house for anyone going to Seattle and wanting to enjoy a bit of the city in a semi-residental area.   "
261912,1834208,2012-07-30,1778741,Janna,"We had a fantastic three weeks staying in this perfectly-located apartment!    It was spotless when we arrived and we had everything we needed to be comfortable.  The proximity to Green Lake, restaurants, grocery stores and  major arterials for getting around Seattle is great!  Natalie and Beau were helpful and immediately responded to any questions we had.  We will definitely stay again if possible and highly recommend this darling apartment to anyone visiting Seattle.  "
261912,1866689,2012-08-02,1885198,Svitlana,"Great, Super Location! We would like to stay here next time again!"
261912,1946445,2012-08-11,2150400,Marc,"What a great place for a family of five.  We found it clean, spacious, comfortable and convenient.  We loved being so close to Green Lake and took advantage of the prime location every day.  The home had all the amenities you could ask for including appliances, books, washer/dryer and many more.  Natalie and Beau were great hosts who were accessible by phone or email any time we had a question.  We will most definitely return on our next trip to Seattle.  "
261912,2008458,2012-08-17,1299612,Garren & Deirdre,"We had a lovely time at Natalie's home.  It was close to the walking traili at the lake, close to shops and dining and very convenient to get downtown via the bus, which we did many times.  

The home was very clean and well appointed upon our arrival and Natalie maid the process extremely easy and fluid.  This is a great spot for anyone coming to Seattle that wants a home in a nice neighborhood.  "
261912,2037096,2012-08-20,2300965,Sarah,"We loved staying at Natalie's place. It was a great location, very close to everything. We were able to walk and get groceries, and walk around green lake which was gorgeous. It was only a 5 minute drive to the zoo which was great for the kids. The place was cute and clean. Lots of space for us and two kids. 
Thanks Natalie for the great place to stay!

"
261912,2154147,2012-08-31,1241034,Pamela,"The setting for Storybook Tudor couldn't be better with the house just around the corner from the lake.  During our stay, the weather was perfect and we were able to walk around the lake one day - no problem.
It should be noted that the house is on a busy street (though at night with the bedrooms at the back I hardly noticed) so if someone were sensitive to street traffic they need to be aware of this fact.
The kitchen was fully equipped and we found everything we needed.
We also found a wonderful alternative market just up the street.
The master bed was comfy and the bathroom nicely renovated. 
Check-in was easy and when I had a question late at night, Natalie got back to me right away.  Thanks for hosting us.  
"
261912,2443282,2012-09-29,2819916,Kenneth,"Storybook Tudor was a perfect spot for us.  We had wonderful weather the three weeks we were there.  Loved being able to walk around the lake and watching the activity on the lake.  The house was perfect for the two of us.  Washer and dryer were a great help.  We certainly would consider staying at Natalie and Beau's house on our next visit to Washington to visit our son.  The restaurants, grocery store and coffee shops were within walking distance.  
"
261912,3208375,2013-01-01,4175492,Daniel,"Natalie's home is the perfect place to fully experience the essence of the best Seattle has to offer with its proximity to Greenlake, coffee shops, restaurants, PCC (Natural food stores), and it is a great walking neighborhood. The house is fully equiped and felt like our Seattle ""home"". I looked at other choices in this Seattle area and nothing beats this location and accommendations!"
261912,5577472,2013-07-07,5379251,Kai,"This is a wonderful place in a fantastic location just steps from Green Lake. I absolutely loved the location, layout and decoration. For groups of six that need a little privacy it may be a little tight but for families of six with children or two couples with two children it would be absolutely perfect. I did not meet Natalie myself as she was out of the country but all of my interactions with her where very positive, and the check-in and check-out were a breeze. "
261912,5860909,2013-07-20,5591795,Kat,"We stayed at the Storybook Tudor for two weeks with our three children.  We absolutely loved the location.  The home feels like it is practically across the street from Green Lake.  We spent many afternoons at the wading pool in the park (really couldn't be closer), and enjoyed the pizza, ice cream, and chocolate shops greatly.

The home itself was charming, clean, and comfortable, and the check-in process was easy.  We had no need to contact Natalie during our stay, as the notes she left answered all our questions.  All in all, this was a great home base for us, and we'd love to come back someday.  It is worth mentioning that it is an older home with an apartment below, so it was important to keep the kids quiet, especially their little feet!  While I would recommend this home to any family, it might be easiest for families with older children.   "
261912,17757038,2014-08-17,2120070,Dominika,Natalie was always helpful and responding messages quickly. House was very clean. Great spot. Very well located. 
261912,18675507,2014-08-30,11430503,Meriah,"Great location, comfortable house. Air con was a plus on hot days. Backyard seating area while not private was very lovely. May not be as suited for families with small kids, as noise travels between the upstairs and downstairs which is occupied. "
261912,18899319,2014-09-02,19574780,Becca,"Natalie is a wonderful host with a lovely home right near Green Lake. The house was clean, spacious, exactly as described... and Natalie was professional, responsive, and helpful. We could not have had a better experience!"
261912,19891272,2014-09-20,18842364,Debbie,"I had a great stay! Centrally located in a wonderful neighborhood. Nice restaurants and grocers and shops. The heart of Green Lake is the 3 mile lake, the hub of a lovely Seattle neighborhood. The house is on a slightly busy street but it is quiet at night."
261912,24083061,2014-12-19,4152815,Larry,"We really enjoyed our stay. Fantastic location near the lake. Lots of restaurants and coffee shops nearby. Organic market just down the street. The home is cozy and comfortable, with great entertainment options too. "
261912,24400863,2014-12-28,1579024,Stephanie,"Natalie was great from the start!  Very prompt at responding to emails with questions.  We found the house to be just like the pictures.  It was perfect.  Nothing out of place and very clean.  I had a few questions during our trip, nothing urgent, and I heard back from Natalie even though she was on vacation too.  I was sad the bunnies weren't there but they must have been on vacation too.  "
261912,32561310,2015-05-19,31737757,Lara,"The home was very cozy and inviting and fit the description and the reviews completely. It was in a great location, easy to find and close to Green Lake.
"
261912,42442121,2015-08-13,18082819,Jennie,"My two adult sons and I found Storybook Tudor to be a lovely vacation home in an ideal location with all the amenities needed. Scenic walking areas and activities are just steps away at Green Lake.  Good restaurants and local organic market also are within a short walk.  We loved the easy access to bus service into downtown Seattle, Freemont and other sights we visited. Host Natalie was out of town but easy to contact on the few occasions we had questions.  We had an ideal Seattle vacation experience while enjoying the comforts of home."
261912,43123686,2015-08-17,11030949,Bob,The house was nice.  The AC instructions were difficult and it was a hot night the first night but they responded with directions when asked.  The neighborhood is amazing!
261912,57778263,2015-12-29,3717272,Paul,This place was perfect for gathering with family at Christmas. Everything was as expected.
1416763,6315170,2013-08-07,924362,Miranda,"The location is great- right down the street from Seward Park. Darren is friendly, very committed to making your stay wonderful. Any little issues that came up- he took care of them right away. I think he is the process of posting pictures of the downstairs that you are renting.  I would definitely stay here again. "
1416763,6930250,2013-08-30,523790,Alex,The reservation was canceled the day before arrival. This is an automated posting.
1416763,15474556,2014-07-09,17575991,Steven,"We had a wonderful stay in Darren's apartment which is attached to the main house where he lives. It's completely private, but he is as accessible as you need him to be. And a more gracious and accommodating host you won't find! We were delighted when we arrived and walked in and found everything to be spotless, attractive and very comfortable. The neighborhood is quiet, the view of the lake and Mercer Island spectacular, and beautiful Seward Park just 3 blocks away, with hiking trails throughout. Quiet, peaceful, yet close enough to bustling Seattle --a retreat we will certainly return to again. "
1416763,16204061,2014-07-23,842807,Randolph,"Host made me feel welcome and was very accommodating. He even went out of his way to provide an additional air bed and blankets. 

Overall very pleased by the experience. Thank you. "
