listing_id,id,date,reviewer_id,reviewer_name,comments
1606171,12705674,2014-05-08,15049413,Yuta,"Thank you for my staying!
Great room！
This is really clean and comfortable.
"
1606171,12800787,2014-05-11,5414124,Jerome,"Nice comfortable room with all the amenities.
Full kitchen, Full size Fridge and very quiet location.
The best part was it is a mere 50 ft. away from the 
public bus/rail link.  Easy to get downtown or airport 
without the hassle of traffic.
Daisy was a  wonderful hostess, giving me all the tips
and space I needed.  Highly recommended"
1606171,13004314,2014-05-17,12011861,Jamie,"Daisy was great! the location was perfect, super close to the Link Trains downtown, I was able to use them everyday I went downtown. Plus, really close to the grocery and walking distance from the lake. Daisy was a great host, willing to help and answer all of my questions. "
1606171,13112235,2014-05-19,12939180,Ruben,"Daisy's apt was perfect. Exactly as described, with detailed note cards and instructions on everything. Room and bathroom were very clean and bed was very comfortable. Daisy was also accommadating and flexible with our late arrival. Would definitely stay here again."
1606171,13172223,2014-05-20,13869607,Anna,"Daisy was a great host, really friendly and helpful. Her place was so clean and tidy and very homely. The neighborhood in seattle is nice and safe."
1606171,13288029,2014-05-24,1552159,Andrew,"Daisy is a wonderful host. Her place is convenient, comfortable and exactly as shown. Definitely recommend it if you're visiting Seattle. "
1606171,13420405,2014-05-27,7595807,Katrina,"Daisy was not personally able to greet us the first night (we had a very late flight coming into Seattle), but she was very good at communicating via email/texts beforehand and so we were able to let ourselves in without a hitch. The room and bathroom was kept clean/neat. She also left us with thoughtful directions written in little notes posted throughout the house to help us get acquainted with the place and the neighborhood. We easily walked to Seward Park/Lake Washington from her place and were just a 20~ min drive away downtown. I recommend Daisy as a host. Thanks again! "
1606171,13575123,2014-05-31,6727813,Cathy,Daisy is a delightful well organized host.   The space was comfortable with thoughtful amenities that made me appreciate her attention to detail.  I enjoyed the neighborhood and found it perfect for public transportation use as well as the fun little neighborhood whole food store.
1606171,13936996,2014-06-08,14987192,Bo,Very good place! I like it.
1606171,16113095,2014-07-22,2946496,M Cooke,"I thoroughly enjoyed staying at Daisy's listing. My room was exactly what I expected and needed.  Comfortable bed, bathroom close, secure wifi and a good coffee shop around the corner.  I had very busy days so I was not at the location much but it was a joy to come back to.  The area is pleasant and right up the hill from an amazing park Seward Park. I did not use the kitchen as I ate out with my son in Seattle. The coded secure entrance was easy and I did not have to carry a key which was nice. I ran into Daisy the last night and we had a brief pleasant chat. It was helpful that she was easy going with my arrival time. I thought it was helpful that she had a booklet regarding house rules and local shops and amenities. I would definitely stay there again!"
1606171,16281119,2014-07-24,13970494,Gail,"This was a very affordable and comfortable stay.  Daisy is very helpful and I was grateful for the vitamin for smoothies!   Neighborhood is nice - natural foods/health food store is a one minute walk away and a pleasant 20 minute walk to Seward Park and Lake Washington.
"
1606171,16427355,2014-07-27,17934336,Stephanie,"Daisy was warm and welcoming from the very beginning. We only saw her during the start and end of our stay, which was fine with us. The room was tidy and a good size. We appreciated its decor and homey feel. We also appreciated the small notes that Daisy left around her place to help us navigate our way around her place. Parking was easy and never an issue. Her door was number coded so we didn't need a key, which was convenient. Her neighborhood felt safe. Also, there is a lake super nearby if you want to get a run/ workout in. Overall, we'd strongly recommend staying at Daisy's. "
1606171,16695625,2014-07-31,15400620,Amy,"Daisy is so nice, and her home is cozy and a good place."
1606171,17174273,2014-08-08,10182204,An-Chu,"Daisy is a great host,she prepared almost everything you need at the room,the only thing you might need to bring with you is the hair dryer. During the summer the room will be a little hot at night~ Otherwise everything was perfect!"
1606171,17374987,2014-08-11,18228473,Chase,"Daisy was a very nice and respectful host during our stay, I have zero complaints or negative things to say about her! 10/10. The room looks as the pictures show, which was very fitting and comfy for a weekend stay especially with a memory foam bed like she had. The location of her apartment to the downtown area of Seattle made it conveniently easy for us to get around and avoid a lot of the freeway traffic (took side roads into downtown). This allowed us to have more flexibility in our schedule and time  exploring and less sitting in the car.  The neighborhood itself didn't seem ""approachable"" but if you drive around the surrounding area you get the sense that is how it setup and in the end we found no problems with a false sense of security.  I am glad we chose to stay with Daisy and would suggest to others that you do the same if you are looking for an affordable accommodations outside of the city yet within reason. 

Thanks for letting us stay at your place Daisy  "
1606171,17650713,2014-08-15,1781102,Lauren,"The room was pleasant and the photos were accurate. It's clear Daisy puts in a lot of effort to make the space comfortable for her guests. She provides entry to the apartment via keypad instead of a key, which made it really convenient for me, especially as we had different schedules and it would have been difficult to meet to receive and return keys. I only met her for brief moment in the midst of my visit, but she was very sweet and went out of her way to give me privacy."
1606171,17865720,2014-08-18,10086625,Jed,"My father stayed here but I got to visit with Daisy for some time on the first day. 
Daisy is extremely friendly and very knowledgable about her neighborhood and of Seattle in general. There will be no lack of ideas from her if you're looking for things to do. Her place is in a great spot. She's blocks from Lake Washington and blocks from one of the better up-and-coming neighborhoods, Columbia City. There's movies, music, food, etc. plenty to do. 
Daisy's place is nice and clean and my father had zero complaints. He's never heard of airbnb before and with this one stay, he's hooked. He loved everything about the stay. "
1606171,17989293,2014-08-19,15510558,Andrius,The communication with the host-Daisy was very swift. The room and house are very clean. I would say 10+ to anyone wishing to stay. 
1606171,18029683,2014-08-20,19579579,Raina,Daisy was so sweet and had helpful recommendations for our trip. We absolutely loved her home. It's so well organized and cozy. I'm so glad she was our first airbnb host!
1606171,18139085,2014-08-22,19579579,Raina,After traveling all day it was so nice to come to a cute and well organized home that provided a very helpful brochure on the bed directing me to tasty eateries and directions. The room was even cuter in person! I absolutely loved Daisy's helpful notes. Seaward Park is such a lovely area. 
1606171,18339880,2014-08-25,14614010,Kendra,"Daisy was very nice and welcoming.  I loved the fact she left little notes explaining how to use things or where things are, so you don't have to bother her every five minutes with questions.  I also loved how she installed a Keyless lock on the door.  "
1606171,18590585,2014-08-28,18363846,Tai,"This Daisy place is very good, perfect for 1-2 people. Daisy is very busy, it makes me feel that I have rent the whole apartment."
1606171,18908112,2014-09-02,20021471,Sydney,"This place is great!  Daisy is wonderful!  We were in town for a convention in downtown Seattle, and were mainly only back at the apartment to sleep. (It is a $15 uber/lyft to downtown).  We only saw Daisy once in 4 days, but she is really sweet and accommodating.  The neighborhood is very quiet, and seemed mostly Jewish.  It felt nice coming back to the neighborhood after such busy days downtown.  

Highly recommended, phenomenal deal!!"
1606171,18953412,2014-09-03,13753079,Jonathan,"Daisy was a very detailed host with instructions left in the room and notes everywhere.  That was important because with both of our schedules being busy, I only spoke with her on the phone and communicated by text.  Very comfortable bed and a nice, safe location.  I would happily stay there again and hopefully meet Daisy in person next time.  Highly recommend!"
1606171,19450511,2014-09-12,19258205,Courtney,"Daisy's home was perfect for my needs. I needed last minute room to stay in and luckily hers was available. Daisy was extremely prompt in her responses and her instructions very clear. I did not get to explore the neighborhood, however, my Lyft driver said it was a safe place to stay and a good part of town. It is about a $20 Lyft ride to downtown (I didn't get to use public transport from her house). The room itself is smallish, but cozy, clean, and very comfortable. Daisy was super friendly and helpful the next day when my other accommodations fell through, offering me a place to stay again if needed. I would definitely stay here again and highly recommend it. "
1606171,19578492,2014-09-14,21188825,Tom,"Tom: I would like to thank Daisy in person, and will the next time we stay here, her home is very nice, quiet, comfortable, and inviting.  The best compliment I can give is that we want to come back, and have recommend Daisy's place to our friends.
Yukie: I liked your sense of room decoration a looot! Thank you :).
Situation: We arrived just after midnight, after the entire neighborhood had gone to sleep, and left early again the next day in order to get to out next destination on time.  We are very glad that Daisy has the keypad for guests so that we did not have to disturb anyone when we came and when we left."
1606171,19618006,2014-09-15,20118702,Nels,Daisy was warm and inviting. Notes were posted throughout the area to help finds things etc..
1606171,19704886,2014-09-16,12367586,Elisabeth,"I booked my mom at Daisy's. The room was neat and had everything she needed, and the apartment and neighborhood are safe. The bathroom is shared. Daisy is friendly, easy-going, well-organized, and makes tea and coffee available to guests in the morning. Within walking distance of Lake Washington and Seward Park, at $55 this place is a great deal. 
"
1606171,19879074,2014-09-20,7861469,Bridget,The room was very tidy. Daisy had little useful notes around the room and bathroom for our information.  We only stayed for one night but everything was great. Thanks!
1606171,20055292,2014-09-22,1845921,Daniel,"I didn't had the chance to meet Daisy in person, I arrived late at night and left early in the morning, but the communication with her was always great, she replied to all of my messages and was always willing to help. 
The room is very nice, everything is well organized, and clean. The bed is very comfortable, and the neighborhood is very quiet. "
1606171,20419320,2014-09-29,13239796,LaKiesha,"Daisy was a wonderful, welcoming host, and I thoroughly enjoyed my stay at her apartment in Seward Park. The room was exactly as described and pictured in her listing. I loved all the little notes around the room and her apartment. Daisy's place had great access to public transportation (right on one bus line and about a 10-minute trip by bus to two light rail stations). There was a wonderful natural foods grocery store and a few restaurants just a couple of blocks away. I'd highly recommend Daisy's cozy, quiet room to anyone visiting Seattle. "
1606171,20553793,2014-10-01,7608910,Jessica,"we only had 1 night in Seattle but our stay was wonderful.the room was cosy and you feel like sleeping on a cloud in this bed.daisy is a great host.you will find everything you need.you can easily get to the city by bus.I highly recommend this place.
"
1606171,20822573,2014-10-06,2817719,Christina,"I stayed at Daisy's place for three nights on a solo adventure of the Seattle area. Daisy made coming and going very easy and was extremely accommodating to my late arrival. Because I was coming and going all day, It was nice to have clear directions/suggestions on what to do, see, eat, etc and not feel like I wasn't interrupting anyone's schedule. Daisy was also great about communicating throughout my stay. If you're a solo traveler looking for a comfortable, affordable place to stay, I recommend Daisy's place."
1606171,21014934,2014-10-09,22020240,Natalie,"The room was exactly as it is shown in the listing.  It was warm, welcoming, bright, beautiful, and comfortable.  The space was beautifully decorated and had a lot of professional touches.  Daisy has the gift of hospitality.  She was very friendly and made me feel very welcome.  I especially like the little note cards with instructions and tips.  The booklet with the rules, local eating places, and Wi-Fi instructions rivaled hotel quality booklets.  Although the inside of the space was wonderful, I did have trouble with the outside stairs.  I have old knees so carrying luggage up the stairs was just a bit difficult.  Otherwise, I enjoyed my stay very much.  "
1606171,21258023,2014-10-13,21385525,Brandi,"Daisy is a wonderful hostess with an excellent sense for decorating - her room is comfortable and stylish! I loved the Roku, the thoughtful touches (handwritten notes, toiletries). The proximity to Lake Washington and Seward Park is amazing, as is the close by coffee shop and natural grocery store.

Daisy was great about access to anything in the kitchen, keeps refrigerator tidy, and even washed and set out the Vitamix when I mentioned my hope of making smoothies.

She is great about providing personal space too. I highly recommend this room!!"
1606171,21325749,2014-10-14,13167177,Jisun,"Thank you for the pleasant staying in Seattle!
The house is very clean and comfortable enough to take some rest!
"
1606171,21629551,2014-10-20,17622793,ChiYo,Nice host! It was a good experience during the stay. I really enjoy the time there
1606171,21913634,2014-10-26,4205500,Nathan,The room in Daisy's apartment is very clean and well decorated. She was a gracious host and given the cost of comparable rooms in the Seattle area it was an excellent value.
1606171,22293043,2014-11-03,5778349,István,"Daisy's apartement is in a very nice anq quite place. I spent there only two days, and only slept there, as I was away the whole day. I generally sleep badly in the first few days because of the jet lag, but the bed in the room was so comfortable, and the room itself so quite that I could sleep hours longer than I expected.
Although I met Daisy just for a few minutes every time I was arriving or leaving the apartement, she's really nice, and her small and lovely instructions put down all around the flat made me feel as if she were there all the time to help me.
I'd be happy to return to Daisy the next time when I'm in town, and would recommend her apartement to anyone who likes peace and silence."
1606171,22558588,2014-11-09,870066,Joan,"If they ever create an AirBnB dictionary, pictures of Daisy's room should absolutely be included under ""thoughtful."" My stay was so brief, but everything was perfect. 

My schedule had some unexpected changes and I couldn't make it in until very late. However, I was able to find her apartment and make it to my room with no trouble at all. The bed was fantastic. There were lovely little notes to explain the space so there was no confusion at all. 

It's located in a really wonderful neighborhood and is a short walk or drive from some great restaurants. 

I left my jacket there on accident after checking out and Daisy promptly contacted me so I could pick it up. I would absolutely recommend her place to anyone visiting the Seattle area. "
1606171,22714449,2014-11-12,19392474,Angela,"Daisy was a great hostess, she made me feel right at home. :) "
1606171,23129689,2014-11-23,6621873,Sławek,Daisy made my stay very welcoming since this was my 1st time in Seattle. Easy communication and pretty good location made my stay very good impression on Seattle and people who live here. 
1606171,23283275,2014-11-27,764481,Andrew,"Daisy's place was comfortable, clean, warm and well located in Seward Park. She thought of everything a guest could possibly need and had a great little packet of information about the surrounding area. 10/10, A++, Would stay again in a heartbeat!"
1606171,23351867,2014-11-29,23880893,Tam,"Daisy was a great host,  she was personable and welcoming.  The room is as described.  The location is great,  we walked to a park at the lake,  which had a great view.  "
1606171,23542479,2014-12-03,14129709,Mia,"Daisy, Is a nice and knowledgable host. "
1606171,23565127,2014-12-04,12364968,Matt,The room os nice. Great on a short notice. Daisy is so nice. Highly recommended..
1606171,23976777,2014-12-15,11609929,Stephanie,Daisy was very organized and sweet. It was super easy to get in and out of her place. The bed was amazingly comfy. We were in and out of there really quick and were not able to meet Daisy but there were notes explaining where everything was. 
1606171,24315717,2014-12-25,24197342,Kevin,"Daisy was the perfect host!  I found her friendly and helpful at all times.  The room was exactly as pictured and she expressly made it known that I was free to set the room thermostat where I felt comfortable.  Bus access was actually better than she stated on her listing; the #50 bus is literally about 30 feet up the street from her door, and one transfer will get you do downtown, First Hill and Capitol Hill within 45 minutes (it only took me 30 minutes one day).  "
1606171,24511651,2014-12-29,25045932,Randy,"Daisy was my first Airbnb experience. She was an amazing host. She made me feel as if her home was mines. Her place super clean and very comfortable. The bed was so comfortable, it reminded me of the beds in a luxury hotel. She is located in a great community surrounded by restaurants, coffee shops, etc. Her were rules are simple and laid out nicely on a typed package. I will recommend Daisy to anyone looking a relaxing experience."
1606171,24682174,2015-01-01,12740772,Jeremy,Welcoming experience. Daisy is a real MVP. 
1606171,24798515,2015-01-02,25403478,Shey,"We felt very welcomed at Daisy's. She left notes all over so that we knew how to navigate seamlessly, and she even had a little print-out with wi-fi info, nearby spots to eat/things to do and etc- super organized/prepared! She was there to welcome us and directed us to Columbia City for dinner. The place is in a safe neighborhood, street parking was available right out front, and the rooms is super clean. She literally took care of ALL the details. It was just as though we were staying in a hotel, expect we received one-on-one care if needed. Truly a pleasure. Thank you!"
1606171,25121690,2015-01-06,1858249,Patricia,"I made a quick book reservation at Daisy's airbnb. It was very last minute, just three hours before I wanted to arrive. She answered right away with all the info I needed. Her place is wonderful....a very private room and bathroom. It is quiet and she leaves all kinds of notes around so the experience is very user-friendly. The neighborhood is quiet, safe and very accessible by public transportation. I parked my car on the street with no worry whatsoever. Daisy is friendly and welcoming. I will be staying with her again and will highly recommend her airbnb to friends and family also, who love to go to Seattle for a change of pace from Vancouver."
1606171,25250674,2015-01-10,10866213,Sweeny,Daisy is nice host. Her house is so nice.
1606171,25335742,2015-01-12,25573095,Micheline,"Daisy is the perfect host for those wanted a private Seattle experience! You can easily come and go without issues (there are a few house rules, but not burdensome) and the room is clean, quiet and the bed is comfy-great. I appreciated the desk and connectivity available - I didn't bring my electronics with me this time, but I would certainly see if ""Seattle's Best Rate"" is available again. Two amenities that were very special and exciting to me were the ease of driving into downtown Seattle using Rainier Ave South and Columbia City (where was that traffic?) and the proximity to the Lake Washington loop - it was nice to watch the ducks at the park and I drove home ""south and east"" along the lake - a big bonus that extended my relaxing time. I was also fortunate to be at the listing when Daisy was home for an evening and we had an unexpected delightful conversational encounter. I will go again AND I will check her FIRST next time. I had stayed at a Hilton Conference center the two preceding days and this was better - much better - by comparison! I will suggest that if I were coming to Seattle to move there, this might be an excellent spot to stay while checking out housing in the area. Super relaxing. Thanks Daisy! I hope in the future you will have space available for me in spite of this good review!"
1606171,25376935,2015-01-13,67191,Nadine,"We arrived later at night, easily let ourselves in. Set up was great, small space, but somehow felt comfy with everything you needed. The little notes around the space let you know  to help yourself and feel comfortable. We stayed a little later than the check-out time to print some documents. Daisy didn't mind at all, and was friendly."
1606171,25606372,2015-01-20,24987957,Jrlle,"I had a great experience at Daisy's place. Super easy to get to and located in a neighborhood that I adore. Her place was very comfortable, clean and she made it very easy to feel at home. Even conversations with Daisy made the experience that much more enjoyable. Thank you for a seamless experience =)"
1606171,25649374,2015-01-21,11347446,Lucy,"Daisy was a wonderful host. She was communicative and welcoming. She literally opens her entire place to me that night. Unfortunately I didn't get to meet her in person but she we very helpful and very responsive to emails. The place is exactly as described and is conveniently located. Bed was comfortable, slept like a baby. Parking was street parking but very easy to find one, I found one right in  front of her apt entrance. Truly enjoyed my stay. Thanks Daisy!"
1606171,25726913,2015-01-24,1503550,Maricruz,Daisy's listing was accurate. Comfortable room at a great rate. Neighborhood was safe. Plenty of street parking available. Daisy was kind and responded to messages quickly. Would recommend to others. 
1606171,26325946,2015-02-09,4524347,Garrett,"A delightful experience, no hitches or disruptions with the apartment. The place was clean and well kept and in a cute part of Seattle. The closeness to the supermarket, coffee shop and restaurants made for a nice walk to dinner after getting off of work. No complaints, I would stay again!"
1606171,26411338,2015-02-11,14851193,Alyshia,"Daisy was a great host. The room was clean and she was very helpful with anything we asked about! The apartment is a little bit further from the city than we had anticipated (a 45-50 minute bus ride into the downtown core) so we ended up having to drive, but otherwise it was in a safe and clean neighbourhood. Thanks for the great stay!"
1606171,26505813,2015-02-14,27338152,Bo,"Clean and nice. The condo is smaller than it looks in the photos, however."
1606171,26614650,2015-02-16,26392291,Keng,This was our first AirBnB experience so we really did not know what do expect. The room was very nice and comfortable. Parking was easy and the burger place next door was a real treat. We appreciate that we were given total privacy. 
1606171,26719294,2015-02-17,12260364,Cherri,"This was my first airbnb experience and it was safe, easy and comfortable.  "
1606171,26807291,2015-02-19,26384983,Jerome,"We loved the location, you can drive easily to many parts of Seattle. The place was clean and organized. We had everything we would need."
1606171,26931312,2015-02-22,21986356,Yuge,"First Airbnb experience, only $40/day, but far beyond my expectation. Nice room, hospitable landlord, prefect experience."
1606171,27081993,2015-02-24,17988453,Inge,"The bedroom is tidy, clean and comfortable. You will feel relaxed like at home. I recommend it to you."
1606171,28254503,2015-03-21,26922839,Dean,Not bad.
1606171,28367773,2015-03-22,29580458,Natalie,"Daisy was a lovely host! Even within the first couple minutes that we walked into the apartment we felt welcomed and comfortable. She genuinely cared a lot about us and our visit, which was very refreshing. "
1606171,28563171,2015-03-26,1523689,Kurtis,"This was a fantastic neighborhood to be staying in. Daisy's place has a great location. And she was so nice! For those few days I felt like I actually lived there and didn't feel like a host. If you're coming to Seattle, stay here!"
1606171,28631345,2015-03-27,24678293,Louise,"Daisy's apartment was very quiet and peaceful, with tasteful furnishings. She was very friendly and welcoming, providing me with all that I needed for a good stay. 
The location was perfect, as all I needed was good food nearby and a short trip to work in the morning."
1606171,28661568,2015-03-28,28525878,Jihan,Quiet and comfort. Overall it was good!
1606171,28759846,2015-03-29,29884313,Ben,Great room!  I felt very comfortable and the bed was fantastic!  Daisy is a great host.
