listing_id,id,date,reviewer_id,reviewer_name,comments
224763,25953034,2015-01-31,16302309,Robert,"Location was exactly what I wanted for my explorations of Seattle - While I was willing to rent a vehicle, walking and mass transit was so easy I had no need to seek alternatives. The condo I rented was exactly as pictured and envisioned and hostess, Autumn extremely helpful in explaining the unit/building and elaborating supprot services in the neighborhood - I must also say the unit was clean, safe, quiet and Easy!"
224763,28634311,2015-03-27,14066046,Josette,Autumn was very personable. The place was very nice. Cozy. Especially loved the courtyard garden and fountains. 
224763,34430489,2015-06-08,31543574,Erin,"This condo worked out great for our trip! The location is the perfect walking distance from the Public Market and the Space Needle. It was clean, quiet, has a lovely courtyard, and rooftop deck from which you have nice view of the ocean. There is a yummy bakery in the same building, Macrina Bakery, that was our chosen breakfast spot for all four days of our trip. Delicious pastries. We also visited La Vita Bella the Italian restaurant right out front of the entrance which was yummy and exceptional service! As three females we felt safe and very comfortable in this part of town. One very important note, the condo is much smaller than the pictures convey. It was a good size for three people, but would be a tight squeeze for four. Also, the parking spot in the garage is very convenient as city parking was hard to find, but the spot is VERY small!!! Be warned if you are getting a rental car, get something small as you must park within the white lines or be fined. Overall, would highly recommend this condo, just be aware of the size."
224763,39468927,2015-07-23,13348069,Maryann,"Autumn's place was exactly as described online.  It was in a perfect location, near many bars and restaurants, but also an easy walk to some of the more touristy areas and downtown.  

I travel pretty extensively for work, and staying at Autumn's was nearly like staying at a hotel, rather than an AirBnb.  Furnishing was stylish, the bed was comfortable, and having a full kitchen would be really nice for those staying longer than a day (like me).  

I would definitely stay at this, or any of Autumn's other properties again.  She was very easy to work with, and instructions for my stay very clear.

Thanks for a great overnight work trip in Seattle, Autumn!  "
224763,49608475,2015-10-05,17804210,Andy,"The place was very clean and centrally located. There are bars and restaurants within walking distance. Autumn is a very nice and easy to reach host. Only complaint I had was that the air mattress seemed to deflate every few hours and had to be re-pumped, but Autumn was quick to try to address the issue. Since we discovered it with a day left, I told Autumn not to bother."
224763,54045622,2015-11-15,21139592,Craig,"Autumn, was extremely helpful and a pleasure to meet with. Condo was great, walking distance to everything you need downtown. Would come back and looking forward to it..."
6675927,34594524,2015-06-09,34406186,Mike,"Jon was a great a host. This was my first bnb experience and he made it a great one. The room was super big and clean, the house was perfect lots of things to entertain yourself if you feel like staying in. The location was great close enough to all the restaurants and bars. He was very friendly and made sure I had everything I needed. Thanks again for everything!"
6675927,35153883,2015-06-15,34957187,Brittany,"We had an awesome experience here. The space was accurately described in the listing. When we arrived everything was very clean and Jon had left fresh towels, soap, toothpaste, toothbrushes, and clean bathrobes for us to use. We felt very comfortable during our stay. I would 100% come back for another stay. "
6675927,35591591,2015-06-20,34885541,Jiahang,This is our first time using Airbnb and Jon has made the experience a great one. Jon is a super friendly and helpful host who had given us a lot of info about where to eat and go. The house is gorgeous and super spacious. The host has a great taste of the arrangement and selection of furnitures and decorations which provides us a cozy and comfortable environment. The location is great. It is only half block from Safeway grocery store and only one block from the #11 bus station which takes you directly to downtown Seattle. I would definitely recommend Jon's house to you.
6675927,35852982,2015-06-22,25474817,Monica,"This listing was as described and less than 10 minutes of downtown and Pike's Place. There were lots of restaurants, bars, and stores all around. The neighborhood was safe and specifically his 4 unit residential area, was gated too. 

The home was spacious, very clean, and organized. Jon was super welcoming and messaged me to feel free to the snacks and liquor on the counter. I met him once the night before I left and he was very friendly. 

The master bedroom was so spacious and had a walk in closet for all our stuff to go into. The bed was super comfy. The bathroom was a shared bathroom and was kept very clean. Made sharing a bathroom easy. "
6675927,36323316,2015-06-27,35741464,Andrew,"Jon's house was clean and quiet, located in the best part of town! Easy to get to, and very comfortable! "
6675927,36707206,2015-06-30,22587252,Shelley,"Jon's place is very comfortable, clean and in a great location. The apartment has all the amenities of home (and then some!) and Jon makes you feel very welcomed. I would definitely stay there again. "
6675927,37223551,2015-07-05,9130707,Alicia,"Jon's space was a great place to stay while on vacation in Seattle. We were able to utilize the kitchen for breakfast and such which was of great convenience. Location was great, a block from the supermarket close to things to do in Capitol Hill.

Jon was very responsive when it came to communication. While we didn't see him much, he messaged us as to when air-conditioners were on the way (as it was abnormally hot for Seattle that week) and was quick to answer when I needed a hair dryer.

Definitely a great place to stay if you're looking for a longer stay, such as week."
6675927,37677252,2015-07-09,817507,Mary,"Jon is a fantastic host. His place is clean and well appointed, and he makes certain the kitchen stays stocked with items that guests are welcome to consume. He was very helpful giving directions and recommendations and accomdated our special requests with grace. The house is in a great neighborhood where you can walk to several bars, a grocery store, coffee shops, or hop on a bus that takes you all around town. Highly recommended!"
6675927,37805137,2015-07-10,31392167,Jeremiah,"Great location close to food, shopping and night life. Gracious host and awesome space. Hope I get lucky enough to say with Jon when I visit Seattle again. Made my friends 1st trip to Seattle and my 1st BnB experience really great. "
6675927,38299213,2015-07-14,2941026,Anje,"De verhuurder gaf ons een welkom gevoel. Hij maakte dat wij ons thuis voelden in zijn huis. De omschrijving was accuraat. Je kunt lopen naar Pike place Market, ongeveer een half uur of makkelijk de bus nemen.  Vandaar is veel op loopafstand. Je kunt goed parkeren in de buurt van zijn huis."
6675927,38620714,2015-07-17,28814050,Ziva,"We were immediately greeted and offered refreshments.  Beautiful ambiance, generous with their offerings of comfort.
Kitchen fully stocked for guests, coffee made for the start of each of the three mornings.
Kindly helped me receive my special delivery package: my passport.
Grocery store 1/2 block away.
Busses into town easily available.
We really enjoyed the restaurants nearby, especially The Skillet.
We felt very safe both in the neighborhood as well the city, at large"
6675927,38871356,2015-07-19,2356243,Daniel,Fantastic
6675927,39226559,2015-07-21,38043830,David,"Jon was a fantastic host- extremely friendly, hospitable, clean, and accommodating. He made our stay in Capitol Hill very convenient, affordable, and comfortable. His knowledge of the area is a huge plus, providing maps, books, and personal advice for what to see and do in the area. His place is gorgeous and conveniently located to shopping, public transit, and restaurants. We felt very comfortable staying here, allowing us the option of lounging in his living room watching Netflix after a long, hot day! Jon made our stay memorable and gave us a great first experience with AirBnb! We would definitely stay here again. :-)"
6675927,39357572,2015-07-22,35623810,Prasanth,"Excellent, clean and very comfortable place. Really enjoyed my stay there. This is highly recommended place to stay, in a nice calm Seattle area."
6675927,39559376,2015-07-24,22747489,Surlybasser,"Jon's house was clean and well appointed. It was the perfect place for me to crash after a very taxing week of training. I would go back without hesitation.  Tougo coffee is a about a half mile away, and worth the walk up the hill!"
6675927,39705138,2015-07-25,6623708,Eileen,The stay was very short due to a hectic business schedule. The home was lovely and clean and Jon was very accommodating to a late arrival and very early departure. 
6675927,39952566,2015-07-27,35730555,Keisha-Mae,"I was not welcomed by the host, but his partner was polite. Our host was not in the city for our duration of the stay. I was not impressed with not being able to get into contact with our host especially when we had to call the fire department for a carbon monoxide alarm. I was not impressed by this and did not feel safe. I expected safety and available communication more so if  a host is not going to be present. Later that day after informing Jon's partner, it had come to our attention that Jon had been in communication with his partner, yet this information was not passed on. "
6675927,40649639,2015-08-01,38597079,Benan,"Jon is a great host. He is super helpful, communicate in a very clear and friendly way. He is hospitable and interested in his guests. His Generosity is above and beyond. "
6675927,40991071,2015-08-03,36643643,Steven,"Nicely furnished, spacious apartment with common space and kitchen downstairs, private bedrooms upstairs.  Had a friendly generous atmosphere.  Large screen TV, upscale coffee/tea service, computer all available.  Close to bus line, and walk downtown not unreasonable.  Would definitely use this listing again.  Thanks"
6675927,42233138,2015-08-11,7690746,Jane,"This house is awesome! Great location, very clean and well decorated, and Jon was responsive when I got in touch. It was really nice to have the numeric keypad entry instead of having to keep track of keys. Parking was easy to find. Would definitely stay here again! "
6675927,42325640,2015-08-12,13197435,Kate,"We enjoyed our stay at Jon Shepherd's place.  The room was spacious; the bed was uber comfortable!  There were some nice touches -lovely soap, toothbrush and paste, and these melt-in-your mouth mints (Dilantante, or something like that which we found in a chocolate shop closeby).  

In the morning, we enjoyed coffee, fruit, cereal and conversation with two other guests staying at Jon's.  I would recommend   his place, located in the Capital Hill area."
6675927,42584802,2015-08-14,4872241,Bryan,Jon's home was lovely and in a great location. They were extremely accommodating and made our stay as comfortable as possible. Would definitely stay there again when we pass through Seattle. 
6675927,43440570,2015-08-19,26130750,Chanjuan,"The room is sooo beautiful and spacious, the bed is comfortable. My friend and I both had a great time stay there!! Jon also provided us pretty much everything in his house( fruit, bread, cereal,  wines(YES! THERE IS WINE!)) The only pity was that we didn't get a chance to say hi to Jon face to face."
6675927,43664469,2015-08-21,16067775,Lisa,"Jon's place was great! The bedroom was spacious and very clean. He provided a lot of great travel necessities such as maps, suggestions, and extra toiletries. Capitol Hill was a great place to stay as well. There were a lot of great places within walking distance. Jon was extremely friendly and welcome. I would highly recommend this place."
6675927,43987617,2015-08-23,2934134,Scott,Jon's place was awesome and Jon was a great host. The location is great. You can walk to many restaurants and transit options. The house is really nice and we enjoyed sharing it with the other guests and Jon. Jon was also very flexible with a later then expected check in due to flight delays.  We would definitely stay here again!
6675927,44661804,2015-08-28,38088819,Bob,"Can't say enough about Jon and Dave. We had the run of the house, refrigerator and liquor cabinet. Felt right at home the minute we walked into the house. Great conversationalists for the short times we saw them. Loved stories of Dave's childhood in the small town Washington mountains. Bed was very comfortable; kitchen facilities adequate, and although we planned on using them, didn't have the opportunity to do so. Great location, especially for food shopping (2 blocks) and free (street) parking. Would definitely stay there again!!"
6675927,44819080,2015-08-29,2796087,Kyle,We had a pleasant stay at jon's place. The room was clean and quiet and Jon was a very friendly host. Would stay there again in the future. 
6675927,45453481,2015-09-02,2219865,John-Paul,"I was pleasantly surprised by how beautiful this unit is. Gorgeous wood interior, comfortable bed, kitchen fully stocked. Jon is amazing, he obviously takes this seriously and is available to help whenever needed. I was leaving for the airport later the next day, and it wasn't a problem for my bags to hang out there a while longer. Great to work with someone so accommodating. "
6675927,45984731,2015-09-07,455762,Andrew,"We felt very welcome and comfortable in Jon's house.  He was very generous, making his kitchen and food  available to us.   He even offered us a beer or cocktail on our arrival.  

The house is in a residential neighborhood on a busy street, with ample free street parking near by, and easy access to great shops and restaurants near by.  

I definitely recommend staying here."
6675927,46408224,2015-09-10,40073968,Suiyan,Soooo good! I will choose again when we come to Seattle again!!!
6675927,46955692,2015-09-14,28186872,Jackelyn,"Jon's place was beautiful. I love the hard wood. The place was impeccably clean. 

The neighborhood was cute and quiet but walkable to the bars in capitol hill. I also used the bus to get downtown and it was very easy and cheap. I loved Seattle and am now seriously considering moving there. 

Jon was also incredibly helpful with recommendations of things to do. We never would have known about the grove of the patriarchs at Mount Rainier national park and it was definitely a highlight of my trip. Thanks Jon!"
6675927,48777964,2015-09-28,27241232,Melvin,"Good location, clean & comfy digs. We were in town for 2 days/nights and were looking for someplace to crash at in the evenings. Jon's space was ideal. We arrived late in the evening on the first day, and decided to stay in. Jon was nice enough to offer us wine/spirits while we relaxed. "
6675927,49856086,2015-10-06,2489216,Pashmeen,Jon was a great host ! He made me and my friend feel just at home.. He is extremely knowledgeable of the area and fun things to do.. We had a great time at his place and all the conversations that followed throughout the stay!  
6675927,50154566,2015-10-09,18069072,Candice,"My partner and I decided last minute to spend one more night in Seattle during our PNW trip, and Jon was very quick to respond to our booking request. We got to meet him for a brief amount of time and he was very nice and accommodating. His place is a seriously ideal location - a short walk to a ton of great bars and restaurants in Capitol Hill. The spot itself was clean and very welcoming. Thanks Jon! "
6675927,50501439,2015-10-12,31699224,Griffin,Great location near downtown Seattle. Walking distance to Capitol Hill which is a lively and vibrant district of Seattle for nightlife. Jon was very accomodating and welcoming towards me while staying in his home. The room itself was spacious and comfortable.
6675927,50902335,2015-10-15,39334793,Grace,"Jon's place blew our air bnb expectations out of the water ❤ we have never stayed anywhere so great through air bnb, house was safe, easy access and so clean! -- the hosts were a perfect mix of attentive and accomodating, have us plenty of space to do our work but were so friendly.. Wished every experience was this good!"
6675927,51638137,2015-10-22,21491271,Donnita,"This is about my 4th airbnb, and quite possibly the best.  Jon ( and David) we're very personable and helpful.  The home and room we're beautifully decorated and maintained.  The bed was very comfortable.  As hosts they we're very thoughtful and accomodating while maintaining privacy for everyone.  Just an overall great experience!!!"
6675927,51801108,2015-10-24,2262326,Jane,Jon was a great friendly host. The house is cozy and nice. The bedroom is actually bigger than what I initially imagined. It was a very pleasant stay.
6675927,53137694,2015-11-05,10951925,Joan,"Communication with Jon was good and we were made to feel welcomed in his home.  Jon and David were helpful in making suggestions to us since this was our first trip to Seattle. Location was great  - close to the bus or a short walk to restaurants, groceries. Bed was comfortable and tons of closet space for guests."
6675927,53485174,2015-11-09,8014596,Susan,"Jon is a wonderful and welcoming host.  This was the second time we stayed in Jon's lovely home. We hope to stay with him every time we come to Seattle to visit our family.  We love it that Jon provides a clean, comfortable place to relax. It is quiet and cozy. The kitchen is so well stocked and he is very generous about sharing everything. We also love it that there is parking within walking distance. Remember - this is Seattle and parking is often hard to come by. Each bedroom has it's own heat/air control which made for greater comfort.  Thank you, Jon, for another great stay!"
6675927,54251244,2015-11-17,46326260,Roxanne,"This was my first Airbnb experience and it was wonderful! My girlfriends and I decided on a weekend getaway to Seattle since we have never been and this place was an excellent home base location for all our tourist and adventure needs. There was construction going on in the street in front of the house, but it was still easily accessible using Lyfts and Ubers. Our flight arrived early and Jon was very accommodating by having our room ready a few hours early as we dropped off our bags and made ourselves comfortable in the living room. The place is very clean and well decorated with more amenities than I could ask for such as an accessible computer, Netflix, and board games. The room itself is spacious with a comfortable bed and large closet. You will be sharing the upstairs bathroom if there is another guest on the other room but there is also a half bathroom downstairs. Jon made us feel welcomed and gave us a good balance of interaction with privacy. The only thing I would warn about is that you can hear movement of other people throughout the house (footsteps upstairs when you are downstairs and vice versa) but if that doesn't bother you then you should be fine! I would definitely recommend!"
6675927,54557161,2015-11-21,4970301,Patti,"This was my second visit to Jon's house.  This time I stayed in the master bedroom. It was very comfortable.  I find the location very convenient and will stay here again.  Thanks, John!
Lonnie (Patti's other half)"
6675927,54897846,2015-11-25,6171523,Rowena,"Jon's place is centrally located and very easy to get around to many places in Seattle which was a plus since we rented a car. Room is as described and bed was extremely comfortable. Did not see Jon too much since my bf and I were out exploring majority of the day but he was very accomodating and responded quickly to any questions we had. Light breakfast (cereal, toast, etc) and coffee/tea were made available to us which was extremely helpful and Jon was very kind and generous to also offer us some beverages. Overall, we had a great time and would recommend Jon's home to anyone visiting Seattle!"
6675927,55509219,2015-12-01,1340403,Kar,Jon was out most of the time but the place was near to everything and we basically walked everywhere! Would definitely consider his place again if I am visiting. 
6675927,56340783,2015-12-12,21607838,Jason,"Great place to hang, Jon and his mate were great hosts and I would be happy to stay again"
6675927,56891306,2015-12-19,13972159,Erin,"Jon offers a very warm, friendly and relaxing home. He is a great host that goes above & beyond and I would definitely stay again. I felt very at home in Jon's house and he made it extra special with all the small touches he adds like filter coffee, light breakfast option of cereal, local books and pamphlets, toothpaste, soap etc.... 
Highly recommend staying with Jon!!"
6675927,57093334,2015-12-21,17531456,Rebecca,"What a great location and an inviting house. When we arrived our host was there to greet us and show us around. I'll admit that my partner and I were rather reclusive and tired during our one night stay but felt invited to enjoy the main rooms if we had wished to.

One more thing, the bed was amazingly comfortable and now I want one."
6675927,57318821,2015-12-24,33470376,木,"用中文描述也许会更多的帮助和我一样的朋友。Jon 的家的地理位置非常不错，在比较市中心的地方，当然整个西雅图并不大。出了家门步行就有快餐店和便利店以及加油站，非常方便。家里的小院和路边都可以免费停车。开车5～10分钟左右可以到附近的植物园，空气非常好，可以在里面散步。
我们住的房间是楼上相对大些的房间，一切都够用，整个房间有两户租户，Jon本人也住在地下室，两个租户分别使用一层和二层两个卫生间以及分享一个浴室。歪果仁在家都是光脚走来走去，如果你不习惯可以自带一双拖鞋。Jon贴心的准备了洗漱用品，包括牙刷牙膏洗发水洗面奶都是很好的品牌，而不是一般汽车旅馆不知道的品牌。Jon的厨房里有咖啡、茶、面包，如果你想方便或者省钱可以直接在家DIY。
非常好的体验。"
6675927,57812387,2015-12-29,2753279,Matt,"Jon's place was so much better than we expected. It was warm, beautiful, and perfect for staying for the holidays. Not only that, but Jon and his friend decided last minute to grab a Christmas tree and decorate, which was perfect for us and made it possible for us to have small Christmas gathering with my girlfriend's family. It gave us a place to put our gifts and filled the house with the smell of Christmas. There were labels on every important item and drawer in the kitchen, which made the space feel surprisingly welcome. We can't even begin to describe how wonderful it was! They clearly enjoy hosting and were  gracious with our needs and requests.

We'll definitely be looking at Jon's unit again for the next time we stay in Seattle!

P.S. My girlfriend loved the decor of the place, and wanted to thank our hosts for the small things like our guest towels, toothpaste & brushes."
5760902,31378026,2015-05-04,31697046,Trevor,"The listing description was accurate.  The location is great, about halfway between the Space Needle and Pike Place Market.  Both are easily walkable in a few minutes and there are other bars and restaurants around, too.  The neighborhood seemed safe enough.  There's a fire station a block away and there are some trash cans in the alley, so it's noisy sometimes.  I still had no trouble sleeping.  We were able to check in by phone, which was really convenient.  There was plenty of toilet paper and other toiletry stuff like shampoo and toothpaste, and if you forgot anything else or need a bag of chips at 11 PM, there is a market directly across the street.  We'd stay here again.  "
5760902,32396908,2015-05-17,795822,Miglena,"We stayed at Jes and Ashley's place over the weekend and loved it. They were very responsive and accommodating prior to and during our stay, and although we didn't get to meet, they made us feel welcomed. The place is a gem, and best of all is the location. It's walking distance from everything you can see downtown and nearby neighborhoods, which was key for our short stay. Don't think twice when you book your next stay in Seattle!"
5760902,33130806,2015-05-25,30881248,Kara,"We had a great stay! Convenient location, 10 min walk to Pikes, 10 min walk to space needle. Owner very friendly and helpful with suggestions for the city life. Seemed Very receptive to feedback. The area was a little rough after 10pm, but honestly We never felt unsafe. Mind your business and everyone minds theirs! Overall an Awesome weekend! "
5760902,33812857,2015-06-01,926219,Smita,"I had a very comfortable stay at Jes and Ashley's place. The location is great and it is easy to walk to most places, including Space Needle, Pike Market and Seattle Art Museum. The apartment is spacious, gets lots of light, has all the essential amenities and is close to some nice cafes and restaurants in Belltown. Jes was always quick and helpful in communicating."
5760902,34321679,2015-06-07,1880951,Samantha,"A friend and I stayed here for a fun weekend after a work event in Gig Harbor earlier in the week. Jesse and Ashley's apartment is comfortable and in a really great location - we loved the Belltown neighborhood and were able to walk to Seattle Center, Pike Place (of course) and lots of delicious neighborhood cafes and bars. Jesse was flexible with checking in/out and gave us thorough and helpful suggestions on where we should go!"
