listing_id,id,date,reviewer_id,reviewer_name,comments
611500,10965821,2014-03-15,8107132,B,"i stayed there with a group of friends for my spring break. It was a really easy process. prez got back to me really fast too. The place is very spacey and looks exactly the same as the pictures. plus, its really close to everywhere (around 5-10 mins to pikes place, 15mins to bellevue). Theres a grocery store nearby. they also provided us with necessities like towels and full equipped kitchen too! Overall, we had a good experience while we were there!"
611500,12043693,2014-04-22,10800511,Paulette,Our family enjoyed their stay at the rental place. The owners had everything prepared for us and were always checking if we needed anything else. The place was not only clean but spacious as well. There was free WIFI and parking space. The place was also accessible to grocery stores and restaurants.
611500,13498133,2014-05-28,7759565,Rotem,The reservation was canceled 83 days before arrival. This is an automated posting.
611500,14405559,2014-06-18,12657039,Allison,We stayed two nights at this property and overall were very pleased. The neighborhood looked a little concerning when we first pulled in but seemed to be fine. The house was very clean and had everything we needed and more. Prez and Cherie were very accommodating and helpful. 
611500,15532240,2014-07-11,15312557,Pingjie,This house has lots of space and the hosts are very nice.  The house is clean and well maintenaned.
611500,15605226,2014-07-12,1772631,Duval,"The apt was as advertised, 3 BRs 2 full BRs, huge LR, DR and plenty of places to sleep. The air mattress was a bonus. Comcast cable, flat screens in every room. Our host Prez was super cool and accommodating, even greeting us with some Champagne! (Not sure if every guest gets that treatment but we did). The place is well stocked with plenty of towels etc and the washer dryer came in handy and was easy to use! Overall very nice stay. Wished we could have stayed and extra day but we booked late. 15 mins from downtown.  "
611500,15876638,2014-07-17,786927,Monique,"Prez and Cherie's place was great for my trip. It was close to the light rail, which made getting to and from downtown Seattle super easy. The house was clean and cozy, and Prez was very communicative throughout our stay. Highly recommend!"
611500,16312587,2014-07-25,6110358,Esther,"We had a wonderful stay at prez's house. the apt is fully furnished with everything we needed, it's roomy, tidy and comfy. Also, Prez is a very helpful and friendly host, thanks again !"
611500,16783896,2014-08-02,17388466,Steven,Well coordinated and great service.  Recommended! 
611500,17540766,2014-08-13,7386921,Steve,Staying with Prez and Cherie was a wonderful experience. They repaired quickly to any questions I had and even went above and beyond to help with a billing issue. If you are going to a game or to Seattle for any reason this is for sure the place to stay. I know we'll be back! 
611500,19501347,2014-09-13,19927000,Pati,"My host was at the house to greet my son and his girlfriend when they arrived first. He was very pleasant and I got to meet him when I arrived. The house was located in a nice, safe neighborhood. It was easy to park and located about a 10 minute drive to SafeCo Field. We were celebrating my son's birthday and going to a game. I only wish I could have stayed 2 nights because the house was a good place to base activities from. The house looked very much like it is represented on the website. People rented the apartment below us and I never heard them until they were leaving the next morning. We all enjoyed our stay. Thank you Prez."
611500,22517031,2014-11-08,16980026,Christopher,The reservation was canceled the day before arrival. This is an automated posting.
611500,31152301,2015-05-02,30553203,Desta,"The neighbour was quiet. The house was big and clean, the kitchen was furnished, we enjoyed using it. "
611500,32306221,2015-05-16,32081026,Michelle,The host canceled this reservation 26 days before arrival. This is an automated posting.
611500,33406888,2015-05-27,20541542,Mallori,I booked this house for my team of brand ambassadors who were in town for training. They said check in was very easy and Prez was very helpful. The house was in a good location and they had zero complaints.
611500,34094606,2015-06-04,22119463,Mike,"The listing was perfect for our purposes. It provided easy access to Bellevue and helped us avoid any potential traffic issues. There was plenty of space in the unit, and each of us had our own beds. Great spot for a quick business trip that substantially saved the company money on hotel rooms."
611500,46779412,2015-09-13,42337097,劼,it is a fantastic house! clean and comfortable. you can find whatever you want there. the location is also great. quiet and convenient.
611500,47573755,2015-09-20,26727085,Morgan,It was an enjoyable stay.  Prez was around to make sure there were no issues but not to much to feel like someone was watching you.  When ever I'm in Seattle I will be looking to stay w/ Prez and Cherie's.
5164194,28837812,2015-03-30,10105300,Bryan,"This place is absolutely fantastic. It is on the 3rd floor of the house and has a stunning view of Lake Washington and Bellevue via a private balcony. It is conveniently located in Capital Hill, with various bars and grocery stores within walking distance. The Cerfs are gracious and polite. They were really nice to chat with whenever we passed each other. It is a very quiet and relaxing spot, with lots of privacy. I would rent this location for a longer period if I could. "
5164194,31329161,2015-05-04,30001226,Rylan,Nice sized room with a great view and good light. Hosts are very welcoming and helpful.
5164194,48391374,2015-09-26,37498394,Clint,"Overall, this was a terrific location to stay at during my month in Seattle.  I primarily chose this site due to its location being in such close proximity to where I would be working (a little over a mile away).  Plus, there is great public transport with bus stops close.  Lynn and Randy were very welcoming, always in communication and made me feel right at home when I arrived.  This room specifically is it's own floor with a private deck that provides gorgeous views of the lake, pointing you directly at downtown Bellevue with the cascades in the background.  No private bathroom, but the common bathroom on the second floor is well kept and it was not a problem sharing with the 1 or 2 other occupants who were renting other rooms.  The neighborhood is quiet, there was always available street parking if you do have a car, and all necessities (groceries, drug store, restaurants, coffee shops, ect) were in close walking distance, no more than 10-15 minutes on foot.  And, if you are a runner, this house is just uphill from the Arboretum, which I made ample use of as a running route during my stay.  I would gladly stay with Lynn and Randy again if my travels do bring me back to Seattle.  Thank you both for the excellent lodging."
719233,2501320,2012-10-03,413273,Jillian,The reservation was canceled 15 days before arrival. This is an automated posting.
719233,2552461,2012-10-08,3741638,Amanda,"The apartment was in a great location and was exactly as stated in the listing.  Nick was really flexible about working around our schedule and was really quick and thorough in his communication. The place seems like a great deal, and I highly recommend it."
719233,2567617,2012-10-09,3423829,Juan Carlos,"This place was just amazing! From the very beginning Nick responded so quickly to my request. He made the best to make the futon in the living room so comfortable for my friend. Nick had no problem with our bicycles inside the place which made us feel safer. The apartment is located in a nice area, very close to downtown with tons of restaurants, coffee shops, bars and the vibrant energy of Capitol Hill. 

Nick wasn't in town to check us in but his friend Nicole was going to be in charge. She met us even before than we were supposed to (two hours before), she was very nice and attentive, she gave us some ideas on places to eat. I needed a screw driver to remove something from my bike and she got one right away.

The whole apartment for such a wonderful price is seriously the best deal in town!!! the living room is spacious and the TV has the Roku box so we could stream Pandora and watch anything from Netflix. The kitchen has everything you need to make a delicious meal, the bedroom is very spacious and comfortable, the bedding and appliances were new, the bathroom  and the whole apartment was super clean. 

On our second day at the place we met Nick, he is very laid back and genuine, I could tell he just wanted to be the most helpful possible, he felt like an old friend. He had no problem with us checking out later than supposed to if we needed to.

I definitely recommend Nick's place and look forward to come back for more Seattle times! I will not look for another spot to stay, just like that. "
719233,2607900,2012-10-14,3738094,Tim,"The description Nick gave is spot on.
Very quiet building, can only hear sirens sometimes, good locks on doors and windows, good lighting, great to have Netflix and Pandora, kitchen well stocked, comfortable bed, good shower and toilet. 
Nice little living room with a breakfast table next to the window. Wooden floors all throughout.

Yeah it's well used but it's clean and the location is perfect to get downtown or late night fun in Capitol Hill!"
719233,2635014,2012-10-16,717566,Allison,"Cute apartment, great location.  And Nick was an incredibly attentive and accommodating host.  Thanks!"
719233,2686557,2012-10-22,693388,Hannah,"Nick's Melrose Court Apartment is minimal but has everything you would need. Nick is beyond helpful, had a list of useful information for us and is more organized than any host I've ever stayed with. Nick is just a few doors down and was quick to mention that he's always up to help. We shortened our stay because we found an apartment in Seattle, and Nick could not have been more accommodating in refiguring the reservation. Although our stay wasn't for tourism, the location is really awesome for people who want to see all Seattle's sights!"
719233,2734552,2012-10-27,3965593,Jeremy,"We stayed at Nick's place for a couple of nights in October. The apartment is clean and tidy, and in a fab location, close to the CBD and some funky inner city areas. Nick was really amenable and easy going, easy to get in contact with, flexible and also great in making sure we were ok and comfortable. If I make it back to Seattle, I'd definitely stay again!"
719233,2754550,2012-10-29,2611408,Kipp,"Nick's place is cozy,  tastefully decorated, and in a fantastic location.  He made us feel  welcome and went above and beyond our expectations in terms of friendliness and making sure we had everything we needed. The place came complete with maps, local guides, wifi, and Netflix streaming! (Not to mention a helpful host). I would definitely recommend Nick's place to any other traveller."
719233,2792919,2012-11-03,3686448,Jason,"ANicks apartment was great and exactly as advertised. It was clean with a fresh bed and an excellent location. Nick and I did not meet until the day I left, which goes to show that I had no problems to give to his attention during my stay. Check in and check out was simple, and he even let me check out really late in the day to accommodate my 11pm flight home. I would stay here again, for sure."
719233,2813980,2012-11-05,290148,Anisha,"Nick was so great! My friend and I arrived at 11PM on a Friday and he was there to greet us and let us in, show us around the apartment and lay everything out for us. The apartment was so great! Everything we needed was right there- towels, a nice comfy bed, a clean bathroom, kitchen utensils, even Netflix! Nick even had books and recommendations out for us and even went out of his way to let us store our bags after checkout time so that we wouldn't have to carry them around with us all day until our scheduled flight. 
The location of the apartment was FANTASTIC! Perfect spot in Capitol Hill. Great coffee shop nearby, as well as Melrose Market and yummy Li'l Woody's! I wouldn't stay anywhere else if I were to revisit Seattle.
Thanks Nick!"
719233,2841523,2012-11-08,3870037,Martin,"This location is very close to Seattle downtown. For me the apartement was almost prefect. It was clean, nice, warm and the kitchen was well equiped. Some guides for the town has been prepared, also a personal one from Nick himself.
Nick was a very nice and friendly host!"
719233,2844101,2012-11-09,3778133,Mark,"The place is terrific! I only stayed for one night, but was left wishing I'd stayed for more. The apartment is in a great location, very close to cool restaurants, coffeeshops, bars, shopping, etc., and you can easily walk, take a bus or drive to downtown. It was clean, a good size space, and great value for the money. Nick is a really great host--friendly, knowledgeable and reliable. He offered lots of recommendations, and went out of his way to make sure I got into the apartment okay. "
719233,2853819,2012-11-10,4061597,Jasmin,"My friend and I had a fantastic time in Seattle and Nick's place was perfect for our short stay. It was my first time using airbnb and everything worked out well. His place was clean, and had everything we needed, the bed was super comfortable and the location was fantastic. Walking distance to Capitol Hill as well as Pike Place / Downtown Seattle. 
I can absolutely recommend Nick's place and probably even use it myself again when I'm in Seattle the next time.
Thank you so much Nick for being such a great host as well!"
719233,2878279,2012-11-13,3711258,Michael,Nick was great.  So was the apartment.  Exactly as described in a very cool and accessible area of Seattle. 
719233,2892358,2012-11-15,9683,Howie,Nick was a fantastic host--super helpful and made everything easy from checkin to checkout.  Apartment is a great 1 bedroom in a fantastic location.
719233,2897970,2012-11-16,3947960,Jane,"This was a great first time experience with airbnb and my stay at Nick's was perfect. 

It's a cozy apartment that was more than adequate. Nick was extremely helpful and friendly. The location is convenient to food and entertainment and we enjoyed walking around exploring the surrounding neighborhood.  I recommend staying here!"
719233,2936721,2012-11-21,3975786,Samuel,"Nick's apartment was my first AirBnB experience. Before the booking, he ensured that I had everything I needed and was incredibly responsive. When I arrived in Seattle, he let me borrow an umbrella (I know, I was going to Seattle and forgot one somehow!) and offered a few suggestions for places to check out in the Capital Hill area. Staying in his apartment which was tastefully decorated, roomy, comfortable was everything I expected. If everyone is as friendly and helpful as Nick, I would say my first (and certainly) not my last booking was a huge success. Thanks for making me feel so welcome!"
719233,2960981,2012-11-25,3755211,Matthew,"Nick was helpful, friendly, and very welcoming.  We did not get to meet in person but he was very easy to communicate with and even left a list of tips for places to check out in the area.  The apartment is in a cool area of Capital Hill and a short walk downtown.  Overall the stay was perfect and I would like to stay again if I am back in the area."
719233,2983866,2012-11-27,3495817,Amy,We had a great time at Nick's place! The location was fantastic and Nick was a friendly host. I'd recommend this place to anyone. Thank you Nick!
719233,3016399,2012-12-03,3958383,Holland,"Nick was a welcoming and gracious host who went out of his way to make us feel at home. The apartment is well-furnished, with a great location in Capitol Hill, and the Roku box is a nice touch. Next door to the apartment are a game room/bar and French creperie. Not bad at all. Overall, we were immensely pleased with our experience and will be returning again soon. "
719233,3028742,2012-12-04,3335374,Cassandra,"Nick's place was perfect for our stay. We were only there one night, visiting from Portland, looking for a warm bed and a good ""home base"" to explore the city. The location was amazing, walking distance to downtown and capitol hill! Pike's Place Market, coffee, food, bars, etc. Parking, although not provided was really easy and close by. The bed was incredibly comfortable and clean and Nick made sure we were aware of all the heaters in case we were cold. Very easy, friendly, convenient.  "
719233,3037434,2012-12-06,3652438,Stephanie + Michael,"Great location. Not quite as nice as the photos, but still an enjoyable stay!"
719233,3048775,2012-12-08,1964807,Chris,Perfect location in Capitol Hill. Really interesting space (a former motel). Nick couldn't have been more welcoming and helpful. Wouldn't hesitate to stay here again. 
719233,3054389,2012-12-09,4328317,Josh,"I came to check out a grad school and had never been to Seattle before. Nick went out of his way to show me around town and make sure I had everything I needed.

While the apartment is nothing fancy, it is clean and a solid choice for a traveler looking to get to know the city. I took the rail from the airport and got off at Westlake; the rest of the distance was an easy walk.

All in all, a good value and a great host. If you choose to stay here, time permitting, you should hang out with Nick. He's a great guy who has interesting thoughts on Seattle and life."
719233,3058272,2012-12-11,3871852,Daniel,"From the get-go, Nick was very attentive and made sure that he had all my travel info correct, but also that I had everything that I needed.  As for the apartment itself, it's well heated, has everything you need for a few people (I stayed by myself and found the size of the apartment more than adequate), and the location is pretty solid.  I was able to walk to downtown and to the bars in Cap Hill.  I'd recommend staying here and I will next time I'm in Seattle and need a place to stay in the Cap Hill area."
719233,3119286,2012-12-19,4186268,Sandra,"Nick was an attentive host, who checked in during our stay to see if we needed anything. The apartment is quiet, well heated, and comfortable, though not fancy. Great location! - convenient to many good restaurants (I could eat at Skillet every day), nightlife, and public transportation."
719233,3129183,2012-12-21,752859,Bronwyn & Ryan,"We had an excellent stay with Nick in apartment 307. Had the apartment to ourselves, everything was clean and comfortable. He was able to accommodate our later checkin at about 9pm and our early checkout of 6am. Was great to have the place to ourselves, complete with netflix and full kitchen with all the basics - coffee, tea, etc. Right between Capitol Hill and Downtown, super convenient location. Don't hesitate to book here."
719233,3133091,2012-12-22,3729722,Francisco,"Location is fantastic; right in the middle of Capitol Hill nightlife and within walking distance from Downtown as well!  Living room is spacious, kitchen is convenient, bed is comfortable, and Nick (the host) is very helpful."
719233,3141914,2012-12-23,677232,Vlada,"Our stay was wonderful, Nick was punctual in his responses it was very easy to access his place. Located in the center of the city in a funky part of town with lots of restaurants coffee shops and bars. We truly had an amazing time don't forget to access the little taco shop up the street."
719233,3146406,2012-12-24,4061597,Jasmin,"My second visit at Nick's place at Melrose Court in Seattle. The place is always super clean with Netflix and Wifi. The location is fantastic, very close to Pike Market and in easy walking distance to Capitol Hill. Nick also has some great tips on what to do in Seattle and some great tips on where to eat and drink. I totally recommend his place!"
719233,3178398,2012-12-29,3003442,Paul,"Nick is very easy to deal with, and this apartment is perfect for what we needed, somewhere to crash at night when we weren't exploring the city. Just keep in mind that this place appears to be a super old motel converted into apartments. My only beef was that the futon in the living room was probably less comfortable than a rock. That being said, the bed was comfy and there are heaters in each room. I would stay there again. "
719233,3251770,2013-01-03,2602951,Georgia,"We stayed over New Years at Nick's Melrose Court Apartment which was warm, cosy, comfortable, clean and tidy. We found the location to be perfect for what we needed and was within walking distance to great bars and restaurants as well as downtown which made our stay and seeing Seattle just that little much better. I would recommend staying with Nick as he is extremely helpful and really wants you to experience Seattle at its fullest!"
719233,3279207,2013-01-05,4059324,Zak,Nick is a good responsive host.  He was out of town while I stayed at his place so he put another person in his building in charge.  She was super helpful and dealt with our request to keep luggage in the room after check-out.  The place is in a primo location (you can walk everywhere and it is steps from the heart of capital hill nightlife and restaurants).  It is as advertised and the price is appropriate.
719233,3297699,2013-01-07,914663,Meiling,"nick is very easy to communicate with, and though he wasnt around when we came, everything was taken cared of so that we wouldnt have any problems getting to his place and checking in. the apartment is in a very good location, a rather nice walk to pikes market. transportation was also hassle free, and there was a supermarket nearby which was also very convenient. the house was clean in general.  could have used just a little bit more dusting, but it wasnt really much of a problem. overall, it was a very good stay and id recommend the place to anyone looking to go around seattle."
719233,3332125,2013-01-12,4345680,Carla,Great location. Included the basic amenities of an apartment without being pretentious.  Clean and met our expectations. We would stay here again if we ever visited Seattle again! 
719233,3349063,2013-01-14,4641270,Sarai,"Nick's place was clean and wonderful to stay in.  Close to many fun areas of town and although we didn't meet him personally, he was easy to work with and very quick to communicate with us making everything go smoothly.  He had a friend give us the keys and she was also super helpful and wonderful to work with!  I would definately stay in his place again."
719233,3441909,2013-01-30,189983,Jennie,Great location and space for the money! Very walkable to downtown area and felt safe.
719233,3480970,2013-02-05,4523688,Luc,"We were very pleased with the arrangements pre arrival and with the appartment itself. It is conveniently located (close to  atractions, bus stops nearby,restaurants, grocery) and provides adequate space for three people . (room 107 accomodates easily 2 people).  Good kitchen applicances and some stuff in the cubbard such as tea, coffee and peanut butter. Parking is a problem but can be managed wiht $10-$12 full day sites and off street parking; manageable over the week ends but some creativity required. Nick is extremely helpful:we forgot some stuff after packing in a hurry and he will send this ..and declined us paying postage... Highly recommended!!!"
719233,3515557,2013-02-11,4670176,Louise,"This was my first Airbnb experience and I was very impressed by the whole setup! Nick was a great host and prompt with his responses when I had a question. If you're looking for a place that's central to the different neighborhoods in Seattle, Melrose Court is a great option! I would definitely recommend it. "
719233,3529154,2013-02-12,1025392,Claire,"This modest apartment is in a great central location. Nicole, Nick's helper, was very warm and welcoming, and was helpful in orienting us. The apartment is basic, as Nick clearly outlines, so visitors should temper their expectations to match the listing. The beds were comfy and the unit was quiet, which was great. Everything worked as it should! There were a couple of minor cleaning issues, which I understand Nick is currently correcting. "
719233,3566515,2013-02-18,4018978,Marlene,"We visited Seattle for the NASP conference in February and we had a great time (sorry for the late post). We really appreciated how helpful Nick was before our arrival, he always answered emails promptly and gave us a lot of information. When we were there Nicole was very helpful, she pointed out the great coffee shop around the corner (Bauhaus) and even walked Katie to the convention center on the first day. She was available for late check-in and was always helpful when we had questions.
We enjoyed the location of the apartment very much, which made us very independent of public transportation. It was also well heated and cozy, and we enjoyed how silent it was. 
Some minor cleaning issues were discussed with Nicole directly and we are sure that that's not an issue anymore since a month has passed. 
Marlene and Katie :)"
719233,3594649,2013-02-20,1931732,Stephanie,"Nick and Nicole are both very accommodating. The place is centrally located in Capitol Hill where everything was. The place does need a bit of a clean up. Very dusty and bathroom was somewhat dirty. The bathroom door also had problems closing fully and required a huge force to close and open it. Overall, the apartment had everything you needed for a weekend getaway minus free parking, which wasn't an issue for us since we traveled by foot and public transportation. 

Thanks Nick and Nicole for all your help! "
