listing_id,id,date,reviewer_id,reviewer_name,comments
2693137,20983073,2014-10-08,6031189,Uday,"Home is a place where you can come back in the evening and relax. 
With the home theatre, the comfy sofa, the great view out the window and the pets, home is exactly what the place feels like.
Mark is a friendly guy and I enjoyed chatting with him.

Elizabeth needs a separate mention. 
If you like cat's, you will LOVE elizabeth ! She is one playful cat who will come running to you the instant you sit down on the sofa !

P.S, Seattle isn't on a plain and there are many slopes around the city. Mark's beautiful  place is on the top of a slope (hence the views). So if you have heavy baggage with you and are taking the bus, avoid taking any of the (phone number hidden) irrespective of what the maps suggest.
The #25 is your best bet and stops very near the house."
2693137,21273948,2014-10-13,3212016,Tina,"We were greeted by a friendly Mark and his furry side kicks Luke and Miss queen kitty ...nice place, comfy sleep.  Thanks for having us last minute. "
2693137,21371394,2014-10-15,21652717,Story,"What a great experience, Mark was very helpful and very friendly.  I would quickly recommend staying here to any of my friends.  "
2693137,21571554,2014-10-19,21507337,Hilke,"Thank you, Mark, for hosting me.

This is a beautiful place and a great spot for a calm night and a good sleep. And definitely a great view!

You are an easy going host; thank you for a good talk. "
2693137,22054248,2014-10-28,22931917,Luwam,"I absolutely loved my experience in Seattle-thanks to Mark! He was an amazing host and has an awesome apartment in a cute part of town. I enjoyed a neighborhood run and a cute, cozy coffee shop nearby. There are also buses conveniently located near his spot!"
2693137,22220273,2014-11-01,23083545,Blake,Mark was great!! He was very acomidating. It was a privilege to stay is this home with suck a wonderful view!!
2693137,22661002,2014-11-11,8290469,Michael,Mark was a great host. He played provided some useful information about places in the area. The fold-out bed is really very comfortable. I had a good time and would recommend this spot if you need a place to stay while visiting Seattle 
2693137,22991355,2014-11-19,23342924,Quoc,"This is my first time booking through airbnb and was a little hesitant just because I like my own privacy. For a cheap rate, I couldn't pass this opportunity up. I am glad I booked the Bnb with mark. Mark and River were the most friendly person I've ever met. I was new to Seattle, but mark provided many great suggestions for places to eat and things to do. Will definitely recommend staying with mark if you are looking for a place to crash in Seattle. "
2693137,23141693,2014-11-23,23176162,Franz,Mark is an awesome host! We got great tips from him and if you are looking for a cheap shared space then it's definitely the place for you! 
2693137,24181035,2014-12-22,3860412,Phanos,We had a wonderful time in Seattle. Mark was an excellent host and his home was lovely. The home was in a great location and I definitely recommend staying with Mark and River if you're ever in Seattle.
2693137,27311713,2015-03-01,25869411,Dean,"Experience was positive, Mark was very friendly, place was clean and in proximity to Lake Union and downtown. I recommend staying at this property."
2693137,28889099,2015-03-31,27367780,Emily,"I can't say enough good things about my experience with Mark and River. They both made me feel very welcomed and helped me quickly adjust to a new city (teaching me about the different areas, bus routes, music festivals etc etc). Their home is in a great area with a fantastic view and some very sweet animals. I truly only have positive things to say about these two and my time staying with them - Thanks, guys!"
2693137,29078995,2015-04-03,8215821,Andrew,"My girlfriend and I had a lovely time at Mark and River's home.  The pets (kittens and a dog) were adorable.  Mark and River were quiet and sociable.  We had a great trip!  
"
2693137,30108106,2015-04-17,22172481,Laura,"Mark was extremely accommodating, especially considering I had initially booked the room for the wrong date.  He was flexible and thank goodness the place was free for the date I actually needed.  The room was clean and offered everything I needed and the view of Lake Union is amazing.  "
2693137,30415758,2015-04-21,16303735,Sebastian,I had a great time in Seattle thanks to Mark! He was a great host and provided me with info on what to do and see! His house is clean and well decorated. The view from the living room is spectacular!
2693137,30645606,2015-04-25,2294171,Ro,Mark & River were great hosts - their apartment was exactly as seen in the pictures. Mark and River were also nice to offer a beer and chatted  with me during my stay. They made my first visit to Seattle very pleasant. Hope to be back in Seattle soon! 
2693137,30750904,2015-04-26,30912823,Nichole,"Mark was very friendly and helpful. We had to find a place last minute and he quickly responded to our request. When we showed up the place was a bit disheveled, but that could have been due to having unexpected overnight guests. We also ended up having to cancel one night, and he was flexible and understanding. He gave us a lot of recommendations on places to visit in the area, as neither of us had been to Seattle before. Also, the view is pretty amazing!
I would add that we knew beforehand that a cat lived in the apartment but when we showed up there were also three kittens. So if you're not a cat person, this probably isn't the place for you. His dog Luke was a sweetheart though. "
2693137,31156013,2015-05-02,32077365,Jono,"Mark was very accommodating and friendly. Great view, nice vibe. "
2693137,31481432,2015-05-05,18002293,Daniel,Mark was a very nice host. His home is a very comfortable place in a beautiful neighborhood. Easy to go to downtown by bus. My girlfriend and I enjoyed very much our stay. Thanks a lot Mark!
2693137,32086116,2015-05-13,3742835,Willy,"I loved my stay at Mark's Apt, Mark keeps an incredibly clean and welcome place for visitors.  The apartment is in a great part of city close to bars, restaurants and the lake view is awesome.  I intend to come back to Seattle, I would definitely work with Mark again."
2693137,32831720,2015-05-22,31552597,보미,"이 곳은 접근성이 좋다. 왠만한 곳은 도보로 가능하기도하고(10분에서 1시간정도) 주요거리들을 지나다니는 왠만한버스들은 다 지나가기때문에 교통편이 편리하다.

처음부터 끝까지 마크와 리버는 우리를 친절하게 대해줬고 전혀 우리생활에 지장을주거나 불편함을 주지않았다. 시차가 거의 반대인 나라라 우리가 새벽에 잠을 못이뤄서 불편하기도했을텐데 그들은 우리에게 전혀 불만도 없었다. 

불편한 사항들을 이야기하면 바로 도움을주었고 이 곳에 있는 듬듬한 강아지 루크와 매력적인 고양이 엘리자베스는 항상 사랑스러웠다. 

비가올때나 날씨가 좋을때나 전망이 좋은것이 가장큰 장점이다. 집주변에 카페나 식당이있고 간단하게는 샌드위치가게도있다. 그리고 집앞에있는 마켓이 한국인이 운영하던 곳이라 더욱 좋았다. 

다음번 시애틀이 갈일이 있다면 다시한번 이 곳에 머물고싶다. "
2693137,32927993,2015-05-23,26870954,Greg,"Mark and River were great hosts!  I will stay again in June and am looking forward to it.  The apartment is modest but clean, very convenient, with a great view, and a great value over a hotel.  Very close to downtown and UW campus, in the very cool East Lake area. My room and bed were comfortable, the shower was hot, and the fruit they shared was delicious.  I got to experience a great new neighborhood and meet some new friends, something that would not have happened in a hotel!"
2693137,33286476,2015-05-26,16681637,Ying Qian,"My bf and I had a wonderful stay at Mark's place. The apartment is clean and the location is great. You can see the lake and Space Needle from the window. Mark gave us some great travel suggestions, and River made us delicious hot tea. The kitty was friendly and so adorable. "
2693137,33537128,2015-05-29,29246333,Kyeong Rok,"Mark and River very great host in seattle! mark's house is so comfortable, clean, so beautiful! and their cat Elizabeth, dog luc are great mate in seattle. Mark and River gives me great memory of seattle. talking with me long times, give me information of seattle tour, and they recommend seattle's beautiful tour spot! if i going to seattle again, i will going mark's house again. thanks Mark, River! "
2693137,34708404,2015-06-11,6900216,Vilma,"The view over Lake Union was even more amazing than described, and Mark was an excellent host! Communication was easy and fast, and Mark was very easy-going and helpful when needed. River and the pets were nice too. I had a lot of freedom coming and going when I liked. Location was good, and it was easy to get to Capitol Hill / downtown / University district by buses. I can sincerely recommend this place! "
2693137,34875246,2015-06-13,26870954,Greg,"Another great stay with Mark and River.  They are very warm, welcoming, and make you very comfortable.  The fresh cherries were delicious and the Jelly Belly's a nice treat.  Their location is so convenient and there are great coffee places, restaurants, and convenience stores a short walk away."
2693137,35090387,2015-06-15,1969799,Kristal,"Mark and River are lovely. The place is clean and comfortable, and the view from the living room is gorgeous. I wasn't there often, but I encountered no problems in the time I was there. I'd certainly recommend staying here if you're visiting Seattle."
2693137,35662992,2015-06-21,4220772,Bruno,"Mark and River were very kind and welcoming. The room was clean as well as the bathroom. The apartement is close to public transportation and interstate 5. At night, we would suggest to turn the fan on in order to mask noise coming from I5."
2693137,35892923,2015-06-22,36165379,Philip,"Mark and River were very acomodating when I needed somewhere to stay at short notice. They were very hospitable, and their kitten was adorable"
2693137,36033549,2015-06-24,9688138,Magdalene,"Mark and River were very hospitable to my boyfriend and I. Mark had many good suggestions to give for Seattle. We really enjoyed our stay at their place, a real plus point too if you're an animal lover. Their poodle luc and their cat are both adorable. "
2693137,37170868,2015-07-05,33748802,James,"Mark was a cool, easy going guy with cool pets. The spot was nice and cool, and the view was great. "
2693137,37436565,2015-07-06,33591593,Chelsea,"Mark's home was very quiet and cozy. We didn't see him much but he provided us with everything we would need for our stay. Particularly loved the cat and dog -- neighborhood was very cute and green, and had a good breakfast place nearby. "
2693137,37506717,2015-07-07,9689563,Erin,"Mark was very welcoming, lots of ideas of places to see and things to do.  Loved his dog and cat too!  Mark was great about helping us find the place and feel at home.  "
2693137,37570299,2015-07-08,1454561,Darlene,Great location and neighborhood. A bit tricky to find as Google maps seems to not find the address but once we got there it was no problem. Free parking on site was great. Mark and his partner were helpful and checking in was super flexible and easy. He gave me some things to check out in town and great place to go for breakfast. Their kitty Elizabeth is such a cutie pie we fell in love with her. 
2693137,37698780,2015-07-09,26859584,Jennifer,"Mark and his husband River were great hosts. Their apt was very clean, quiet, and we were welcomed home by the cutest little kitten. "
2693137,38269600,2015-07-14,8714571,Zac,"Mark and River were very welcoming, and the kitten greeted us with joy each time we came through the door. Mark had many good suggestions to give for Seattle, and invited us along for a night out. We really enjoyed our stay at their place: the location is wonderful for everything we wanted to do, and easily accessed without a car. The view is amazing and can't be adequately captured in photos. "
2693137,38651762,2015-07-17,37714366,Ayaka,His hospitality was pretty good :) I had a great night. I would love to come back!
2693137,38733499,2015-07-18,6862643,Chandler,"Mark and River were so welcoming when I stayed with them. Their pets are also equally as welcoming! We didn't stay for very long, but enjoyed it nonetheless. "
2693137,38951795,2015-07-19,38480996,Anne,"Sorry to say, our experience wasn’t good and I wouldn’t recommend this place to friends. I originally asked for my daughter, her husband and their 3 month old baby. The listing said “kid friendly” and Mark was most friendly and encouraging that the baby would be welcome, so we confirmed. Fortunately, because of an afternoon event that conflicted with check-in time, we picked up the key early. Seeing that there was not enough room for a baby, two adults, and their combined luggage, my husband and I switched accommodations with my daughter. 

When we returned in the early evening, no one was home. With a fan on, the power blew in the bedroom when we tried to turn on a light. I called Mark, who said he’d fix it, and we went out. I’m sure Mark and River are very nice and helpful, but we barely saw them. They arrived just after midnight, thinking that they would get there before us to fix the power outage. We were on our way to bed. I’m capable of flipping a circuit breaker, but it’s hard to hunt for a fuse box in the dark. 

It was a very hot weekend, and things happen. But I was disappointed again in the morning when I found the kitchen sink so full of someone else’s dishes, pots, pans, etc. that I couldn’t get my water bottle under the tap to fill it. (Rule #1: clean up after yourself in the kitchen!) We left by about 8:30 with no sign of our hosts.  

The inside of the apartment, sheets and towels were clean, but cluttered, with no place to sit in the small bedroom and only an open futon to sit and enjoy the view, the featured draw of the location. This may be OK if you need a clean bed and don’t mind the freeway noise, but not if you expect a bit more.

Recommendations to Mark:
1)List the correct apartment number and get the locks fixed – took us quite a while to get the doors open. After a while, I saw that the door was a different number than listed w/airbnb, so we tried the other apartment – no luck. We then returned, knowing that the “décor” on the floor outside your apartment was distinctive and had to be correct.
2)Provide guests instructions for “free parking”, that was not obvious, ahead of time. If the “back alley” is best, it would have been good to have directions for how to get there and how to get from the alley into the apartment
3)Would be nice if you could get the carpets cleaned. That was a real turn off.
4)Clear the clutter from the rooms (including picture frames between the bed and the window wall) or be honest that the space can only sleep two with only a small amount of luggage. And warn guests about the power!
"
2693137,39138659,2015-07-20,35378183,Yoav,Great apartment in a great location with great hosts! We got a lot of good tips and suggestions to where are all the cool places. Very clean and nice apartment with great view
2693137,39315684,2015-07-22,37261768,Molly,"Mark and River were excellent hosts! Mark  gave us tons of pointers on where to go in Seattle.  Walk to the space needle was not bad at all, very flat and the weather was perfect for it. Their pets couldn't have been any sweeter. Great experience, would absolutely stay with them again!"
2693137,39415981,2015-07-23,33613541,Daniel,"My girlfriend and I spent one night with River and Mark. We actually didn't see Mark as we came home kind of late and left early. The apartment is as nice as shown - everything was great. River was nice, the pets were nice, the space was nice.  A good first airbnb experience.  If we had to pick something we didn't like it would be the proximity of the highway, but that didn't bother us."
2693137,39730253,2015-07-26,18659397,Erina,"Mark was a great host! Whenever there was a concern he was easily reachable, and he warmly welcomed us into his home. The location is quiet and close to bus lines. It is also conveniently located near the entrance to the highway, making for a stress-free drive to the house! Also, his cat is truly the best cat I have ever come into contact with :). "
2693137,40137520,2015-07-28,4870756,Maura,"Mark and River were absolutely accommodating and delightful. We had poor communication in contacting them, yet they still were prepared for us. I appreciate their presence in the house, and they have a gorgeous view!"
2693137,40334409,2015-07-30,2610294,Franziska,"We had a good time at Mark's house. Mark was very friendly, helpful and we had a nice chat with Mark. His cat is very very cute. :)
To downtown it's about 3 miles. You can walk or you can take the bus. The public transport system in Seattle is not much as good as in other city but if you have a bit time than it is ok. In the neighborhood there are a few restaurants."
2693137,40516822,2015-07-31,3286185,Eric,"I enjoyed my brief stay with Mark and River. Their place is comfortable, clean, and quiet; the location is well-served by public transit."
2693137,41206439,2015-08-05,3515152,Daniel,Mark and River have been responsive and helpful in catering to my various requests.
2693137,41733905,2015-08-09,30848928,Man-Ted,Great host and was very accommodating to when my friend had to crash with me for a night and my other friend showing up the next day. Clean place and friendly pets
2693137,42413240,2015-08-13,37277157,Emma,"Mark I use Chinese to write reviews, because the Chinese to express my gratitude to you.Mark和他的丈夫是一个非常好的房东，西雅图是我们这次美国之行最喜欢的城市，没有之一。我们抵达西雅图的时间稍晚，但Mark还是来机场接了我们，并且在我们没抵达西雅图之前，想办法帮我们安排车辆去波音公司，这是非常棒的，特别热情与热心。昆明小哥（可以这样形容吗），我们有看到你的画，是要多么细心的人才能画得那么精致，虽然很想开口让你送我一幅，因为真的太漂亮了。谢谢你们俩对我们的照顾，下次西雅图再见。"
2693137,42669785,2015-08-15,33019540,Joppe,"We stayed for two nights at Mark's place. The house itself is perfect, with a very impressive view over the lake. The room is clean and the bed is nice.  The location is great too, you can easily walk to downtown and capitol hill  (great for food) is even closer.  Mark knows a lot about the direct area as well a the rest of the city. We followed some of his suggestions and all of these were perfect. 

Would recommend a stay here to everybody and wouldn't hesitate to book again."
2693137,42898780,2015-08-16,15150723,Jordan,"Mark and River were amazing and accommodating hosts, the view was even better than advertised and especially beautiful at night. Mark's restaurant recommendations were spot on, and the pets were both adorable temporary companions!"
2693137,43245737,2015-08-18,34231385,India,"Mark and River were the cutest, nicest, and most welcoming hosts! Even tho we were only there to shower and sleep we felt right at home! They have a gorgeous view of Lake Union and the apartment was very cozy. Transportation to and from was very accessible. We would highly recommend people to stay here and will hopefully be returning sometime in the future!"
2693137,43963874,2015-08-23,24877336,Amaury,"Mark was very accommodating for our late arrival. Apart from the rapid chat that we had to welcome us in, because of his timetable and our plans, we actually did not see him at all for the two days that we stayed.

The pictures represent well the place, which is conveniently located. We walked most of the time."
2693137,44908182,2015-08-30,15194978,Heather,"Mark was very welcoming - he was home to greet me and got me settled in my room and answered my questions about all things Seattle  where to go, how to get there, etc.  Eastlake is a great neighborhood, I felt safe walking alone at night as a solo female traveler.  "
2693137,45308184,2015-09-01,28338667,Tara,We had a great stay in Seattle! Mark's home was clean & cozy. He made us feel right at home & offered lots of great suggestions for eating & sight seeing. The view was amazing & the location was an easy bus or Uber ride to everything we wanted to do.
2693137,45498766,2015-09-03,33652093,Martin,"Mark and River are nice guys and gave me a warm and easy going welcome. Parking is no problem at all, the bed is cozy and the room is quiet. Don't worry if you read that interstate is very close by. You will not notice if you close the window.
The view from their apartment is simply breathtaking.
Special thanks to River with whom I spent a couple of hours tasting beer and laughing.
You'll find everything you need within 5 minutes walking: breakfast, diner, beer.
Do not hesitate to get in touch with Mark and River if you want to spend a few days in Seattle."
2693137,45569806,2015-09-04,14521550,Jewel,"Check-in was easy, bed was comfy, and view from the living room was amazing. Close to two bus stops (one is at the top of the hill and one is at the bottom). Has one very cute dog and a tiny kitten. Thanks Mark and River for a great stay!"
2693137,45662301,2015-09-05,35711242,Kirsten,River was there waiting for me when I arrived. He was very nice and welcoming.  It is a good place to use for a quick overnight stay in Seattle. 
2693137,46754029,2015-09-13,41375518,Stacy,The neighborhood was a great location. Super close to main attractions. Mark and River were very friendly and accommodating. They told us about an underground tour that we did that was so fun and we wouldn't have known about it otherwise. The space was clean and quiet. I would stay again. 
2693137,46983963,2015-09-14,43451459,Julian,"Host Mark was welcoming, and the view and the friendliness of the pets were certainly as described.  However the listing could be clearer that what is offered is simply a second bedroom in a small condo, and that the bedroom does not seem to be reserved for visitors nor particularly set up for such use. There were, for example, no side tables or reading lights, and hosts' personal items remained in the room. Visitors share the bathroom with hosts, and in spite of best intentions, it is hard not to feel constrained to avoid the kitchen or living room as long as those are also in use by the hosts.  The bed is a double, but surprisingly noisy, so that every movement by one occupant tended (in our case) to wake the other.  In general this accommodation is best for friends of the hosts, and less ideal for strangers."
2693137,47151145,2015-09-16,10441726,Colin,"Mark was helpful in responding before arrival.
His cat was not willing to give me the room and hid under the bed.  As soon I lay down the cat jumped up on me... Had to keep the door closed. It is by a very busy freeway however the noise is regular. "
2693137,48286496,2015-09-25,38718900,Jinseok,"Mark's feedback of my question is so fast & kind. 
The place is so peaceful & comfortable.
As you see, the window view is so good. (I see the view so long, every morning & night)
I couldn't meet with Mark, but River is welcoming me & so kind all the time.
Because of Mark & River, my first impression of Seattle remained in my mind! Nice holyday! Thank you! May meet again^^"
2693137,48722606,2015-09-28,41419484,Scott,It's a neat little apartment in a great location. We came and went as we pleased. The cat and dog were very friendly. 
2693137,48923952,2015-09-29,25006617,Sankar,"Mark and River were very friendly and hospitable, they were good in communicating before and during my stay and easy to talk to. The house was in good condition and in a great neighborhood, I enjoyed my stay at their place. "
2693137,49154814,2015-10-01,7467435,Chris,The short stay with Mark and River was great. The place is clean with a great view of the river. The dog and cat are very friendly.
2693137,49637699,2015-10-05,5905641,Andre,"The place has a fantastic view on the lake and the space needle. Mark was very kindly and help us for everything (even some medical advices). To reach the pike place market amd downtown, it's easy with a bus line 200m from the appartment. 
And it's true, the cat made us her slave!"
2693137,52261152,2015-10-27,3474026,Chris,"Mark and River are amazing and friendly hosts. It was great to end the days chatting with them and their pets. He had good recommendations on what to check out in the city, and the view at their place is indeed amazing!"
2693137,52599595,2015-10-31,13573799,Steven,"Mark and River are awesome hosts! Super friendly and very accommodating when we first arrived. The view, as everyone described, is beautiful. I was out of the apartment for a majority of the time, however it was always nice to come back and chat with Mark or River about the day.

The bedroom itself was just enough room to unpack and relax. The bedroom, bathroom, and overall apartment was clean. Since I went to visit people in UW and did tourist attractions downtown, the buses by their apartment was extremely convenient. 

Last but not least, Luc and Queen Elizabeth were the starts of the apartment. My friend and I enjoyed playing with them everytime we got back. Super friendly pets and hosts :) Overall, if I'm in Seattle again, I'd definitely stay at Mark and River's!"
2693137,54226249,2015-11-16,5548765,Stanislav,"Amazing hosts, great location (40 min walk to downtown)"
