listing_id,id,date,reviewer_id,reviewer_name,comments
719233,25424533,2015-01-15,468964,Simran,"The apartment was clean, centrally located, and parking wasn't as bad as I might have thought. The place is pretty close quarters and not terribly cozy but the location is great so you won't likely spend much time in the house anyway. There was an issue with the hot water heater while I was there and Nick was very quickly able to get me access to another apartment with working hot water. "
719233,25551533,2015-01-19,1270317,Gabriel,"This apartment is in a great location in a very hip area of town.  It is within walking distance to many tourist attractions (walked to Pike's Market for example during my stay) as well as tons of nightlife.  It also is near many convenient places, including a convenience store, a great pie place, and a bar/arcade.  The apartment is a budget apartment, and that's reflected in the price, since I wasn't planning on spending much time in the apartment itself, that worked out great. "
719233,25838288,2015-01-27,22238259,Nicole,"I liked how convenient the check in/out process is with the lock box right outside the door. The reviews don't lie, street parking is really hard but thankfully we only had trouble 1 of the days we were there. And 1 other thing, there was absolutely NO hot water. Other than that, the place was clean, comfortable, and in a great location. Thank you for having us :)"
719233,25939001,2015-01-30,8010603,Robin,"The location was so much better than we expected. We basically walked everywhere - a mile to pike place market, a few blocks to good restaurants and coffee houses. The apartment would have been perfect for two. It needs a new sofa bed for the third person. We had water issue but Nicole and Nick responded quickly."
719233,25965152,2015-01-31,7119177,Thomas,"Great crash pad in a cool location. If you're staying for a day or two, this will be a good spot if you are looking for a night life. If you plan on staying longer, you'll probably want a bigger place. Nick was great and very accommodating. "
719233,26120438,2015-02-03,11675778,Brad,Check in was very easy and communication was great. 
719233,26321754,2015-02-09,16600641,Aaron,"This apartment is the ideal place to stay in Seattle. It's a walking distance to many restaurants and bars, or you can get a 3-5 minute ride to the Space Needle or Pike's Market. So many good restaurants around the area. I think we gained 5 lbs during the 3 days we were there. 

Although the apartment is small, it is cozy and a great place to sleep and shower. The apartment is ideal for 3 people. 

Check-in and check-out process was very simple; just take the key from the lock box to check-in and put it back to check-out. Nick and Nicole are only a text away to answer our questions and concerns. We didn't have any issues, because the place was clean and everything was in working order. 

I would recommend people to stay here! I'll book this place again if I ever go back to Seattle. Thank you, Nick and Nicole!"
719233,26469486,2015-02-13,1550538,Aaron,"Cool place in a great neighborhood. Pretty rustic, but great value. And clean."
719233,26602018,2015-02-16,4660619,Lizette,"The location is very central. Walking distance to anything relevant in that district. The place was equipped with all the basics and more like extra heater and blankets and pillows. I recommend the unit for quiet guests because the complex is pretty quiet itself.  A bag of ice comes in handy as there is not real freezer. Didn't like that they left used shampoo and conditioner in the shower! Didn't smell pleasant, it smelled like wet laundry! Old TV didn't work good. The mattress pad needs to be replaced it looks very old and unsanitary.  "
719233,26956988,2015-02-22,4979767,Roger,"The place was warm and bed was comfortable. Surprisingly quiet, for being right in the middle of town, and close to transportation. plenty of food, coffee, and nightlife options within walking distance, bus close for all others. instructions were timely and clear, the candy was a nice touch, thanks"
719233,27260248,2015-03-01,26220719,Brendon,"I had a great stay in Seattle thanks to Nick and Nicole. Nicole was very helpful during the check in process and ensured we enjoyed our stay. Listing was 100% accurate.

The location was great. Within walking distance of a local grocery store and some awesome bars. I particularly enjoyed the 21-and-over arcade/bar that is literally right around the corner from the apartment.

I would definitely stay here again and I highly recommend this apartment to anyone looking to experience Seattle from a local's perspective. And for the money, this will be the best deal you can find for how perfect the location is."
719233,27381674,2015-03-02,670637,Pablo,"Nick's appartement is perfect and is all we were expecting. The neighborhood is really fun and yet the flat is very quiet and confortable. Nicole who we were in contact for the reservation was really easy to reach. When I go back to Seattle, I'll definitely ask Nick to stay in his flat again !"
719233,27483698,2015-03-05,6258840,Cari,Apartment was in a good location and perfect for my travel needs. If you're wanting easy access to downtown and exploring Capital Hill it's a good spot. 
719233,27765147,2015-03-11,7019848,Jessica,"The location is great - it is so close to everything you could need. The apartment is perfect if you just need a place to sleep and store your things. It is very comfortable and quiet, albeit a little bare bones. I would definitely stay here again."
719233,28017691,2015-03-16,24500052,Erin,The perfect location to everything with Amazing restaurants all around. We spent much of our time in Seattle out and about so we mainly just slept there. The TV is cool because it's adapted to so many different movie and TV show channels. The bed isn't extremely comfortable but it did have a great amount of pillows. Host was very curtious to us while we were checking out. 
719233,28108273,2015-03-17,20283594,Kyle,Very easy to get in and out of.  Nicole made the experience effortless and I didn't mind the stairs one bit.  Had a great trip.
719233,28306887,2015-03-22,26534333,Shane,"I never met Nick or Nicole, but they were always clear and kind with communication.    The neighborhood was alright, not bad for downtown Seattle.  They were quick to respond to any issues we had and the place was clean and workable, especially for the price!  A couple of issues like the only bathroom being right next to the bed and the internet sometimes not working, but overall it's a nice place!"
719233,28448210,2015-03-23,20487427,Samira,"This place worked out great for us! We wanted to go to the Starbucks Roastery and it was five minutes walking distance. The parking wasn't too bad, we ended up paying for about 2 hours of parking since we arrived on a Saturday and then parked on the street for the rest of the trip and walked. Everything was really convenient and it worked great for having 3 people there. Nicole was great, and got back to me pretty quickly. I couldn't figure out how to keep the shower at a ""perfect"" temp, but that wasn't' a big deal. There's a pad for the pull out bed which was really comfortable and it was nice and warm. When we got there we opened the windows it felt like it needed some fresh air, and then we closed them and it was still warm. One way to describe this was: easy, convenient, and efficient. Thanks guys."
719233,28553973,2015-03-26,22698111,Kelvin,"Great place to stay in, apartment was well kempt and equipped with necessary amenities. Thanks!"
719233,29042233,2015-04-03,27238455,Jeremy,"Listing was alright, although I have to admit, the apartment was not quite what we expected. The wifi was absolutely awful. Walkway/outside portions of the building all smelled like smoke. A few minor things could have made the space seem much nicer, such as replacing the rusted fixtures in the bathroom or removing the burnt heater panels. Nicole was great though, very responsive when we had questions. It was also surprisingly quiet for the area, and a fun neighbourhood. All in all it was a good stay, we just felt like the pictures made it seem nicer than it actually was."
719233,29383404,2015-04-07,25476033,Molly,Check in and out was very easy and the apartment was well stocked and furnished. It was within walking distance of everything I needed and had some good food in the area. 
719233,29764884,2015-04-12,6343361,Sam,Nick provided a detailed check in itineary and enabled me to check in a little earlier than expected. The location of the apartment is good and within easy access to buzz of Capitol Hill.
719233,30020503,2015-04-16,24937652,Patrice,"Nick et Nicole nous ont bien informé des démarches à faire pour se rendre au logement, l'axcés et relativement simple à partir du tram-rail,il faut compter 600m à pied. L'emplacement est correct,et calme. L'immeuble n'est pas récent et même surprenant. La surface est bonne pour 3.
- il serait bien de rajouter une passoire pour les pâtes,et 1 ,ou 2 saladiers."
719233,30126687,2015-04-18,13076057,Kimbear,"The best thing about Nick's apartment was the location. It is very central and walkable to lots of restaurants and bars. However, we had a bit of a communication mix-up when we first arrived, which was resolved relatively quickly thereafter. Overall, it was a positive experience."
719233,30444582,2015-04-22,27474984,Kate,"Communications for check in, home use and check out was timely and clear. I felt like I had all the information I needed at the right time. The apartment is quite small and a little musty, but comfortable and safe. The only drawback was the sketchy wifi. The lack of reliable internet access really changed my weekend's productivity. But the location is incredibly central to the heart of downtown and within walking distance of nearly everything we wanted to see. I recommend the apartment and I would stay there again."
719233,30769283,2015-04-27,28090952,Cindy,The appartement was great. Just what we needed en really good located.
719233,31246772,2015-05-03,11996380,Erin,Good location for people wanting to explore Capitol Hill.  No frills accommodation.  Check in and check out was no fuss.  
719233,31509364,2015-05-06,11264318,Joey,"Details on check in were spot on! My GF and i were very satisfied with the stay. I needed to store my bags on check out day for a few hours and Nicole helped make it happen even with late notice. Located walking distance to an arcade bar, night life, shopping, restaurants, and of course Pike Place. "
719233,31814455,2015-05-10,1314071,Samantha,"Like everyone else has said before me, check in was a breeze.  The place was perfect for the three of us.  The location was the highlight.  We were near a lot of cool bars like The Pie Bar and a speakeasy called Knee High Stocking Company.  We were easily able to walk down to Pike Place Market.  We parked in the lot near the Apartment which was a little pricey, but much better than worrying about whether or not we were going to get a ticket.  The place was a little dusty, but nothing to really complain about.  For the price of the place compared to all of the overpriced hotels, this is a steal.  "
719233,31946345,2015-05-12,27039717,Cynthia,"Great location just minutes walk from downtown. 

Checking in and out was very easy and straightforward. 

The apartment itself was basic but adequate, not the kind of place to hang out in for extended periods but if you just need a place to get clean and sleep then it's perfectly fine.

Only real negative of note was the wifi as some others have also mentioned. We had problems with it the whole time and found it basically unusable, probably due to there being no dedicated router in the apartment. 

Communication was mainly excellent and responses usually very quick.
"
719233,32464228,2015-05-18,27226207,Andrew,Couldn't have picked a better place to stay while visiting Seattle. Situated in the perfect neighborhood. The apartment is cozy and clean. Easy to find and get in and out of. Highly recommended. 
719233,32914903,2015-05-23,10546751,Philip,"Although I never got to see the host directly, she was very easy to get in touch with and very helpful. The place was clean and everything worked as expected. I've lived in Seattle before so I knew this was a great location."
719233,33089990,2015-05-25,13308495,Dimo,Place was little outdated but great location and price. Hosts were responsive and accommodating for early arrival.
719233,33390283,2015-05-27,14769065,Regina,"We were looking for a clean and cozy spot to rest/sleep and this place was exactly that. Capital Hill was awesome so we were in a great location. Checking in was a hassle though. The lock box was jammed and my friend had to wait for nearly an hour for Nicole's friend (Nicole was away on vacation) to get her keys to the apartment. We also had some trouble later with getting a key to the apartment building (was not given with the apartment keys initially), BUT it was smooth sailing after all of that was sorted out.

Like others already mentioned, the wifi was pretty terrible. We couldn't use it at all during our stay.

Communication was easy, even with Nicole being away on vacation- her responses were still fairly quick."
719233,33482852,2015-05-28,33941089,Brenna,"I had a lovely experience at this place! The neighborhood was great, the apartment was clean and very pleasant. I would recommend it to anyone!"
719233,33790563,2015-06-01,26969392,Zac,"This spot served my needs perfectly. Situated among some of Capitol Hill's hippest joints, adjacent to the Downtown scene, I would happily book this apartment again. No red flags."
719233,34228459,2015-06-06,3389011,Aaron,The apartment was just as described and the price was great. We only needed to stay a night and this place was in an excellent location. Would definitely stay again! 
719233,34699745,2015-06-11,30152509,Barry,My two adult sons and I stayed here for 4 nights. It is a great location (close to downtown and two blocks from grocery store) and the apartment met our needs very well. The hosts were very responsive to our questions. 
719233,35077636,2015-06-15,30320468,David,"This is a great spot for a couple or a single person. The location is great as it's right in the middle of a lot of spots locals like to hang out at and only about $5-$10 cab ride to downtown. If you're going to Pike Place I would just take a ride to downtown and walk the remaining 5-6 blocks as traffic gets bad the closer you get to it. The apartment is clean which is about all I ask for as I tend to spend as little time as possible in my living space while traveling. If all you need is a clean bed, bathroom, and decent kitchen then this is the place for you. "
719233,35356073,2015-06-17,35041341,Michelle,The room is quiet and comfortable. And the best thing I love is the location. We can walk to the Pike Market.
719233,36005754,2015-06-24,4782153,Kristel,"Listing was accurate, place was good. Great location, we walked to almost everything and lots of bus routes crossed the area."
719233,36263374,2015-06-27,28722657,Huanjing,"It was good stay overall, however both of the internets did not work. Check in and out process was easy. "
719233,36845159,2015-07-01,37006040,Cheyanne,Cute place.
719233,36947558,2015-07-03,5668273,Raveena,Excellent location. It was walking distance to the to Pike place and the Starbucks roastery. The apartment was a little hard to find at first but it was big enough and very clean for the two of us. 
719233,37461886,2015-07-07,31254903,Eric,"Had a good time at Seattle, Washington for 4th of July weekend, and being at a central location contributed to that experience.  The pictures are completely accurate except for the couch.  There's now a collapsible Sofa Bed instead of a fold open sofa bed.  It's semi comfortable, but acceptable comfort level.  The bed in the bedroom was comfortable, and I slept like a baby.  Though, a lighter sleeper might hear the neighborhood if it's rowdy, as it was for me since it was the fourth of July weekend.  It was hot, so we had to keep the windows open, equaling high accessibly to the street noise.  

If I had to be nitpicky, the wifi was spotty and slow.  outside of that, Nick's place delivered as advertised, and in a big way on it's location.  20 min walk to everything, and lots of food and bar choices close by.  Grabbing a morning Coffee was just up the street and convenient.  

If I roll into town again, this place is a nice place if location is a priority, which it is for me. "
719233,38259208,2015-07-14,1030409,Cindy,Pros: Amazing location. Affordable. Easy access. Includes Netflix and other free movie subscriptions. Cons: Wifi internet pretty much non-existent. Shower drainage was slow. A little dingy in some corners. Overall: Good for travelers on a budget looking for a centrally-located spot. 
719233,38499171,2015-07-16,11254972,Ben,"Great location, especially if you're visiting the convention center, and everything was very clean. All communication was clear and responsive. Thanks!"
719233,38625318,2015-07-17,36157479,JoAnna,"Great location in Capitol Hill! Walking distance to restaurants, bars, and downtown. This apartment has a really nice wall of windows, and gets a great breeze when you open them all. Plenty of room for a solo traveler or couple. Nick worked with me to let me drop off my luggage  at the complex early before check-in, so I wouldn't have to lug it around at my convention all day. Would definitely stay again!"
719233,39001164,2015-07-20,3131636,Hannah,The house was small but clean. It's in a great location. We walked or took an uber everywhere. Only downside was there was no air conditioning and we were there in July so it was hot.
719233,39209675,2015-07-21,7803308,Miriam,"Unfortunately I only have bad things to say about this place. 
The bedding was stained, the wifi didn't work, and the bath & the basin were both blocked. I had a lot of trouble sleeping because I could feel the springs coming through the mattress & the freeway was extremely loud.

I was very disappointed with what I got for the high price I paid. 
I wouldn't recommend this place. 

The host did make the check in process easy & left some brochures for things to do in Seattle, which was nice. "
719233,39392602,2015-07-23,34694616,Jessica,"Pictures can be deceiving..
We recently stayed here for what was supposed to be a romantic vacation for my boyfriend and I, until we found out what we picked to stay in. If you have luggage or lots of stuff to take with you on the trip don't book here. We had to walk ten blocks with all of our luggage the haul it up 3 flights of stairs. Parking was horrible. We had to wake up at 7 am to move my car and be back at 6pm to move it again, it really put a damper on the things we could do. But there was no other parking around

The apartment was close to downtown which is the only good thing I can say. There was mold on the roof in the bedroom.. Mold growing in the drains of the bathtub. The vanity where you're supposed to put your toiletries was all rusted. And we were only left a roll and a half of toilet paper.. 

This is definitely not a 3 person apartment. The pull out couch is half of a love seat that looks pretty worn in. And the only bathroom is through the main bedroom. So if your third guest has to use the washroom in the middle of the night, everyone is being woken it.

We rented thos place for the kitchen and never used it once. We needed to clean out a cooler and so we used a little soap, which wasn't soap it was pure bleach.. 

The walls looked like they had snot smeared across them.. It was aweful I dreaded every night we had to go back to this place.."
719233,39643438,2015-07-25,35439705,Cindy,Nick notified us a couple of days before our arrival and gave us detailed instructions on how to check in.  We had a smooth arrival and was able to get into the apartment.  The description of the listing was accurate and was suitable for 2-3 people.  There were even some leftover food (unopened box of crackers) in the kitchen.  The neighborhood was safe and only about a 10-15 minute walk to Pike Place and downtown.
719233,39912781,2015-07-27,26524083,Matt,"Generally the property was as described. There's no AC and the surrounding area is a bit noisy (it's located close to a major highway), which makes keeping the windows open at night difficult (we visited in July). The apartment was clean but in an older building. Generally, when compared to hotels in the area this unit is a great value. "
719233,40342425,2015-07-30,36305871,Sandip,Very accommodating host (coordinated with cleaner to let us check in early) and fantastic location!
719233,40728040,2015-08-02,3699619,Amitava,"This a great location for anyone who is looking to explore Seattle by foot. The apartment is older so expect it to show some age. So, if that is all okay then this is the place for you! Area is surprisingly quiet. All in all it was good stay. If you have a car you can park at the Washington Convention Centre which allows secured overnight parking (locks up midnight-5:30am)."
719233,41924369,2015-08-10,30025417,Alex,"The listing description was spot on. It whole place was very clean and the bed was comfortable. The little kitchenette was just enough to cook some basic meals, which was just what we needed(mainly breakfast). 

It is maybe a mile walk down the hill to Westlake Station to catch the monorail and just a few blocks down is Pikes Public Market. 

However, you can catch some great coffee, beer, and food all around the apartment. Nightlight is very vibrant on Friday and Saturday with lots of energy and young people walking around having a good time."
719233,42386992,2015-08-13,1893082,Jared,"Basically as described. The location is convenient to the conference center.  The WiFi is sketchy and bordered on useless, as others have noted. The shower would have been a great height for someone a head shorter (I'm 5'9""). Communication was OK, not great. I mostly chalk that up to Pillow, with whom I was not impressed. I asked about stashing my bag someplace when I got in at noon and before my departing flight, and Pillow referred me to a hotel a half mile away. But when I got there, there was a note in the room that there is actually storage on site. No one ever told me that. Then the cleaning person was late and had to clean around my bag anyway. The person from Pillow who called to tell me they were running late spoke barely passable English and told me the cleaning person was having car trouble, but when I talked to the cleaning guy after he got there he clearly had no idea when he was supposed to arrive (I told Pillow I wanted to check in at 3, and he showed up after 3:30 cracking jokes about how early I was). "
719233,43363616,2015-08-19,16539984,Rebecca,"A disappointment. The initial information did not disclose a mold and mildew problem. That can be deadly for someone who is allergic. The initial information said to contact the Pillow Team for any problems. We did. They responded but did nothing to correct the problems - no hair catcher in the tub, internet would not work, no washcloths or lack of full set of bedding for the couch. We were offended by the response from Pillow Team, and we would not stay there again."
719233,43618611,2015-08-21,25954118,Jina,"This is a great place and a great location! Nick made everything very easy for us to put our bags away before check-in, and the place is exactly as described. It was clean and incredibly spacious. As far as the noise concerns go, please be aware that you will be staying in the city-center of Seattle so expect big city noise. I would stay here again because it is within walking distance of everything that you could possibly want, and I enjoyed staying in the apartment! "
719233,43924904,2015-08-23,34757776,Larry,The neighborhood was in walking distance to everywhere that we wanted to visit. The building was older but description was accurate. 
719233,44134731,2015-08-24,7165995,Alan,There was some confusion regarding the key and storage room. There were no sheets for the sofa bed. everything was solved and I was issued a $45 refund for the inconvenience. I was told there was a new management company handling the property and the issues will be corrected in the future  
719233,45233403,2015-09-01,17427580,Betsy,"GOOD STUFF: Excellent location just a few blocks away from the Convention Center. Our room was off the road and quiet so that was an unexpected plus. Communication was rapid especially when we had car problems and had to check out a few minutes late, they were very accommodating. Queen size bed quite comfortable.

BAD STUFF: The only reasons I am not giving a full five star is that the futon pictured was actually a pullout armchair and the sheets were not labeled but just in a trash bag in the closet. Also we were only given a 1/3rd of a roll of toilet paper with no back up so we had to go out a buy more our second day there. Also limited outlets. Recommend bringing a power strip if you have many electronics. INTERNET: The internet they provided in the information page from Pillow was a terrible connection and came from a mysterious unknown source. However there is a modem/router inside the room with the information on the bottom of the router- much better connection. 

Would stay again."
719233,45947555,2015-09-07,1360206,Brian,"Nick's place was exactly what I was looking for in Seattle. It was conveniently located, easy to find, in a safe neighborhood, and clean. Instructions and communication were clear and easy throughout the process. 

The neighborhood was great, too! The oyster bar just up the street was a fun late evening stop. 

If you're looking for a simple, clean place while in Seattle, I'd recommend Nick's! "
