listing_id,id,date,reviewer_id,reviewer_name,comments
193836,16451457,2014-07-28,12844038,Jessica,"Amy's place is great- spacious and very well supplied with everything you could possibly need: hairdryer, first aid kit, iron, small kitchen, tv, etc. The bed is very, very comfy and the sofa is a great place to take a load off after a day exploring Seattle. Amy has also provided countless guides and maps for Seattle with recommendations on what to do while you're there. We had a wonderful weekend and Amy made it very easy to access the property when we arrived. I recommend Amy's place highly."
193836,17143425,2014-08-08,340235,Kiri,"Amy's place was a perfect fit for our family of four (a 2 yr. old and newborn).  The basement apartment had all the amenities we needed to have a successful vacation including a pack n play for our newborn, a pull out sofa bed for our 2 year-old, a swing, an extra stroller (which was super helpful) and other baby gear (all available on request and included at no additional charge).  The West Seattle location was very convenient (we explored Seattle, Vancouver & Victoria). The apartment was clean, charming and exactly as shown. Our hope when we selected this apartment was ""family friendly affordable comfort"" and Amy's place fully met our needs and expectations! We would definitely stay here again!


"
193836,17254894,2014-08-09,14326974,Emily,"Amy's studio was the perfect reprieve after a long drive to Seattle. It was easy to find, clean and cozy and in a great location. The bed was really comfortable and it was really nice having a DVD player already hooked up so my five year old could watch a movie before bed. I had to leave early for my sister's wedding prep stuff so my boyfriend and son were responsible for packing up, Amy was awesome and let me know we left a few movies behind and bagged them in a spot that was easy for us to pick up with our crazy schedule. "
193836,17681918,2014-08-16,1846376,Chieko,"Amy and Nathan loaned us a stroller, booster seat, and put toys in the suite to make us feel welcome with our toddler. It was much appreciated. We found the location was convenient and enjoyed the nearby waterside parks. It was an easy drive into downtown Seattle. We would stay here again."
193836,18111473,2014-08-22,16149107,Syd,"This is a comfortable studio apartment in a quiet, safe, picturesque Seattle neighborhood. The hosts were friendly and welcoming, and invited my kids to play in the fenced backyard. The apartment was clean and spacious, and the fully equipped kitchen was nicely supplied with good quality dishes, utensils, and a coffeemaker. When I left behind my phone charger, Amy was nice enough to mail it to me.
My only complaint is minor: there was a strong perfume smell in the apartment. I happen to be sensitive to perfumes and odors, so it probably bothered me more than it would bother others."
193836,19399635,2014-09-11,8329481,Louise,"Amy and her husband were really welcoming and even offered us a sample of their home brew - which btw was apparently wonderful according to my fiancé! The studio itself was far more comfortable than a hotel room, with everything we needed and more. The location is about a 15 min cab ride outside of the city, but a great way to experience a friendly Seattle suburb. "
193836,19490411,2014-09-13,12743983,Danielle,"Was a great place to stay in West Seattle.  Extremely convenient to all the awesomeness of the Junction and Lincoln Park.  We arrived very late from the airport (1am) and Amy very open to that with no hesitation!  The apartment was more than comfortable for our family of 4 (kids are 7 & 9).  Lots of details that make this feel more like a hotel than an apartment - fully stocked shampoo, soap, conditioner, a hair dryer, etc.  It is the basement so natural light is limited but the lights inside are very bright with lots of lamps if you like it not so bright.  The beds were very comfortable - even the pull out bed had an extra cushion on it so it was fine for sleeping.  "
193836,19701607,2014-09-16,20821022,Steve,It was a good place to stay and easy for my mother to get in and out with no stairs. Amy and her family were very nice.
193836,20516430,2014-09-30,21222591,Jeff,"Great place in West Seattle, Amy was great. Everything I needed was there, an effortless stay."
193836,20637619,2014-10-02,21333903,James,"Amy made a point of meeting in person and showing me the apartment and making me feel welcome. It is a sizable space in the basement/garage of the house with a full kitchen, just as shown in the pictures. Though you go through the garage door to enter the apartment there is nothing ""garage-y"" about the place once you are inside. 

The house is about 3/4 mile up a hill from a good selection of restaurants, fast food places, bars (including one of Seattle's top rated beer bars!), gas station, and full grocery store. A nice walk down to stimulate your appetite and thirst and then a nice walk back up to help it all settle. Unless of course it is raining, in which case the experience might be different. If you have limited mobility the hill is steep enough that you might have issues, but otherwise it's not too bad. 

"
193836,27197645,2015-02-28,16056921,Megan,I had a great time during my stay in Seattle! The basement apartment was exactly as described and met all my needs! 
193836,29841373,2015-04-13,28836940,Sara,This is a perfect location in west Seattle! It was great for my first week in the city! The space is great and exactly what I needed!
193836,37835001,2015-07-11,28836940,Sara,Perfect for my long term stay in Seattle! Awesome location for people visiting the city! 
193836,38302961,2015-07-14,36006633,Alex,"Amy and Nathan were great hosts.  Amy was super accommodating on arrival times and her instructions were concise. Their space was very accommodating for young children (e.g. Pack n' Play, a tub in the bathroom for baths).  

She was also helpful in pointing out directions to a downtown attraction that was an easy short cut and helped avoid traffic.  

Overall, their rental space is great for travelers.  Comfy bed, space to move around, and all the amenities of a home.
"
193836,38471361,2015-07-15,2761324,Dmitry,"I would definitely recommend Amy's apartment, & would stay on my next visit in Seattle. Clean, comfortable & proximity to Alki Beach is a PLUS!"
193836,39015023,2015-07-20,33994828,Jessica,"They made us feel welcome by meeting us when we arrived, showing us around, and letting us taste their home brewed beer! Our stay was great and would like to stay here again next time we make it to Seattle. "
193836,39916301,2015-07-27,30985806,Elizabeth,"Amy welcomed us on arrival and did a wonderful job giving us all the information we needed for our stay.  Great we had a place to park our vehicle. Close proximity to transit was good. Bed was super comfortable, kitchen well stocked and suite was spacious. Will definitely check out Amy's listing next time we head back to Seattle"
193836,40617277,2015-08-01,36749027,Lea,"We arrived late and appreciated the accommodation to do so. The house was easy to find and the instructions to get to our space was simple. The apartment was spacious and clean. Our stay was short, but this space was very comfortable! Thanks!"
193836,41755813,2015-08-09,3310611,Suzy,"Short overnight stay, everything was as described. It was clean and very comfortable. The kitchen had everything you need to cook a meal. Nice little table to sit at. 
The set up of the room was well thought out. 
As another reviewer said a little noisy in the morning. The host lives upstairs and obviously has toddlers, hard to keep them quiet, no volume control!
"
193836,42041188,2015-08-10,30930545,Jeremiah,"I did not actually stay here because of a late change in my travel plans, but my communication with Amy was great throughout. I'm sure it would have been a good experience."
193836,42247996,2015-08-12,28561287,Frank,Wir hatten eine tolle Zeit bei Amy und Nathan in Seattle. Amy hat uns persönlich in Empfang genommen ist dabei sehr flexibel auf unsere gewünschte Ankunftszeit eingegangen. Sie hat uns alles was wir wissen mussten gezeigt und auch einige Tips für unseren Aufenthalt in Seattle gegeben. Die Wohnung entsprach der Beschreibung in vollem Umfang und war sehr komplett ausgestattet. Abends durften wir noch  das von Nathan selbst gebraute Bier probieren und haben uns dabei angeregt unterhalten. West Seattle ist eine angenehme Umgebung. Man fühlt sich fast schon wie in einer Kleinstadt und ist gleichzeitig in 30 Minuten mit dem Bus in Downtown. Für uns war es ein rundum gelungener Aufenthalt.
193836,43487689,2015-08-20,34016716,Kathleen,"Amy and Nathan are great hosts!  They both greeted us when we checked in and showed us the place.   It was clean and cozy and had a nice kitchen with everything you need.  
We came to Seattle for a week with our two young kids, so we needed a place with a full kitchen so we didn't have to eat out 3 meals a day plus snacks and didn't want to spend a fortune. This fit the bill. 
Nathan is a brewer and had a few brews on tap along with a root beer which were all really good!   And 
We were out and about most every day and the location was great, easy to get to and from the downtown Seattle area without having to be in the midst of it all the time.  There's a dedicated parking space in the driveway with easy access to the house which was super convenient. 
I will say that I'm not used to basements and so wasn't prepared for the amount of noise coming from upstairs or for the complete lack of natural light and fresh air.  The noise from upstairs was just them walking around, we couldn't hear talking or anything, but the footsteps were very loud and woke me up a few times in the middle of the night.  There are windows, but they are blocked with bushes and you can't open them.  So it seemed stuffy.  We would leave the front door and garage door open and hope for a breeze.  
The entry to the space is through their garage which just felt a tiny bit awkward or weird, but wasn't a big deal, especially since it also meant walking past the kegerator with the beers on tap. 
We would definitely stay here again, but maybe not for an entire week.  "
193836,43935566,2015-08-23,12356837,Michelle,"This was a very comfortable place for my son and I to stay during our visit to Seattle. Both the bed and the couch bed were very comfortable! Also, it's in a great part of West Seattle -- residential but with easy access to both the Junction (business area that includes Easy Street Records and a great cupcake shop!) and the Sound. In fact, I took a cup of coffee to the corner (three houses away) and sat and looked at the water every morning we were there. 

Thanks, Amy! We'll be back!"
193836,44836331,2015-08-29,9770391,Monika,"Great place, nice hosts. Recomended stay. "
193836,45745808,2015-09-05,43010742,Aranda,"Amy was an excellent host and our room was great! Me and two friends slept comfortably in the beds provided. It was awesome being somewhere with a kitchen. There were pots and pans and basically all the kitchen supplies you'd need to cook! You enter this apartment through their garage, and they give you a personalized code to get in. It's a downstairs room, but it feels very separate from the house. All in all it was great and just what my friends and I needed for our weekend trip in Seattle. "
193836,45962133,2015-09-07,15879685,Sarah,"Amy and her husband were great and welcomed us to the place when we arrived. It was clean, spacious and comfortable. We really enjoyed having a little kitchen and sitting area   We chose this location because of its proximity to the ferry terminal in West Seattle and that worked out very well for us. The only drawback of this spot is not being able to sleep in because of the little ones upstairs being active in the morning. But that wasn't a surprise and didn't bother us! We had a wonderful visit and recommend this place to others. "
193836,46761031,2015-09-13,392983,Jason,"Amy and Nate were such great hosts. They were communicative, and we never had any complaints. They were flexible, provided A+ hospitality, and we wouldn't hesitate to book with them again. Thanks you two!"
193836,47579058,2015-09-20,22576469,Joshua And Renee,Amy and Nathan were excellent in coordinating and communicating. They made an effort to ensure they were there to welcome us on our stay. The location was great as we were in town for a XC race at Lincoln Park. It met our needs well for a quick stay and everything we needed to be race ready in the morning. Thanks!
193836,48892081,2015-09-29,41066411,Robert,"We were cordially welcomed and shown details on some of the features we needed to know about.  We did some cooking and easily found items needed to cook with.  The studio apartment was spacious and comfortable.  We had trouble getting Netflix on the TV, but Nathan quickly and easily resolved the problem.
We were familiar with West Seattle, but not having a car this time, we found public transportation very convenient from this location by bus and nearby water taxi.  Walking in the neighborhood was safe and gave us a wonderful view of Puget Sound.  We felt welcomed and included when we saw our hosts.  We would stay there again if the opportunity arises."
193836,55107354,2015-11-28,392983,Jason,We're repeat customers. Amy and Nate make my choice easy when having to find a place to host my parents. Reliable. Communicative. Flexible. Enough said.
193836,57294159,2015-12-24,47023717,Justin,Amy and Nathan were great!  Very respectful of our privacy and excellent hosts overall.  The apartment was perfect for our needs and they were so sweet to loan us their old pack n' play and high chair for our 1 year old.  Would definitely stay with them again. 
193836,57798378,2015-12-29,23063700,Alice,"Amy was very welcoming. The studio was cozy and clean. We didn't do any cooking, but the kitchen was ready to feed a family and a very fun grocery store is just a few blocks down the street. Our girls loved playing and hiking through Lincoln Park very close by. We enjoyed our easy bus rides into the city. It was the perfect place for us visiting family in West Seattle. Thank you!"
7620570,41178473,2015-08-04,25568237,Ellina,Such an amazing stay! House is lovely and Beatrice was very accommodating.  Really enjoyed the visit in her home- not enough positive words to describe the experience. Location is lovely with walking distance to the beach and restaurant shops. Very comfortable. Thank you again! Will definitely be staying with you next time !
7620570,42464122,2015-08-13,37239531,Rachel,"Beatrice was a wonderful host, and her home was accommodating, beautiful, above and beyond in every way. Great stay! "
935845,5186537,2013-06-17,6122315,Brian,"From May 22nd to June 19th, we stayed at Wendy’s residence as we worked our various internships around Seattle. During this time, Wendy amazed us by her hospitality and the amenities she provide to us during our stay. The electronic appliances were new to the point that many still had their operation manuals still attached. Additionally, the silverware and linens came wrapped in plastic still. Overall, the location has a microwave, oven, refrigerator, pots, pans, silverware, towels, bed sheets, 3 beds, a pullout bed / couch, large TV, wifi, 2 cupboards for clothes, cabinets for food, coffee machine, chairs, foldable table, shower, laundry machine, dryer, toilet, and even more things I probably have not had the time to use yet. As you can see form the exhaustive list, we had everything we could ever need for our stay and then some. In addition, the freshly painted walls provide a homely and cozy aura to the location. As for parking, it occasionally can get tight on 46th but more free parking is across the street so at worst you may have to walk 30 seconds. Finally, Wendy and her family are extremely cordial and have gone out of their way to help us several times (even warning us when one of the roommates car was about to be towed). Location-wise, it is about 10min in traffic to downtown Seattle, UW, and less to Ballard. Also, Fremont is known as one of the liveliest areas to live with the benefit of Paseo’s (the top rated restaurant in Seattle) being ~6 blocks away. Overall, I greatly enjoyed y time there and would recommend it to a family, friends, interns, etc… who need a place to stay in Seattle. "
935845,5462729,2013-07-01,6591365,Caroline,"Awesome place! Clean, new, modern, and has everything you need. Really flexible check in and check out which is nice when you're traveling. Great experience!"
935845,5613212,2013-07-08,6718819,Sarah,"My friend and I had a great experience at Wendy's apartment. When we arrived, it was clean and exactly as pictured. Wendy was a great host and texted us regularly throughout our stay to address any questions or concerns we may have had. Overall, I would definitely recommend this Airbnb to anyone looking for a convenient place to stay in the Seattle area. "
935845,5769710,2013-07-15,5090262,Jen,"We enjoyed are brief stay in Wendy’s apartment. It’s in a great location—easy walking distance to Freemont and a close drive to the Ballard neighborhood. The apartment was extremely clean, bright, and welcoming. 

Wendy was easy to reach prior to our visit, and scheduling with her was efficient and painless. 

When we arrived she gave us simple directions on how to get to a local market and several restaurants within walking distance of her home. We had a nice meal at Pecado Bueno just a few blocks away.  We will definitely plan to stay here again (if Wendy will have us!) on future trips to Seattle.
"
935845,6105417,2013-07-30,6200206,Stanherbert,"What can I say about this place? Wendy and her husband were such gracious hosts for the week my friend's and I were in Seattle. The place was as listed and even more than I imagined it would be. It was clean, modern, and the location was a huge plus. Being in Fremont, it was a ten minute drive to Seattle Center, and 15-20 minutes to Safeco & CenturyLink Fields. So we didn't have to drive far to get around. Wendy & Tim were easily available before our stay, as well as during our stay. Wendy provided us with coffee during our stay from her favorite local shop and her husband even took a look in the apartment during our stay, and even rewashed our towels for us. Also, with the kitchen & fridge, you have all the pots and pans you need as well as plates, cups and utensils you need to cook meals. The next time I'm heading into Seattle, this will be the first place I look to. Great people, great place and great city. Thumbs up! "
935845,6957076,2013-09-01,6747553,Todd,"I stayed at Wendy's for a month and had a great time! Wendy is warm, welcoming, generous with her suggestions and recommendations about things to do and places to go. She is also extremely respectful of your privacy. The space itself is clean, bright, and located in a very cute neighborhood, a very walkable area of Fremont, close to grocery, cafes, restaurants. Also a quick bus ride away to downtown Seattle or to UW campus. I really enjoyed my stay! Highly recommended!!"
935845,7693029,2013-09-30,3065304,Jessica,"I spent a month in September for work (and fun times too). Wendy was an awesome host and her space was just as advertised. We went out to eat a couple of times while I was there. I love that when I arrived she had brochures of nearby attractions in addition to printed lists of her favorite restaurants and things to do in the neighborhood.

The apartment is located right on the tip of the Fremont neighborhood, with short walks to great bars, restaurants and local shops. It's also an easy bus ride to the Ballard neighborhood and downtown Seattle too! I loved that I rarely needed to step in my car.

The apartment itself is clean, colorful, and very spacious! I enjoyed my stay and my explorations of sunny Seattle. Wendy is full of good advice and does some amazing work for a living. I'm excited for what she does next and highly recommend staying in her apartment."
935845,7986892,2013-10-11,4326435,Richard,Great location near the Fremont and Ballard districts. Apartment is the ground floor of Wendy's house and is very comfortable and clean. All appliances are new and in good working order. Bathroom and shower are great. Wendy is a lovely host - friendly and very helpful. Nothing was too much trouble and all the information we needed was available.
935845,8164638,2013-10-18,9433842,Rebecca,The reservation was canceled 31 days before arrival. This is an automated posting.
935845,8448981,2013-10-31,9306339,Karen,"This place was terrific!  Wendy met us late because we had travel issues getting to Seattle and she worked with us when things changed.  The apartment was very clean, comfortable, and cheery.  It perfectly met our needs and was very conveniently located.  We will definitely stay here again.  "
935845,8704797,2013-11-12,8381826,Andrew,"Wonderful apartment, great host."
935845,8724611,2013-11-13,1523198,Pam,"The apartment was terrific, and in a terrific location. It had everything and was spacious. This would be a terrific place for a family because the one big bedroom has 3 beds (2 twins and a double -- or maybe that's a queen, not sure). It is also nice that you can come and go without bothering the owner. In fact, I never saw Wendy because we were out visiting family most of the time we were there. But it was easy to get the key from the lockbox, and there wasn't anything else we needed. If I had to say there was a problem, it would be in finding parking, but we managed fairly easily. When we first arrived at the house, I thought street noise would be a problem, but once you are in the apartment it is completely quiet. I would be happy to stay here again, and I highly recommend it to anyone needing a place to stay in Seattle!"
935845,8804505,2013-11-18,1685546,Richard,Wendy was wonderful.  The space was clean and comfortable and in a great area.  I HIGHLY recommend this spot.  I have given this place to all of my friends as a recommendation when traveling in Seattle. 
935845,8922676,2013-11-25,4185776,Sunny,This place was perfect! It was very clean and cute. It had everything we needed. Wendy was super nice and accommodating. I will definitely stay here again. 
935845,9001513,2013-12-01,496743,Seijen,"I booked the apartment for my parents coming into town for Thanksgiving. Wendy was awesome and the place perfect. 

The apartment is spacious, cheerful, and well equipped. (we actually hosted Thanksgiving dinner there because I didn't have an equipped apartment yet.) It was just my parents staying there, but easily 4-5 people could sleep there and not feel cramped. 

As a host, Wendy was fantastic. Ultra communicative and super friendly, she texted me to see if my parents needed anything from the grocery store and even invited us for dessert on Thanksgiving day. 

Thanks Wendy for everything!
-Seijen

"
935845,9832534,2014-01-13,10486106,Mandy,Wendy was a great host!  We would definitely stay here again!
935845,10054608,2014-01-27,3097100,Devin & Michelle,"Wendy's basement apartment was super cute. Clean, bright and a great use of space. The living and kitchen area is ample and the ""sleeping porch"" are was really great for a family. Would certainly recommend it if you are looking to be in the middle of the action in the north Seattle area."
935845,10230150,2014-02-08,10885841,Claire,"Nous avons passé un agréable séjour dans l'appartement de Wendy,
il est très propre et on s'y sent bien. Wendy et son mari nous ont fait un très bon accueil. Par contre l'insonorisation avec l'étage du dessus n'est pas suffisante et nous espérons ne pas les avoir trop dérangé. 

"
935845,10345334,2014-02-15,10553675,Peter,"Excellent!
Nice couple, beautifully remodelled and comfortable basement apartment, very well located, good information, excellently equipped. Totally recommended :)"
935845,10396973,2014-02-17,11759925,Michael,"The Seattle apartment was indeed located well for us, in a neighborhood just north of downtown.
Convenient location.
The apartment was neat, clean, bright, and plenty of room for us.
Thank you so much, Doug"
935845,10483167,2014-02-21,11849282,Bita,"The place is cozy, comfortable, nice and clean. Wonderful hosts and central location.
There is a bit of traffic noise and walking about noise from upstairs, but not excessive. Over all it's a great place to stay. "
935845,10683021,2014-03-03,5028592,Molly,"Wendy's place is great! It feels brand new, bright, and well appointed. Like true northwesterners, there's a place to separate your compost and recycling from garbage. :) You can hear a bit of traffic noise and footsteps from the house above, but it was quiet by around nine. We loved this spot and would definitely come back. Directions clear and communication easy."
935845,10741733,2014-03-05,893505,Joey,"Great place to crash with a few friends, dorm room style.  Easy check in and check out.  Gracious hosts and a clean apt.  Very happy with it all.  Thank you!"
935845,10889391,2014-03-11,5157265,Eric,"Four of us dorm roomed it at Wendy's place and had a great experience.  The place is fresh, clean and well appointed.  Especially appreciated the morning coffee, cleanliness and laundry set-up.  We were having so much fun in Seattle we didn't spend much time in our digs but all contact with the place and Wendy was excellent."
935845,11170688,2014-03-24,11234256,Elizabeth,"Lovely apartment, great location right on bus line."
