listing_id,id,date,reviewer_id,reviewer_name,comments
281208,1079843,2012-04-03,1981816,Patrick,Very nice house.  Enjoyed our stay there! Clean and has everything you need.  Would stay there again the the future. Recommended!!!
281208,1087364,2012-04-05,893008,Cheryl,"Wonderful house!  Beautifully decorated, tastefully refinished.  Spotless. Residential neighborhood, very quiet. Within walking distance to a great little playground for the kids (2 and 4).  Convenient to Rainier Ave to get to and from various places in the city. Will plan to come back again in the summer!"
281208,1252909,2012-05-09,1580277,Jeff And Jane,We enjoyed our stay very much!  The house was perfectly appointed and positioned for our short time in Seattle and worked well for 5 adults.  We wished we had more time there.  I would certainly recommend it to travellers.
281208,1275949,2012-05-14,1931328,Tiffany,"Joe's home was beautiful with lots of parking space and plenty of room for our whole family. The family room and dining roon are very spacious with plenty of seating for all of us and a some visitors. The bedrooms have wonderful natural light, comfortable beds and lovely linens. He also keeps the home well stocked with white fluffy towels. He was so quick in responding to all of my e-mails. He was also very helpful when we left something behind and was kind enough to track it down and ship it back to us. I will definitely stay here again the next time we visit Seattle. "
281208,1744898,2012-07-19,2084969,Leesa,We had a great time. The house was super. 
281208,1939986,2012-08-10,731243,Lisa,"Beautiful home, spotlessly clean.  Beds very comfortable, plenty of space, very close to downtown.  Look forward to staying there again."
281208,2158191,2012-09-01,2598355,DeVon,"Was very nice having a place to stay with the whole family and not have to rent two or more motel rooms to accomodate. House was clean with nice ammenities. Kitchen was fully stocked with all needed cooking instruments to prepare anything you wanted to make. We enjoyed shopping at Pike's and then cooking up the fresh foods from the market. It was close to Centurylink for the Seahawks v Raiders game we saw. Saw Dave Mathews Band on the way home at the Gorge. Awesome trip. My wife who is into interior design liked the art and decor of the home. Thanks Joe, great place !!!"
281208,2189583,2012-09-04,1890096,Eric,"Oh where to begin!  We had a wonderful stay here in Seattle.  After cruising Alaska for a week it was nice to come ""home"" and relax before returning to reality in sweltering Arizona!  Our stay in Seattle was sunshine the entire weekend!  Joe's home was welcoming and very clean!  It was stocked with just about everything you could imagine.  It was centrally located and very close to freeways and downtown.  We would stay here again.  Thanks Joe for a great place to call home for a couple days when we visited Seattle :)
E"
281208,2695544,2012-10-23,3298025,Van,"Great accommodations, nicely decorated, convenient to the City, and all the trappings of home away from home. Nothing is overlooked in making this a great place to stay. Thanks so much. Enjoyed it immensely. "
281208,3036608,2012-12-06,3628392,Ariana,"Joe was great to work with - everything was organized and extremely accommodating.  I was with 3 coworkers and whenever we weren't working we just wanted to get back to the house to hang out out the comfy couches!  The house was extremely clean, all of the basics were there (paper towels, toilet paper, regular towels, laundry detergent, etc) and in a very accessible neighborhood to the city.  I would happily come back again!"
281208,3727782,2013-03-09,4704477,Paul,We stayed at this wonderful location for a week.  The home itself is beautiful as you can see from the pictures and the location was really ideal.  We could easily walk to the International district or to downtown and we were right next to bus lines to get to any part of the city.  It easily slept all seven of us and I can't recommend it enough - top notch!
281208,3903604,2013-03-26,4519295,Katie,Great location!  The house is really well decorated and set up.  Kitchen had everything we needed and we were impressed with how well it was laid out.  Nice and close to everywhere we wanted to go.  All directions and instructions Joe left were straight forward and easy!  Would definitely stay here again!
281208,5112751,2013-06-13,2248968,Stacey,Great little place super convenient to downtown! Loved our stay!!
281208,5255060,2013-06-21,4433313,Nils,"We were seven people staying at Joe's house and it was a great place! Fully equipped kitchen, two toilets and within walking distance to grocery stores and downtown seattle. Also has a parkingspace for the car.
We also got a nice welcome-letter with a lot of useful information.
Very nice place!"
281208,7031990,2013-09-04,2282498,Mathew,Super nice place! Location was a short cab ride from everything we wanted to see during our stay.
281208,9296535,2013-12-19,4836797,Jessica,This house is perfect for a family or close friends. It's super clean and well decorated. It's a little off the beaten path for Seattle which is great and adds to the adventure- us your closer to Georgetown and downtown 
281208,10653774,2014-03-02,9422473,Amy,"This was a great house!  Close to downtown but in a quiet neighborhood.  Perfect for family or group getaway.  Easy to access bus-lines and cheap ride in taxi from downtown.  Beautiful, clean space!"
281208,11358988,2014-03-31,12611556,Mario,"If you want to explore the city without staying in a downtown hotel, Joe's house is highly recommended. It's in a nice part of town, next to a great park and easy access to both interstates. The house has everything you need - perfect for 5-6 people. Have fun in Seattle."
281208,17035108,2014-08-06,9016620,Kyle,"Great place.  Slept 6 comfortably, very clean and only a short drive to downtown.  A park is right down the street as well and we were pleasantly surprised that a music festival was happening at the park while we were there so that was an added bonus.  "
281208,44393195,2015-08-25,11969601,Matthew,"After a poor experience at a ""luxury"" condo our group was forced to make a last minute booking. Luckily, we were find Joe's house which was the best decision we made.

I would highly recommend this property to anyone visiting the Seattle area. The house is well maintained and was large enough to fit all four of us comfortably with plenty of bathrooms and extra space. We particularly enjoyed the location which was a short ride away from Safeco Field. 

The house is well maintained and serves as an example of what a well maintained property should look like. Joe was very responsive and accommodating."
281208,45989105,2015-09-07,40645801,Donnie,The house was just as described. A very cozy clean little house with all the amenities one would want. Just what we were looking for. Thanks Joe for providing this house to us on a special day. 
281208,50298671,2015-10-11,42384713,Audrie,"This was an excellent choice for our family--well maintained, clean, conveniently located, and even stocked with baby gear (booster dining seat, simple stroller, pack n play).  We forgot to bring some toiletries and were pleasantly surprised with bathrooms already stocked with the basics.  Since our flight arrived early, the host accommodated an earlier check in, and was super easy to work with.  Our family is allergy prone and no one got the sniffles Bc the place is very eclean and well maintained.  Thanks for making our stay a pleasant one!"
281208,52594877,2015-10-31,3553236,Matthew,"Another great Airbnb experience. Joe's place is super clean, affordable and large. It's also in a great location just south of downtown Seattle. The beds were very comfortable and cozy. And the bathrooms were perfect. Entire place is nicely decorated. "
281208,53928503,2015-11-14,41952341,Katharina,"We loved this house! It had everything we needed, nice bedrooms, big bathrooms, a fully equipped kitchen and a cozy living room! Communication was easy, although we never met Joe, everything was fine and the house was ready for us. Would totally recommend staying at this house again!"
281208,54725599,2015-11-23,21598341,Dan,Outstanding place to stay for a Seattle weekend.  House was perfect and exactly as described.  Very close and convenient to downtown.  Less than $10 Uber to the stadiums.  Will not hesitate to stay here again.  Thank You Joe!
5310503,27077678,2015-02-24,9006936,Aaron,Best deal in Seattle! Diana and her roommate  are friendly. The house is very clean. I love how orderly the house is. There is a Safeway in walking distance and a nice Latin American restaraunt across the street. I'd do it again if I need a place to crash.
5310503,29332839,2015-04-06,29163958,Irene Yoonji,"Diana was pretty kind :) Actually i couldn't see her a lot of time because of her personal stuff. But she explained all i need, and served comfortable spaces. Moreover i think the house was really nice. "
5310503,30645590,2015-04-25,29034662,Tunzala,Great host!
5310503,31071006,2015-05-01,5679528,Wenjing,"I love this place. Really nice apartment, clean, neat, and light! Even it is a shared room, I have enough space. Diana is pretty busy. I enjoyed talking to her, smart and passionate."
5310503,33194590,2015-05-25,33773893,Kendall,"Honestly couldn't have asked for a better experience.  I didn't spend much time there, but the time I was there I felt safe, comfortable (it's a very nice apartment: very clean and homely), and welcome."
5310503,33612138,2015-05-30,33433193,Michael,"Diana was an excellent host. She reached out to me early and ensured I had directions and was registered to use her elock. Your phone is your key, so don't let your battery run out before you come home.  I was gone for most of the day and had very little interaction with Diana or her housemates, but they were all perfectly nice. The place was very neat and orderly and in a great part of town with easy access to downtown Seattle or Bellevue with very little freeway time needed. I would stay there again or recommend her to others."
5310503,34029245,2015-06-03,20110859,소유,"There is so clean and cozy room. I couldn't meet her, but everything was cleaned when I came back after day. It is little far from downtown, but it's easy to access."
5310503,35567578,2015-06-20,24337926,Sahana,Diana was fabulous! The house was very clean and she made me feel so welcome! Thanks for the great experience!
5310503,35873692,2015-06-22,10286593,Gizem,"The house was extremely clean, comfortable and located close to different bus lines that'll take you downtown quickly. Diana was an amazing host and a very kind person. Thank you for everything!"
5310503,43574345,2015-08-20,41415485,Robert,"This is a great place to stay if you’re ever in Seattle. Like people have already said, it’s a little far from the city, but only a little. Getting downtown was easy and it is a nice ride that goes by the University of Washington. You have access to the kitchen, along with pots and utensils, and there is Safeway pretty much right across the street. Diana was a great host; everything about my stay in Seattle was awesome.



"
5310503,45178275,2015-08-31,41864044,Kelly,"Diana is a friendly, welcoming host. We had a bad storm during the weekend I stayed and she kept me updated on where to find flashlights, etc. - so nice! Her house is comfortable and clean with plenty of space; looks just as pictured. There's a Safeway/Starbucks a couple of blocks away and downtown Seattle is a 20-30 minute bus ride. Would definitely stay again. Thanks, Diana! "
5310503,45715070,2015-09-05,41712439,Patrick,"Everything about the listing exceeded my expectations, and it served as a great home-base for my first time in Seattle. The space is very clean, a bit larger than pictured, and fairly private for being a shared space. 

Diana is attentive and accommodating, but gives you plenty of privacy and freedom. Her positive attitude and friendliness made my stay a great one!"
5310503,46207816,2015-09-08,10567978,Nina,Diana is really cute and friendly. She cares about you. Good place to stay. The bed was really comfortable 
5310503,49337158,2015-10-03,41872420,Riko,ダイアナのお家は、写真の通りとても綺麗で心地よい空間でした。徒歩3分の所には値段的にも通いやすいスーパーがあり、いつもお世話になりました。彼女のキッチンには必要なものが全て揃っていて、購入した食材で心ゆくまで料理を楽しむことが出来ました。ダイアナは、物静かですが本当に親切で温かな女性です。
5310503,49794523,2015-10-06,11029797,Kevica,"Had an amazing time, though I wasn't at Diana's house that much I still enjoyed my stay there it was quite comfortable place to stay. I seriously loved it and the next time I visit this will be my first choice for places to stay."
5310503,51507065,2015-10-20,28366714,Amber,"I had a lovely time! The neighborhood is very quiet and I felt very comfortable walking around, even at night. 
Diana was a great host and I felt very comfortable in her home. I would recommend this home if you want to stay somewhere calm, clean and friendly. "
5310503,52127423,2015-10-26,24677011,Emily,"Be sure to check the house manual for which apartment in the building it is -- the smart lock does not look like a smart lock from outside! The bed in the living room is just as Diana described it. It's conveniently located near several bus lines into downtown, and will be about a 30min trip available roughly every 15mins to get to downtown Seattle. Although I was rarely around so I didn't meet Diana in person, she was friendly and helpful in all of our communications."
5310503,53577666,2015-11-09,1562357,Stephanie,"Diana's place was perfect - I was in town for work and needed a place to get a good night's sleep. The house was clean & tidy, and very serene. Diana was very friendly and incredibly helpful, and really made sure I had everything I needed for my stay. Busing into town was a breeze, and the Safeway that's across the street made getting groceries easy, too.

Would definitely stay again!"
8391954,54175828,2015-11-16,36063918,Sache,"Kaitlyn's house was perfect for a weekend in Seattle!  The view was great and it was only a $10 Uber ride to and from downtown.  The house was clean, the heater heated up the house quickly, and the living room was comfortable.  "
8391954,55017353,2015-11-27,41948889,Jake,"This house is comfortable and gorgeous. Lovely decor and an incredible view. Recommend it. 

Working with the hosts was a breeze and we'd stay again. "
8391954,55236654,2015-11-29,36992262,Elizabeth,"Nice place, great views.  We had a great time hanging out there, it was very comfortable.  Kaitlyn was quick in response when we had questions.    "
3186785,34508132,2015-06-08,33619917,Muhamed,Ben and Shannon were great hosts.  Everything was in order when I arrived although I did have a hard time locating the house when using a gps. Shannon did send me a map which helped a lot and I eventually found the place. I had breakfast with Ben a few days and he cooked which was cool. I really liked both Ben and Shannon and enjoyed our time together. Would recommend.
3186785,34759574,2015-06-11,35264110,Sierra,"Shannon and Ben have been incredibly generous and extremely helpful hosts!!!! They are such a rad pair and have such a sense of sharing and giving about them. We needed a place to crash while we looked for a house to move into and they went above and beyond to make sure we felt comfortable and right at home! When we first got here they served us the most incredible home made caramel snickerdoodle cookies that are to die for! Thanks Shannon!! 
You guys are amazing and we are forever grateful for your kindness! HIGHLY RECOMMEND STAYING WITH THESE COOL PEOPLE! "
3186785,37813112,2015-07-10,26035804,Luan,Your house clean and nice! I'm very happy with your house! I will keep your contact for next trip!
3186785,38006344,2015-07-12,78811,Simran,The Bedouin paradise is spacious and comfortable. My stay was short but excellent. Very convenient from SEA. Only sorry my hosts weren't around to hang with. Thanks for the Ghirardelli mini chocolates on the bed... Perfect touch of hospitality!
3186785,38212696,2015-07-13,18456986,New,"I had just a short stay, less than 24 hours, the place was perfect for my needs.  Shannon was very helpful in making sure I was able to find the place and enter the house.   Highly recommend to anyone needing a place close to the Seattle-Tacoma International Airport."
3186785,38660961,2015-07-17,14452797,Gelinda,"This was a great space for my children and I. The home was large and clean. The kids enjoyed all the board games, movies, and instruments available throughout the space. Great location, very close to light rail. That made out visit to Seattle quick and stress free from traffic. Ben was welcoming and friendly. Overall very happy with my stay!!"
3186785,39034123,2015-07-20,35252404,Lindsay,"The house was just as described, & 10-15 min from the airport for easy transportation :) Ben was very welcoming & it was a great place to crash for a few nights while sightseeing Seattle. Thanks!"
3186785,39702104,2015-07-25,28657433,Jessie,Thanks for making our family feel welcome and comfortable! 
3186785,39820202,2015-07-26,37729461,Annalee,"It was a wonderful stay, Shannon and Ben made sure we had everything we needed and more. The room and kitchen were spotless, and we really appreciated the host's friendliness!"
3186785,40448374,2015-07-31,34443565,Olga,"Shannon and Ben were wonderful hosts and made our stay comfortable and pleasant. The rooms were spacious, clean, sunny, and beautifully decorated. It was nice to have a well-organized kitchen and a spotless bathroom all to ourselves. 
Shannon's and Ben's house is close to a major interstate, which made it easy to get to all the places of interest we wanted to visit, as well as to get to the airport in time (it is about 10 - 15 min drive).
I would definitely recommend Bedouin paradise to anyone who visits Seattle. Nice people, nice place.
"
3186785,40983417,2015-08-03,38696494,Elana,"What a wonderful place to stay in Seattle! My friends and I were only in town for the night and were pretty beat from sightseeing all day. Shannon and Ben made us feel right at home and were absolutely wonderful. They were accommodating and kind, and their house is beautiful and comfortable. I would definitely recommend Shannon and Ben's place to anyone visiting Seattle!"
3186785,41948316,2015-08-10,34582708,Seann,Shannon and her husband Ben were very warm and welcoming. They were happy to share meals with us or provide great tips for local restaurants. The kitchen space was extremely nice and the shared living room area was very inviting! Shannon and Ben were incredibly understanding to our schedule and super accommodating. Our trip to Seattle wouldn't have been half as great if it wasn't for Shannon and Ben's amazing hospitality. 
3186785,42693647,2015-08-15,1449474,Bruno,"Fiz uma viagem com minha banda a Seattle e ficamos hospedados na casa da Shannon e Ben por 9 dias, foi sensacional!
Eles deixam os hóspedes bem a vontade, tudo é exatamente como na descrição do anúncio e são muito atenciosos e legais!
O local não é muito próximo ao centro da cidade, mas é muito fácil e rápido para chegar até lá tanto de trem como de carro.O bairro é bem tranquilo também, tudo ótimo! 
RECOMENDAMOS 100%! "
3186785,43373855,2015-08-19,36178007,Cameron,"Shannon and Ben (her husband) made us feel very welcome! They had the space very clean and perfect when we arrived. This was my first Airbnb experience so I was a little worried about how it would be. 
I was on a work trip so I was normally dead tired when I got back each night so I was very happy with the space and privacy they gave us.

Overall this as a great experience and I would stay with them for sure!"
3186785,43508895,2015-08-20,1449474,Bruno,"Fiz uma viagem com minha banda a Seattle e ficamos hospedados na casa da Shannon e Ben por 9 dias, foi sensacional! Eles deixam os hóspedes bem a vontade, tudo é exatamente como na descrição do anúncio e são muito atenciosos e legais! O local não é muito próximo ao centro da cidade, mas é muito fácil e rápido para chegar até lá tanto de trem como de carro.O bairro é bem tranquilo também, tudo ótimo! RECOMENDAMOS 100%! "
3186785,45377075,2015-09-02,18295839,Koriel,"Shannon and Ben were awesome hosts. They were very hospitable and ""cool"". The downstairs area was larger than the photos made it seem, which was great for our crew of 5 people. Everything was clean and organized, and there was even food in the refrigerator! The instruments were free to use, as was the TV. I would definitely recommend this place to friends looking for a great deal in Seattle!

Also, for cat people, they have a cute white kitty upstairs that loves getting pets :)"
3186785,45793715,2015-09-06,37623577,Yingying,"Did not get to meet Shannon, which was a pity because she seems really nice and helpful. Was very happy with the fully furbished kitchen, which was all for us to use. There was only 1 king-sized bed, and smaller couches for us to use. Bedroom and living room were full of pillows and blankets, so we could use those to make ourselves comfy. It was an enjoyable stay! Thanks Shannon for Whatsapping us!"
3186785,46133866,2015-09-08,37189110,Sara,"Thank you for sharing your lovely home with us! Shannon and Ben made it very easy to find their place and make ourselves comfortable during our visit. You can tell that they put time into making the space fun for many people's interests with tons of options for movies, Xbox and board games, as well as an electronic drum kit. The space was ample yet cozy and felt like a second home! I would say that it is advertised to accommodate 6 people, which space wise it did, but this space is definitely ideal for a younger crowd who may not care as much about their sleep quality while out exploring Seattle. One bed is very comfortable for 2 people to share (3 if small or you like to cuddle). A futon unfolds into a bed in the downstairs living room but is very stiff and bows up in the center, creating a hard spot that hurts to roll over.  The other two were able to make themselves comfortable with nests on the floor. This did not detract from our trip and we were plenty happy with these accommodations! However, if you are traveling with a family or pickier travelers it's important to know that while 6 people can fit and will be provided pillows and blankets, there are only really comfortable mattresses for 2+ people. "
3186785,46717641,2015-09-13,38177870,Nhi,Ben and Shannon were great hosts! They have a lovely home and a really awesome cat. Couldn't have asked for a better host :) 
3186785,49043737,2015-09-30,16060433,Martin,"This was a great find! My boyfriend and I needed a place to stay while we found an apartment. Not only was it a good price but it was just what we needed. Lots of room, own kitchen, bathroom, large bedroom and living room with its own big screen tv.  We were able to use their coffee machine, stove and fridge. Not going to lie we were a little sketched out when we pulled into the alley to park but out car was parked out there everyday for a week and it was safe. Ben have us great advice on transportation and locations. I loved having my own living space and if you have ever stayed in Seattle you know the weekly rate at his place was a steal! 5 stars all the way!! "
3186785,49197693,2015-10-01,1469000,Daniel,"Shannon and Ben could not have been nicer; I watched a show with them (until I fell asleep) and they quietly left.  The house was great; we had the entire downstairs, with a really comfortable futon for the third person (me), had some yogurt in the fridge which they shared.  House was just great."
3186785,51409700,2015-10-19,2684976,Jef,"Really convenient location for us, visiting friends nearby.  Super nice quiet & friendly hosts who were very patient with our flat tire late arrival.  Adorable cat was very kind as well.  Everything worked out great with this visit.  Thanks!"
3489837,16569502,2014-07-29,2159920,Matsvei,"Rented the apartment for the business trip.
The apartment is really nice. In quiet neighborhood and in walking distance to nice restaurants and bars. My colleague an I really enjoyed drinking local beer on the terrace. The apartment is not that new but in a nice cozy way. It really feels like visiting a relative not like living in a hotel.
Annie was really nice. Key exchange was convenient and fast. Nothing to complain about.
Overall would recommend this apartment to a friend."
3489837,34971822,2015-06-14,32617846,John,Annie was very communicative with arranging our arrival and the house was as described. Annie was friendly and welcoming to the house and neighborhood.  The house was nice and clean and the location made it super helpful for our busy weekend!
3489837,39637064,2015-07-25,9460753,William,Great place to stay to see the city! Annie was a welcoming host with clear house rules and plenty of good recommendations/ things to see in the neighborhood. The neighborhood is located in a central part of the city and is a good jumping point to many of the other neighborhood and attractions.  Thanks Annie.  
3489837,40135455,2015-07-28,9058472,Matthew,"Annie was a lively host and very accommodating. Her place was a short walk to the lovely Fremont area full of bars, restaurants and shops. "
