listing_id,id,date,reviewer_id,reviewer_name,comments
365550,3481796,2013-02-05,4636531,Jessica,"Lovely cozy place in between the heart of Seattle downtown and Chinatown.  I didn't get to have the pleasure of meeting neither Jaq or Dirk, but they have a very organized system of making ends meet.  Yes, as the pictures show, you will be climbing up and down a ladder into your bed :)  Otherwise, we did not run into any other guests, and had no problem using the shower or bathroom at any given time.  Very quiet otherwise, and a lot of amenities provided for you.  I would love to come stay here again if I ever come visit Seattle again.  Thanks Jaq & Dirk!"
365550,3489069,2013-02-06,987497,Emma,Good place for a short stay in Seattle. The studio is compact but everything in perfect working order.  It's ideally located near the train station and Pike Place market is only a stroll away. 
365550,3507681,2013-02-10,4327925,Bastien,"The place is very nice, clean and close to the bus/metro station. The bathroom is convenient. We got to meet Jaq and she made sure everything was going well for us. She let us put our bags aside after the check out time, before coming back and going to the airport."
365550,3557594,2013-02-16,1764879,Ben,"I asked to make a reservation and was approved in hours. Jaq wrote me a thorough description of the neighborhood and entry to the loft. I texted her a couple times to get recommendations on places to park and eat – she wrote me right back with great suggestions. When I couldn't figure out the key box right away I called Jaq at about nine and she picked right up and walked me through it.

This loft is ideal for a night or two to visit downtown Seattle and the common spaces were really well maintained. Thanks again for a great stay."
365550,3566864,2013-02-18,662446,Andrea,"Great space.  Very convenient to ferries, galleries, great food and more.  Lovely to be in the midst of artists at work as well. Everyone working or staying in the building was absolutely lovely. We had a great time!"
365550,3616775,2013-02-26,4061850,Ankesh,"The art loft is in a great location. We used Car2Go to drive around and there was one just down a block from their location.  It was easy to get in and the place was very quiet.  Dirk and Jaq had great communication, making this possible.  We had all the amenities needed including a blanket, bath towels and hand towels, soap, toothpaste, shampoo, TV with DirectTV, a space heater, plenty of lights, free wifi, ergo chair and desk, and nice couch.  I love the fact that they have a tankless water heater. It means hot water, fast.  We had access to a common fridge and kitchen area.  We will definitely stay here again the next time we are back in Seattle.  Price, location, and proximity to public transportation was very important to us.  We arrived by AmTrak and left by Boltbus. Both are only a few blocks away from this location.  "
365550,3642703,2013-02-26,2074470,Nandan,"Exactly as pictures, this place is extremely pleasant. The bed is wonderful, the skylight sublime, and the whole building was very quiet!"
365550,3719114,2013-03-07,4094451,Mat,I really enjoyed the location. Short walk from Bolt Bus and transit. Located near downtown and in easy walking or bus distance to anywhere.  Enjoyed my stay. Thanks. 
365550,3808102,2013-03-17,2637999,Calvin,"I stayed at D&J's contemporary loft for a short trip in town. It was a nice loft, just as depicted. D&J were great hosts: super easy to communicate with, very friendly and helpful. The loft was very clean and it offered everything you would need. The location was unbeatable, perfectly located within walking distance to everything. I really enjoyed my stay at the loft, and would highly recommend it to anyone staying in Seattle!"
365550,3825099,2013-03-18,500385,Erin,"The space was just as pictured—everything was well-kept and clean. Great location, too (and free parking on Sundays, which was awesome). I would definitely stay here again. "
365550,3855479,2013-03-21,443616,Melinda,Very comfortable and great location.
365550,3870973,2013-03-23,5278959,Jourdan,"Wonderful place to stay! Very clean, gracious hosts, and wonderful location right near the rail station, downtown and the international district."
365550,3914407,2013-03-26,5423746,Angel,"This was such a cool place! 

We had never stayed in an artist's loft before and we really enjoyed it. The room and common areas were bright, clean and spacious. The bed was very comfortable and it was nice to have a little living area to relax in at night. The location was great, walking distance from everything. All was perfectly set up for when we arrived and the guest book was complete with maps and restaurant recommendations. Jaq was hard at work while we were there, but Matthew ran into her a few times and she was kind and friendly.

We would definitely stay here again. Thanks for everything!"
365550,3959442,2013-03-31,4881286,Ivy,"Dirk&Jaq responded to all our inquiries and concerns in a timely fashion. Check-in and check-out was hassle-free. The location is superb, walking distance from Amtrak station and Link Light Rail to the SeaTac Airport Station, and short walk to buses that will get you to any part of town. Sharing the bathroom wasn't a problem at all, because it's usually unoccupied when we needed it and kept clean at all times. Dirk&Jaq equipped their guest with basic necessities such as hairdryer and shampoo/conditioner. There was also complimentary tea. Thank you for a great first Airbnb experience Dirk&Jaq! "
365550,4014345,2013-04-02,5622608,Claire,"This was our first experience on Airbnb and we will definitely use the service again. Jaq and Dirk's place was an ideal spot to rest our heads during a Seattle getaway. It was conveniently located, clean, quiet, and the hosts were helpful and quick with responses to questions we had prior to our stay. The photos of the unit make it look deceptively roomy - it is very small, and there were no windows so it didn't encourage lounging around. The shared bathroom wasn't an issue and we saw almost no one during our 2 days there. If you are looking for a minimalist, quiet spot to stay this is a great choice. "
365550,4053506,2013-04-06,1815102,Ly,"Dirk & Jaq's place is in a super convenient location.  It's only a couple blocks away from the lightrail, amtrak station and several bus stops.  There are instructions for everything which I really liked.  Checking in/out was easy.  Dirk & Jaq were even kind enough to let us leave our luggage in the kitchen area before the check in time and again after we checked out.  We only stayed a night so we didn't get a chance to meet Dirk & Jaq.  However,  we did bump into a few people who used the studios and they were really friendly."
365550,4211763,2013-04-19,508798,Susan,"Jaq's lofts are clean&adorable. The location was convenient from the train/ bus (email hidden)ke 2 blocks to be exact( King st station)
Walking distance to the Pikes market as well.Aprox. 15 mins.
 They were accomodidating as far as check in which was very nice and we never had any problems as far as shared bathrooms/ shower.
It was a perfect choice for us.Thanks Dirk & Jaq.
"
365550,4299406,2013-04-26,3473470,Paul,"I booked Dirk and Jaq's art loft for my wife during a conference. Here's here review.

The artist loft was a perfect space to stay when attending a conference for work. The space was very clean and the instructions were very clear. I had no trouble getting into the building early to drop off my things before check in which I really appreciated! The space is pretty cozy, but fine for 1-2 people. My sister and I ended up just sharing the bed since it was so cozy, but the couch will also work for shorter people ;) It did take some getting used to using a ladder first thing in the morning! I took part in some of the free tea left for guests but there is plenty to eat within walking distance. Like most of Seattle, you will get a workout walking up to your room, but looks like they have a setup for accessible entrance as well. The bathrooms were plenty big and well stocked - I never had an issue getting in there to shower."
365550,4319444,2013-04-27,5977243,Carolyn,"The accommodations were great! Everything was spotless.Felt like home away from home! Another bonus is that it is only a few minutes walk to the nearby Amtrak station, making our morning connection a snap. 

Carolyn and Darko Sojak
Eugene, Oregon"
365550,4348169,2013-04-29,382528,Loren,"My hubby and I  fell in love with the loft--it was close to the Safeco and a hop skip away from the sights of downtown. The place was like staying in your own cozy Ikea display room with every accommodation you need and much much more. Like many others before me, I highly recommend staying here."
365550,4385762,2013-05-01,4133073,Emily,"The loft was ideal and in a great location for our needs. Clean room, clean shared area, comfy bed. It's even handicapped accessible to get to the room. "
365550,4425282,2013-05-04,4359633,Deb,"Dirk and Jaq's loft was a sweet little spot for a rest between airplanes and ferries.  An easy walk from the light rail, and through a secure entry up a wide set of stairs, the first thing we noticed was how much light there was in the interior of the building.  The loft was bright and airy with comfortable modern furnishings.  The bedroom is a platform loft built into the middle of the space with a very comfortable bed beneath the large skylight.  We arrived just in time for Art Walk, and visited Dirk in his gallery on the street level of the building.  Dirk was extremely helpful as we wandered off to explore the neighborhood.  Nearby we found good beer in a casual environment, a sweet community garden that seemed to go on forever, and an easy walk to Pike Place and the ferry beyond.  Definitely recommend... it would be fun to stay here again with more time to explore."
365550,4527038,2013-05-11,4012018,Thabo,The place to stay in Seattle! Dirk and Jaq are great hosts - the location is very convenient and the rooms are modern and comfy! 
365550,4560673,2013-05-13,877580,Danyell,"We were lucky enough to find this gem prior to a weeklong Alaskan cruise. This place could not be in a better spot! The kitchen has a great view of the stadiums (all so close) and we were able to go everywhere we needed for very minimal money. If you like Vietnamese/Chinese/Japanese/Greek - you will be in heaven! We had the best Banh Mi of our lives in the neighborhood. We're already missing Seattle and the very comfortable bed! Oh, and the shower is phenomenal! 

Just a note: if you are a light sleeper who likes to get some shut eye later than 8 am, perhaps bring earplugs for the morning. The doors in the lofts are heavy and some shoes have a sound that travels well. "
365550,4677667,2013-05-20,5580903,JiHyun,"Very confortable and tidy space so that it felt like I was at home. All fabric materials; bedding, sofa, towels and bathrobe, were clean and well maintained and we could use branded shampoo/conditioner and body lotion which were prepared by Dirk&Jap with detailed consideration. (even free coffee in the fridge with french-press!). It was one of the most satisfying experiences at Seattle :)"
365550,4720732,2013-05-21,5872006,Ashwin,"Very convenient and comfortable 1-night stay. The place is exactly as described, and the hosts are very nice and easily reachable. I had a little trouble using the keypad lock out front - but that's more me than anything else - but no major problem.

This was my first time in Seattle, and I didn't have too much time to look up neighborhoods and relative costs of staying overnight. But I got the feeling that Pike's Market and surrounding areas are generally pretty pricey to stay in. Dirk and Jaq's space was excellent in this capacity. It was a super convenient location to walk up to the market / waterfront, where I met a friend for the day.

My flight out was not until 9:30pm on the day of my checkout, so I requested ahead of time that I leave my luggage at their place (but not in my room, so as to make it available to others) until around 7pm, and they were accommodating. They said I can leave it in the kitchen area, and while I was at first a little nervous (as any traveler might be), I noticed that others had done the same, and so I thought it was fine, which it was.

Their house rules explained things very clearly, and it's really easy to be on your own while in this place. I heard the occasional sounds from the kitchen and hallway but I pretty much never saw anyone during the short time I was there (Sunday evening / Monday morning).

Mainly due to its location and price, but also due to the comfort, I will definitely look in to this place again next time I am in Seattle.

Thank you, Dirk and Jaq!"
365550,4794721,2013-05-26,6416523,Shelby,This is a great place to stay. Close to the Light Rail and Dirk&Jaq gave excellent directions.  I can imagine the ladder to the bed may be a bit challenging to climb for some.  The hosts were very responsive to all questions and made my stay there easy.  Would definitely book with them again.
365550,4963244,2013-06-04,618444,Daniel,"Nice place to stay, about a 20 minute walk from Pike Place. Helpful hosts, smooth check-in process. Bed is comfortable, room is clean. Enjoyed the stay."
365550,4992585,2013-06-06,1577895,Katelyn,"The loft was comfortable, private, and clean. Jaq and Dirk have a really good system for hosting guests and we'd definitely recommend it!"
365550,5010621,2013-06-07,6347285,Joel,"We only spent one night at the loft but it was great. BTW ""ZEITGEIST"" has very good coffee and breakfast and is just a few blocks away."
365550,5050654,2013-06-10,483789,Chris,"Communicative, accommodating, and easy going! Thanks for making our weekend getaway all the more enjoyable!"
365550,5095607,2013-06-11,251093,Jeff,I was visiting in town for a web developer conference so I wanted to stay in a place that was centrally located. Dirk and Jaq's place worked out well for me. It was very clean and quiet. I would recommend staying there again!
365550,5113271,2013-06-13,5839045,Victor,"Dirk & Jaq's place was perfect for us. We didn't need that much space, wanted somewhere cozy, clean and close to all Seattle's sites and sounds. Everything is thought out for you before and during your stay. You're given a combination for the lock-box that stores your keys outside the building, the bed is like sleeping on clouds and my favorite part .... providing us with umbrellas knowing full well that guests are likely to see some rain! Dirk and Jaq now exactly what their guests need for a pleasant stay and I give two big thumbs up! "
365550,5139225,2013-06-14,6866445,Thuy-Anh,"I had a wonderful stay here! It was a great location, super clean, and comfy. The host was great at communicating with me when I had questions. The check-in process was easy and great because I could come anytime in the evening. I would stay here again. "
365550,5174451,2013-06-17,4878274,Yosef,"Well organized, very clean, good quality bed. Very good location.  The problem is lack of window or opening skylight for fresh air."
365550,5217752,2013-06-18,1987763,Elizabeth,"The loft was fabulous!  Clean, bright room with a very comfortable bed and great linens.  The shared bathroom was not a problem at all.  I actually didn't see anyone else there during my stay.  While the immediate vicinity seemed a little dead, it was a great location for taking light rail in from the airport and walking downtown for work, dining, shopping, etc.  Dirk and Jaq were fabulous hosts...with the detailed guestbook, great communication, little notes in the loft...there was nothing I needed to ask."
365550,5310848,2013-06-24,2072219,Céline,"Great location (nearby the light train and the Stadium) and also nearby lots of interesting downtown Seattle sites! Very easy to find and very accomodating premises. Will recommend and come back any time ! thank you Jak and Dirk! 
Céline and Sylvain :) "
365550,5356975,2013-06-25,4041505,Remy,"Seriously great location, walking distance to great food & shopping & entertainment, and from Union Station you can be whisked to Westlake center or the Airport in no time. The place is kept immaculately clean. Its a shared bathroom but there are 2, so never a problem. Dirk and Jaq are very responsive and even let me drop my luggage off hours before check in. I would certainly use again!"
365550,5379064,2013-06-27,1947855,Liina,"Jaq&Dirk´s place was a great place to stay when visiting Seattle. The room is clean and cosy, the location nice close to e.g. many great Japanese and Korean restaurants. I would recommed this for a saty in Seattle!"
365550,5431432,2013-06-30,6115813,Wanda,"The loft was clean and comfortable for two people and was very well thought out for guests.  The robe and provided shampoo/soap made the shared bathroom and shower very convenient.  The kitchenette came in handy for reheating leftovers and appreciated  the complimentary coffee and teas.  It could get loud when people congregate in the kitchen, but it did not bother my husband and I.  The sky light above the bed did help bring natural light into the room, but I would recommend blindfolds if you plan on sleeping in.  I recommend  this place if you want  to be close to public transportation, ball park, good Asian food.  Walking to the Pike took us about 20-25 minutes. We had the pleasure of meeting Jaq and  to see her art work.  This is a good place to stay at a reasonable price in Seattle.   "
365550,5447556,2013-07-01,1433523,Chrystyna,"Everything was very well organized, very clean and the location is great to visit Seattle and see the sights. Jaq and Dirk were very accommodating when we needed a place to leave our luggage, since we arrived on a very early flight in, and very understanding when we had a 15-minute delay to get our things out due to traffic and a parade in DT Seattle. We were sharing with other artists who are not residents there and that gave a bit a dormitory/hostel feel to the place. The kitchen was a communal kitchen, the bathroom as well which is also in the description. There were notes everywhere about how to use and what to use, what not to do, etc. We chalked this up to the fact that both men and women work and reside there, so we decided that one half left the other half all of these obvious notes about how to use the appliances while not doing this, that or the other thing. It did leave us with the impression that common sense was not as common as the phrase suggests. The only real complaint we have, and it is stated in the description of the place, but we had no idea how affected we would be, is that there is no window, and therefore no natural air circulation. It was also an unusually hot day, and the hosts prepared four fans for us to keep the air going. In this small space, it was pretty loud. We still felt like we were sleeping in a coffin, and both of us had challenges in overcoming the claustrophobia. It's not our favorite airbnb experience in regard to the space. The hosts, on the other hand, are truly kind and are doing their best with the space they have to offer. "
365550,5543392,2013-07-05,980390,Zam,I had a great time at Dirk & Jaq's place. The shared kitchen/bath were very clean and the bedroom was private and comfortable. The location we excellent and a very short walk from the train station. 
365550,5580943,2013-07-07,6486195,Jason,The loft was exactly what I was looking for a short stay in Seattle. It was great to wake up to the bright skylight above the bed. And the location is pretty close to everything in downtown Seattle.
365550,5674095,2013-07-11,729180,Andi,"What a lovely neighborhood and what a lovely little loft! We had a wonderful stay here -- the bed was so comfortable, with a lovely skylight to warm the blanket. The best, though, is the location. There was a tremendous amount to do and see, all within walking distance. And Dirk & Jaq's restaurant & coffee suggestions were the best. We tried several, and were impressed every time. Thanks!"
365550,5703536,2013-07-12,206891,Audrey,"I liked the Loft, nice little space and the fact that it was so easy to get to via rail link. it was just a 2 block walk from the station. The bedding and bed were very comfortable I even tried to find the LABEL of the Mattress so I could purchase one like it. I would stay here and recommend it a friend.and will be back again next year! You will be comfortable here and enjoy the privacy of your own space! Thank you Dirk and Jaq"
365550,5821759,2013-07-18,491029,Jennifer,"Very clean place, never ran into anyone else in the building the entire time we stayed there so it still felt private. Location was good, a little shady a block or two away after dark but close to bus stops so we got around easily. Parking was limited but we managed to grab a spot, otherwise it would have been about $15/night in paid lots which wasn't bad at all. Had a great time in Seattle, thanks again!"
365550,5881411,2013-07-21,5397841,Anneleen,"Perfect first airbnb experience! Dirk and Jaq were very helpful and accommodating. Check-in was a breeze, even when our plane got delayed and we only got to the apartment at 2 in the morning. The studio was clean, cosy and comfortable. Bathroom and kitchen were perfect too. Very convenient location - especially since we were traveling by public transport - within walking distance of most of Seattle's downtown sights. Would definitely stay here again, if we ever happened to be in Seattle again. "
365550,5906645,2013-07-22,359191,Michelle,The apartment was clean and very central.  Dirk and Jaq were extremely helpful and responsive with any questions we had.  Thanks so much for a great stay!
365550,5947298,2013-07-23,6746300,Maggie,"It's a very good location & good design! 
Everything is clean and you get a tv in the room~! 
Easy to check in, check out!"
365550,5970032,2013-07-24,6761523,Alvin,This loft was the perfect place for my short stay in Seattle. The place was very clean and comfortable and it came with a binder of very helpful instructions and suggestions. The location was convenient for seeing tourist attractions. Dirk and Jaq were very helpful and I would definitely stay here again.
365550,6006638,2013-07-26,6876138,Ranjita,"We had a very comfortable stay at the studio. The location was perfect and convenient to public transportation. Jaq and Dirk have thought of all the details that made for a great experience - detailed instructions to access the keys and the apartment, restaurant/cafe/gallery recommendations in the neighborhood, maps, tea/coffee, toiletries and pretty much anything else one might need. "
365550,6103632,2013-07-30,6281970,Nikolaus,"Dirk and Jaq's place was really great.  It was super clean, quiet, and very convenient to everything fun in Seattle.  It's just one block from the light rail so very easy access to downtown and the airport.  I would book again in a heartbeat! "
365550,6127152,2013-07-31,6181657,Anne,"We had a great time at Dirk & Jaq's place. We were only there for one night. But, the location was perfect for us, since we were taking the Light Rail really early in the morning (the station is really close, walking distance). 
The process to get the keys was a bit tedious, but the directions were really clear and we had no problem to get them. The room is really nice and well equiped. 
I would recommend."
365550,6168639,2013-08-02,1409272,Bettye,"Convenient location near Amtrak and even closer to light rail to get to airport. Many Japanese and Chinese eateries as you are on the edge of Chinatown. Friendly hosts and clean space. Room is a bit small with ladder to bed loft...and no window for fresh air (there are fans) but if your're not spending much time inside the room, it's fine and just around the corner from bathroom and kitchen so perfect for guests who just need a comfortable bed!"
365550,6238979,2013-08-05,2403221,Alex,"Dirk & Jaq's place was totally what we needed for a busy weekend in Seattle. It was VERY clean (!), affordable, modern but cute at the same time, very easy to get from downtown, and quick connection from I-5 at the same time, on an 'artsy"" block. We have not had a chance to meet the hosts but there were super helpful via email and also the place was very well set up by them for AirBnB hosting. We loved the skylight above the bed platform. Sharing the kitchen and the bathrooms was not an issue at all as all common areas are maintained very clean and there was only one other loft in the building that had overnight guests. With hosts' advice we were able to find free parking very close to the building for our entire stay (3 nights)! We walked from downtown fairly late at night without any safety issues. We would definitely stay there again."
365550,6293179,2013-08-06,7826407,Tim,"Our stay here was great. Everything was labeled and there were plenty of instructions and information for guests. We only managed to visit one of the hosts recommendations, but it was a great coffee shop. We would definitely recommend staying here. "
365550,6347707,2013-08-09,7251390,Jesse,"Can't say enough how clean, convenient, and easy it was to stay here. It's in a great location (especially for those arriving to Seattle on plane and leaving on train). The hosts were communicative and very friendly making checking in and out a breeze. "
365550,6364730,2013-08-10,6464303,Stephanie,"Unser Aufenhalt in Seattle war leider nur sehr kurz, doch dafür war das Zimmer bei Dirk und Jaq ideal. Von dort aus waren wir schnell im Zentrum und bei der Zugstation, von der aus ein Zug direkt zum Flughafen fährt. Dirk und Jaq waren sehr freundlich und hilfsbereit. Es war spannend, ein wenig ""Künstlerluft"" zu schnuppern. Wir können dieses Zimmer weiterempfehlen! "
