listing_id,id,date,reviewer_id,reviewer_name,comments
7382303,54860900,2015-11-25,39387212,Ian,"A beautiful luxurious cottage with a breathtaking panoramic view of the water in a quiet neighborhood, and the best hosts I've ever met! I am so grateful for this hidden gem and all the thoughtfulness Jon and his wife put into it. A heated bathroom, memory foam mattress, cozy porch, electric candles, reading lights, washer/dryer, handmade guide book and a full kitchen suite are just a few of the many comforts awaiting you here. To top it all off there was a sampling of groceries and wine waiting for me as well, what a treat! This was by far the most amazing Airbnb experience I've ever had, with the kindest hosts imaginable! "
7382303,55383921,2015-12-01,45632125,Sima,"I arranged for 2 family members to stay in Jon's cottage over Thanksgiving, and it was everything promised: clean, comfortable, lovely, private, and efficient. The setting is beautiful; I couldn't have been happier with the experience. Jon was very accommodating and easy to work with. I would absolutely have friends and family stay here again--it was a very positive experience."
7382303,56053053,2015-12-08,43368802,Evan,2nd time here. Grapevine is a great small apartment in wonderful area of Seattle. 
7382303,57066630,2015-12-21,38678407,Dawn,"We had a lovely time at the Grapevine Cottage!  The cottage is beautiful and extremely comfortable.  The hosts left hot chocolate, marshmallows, and candy canes available for the cold winter night.  They also left a box of applets and cotlets, which I'm embarrassed to admit was completely consumed by us during our 2 day stay.  The cottage kitchen is perfectly equipped with whatever you may need.  The bathroom is clean and spacious, and the bed is SO comfortable.  The house is in a great neighborhood, excellent for walking, and we walked twice up the street to MioPosto for pizza.  Uber rides downtown were about $11 during our stay.  We went downtown to the Pike Place Market and the shopping district.  We thought we were going to head to a sports bar to watch our Utah Utes play in the Las Vegas bowl, but the cottage living room was so comfortable that we decided to just watch it ""at home"" and relax.  The television is great!  Jon and Claudia were extremely kind and gracious hosts.  We can't wait to come back and visit again.  "
7382303,57505928,2015-12-27,41775184,Jennifer,"What a wonderful place in a great neighborhood! We enjoyed walking amongst the beautiful homes and along Lake Washington. While we spent most of our time wandering the town, Jon and his wife had stocked many of the items in the kitchen one might not want to buy if you were fixing something quick. The house was very cozy and comfortable. I would come back in a second if it was available."
6019762,36787263,2015-07-01,20026659,Emma,"We had a lovely week here. Very clean, comfy beds, great outdoor space front and back to enjoy the sunshine, everything you need in the kitchen and a great shower! We felt relaxed and at home during our stay. We would definitely stay here again.

The bus to downtown is round the corner from the property, and it takes about 20 mins. We had no trouble getting around from here. Uber is a great app, and not too expensive to use for transport if you don't want to take the bus. 

We found a good breakfast place nearby called Youngs. It does pancakes and all the good breakfast stuff, and is also a Chinese restaurant. Friendly staff and great food. (website hidden)


"
6019762,37161182,2015-07-05,19545326,Jim,The house and garden are beautiful and very stylish. The warm and cozy atmosphere made us feel at home instantly.  There is a park nearby for kids to play and shopping not far by car. We can highly recommend this place.
6019762,38020732,2015-07-12,2172825,Mevelyn,"Jimmy's house was charming and eclectic.  It has the amenities we wanted. It is a 15 minute drive to downtown as he mentioned online.  If your goal is to relax and veg on your vacation, and you don't mind the drive to restaurants and shops, then, I recommend Jimmy's place.  While we didn't get a chance to meet Jimmy when we arrived as he was out of town, he was easy to communicate with and quick to respond to emails. He also prepared a thorough list of his House Manual which made everything easy. Thank you, Jimmy! :)"
3915826,19981708,2014-09-21,21326293,Amelia,I was pleasantly surprised to find that the apartment was even better than I had expected. Jay was incredibly informative regarding the check-in details and even provided great information about Seattle and the apartment upon arrival. It's such a great location and an amazing price. I can't say enough about how pleased I was! Far better than staying at a hotel. 
3915826,21925020,2014-10-26,22774709,Paige,"My stay was wonderful! The apartment was clean and cozy, as promised, and Jay went to extra lengths to make sure we were comfortable. He left us copious resources about Seattle and suggestions for food and activities. The neighborhood felt very safe, and was highly convenient for restaurants and transportation. I would absolutely recommend staying here."
3915826,22640478,2014-11-10,20784507,Aaron,"Great place, very very comfortable place to stay. Great location to lots of good places to eat and visit within walking distance. We had a great time.
Very clean and well kept. We felt right at home.
Thanks for letting us stay!"
3915826,23397535,2014-11-30,2005750,Andy,"Jays place was clean cozy and had all the comforts I needed. It was easy to get to from the freeway and easy to get to and from other parts of Seattle  for my events.
It is a super location with eateries and grocery stores, cafés and pubs all within walking distances. 
To great places to stroll were Ballard and Fremont , both recommend by Jay and both within a short drive. 
The bus to dwntn Seattle was right outside the apartment and ran often.
Great clean cozy, booking here again without a doubt"
3915826,24670228,2015-01-01,24338674,William,Jay was very helpful and the stay was lovely.  He gave us advice on places to go.  His apartment was clean and well laid out. Would recommend.
3915826,33127121,2015-05-25,8762034,Loan,"We had such a wonderful stay at Jay's place. It was very cozy, comfortable and the perfect home away from home for us. Jay was very accommodating with our early check in request. The neighborhood was nice, safe and fun with many food restaurants. We enjoyed staying at Jay's place and hope to stay there again whenever we visit Seattle. "
3915826,36559845,2015-06-29,18230512,Aditya,Jay's apartment was perfect for a weekend trip. The apartment was very clean and inviting and we thoroughly enjoyed our time there. He also left us with a nice binder filled with some nice spots and suggestions to check out around the city which I a absolutely recommend checking out. I would definitely stay here again given the opportunity.
3915826,38443965,2015-07-15,3695901,Jason,"Jay was a nice host. We didn't have the pleasure of meeting in person, but he was great at corresponding. Nice pad, great location. You'll hear some morning street traffic if you sleep with window open, didn't bother me though. "
3915826,39819188,2015-07-26,28243722,Jiaan,"Jay's place was clean and simple, exactly what I was looking for. He left a binder with a ton of recommendations + tour books, which was a nice touch. Street parking was easy to find during my 4-day stay as well."
3915826,46149193,2015-09-08,39159228,Prashanthi,"We a wonderful stay at Jay's place for the long weekend. It was clean, cozy and very comfortable. It is in a nice neighborhood and located only a few miles away from UW which was perfect for us. This is our first experience with Airbnb and we could no have asked for a better place to stay. We hope to stay there again whenever we visit Seattle."
3915826,51414575,2015-10-19,42670170,Boyu (Bill),Jay's apartment is warm and cozy. Every detail of life in Seattle is elegantly concerned. He is a nice and quiet man and he is very suitable for a single traveller like me who likes to enjoy the privacy in a new city. Strongly recommend!
8926060,54549670,2015-11-21,42730385,Guanxiong,"Jason is friendly, helpful and easy to talk. His place is great and definately is among the best in this price level. It's great experience to me!"
8926060,58112142,2015-12-31,6514188,Tanner,Jason's place was well located in a great part of town. The place was nice and access was very convenient. Would highly recommend.
1461971,12086050,2014-04-22,13827491,Jaqui,"We had a wonderful stay in Seattle, at Eric's property. The photos only show some of the elegance of this Seattle cottage home. We had a great stay, the property is very comfortable - comfortable beds and sofas, and well equipped kitchen. We even had our own little easter egg hunt in the pretty garden.
The neighbourhood feels very safe, the off-road parking conveneinet, and overall location is well suited for visiting Seattle and surrounding sites."
1461971,18350909,2014-08-25,16923941,Karin,"Eric was a great host. He was responsive and checked in with me to make sure we arrived safely. 
It's a beautiful house and comfortable. The backyard and deck are great. For those with kids it's good to know bathroom is downstairs. We made it work fine and the beds were very comfortable. 
It's close to some good parks and easy to get to from the 5. Overall good experience!"
1461971,18823623,2014-09-01,2938186,Jessica & Charlie,This is a great (and huge) house with a beautiful backyard and deck.. the only issue we had was that the internet was broken during our stay.
1461971,40127183,2015-07-28,3520528,Byron,"Great place to stay, especially for the price! The living spaces, kitchen and bathroom were clean and provided plenty of room for the time we spent at the house. The rooftop deck that overlooks the backyard, accessible from the master bedroom, was also pretty cool. I wish it hadn't rained so much while we were there so we could have hung out on it more. The backyard is also beautifully forested and peaceful. I'd recommend this place to anyone who will have a car and is looking for a house in a quiet neighborhood. It was only about a 15 minute drive to U District and 30 minutes to Capitol Hill."
1461971,42127818,2015-08-11,27184680,Stephanie,"This house was perfect for us! Eric was great and made sure we were comfortable in his home upon arrival. The location is close to lots of food and stores. It's also an easy drive to downtown Seattle. The house was spacious enough for 4 adults and a toddler. Our favorite part of the house would have to be the huge, beautiful backyard. I'd absolutely recommend this property!"
1461971,44350039,2015-08-25,24049136,Jeff,Eric is a great host!  He is very communicative. His place is clean and comfortable. 
841140,3254437,2013-01-03,829596,Carlos,We stayed here over New Year and we hosted a dinner for some friends. Great kitchen and comfy furniture. Too bad it was cold because I would've liked to spend some time on the outside deck.
841140,8392177,2013-10-28,7987966,Jennifer And Jules,"Our stay at Jeremys' place was perfect!  His apartment is very clean, and extremely comfortable.  What a perfect location in the heart of Capitol Hill!  Jeremy was very thoughtful and very easy to get in touch with. We STRONGLY recommend staying in this beautiful apartment!"
841140,8704501,2013-11-12,3520881,Alysa,"Jeremy's place was amazing and accommodated my two friends and I perfectly. The location was unbeatable with the park mere footsteps away, and Jeremy was always available to reach if we had any questions or concerns. I would definitely recommend anyone to stay here and hope to return myself!"
841140,9024444,2013-12-02,2721121,Norma,"Jeremy's flat was superb! Very centrally located ,equipped with all the things that make you feel at home....would recommend very highly, thank you Jeromy 
We had a great weekend!"
841140,9838613,2014-01-13,345392,Christian,"Jeremy's place is centrally located and very convenient for anyone who wants to explore the culture of Capitol Hill - and beyond.  I rented a car to make it over to Fremont & Alki Beach and finding parking on the same street as Jeremy's place was super easy.  

The apartment itself was spacious and very comfortable. Jeremy was extremely helpful & a great host by letting us stop by earlier in the day to drop off our bags and gave us a few restaurant recommendations and tips about the neighborhood.  We had a great time thanks for Jeremy and his awesome apt!"
841140,12282908,2014-04-28,1090057,Katie,"This apartment is wonderful! Centrally located, beautiful patio, cozy, and clean. While I didn't meet the hosts in person, I heard from my traveling partner they were very nice and made sure everyone was comfortable before leaving. The apartment gets amazing light, so if potential guests are sensitive to light while sleeping, I'd recommend bringing an eye mask to avoid early rising!"
841140,13423713,2014-05-27,6035671,Ty,"This place was great. Everything you need for your stay is included, and there are a ton of restaurants and bars in short walking distance. It's an easy downhill walk to downtown Seattle and Pike Place Market. Would definitely recommend to anyone looking for a place to stay in Seattle. "
841140,13973370,2014-06-09,15352319,Mark,The location and space was fantastic! We didn't even want to leave the apartment! Would love to stay here again for my next visit to Seattle. Thanks for being a great host Jeremy!
841140,15256426,2014-07-06,7421971,Alyssa,"Jeremy's apartment is in an amazing location; the perfect walking distance to the waterfront and downtown. During our week long stay, when we weren't grilling on the beautiful patio that over looked the park, we were exploring the many restaurants and bars that Capital Hill has to offer. As a host, Jeremy was always available if we had any questions before and during our trip. At the end of the day, it was nice to be able to go back to an apartment that felt like home! I would strongly recommend this apartment to anyone looking to experience Seattle!"
841140,16273114,2014-07-24,1223482,Heidi,"Jeremy's apartment is located in a prime location--Capitol Hill. It is an excellent home base to have while exploring Seattle. It is within easy walking distance to the downtown area and by car it is a 10-15 minute drive to other neighborhoods such as Fremont, Ballard and the University District. There is an abundance of places to eat nearby and a supermarket up the block if you want to buy groceries or snacks. The apartment itself is spacious, has great light, high ceilings and a beautiful private terrace where you can unwind after walking around the city all day. Also, the living room couch is dangerously comfortable and could distract you from wanting to leave the apartment! Finding free parking nearby is a little challenging, but if you can score a spot on the same street as the building, then you're all set. Jeremy was fast to respond to all of my questions and was super flexible. He is a fantastic host with a wonderful home. I highly recommend his place to anyone visiting Seattle. "
841140,17869564,2014-08-18,3747305,Sonja,"We had a great time at Jeremy's place. The location is amazing and his place is great value. Jeremy is super responsive and easy to communicate with. It was a very hot weekend in Seattle so it got a little warm in the apartment at night.  There was also noise coming from people on the street, but it didn't disturb our sleep.  I would not hesitate to recommend this place to others and would definitely stay here again."
841140,19949048,2014-09-21,7571678,Kevin,"Great stay! Would definitely book again next time I'm in Seattle.
Jeremy was very helpful and in touch, and flexible with our travel plans. The apartment is great: clean and comfortable, nicely set up, high ceilings, a large patio with garden overlooking the park, lots of light, and an amazing location in the centre of things in Capitol Hill.
The park across the street has playing fields with people out playing dodgeball, basketball, bicycle polo, and generally having a great time. This is a lot of fun to watch. They also make a bit of noise, at least on summer weekends, so if you're used to a quiet environment to sleep you may want earplugs."
841140,21910903,2014-10-26,5100668,Heidi,"Wow! This place is amazing :-) by far the cutest apartment I've seen, I was constantly impressed with everything including the location! Can walk to a bunch of great restaurants and bars... I recommend homegrown for lunch ... And everything is comfy and so practical. We went to Pike Place Market one day and bought fish and veggies to cook and it was just awesome!  I definitely would stay here again :-)"
6591879,37199639,2015-07-05,5785405,Riccardo,"Awesome Awesome Awesome.  EJ was a great host, her home is beautiful, ingeniously decorated, and absolutely comfortable. I love the balcony and the view.  Beds were just right.  Kitchen too.  Perfect place in Magnolia, only 10 mins into the city. EJ was always available and ready to make us feel at home.  Thank you!"
3561237,16045847,2014-07-20,18117629,Christina,"Jan couldn't have been nicer, and her house was BEAUTIFUL, in a Great neighborhood.  Easy to access and easy to get into downtown Seattle.  She made us French press coffee every morning, with organic half and half,  Fresh fruit, and just made us feel relaxed and at ease. I can't say anything but thank you for making our trip awesome.  She was very accommodating by providing an extra bed in the room and having a refrigerator just for the guests.  Thanks for a great experience.   "
3561237,16954251,2014-08-04,16719488,William,"Jan was the best! I have never felt so instantly at home and relaxed at an airbnb. She helped us get settled with a tour of her beautiful house, introduced us to her friendly and well behaved dogs and cat, and gave us recommendations for places to eat within walking distance. She was the perfect host- friendly, responsive, and respectful!

We stayed in the upstairs bedroom which was even better than what is shown in the pictures- the light streaming in from the back yard in the morning was the best way to wake up!

Finally, the location is fantastic. The breeze from the water was perfect as we walked around the neighborhood and explored Discovery park. I would highly recommend this place to anyone!"
3561237,18041808,2014-08-20,7773757,Pippa,Jan was such a lovely hostess. Her house in Magnolia was very spacious and cozy. Had great fun cooking at her well- equipped and big kitchen. Thoroughly recommend her place for anyone looking to explore Seattle and neighbouring areas! 
3561237,19795572,2014-09-18,5136929,Amelia & David,"After our stay at Janyce, we gained a new wonderful friend.  Janyce is now our friend, she rocks!  We are so thankful she shared her beautiful house with us.  David and I loved every minute of our stay.  At had to work from her home, loved hanging out in the living room, quite nice spacious area to work or just chill.   Her home is located in a beautiful neighborhood, amazing views,  peaceful nights and caring neighbors. We felt at home, like staying with our family during the holidays.  Really enjoyed Janyce's company, truly awesome experience, thanks girl. "
3561237,19974286,2014-09-21,7876915,Mohit,"Beautiful, peaceful neighborhood. Janyce was very helpful, and welcoming. Even though she lives on the premise, we hardly saw her. Will definitely recommend this listing"
3561237,24761243,2015-01-02,24550710,Alexander,"Jan was a fantastic host for our group of 14 people over New Years. The house was a beautiful, and provided a comfortable place to hang out in between our excursions into Seattle."
3561237,25502812,2015-01-18,187189,Donna,"This rental is exactly as it is presented on airbnb. Jan is very attentive and easy to communicate with. We rented the entire home for a girls weekend  and Jan's home is just lovely! It is open and roomy in the great room with a very nice, well equipped kitchen. The bedrooms and bathrooms were clean and comfortable. The Magnolia neighborhood is very nice, quiet and convenient to downtown. I would not hesitate to stay here again in the future.  Thank you Jan."
3561237,26948621,2015-02-22,500217,Melina,"Jan was incredibly welcoming.  She had snacks, coffee, and milk available for us when we arrived.  The house was impeccably clean and very very comfortable.  I could have slept in the bed for days, if I hadn't been too busy roaming Seattle.  Thanks for a lovely stay, Jan. "
3561237,31230749,2015-05-03,12063477,John,Jan has a beautiful house in a peaceful neighborhood. Everything was in great condition and very clean. Beds were plentiful and comfortable. We enjoyed our stay!
3561237,31789527,2015-05-10,2433517,Evan,"Everything at Jan's place was great. The home is beautiful and in a very nice residential neighborhood.  There was plenty of room for hanging out in the house and backyard. The kitchen is also very nice as was the barbeque grill. Jan herself was great. She was helpful in pointing us towards some nice places to go out, and made sure that everything at the house was in order for us. Great experience, no problems at all."
3561237,33644067,2015-05-31,21483108,Katie,"We had the most fabulous time at Jan's beautiful home.  Really, the pictures don't do it justice.  The giant house, yard, deck, and surrounding neighborhood were all gorgeous.  We rented the house for a fairly big bachelorette party, but Jan was super accommodating and we all appreciated how sweet and helpful she was!  She was upstairs/in and out throughout the weekend, but was completely out of the way anytime we needed the house.  The house is very nice and thus comes with requirements to keep the house at 100%, but basically it just requires you to be respectful and we were able to get our group to comply without a problem.  I completely recommend renting with Jan, we would all do it again in a heartbeat! "
3561237,35284761,2015-06-17,5250462,Sandy,"This is a beautiful home with gorgeous views, convenient to all the sights and parks of Seattle. Jan is a great host, happy to help make the most of your stay. The home is clean, well stocked, spacious, well furnished and the views are amazing!  You will love your stay in Jan's home. "
3561237,35635068,2015-06-21,20329989,Candace,"Outstanding!! Thank you Jan. The house was beautiful inside and out, very luxurious, and in a great location. 

Her place is our number one choice when staying in Seattle. 

Thanks for everything. "
3561237,37247599,2015-07-05,36982280,Heath,"This house was awesome.  It's big, modern, comfortable and immaculately clean. Jan was the perfect host and always available if/when you needed her.  Magnolia is such a beautiful and convenient location to Seattle proper.  We will definitely be back.  :) "
3561237,38873168,2015-07-19,2926003,Nasim,"Jan's home is lovely and in a very nice neighborhood. Comfortable beds & a great backyard. It was spacious and able to accommodate my group of friends who were joining a weekend celebration in Seattle for a friend's bachelorette/birthday party. As a group of 30-something professionals who wanted a nice weekend away, it was a great home to host the group and be together while we played games and watched movies, and only a 15min Uber into great parts of town. Jan was a little late in letting us into the home for check-in which changed our dinner plans on Friday night after arriving. She was apologetic. The evening check-in is something Jan outlined in her description (4:30p check-in, we got in around 5:45p) so it's a good thing to keep in mind while making your plans. She extended our check-out to Noon on the way out to make up for the time lost (it's typically 10am), which was helpful. Jan lives & sleeps full time in the home upstairs in the master bedroom, down a short hall from the other bigger bedrooms upstairs (we rented the full house, both upstairs by Jan's room & the downstairs apartment). She was polite and didn't really pop in; we only saw her 2 or 3 times throughout the weekend. She was conscientious about allowing our group to have their space. After we left, we did have a conversation about a scratch that occurred under her couch from an exposed nail that was covered by a plastic cap that may have popped off from the couch shifting while some of our guests were sitting on it. We have been in touch to settle the cost, which will be based on her appraisal. Even though we read pamphlets and house rules, I would suggest studying up twice as there are lots of things to remember and adhere to. For example, there are rules about recycling (based on laws in the city of Seattle) where we threw a few items into the incorrect trash vs. recycle repositories - again something to be aware of and read carefully as they're atypical from other cities in the U.S. (i.e. Los Angeles and New York City where most of us were from). "
3561237,42855020,2015-08-16,27760592,Joseph,I had my bachelor here for the weekend.  Jan is super helpful and very accommodatting. The kitchen is great for whipping up a meal for 10. It has everything you need.  the backyard is great to hangout and there are enough beds and couches for my 11 man bachellor party.  Nick (the house supervisor) is super helpful and friendly. This is a great place to stay!
3561237,43623804,2015-08-21,34863758,Kiersten,"Jan made us feel very welcomed into her beautiful home. We were traveling on busy and it was wonderful coming back to a quiet luxury home only 10-12 minutes away from downtown Seattle. The home was highly maintained, all the basic amenities were provided, and we would definitely book again."
